match,start_time,market_name,home_team,home_win,away_team,away_win,margin,agency
Orlando Magic v Charlotte Hornets,2024-03-20,Head To Head,Orlando Magic,1.11,Charlotte Hornets,6.75,1.049,Bet365
Washington Wizards v Houston Rockets,2024-03-20,Head To Head,Washington Wizards,5,Houston Rockets,1.18,1.047,Bet365
Brooklyn Nets v New Orleans Pelicans,2024-03-20,Head To Head,Brooklyn Nets,3.5,New Orleans Pelicans,1.32,1.043,Bet365
San Antonio Spurs v Dallas Mavericks,2024-03-20,Head To Head,San Antonio Spurs,3.9,Dallas Mavericks,1.27,1.044,Bet365
Minnesota Timberwolves v Denver Nuggets,2024-03-20,Head To Head,Minnesota Timberwolves,3.5,Denver Nuggets,1.32,1.043,Bet365
