match,start_time,market_name,home_team,home_win,away_team,away_win,margin,agency
Boston Celtics v Atlanta Hawks,2025-01-19T00:00:00Z,Head To Head,Boston Celtics,1.24,Atlanta Hawks,4.1,1.05,BetRight
Indiana Pacers v Philadelphia 76ers,2025-01-19T00:00:00Z,Head To Head,Indiana Pacers,1.26,Philadelphia 76ers,3.85,1.053,BetRight
Golden State Warriors v Washington Wizards,2025-01-19T01:30:00Z,Head To Head,Golden State Warriors,1.12,Washington Wizards,6.25,1.053,BetRight
Minnesota Timberwolves v Cleveland Cavaliers,2025-01-19T02:00:00Z,Head To Head,Minnesota Timberwolves,2.75,Cleveland Cavaliers,1.45,1.053,BetRight
Portland Trail Blazers v Houston Rockets,2025-01-19T03:00:00Z,Head To Head,Portland Trail Blazers,4.9,Houston Rockets,1.18,1.052,BetRight
Miami Heat v San Antonio Spurs,2025-01-19T20:00:00Z,Head To Head,Miami Heat,1.73,San Antonio Spurs,2.11,1.052,BetRight
Sacramento Kings v Washington Wizards,2025-01-20T02:00:00Z,Head To Head,Sacramento Kings,1.06,Washington Wizards,9.5,1.049,BetRight
