match,start_time,market_name,home_team,home_win,away_team,away_win,margin,agency
Utah Jazz v Memphis Grizzlies,2025-03-26T01:00:00Z,Head To Head,Utah Jazz,4.75,Memphis Grizzlies,1.19,1.051,BetRight
Portland Trail Blazers v Cleveland Cavaliers,2025-03-26T02:00:00Z,Head To Head,Portland Trail Blazers,2.92,Cleveland Cavaliers,1.41,1.052,BetRight
Sacramento Kings v Oklahoma City Thunder,2025-03-26T02:00:00Z,Head To Head,Sacramento Kings,4.1,Oklahoma City Thunder,1.24,1.05,BetRight
Philadelphia 76ers v Washington Wizards,2025-03-26T23:00:00Z,Head To Head,Philadelphia 76ers,1.62,Washington Wizards,2.3,1.052,BetRight
New York Knicks v Los Angeles Clippers,2025-03-26T23:30:00Z,Head To Head,New York Knicks,1.95,Los Angeles Clippers,1.85,1.053,BetRight
Indiana Pacers v Los Angeles Lakers,2025-03-26T23:30:00Z,Head To Head,Indiana Pacers,1.83,Los Angeles Lakers,1.98,1.051,BetRight
Brooklyn Nets v Toronto Raptors,2025-03-26T23:30:00Z,Head To Head,Brooklyn Nets,1.83,Toronto Raptors,1.98,1.051,BetRight
