match,start_time,market_name,home_team,home_win,away_team,away_win,margin,agency
Los Angeles Clippers v Denver Nuggets,2024-12-02T03:00:00Z,Head To Head,Los Angeles Clippers,2.35,Denver Nuggets,1.64,1.035,BetRight
Boston Celtics v Miami Heat,2024-12-03T00:30:00Z,Head To Head,Boston Celtics,1.21,Miami Heat,4.5,1.049,BetRight
Atlanta Hawks v New Orleans Pelicans,2024-12-03T00:30:00Z,Head To Head,Atlanta Hawks,1.22,New Orleans Pelicans,4.3,1.052,BetRight
Chicago Bulls v Brooklyn Nets,2024-12-03T01:00:00Z,Head To Head,Chicago Bulls,1.44,Brooklyn Nets,2.8,1.052,BetRight
Minnesota Timberwolves v Los Angeles Lakers,2024-12-03T01:00:00Z,Head To Head,Minnesota Timberwolves,1.5,Los Angeles Lakers,2.6,1.051,BetRight
