match,start_time,market_name,home_team,home_win,away_team,away_win,margin,agency
Detroit Pistons v Miami Heat,2024-12-17T00:00:00Z,Head To Head,Detroit Pistons,2.4,Miami Heat,1.57,1.054,BetRight
Charlotte Hornets v Philadelphia 76ers,2024-12-17T00:00:00Z,Head To Head,Charlotte Hornets,2.05,Philadelphia 76ers,1.77,1.053,BetRight
Toronto Raptors v Chicago Bulls,2024-12-17T00:30:00Z,Head To Head,Toronto Raptors,1.85,Chicago Bulls,1.95,1.053,BetRight
Brooklyn Nets v Cleveland Cavaliers,2024-12-17T00:30:00Z,Head To Head,Brooklyn Nets,4.6,Cleveland Cavaliers,1.2,1.051,BetRight
Sacramento Kings v Denver Nuggets,2024-12-17T03:00:00Z,Head To Head,Sacramento Kings,1.89,Denver Nuggets,1.91,1.053,BetRight
Los Angeles Clippers v Utah Jazz,2024-12-17T03:30:00Z,Head To Head,Los Angeles Clippers,1.22,Utah Jazz,4.3,1.052,BetRight
