match,start_time,market_name,home_team,home_win,away_team,away_win,margin,agency
Charlotte Hornets v Cleveland Cavaliers,2024-12-07T18:00:00Z,Head To Head,Charlotte Hornets,5.25,Cleveland Cavaliers,1.16,1.053,BetRight
Washington Wizards v Denver Nuggets,2024-12-08T00:00:00Z,Head To Head,Washington Wizards,6.25,Denver Nuggets,1.12,1.053,BetRight
New Orleans Pelicans v Oklahoma City Thunder,2024-12-08T00:00:00Z,Head To Head,New Orleans Pelicans,3.4,Oklahoma City Thunder,1.32,1.052,BetRight
Toronto Raptors v Dallas Mavericks,2024-12-08T00:30:00Z,Head To Head,Toronto Raptors,3.7,Dallas Mavericks,1.28,1.052,BetRight
New York Knicks v Detroit Pistons,2024-12-08T00:30:00Z,Head To Head,New York Knicks,1.18,Detroit Pistons,4.9,1.052,BetRight
Miami Heat v Phoenix Suns,2024-12-08T01:00:00Z,Head To Head,Miami Heat,1.41,Phoenix Suns,2.92,1.052,BetRight
