match,start_time,market_name,home_team,home_win,away_team,away_win,margin,agency
Cleveland Cavaliers v Miami Heat,2025-03-06T00:00:00Z,Head To Head,Cleveland Cavaliers,1.15,Miami Heat,5.5,1.051,BetRight
Charlotte Hornets v Minnesota Timberwolves,2025-03-06T00:00:00Z,Head To Head,Charlotte Hornets,3.55,Minnesota Timberwolves,1.3,1.051,BetRight
Boston Celtics v Portland Trail Blazers,2025-03-06T00:00:00Z,Head To Head,Boston Celtics,1.25,Portland Trail Blazers,4,1.05,BetRight
Washington Wizards v Utah Jazz,2025-03-06T00:00:00Z,Head To Head,Washington Wizards,1.52,Utah Jazz,2.55,1.05,BetRight
Milwaukee Bucks v Dallas Mavericks,2025-03-06T01:00:00Z,Head To Head,Milwaukee Bucks,1.19,Dallas Mavericks,4.75,1.051,BetRight
Denver Nuggets v Sacramento Kings,2025-03-06T02:00:00Z,Head To Head,Denver Nuggets,1.44,Sacramento Kings,2.8,1.052,BetRight
Memphis Grizzlies v Oklahoma City Thunder,2025-03-06T02:30:00Z,Head To Head,Memphis Grizzlies,3.4,Oklahoma City Thunder,1.32,1.052,BetRight
Los Angeles Clippers v Detroit Pistons,2025-03-06T03:30:00Z,Head To Head,Los Angeles Clippers,2.48,Detroit Pistons,1.54,1.053,BetRight
