match,start_time,market_name,home_team,home_win,away_team,away_win,margin,agency
Oklahoma City Thunder v Dallas Mavericks,2024-03-15T02:00:00Z,Head To Head,Oklahoma City Thunder,1.26,Dallas Mavericks,4.1,1.038,BetRight
Portland Trail Blazers v New York Knicks,2024-03-15T02:00:00Z,Head To Head,Portland Trail Blazers,5.25,New York Knicks,1.18,1.038,BetRight
Detroit Pistons v Miami Heat,2024-03-15T23:00:00Z,Head To Head,Detroit Pistons,3.1,Miami Heat,1.37,1.053,BetRight
Charlotte Hornets v Phoenix Suns,2024-03-15T23:00:00Z,Head To Head,Charlotte Hornets,4.5,Phoenix Suns,1.21,1.049,BetRight
Toronto Raptors v Orlando Magic,2024-03-15T23:30:00Z,Head To Head,Toronto Raptors,3.1,Orlando Magic,1.37,1.053,BetRight
New Orleans Pelicans v Los Angeles Clippers,2024-03-16T00:00:00Z,Head To Head,New Orleans Pelicans,1.36,Los Angeles Clippers,3.15,1.053,BetRight
San Antonio Spurs v Denver Nuggets,2024-03-16T00:30:00Z,Head To Head,San Antonio Spurs,4.75,Denver Nuggets,1.19,1.051,BetRight
Utah Jazz v Atlanta Hawks,2024-03-16T01:30:00Z,Head To Head,Utah Jazz,1.86,Atlanta Hawks,1.94,1.053,BetRight
