match,start_time,market_name,home_team,home_win,away_team,away_win,margin,agency
Detroit Pistons v Cleveland Cavaliers,2025-03-28T23:00:00Z,Head To Head,Detroit Pistons,3.85,Cleveland Cavaliers,1.26,1.053,BetRight
Toronto Raptors v Charlotte Hornets,2025-03-28T23:30:00Z,Head To Head,Toronto Raptors,1.35,Charlotte Hornets,3.2,1.053,BetRight
Brooklyn Nets v Los Angeles Clippers,2025-03-28T23:30:00Z,Head To Head,Brooklyn Nets,6,Los Angeles Clippers,1.13,1.052,BetRight
New Orleans Pelicans v Golden State Warriors,2025-03-29T00:00:00Z,Head To Head,New Orleans Pelicans,5.75,Golden State Warriors,1.14,1.051,BetRight
Milwaukee Bucks v New York Knicks,2025-03-29T00:00:00Z,Head To Head,Milwaukee Bucks,1.95,New York Knicks,1.85,1.053,BetRight
Minnesota Timberwolves v Phoenix Suns,2025-03-29T00:00:00Z,Head To Head,Minnesota Timberwolves,1.34,Phoenix Suns,3.25,1.054,BetRight
Denver Nuggets v Utah Jazz,2025-03-29T01:00:00Z,Head To Head,Denver Nuggets,1.06,Utah Jazz,9.5,1.049,BetRight
