match,start_time,market_name,home_team,home_win,away_team,away_win,margin,agency
Washington Wizards v Boston Celtics,2024-11-23T00:00:00Z,Head To Head,Washington Wizards,8.5,Boston Celtics,1.07,1.052,BetRight
Philadelphia 76ers v Brooklyn Nets,2024-11-23T00:00:00Z,Head To Head,Philadelphia 76ers,1.47,Brooklyn Nets,2.7,1.051,BetRight
New Orleans Pelicans v Golden State Warriors,2024-11-23T00:30:00Z,Head To Head,New Orleans Pelicans,4.5,Golden State Warriors,1.21,1.049,BetRight
Chicago Bulls v Atlanta Hawks,2024-11-23T01:00:00Z,Head To Head,Chicago Bulls,1.95,Atlanta Hawks,1.85,1.053,BetRight
Milwaukee Bucks v Indiana Pacers,2024-11-23T01:00:00Z,Head To Head,Milwaukee Bucks,1.44,Indiana Pacers,2.75,1.058,BetRight
Houston Rockets v Portland Trail Blazers,2024-11-23T01:00:00Z,Head To Head,Houston Rockets,1.13,Portland Trail Blazers,6,1.052,BetRight
Denver Nuggets v Dallas Mavericks,2024-11-23T03:00:00Z,Head To Head,Denver Nuggets,1.62,Dallas Mavericks,2.3,1.052,BetRight
Los Angeles Clippers v Sacramento Kings,2024-11-23T03:30:00Z,Head To Head,Los Angeles Clippers,2.28,Sacramento Kings,1.63,1.052,BetRight
