match,start_time,market_name,home_team,home_win,away_team,away_win,margin,agency
San Antonio Spurs v Denver Nuggets,2025-01-05T01:00:00Z,Head To Head,San Antonio Spurs,2.18,Denver Nuggets,1.73,1.037,BetRight
Chicago Bulls v New York Knicks,2025-01-05T01:00:00Z,Head To Head,Chicago Bulls,2.7,New York Knicks,1.5,1.037,BetRight
Milwaukee Bucks v Portland Trail Blazers,2025-01-05T01:00:00Z,Head To Head,Milwaukee Bucks,1.18,Portland Trail Blazers,5.25,1.038,BetRight
Miami Heat v Utah Jazz,2025-01-05T01:00:00Z,Head To Head,Miami Heat,1.32,Utah Jazz,3.55,1.039,BetRight
Golden State Warriors v Memphis Grizzlies,2025-01-05T01:30:00Z,Head To Head,Golden State Warriors,1.67,Memphis Grizzlies,2.2,1.053,BetRight
Los Angeles Clippers v Atlanta Hawks,2025-01-05T03:30:00Z,Head To Head,Los Angeles Clippers,1.41,Atlanta Hawks,2.92,1.052,BetRight
Oklahoma City Thunder v Boston Celtics,2025-01-05T20:30:00Z,Head To Head,Oklahoma City Thunder,1.8,Boston Celtics,2.02,1.051,BetRight
Washington Wizards v New Orleans Pelicans,2025-01-05T23:00:00Z,Head To Head,Washington Wizards,2.38,New Orleans Pelicans,1.58,1.053,BetRight
Houston Rockets v Los Angeles Lakers,2025-01-06T00:00:00Z,Head To Head,Houston Rockets,1.52,Los Angeles Lakers,2.55,1.05,BetRight
