match,start_time,market_name,home_team,home_win,away_team,away_win,margin,agency
Charlotte Hornets v Oklahoma City Thunder,2024-12-28T23:00:00Z,Head To Head,Charlotte Hornets,6,Oklahoma City Thunder,1.13,1.052,BetRight
Washington Wizards v New York Knicks,2024-12-29T00:00:00Z,Head To Head,Washington Wizards,5.5,New York Knicks,1.15,1.051,BetRight
Chicago Bulls v Milwaukee Bucks,2024-12-29T01:00:00Z,Head To Head,Chicago Bulls,2.28,Milwaukee Bucks,1.63,1.052,BetRight
Golden State Warriors v Phoenix Suns,2024-12-29T01:30:00Z,Head To Head,Golden State Warriors,1.38,Phoenix Suns,3.05,1.053,BetRight
Denver Nuggets v Detroit Pistons,2024-12-29T02:00:00Z,Head To Head,Denver Nuggets,1.41,Detroit Pistons,2.92,1.052,BetRight
Utah Jazz v Philadelphia 76ers,2024-12-29T02:30:00Z,Head To Head,Utah Jazz,2.75,Philadelphia 76ers,1.45,1.053,BetRight
Portland Trail Blazers v Dallas Mavericks,2024-12-29T03:00:00Z,Head To Head,Portland Trail Blazers,2.48,Dallas Mavericks,1.54,1.053,BetRight
Los Angeles Lakers v Sacramento Kings,2024-12-29T03:30:00Z,Head To Head,Los Angeles Lakers,1.95,Sacramento Kings,1.85,1.053,BetRight
