match,start_time,market_name,home_team,home_win,away_team,away_win,margin,agency
Atlanta Hawks v New York Knicks,2025-04-05T19:00:00Z,Head To Head,Atlanta Hawks,2.38,New York Knicks,1.58,1.053,BetRight
Detroit Pistons v Memphis Grizzlies,2025-04-05T23:00:00Z,Head To Head,Detroit Pistons,2.02,Memphis Grizzlies,1.8,1.051,BetRight
Philadelphia 76ers v Minnesota Timberwolves,2025-04-05T23:00:00Z,Head To Head,Philadelphia 76ers,8,Minnesota Timberwolves,1.08,1.051,BetRight
Miami Heat v Milwaukee Bucks,2025-04-06T00:00:00Z,Head To Head,Miami Heat,1.98,Milwaukee Bucks,1.83,1.051,BetRight
Los Angeles Clippers v Dallas Mavericks,2025-04-06T02:30:00Z,Head To Head,Los Angeles Clippers,1.28,Dallas Mavericks,3.7,1.052,BetRight
