match,start_time,market_name,home_team,home_win,away_team,away_win,margin,agency
Boston Celtics v Cleveland Cavaliers,2024-11-20T00:00:00Z,Head To Head,Boston Celtics,1.41,Cleveland Cavaliers,2.92,1.052,BetRight
Brooklyn Nets v Charlotte Hornets,2024-11-20T00:30:00Z,Head To Head,Brooklyn Nets,1.68,Charlotte Hornets,2.18,1.054,BetRight
Memphis Grizzlies v Denver Nuggets,2024-11-20T01:00:00Z,Head To Head,Memphis Grizzlies,1.44,Denver Nuggets,2.8,1.052,BetRight
Dallas Mavericks v New Orleans Pelicans,2024-11-20T01:30:00Z,Head To Head,Dallas Mavericks,1.12,New Orleans Pelicans,6.25,1.053,BetRight
San Antonio Spurs v Oklahoma City Thunder,2024-11-20T02:30:00Z,Head To Head,San Antonio Spurs,4.5,Oklahoma City Thunder,1.21,1.049,BetRight
Los Angeles Lakers v Utah Jazz,2024-11-20T03:30:00Z,Head To Head,Los Angeles Lakers,1.18,Utah Jazz,4.9,1.052,BetRight
