match,start_time,market_name,home_team,home_win,away_team,away_win,margin,agency
Detroit Pistons v New Orleans Pelicans,2024-03-24T19:00:00Z,Head To Head,Detroit Pistons,5.75,New Orleans Pelicans,1.14,1.051,BetRight
Los Angeles Clippers v Philadelphia 76ers,2024-03-24T19:30:00Z,Head To Head,Los Angeles Clippers,1.22,Philadelphia 76ers,4.3,1.052,BetRight
Miami Heat v Cleveland Cavaliers,2024-03-24T22:00:00Z,Head To Head,Miami Heat,1.58,Cleveland Cavaliers,2.38,1.053,BetRight
Minnesota Timberwolves v Golden State Warriors,2024-03-24T23:00:00Z,Head To Head,Minnesota Timberwolves,1.71,Golden State Warriors,2.14,1.052,BetRight
Milwaukee Bucks v Oklahoma City Thunder,2024-03-24T23:00:00Z,Head To Head,Milwaukee Bucks,1.7,Oklahoma City Thunder,2.15,1.053,BetRight
Los Angeles Lakers v Indiana Pacers,2024-03-25T02:00:00Z,Head To Head,Los Angeles Lakers,1.65,Indiana Pacers,2.24,1.052,BetRight
