match,start_time,market_name,home_team,home_win,away_team,away_win,margin,agency
Minnesota Timberwolves v San Antonio Spurs,2024-12-30T02:00:00Z,Head To Head,Minnesota Timberwolves,1.44,San Antonio Spurs,2.9,1.039,BetRight
Charlotte Hornets v Chicago Bulls,2024-12-31T00:00:00Z,Head To Head,Charlotte Hornets,2.92,Chicago Bulls,1.41,1.052,BetRight
Washington Wizards v New York Knicks,2024-12-31T00:00:00Z,Head To Head,Washington Wizards,4.6,New York Knicks,1.2,1.051,BetRight
New Orleans Pelicans v Los Angeles Clippers,2024-12-31T01:00:00Z,Head To Head,New Orleans Pelicans,2.92,Los Angeles Clippers,1.41,1.052,BetRight
Utah Jazz v Denver Nuggets,2024-12-31T02:00:00Z,Head To Head,Utah Jazz,3.7,Denver Nuggets,1.28,1.052,BetRight
Golden State Warriors v Cleveland Cavaliers,2024-12-31T03:00:00Z,Head To Head,Golden State Warriors,2.42,Cleveland Cavaliers,1.56,1.054,BetRight
Portland Trail Blazers v Philadelphia 76ers,2024-12-31T03:00:00Z,Head To Head,Portland Trail Blazers,2.92,Philadelphia 76ers,1.41,1.052,BetRight
