match,start_time,market_name,home_team,home_win,away_team,away_win,margin,agency
Los Angeles Lakers v Utah Jazz,2025-02-11T03:30:00Z,Head To Head,Los Angeles Lakers,1.14,Utah Jazz,6.25,1.037,BetRight
Philadelphia 76ers v Toronto Raptors,2025-02-12T00:00:00Z,Head To Head,Philadelphia 76ers,1.34,Toronto Raptors,3.25,1.054,BetRight
Indiana Pacers v New York Knicks,2025-02-12T00:30:00Z,Head To Head,Indiana Pacers,1.94,New York Knicks,1.86,1.053,BetRight
Chicago Bulls v Detroit Pistons,2025-02-12T01:00:00Z,Head To Head,Chicago Bulls,2.4,Detroit Pistons,1.57,1.054,BetRight
Phoenix Suns v Memphis Grizzlies,2025-02-12T03:00:00Z,Head To Head,Phoenix Suns,2.38,Memphis Grizzlies,1.58,1.053,BetRight
