match,start_time,market_name,home_team,home_win,away_team,away_win,margin,agency
Cleveland Cavaliers v Memphis Grizzlies,2025-02-24T00:00:00Z,Head To Head,Cleveland Cavaliers,1.46,Memphis Grizzlies,2.85,1.036,BetRight
New Orleans Pelicans v San Antonio Spurs,2025-02-24T00:00:00Z,Head To Head,New Orleans Pelicans,1.78,San Antonio Spurs,2.1,1.038,BetRight
Minnesota Timberwolves v Oklahoma City Thunder,2025-02-24T02:30:00Z,Head To Head,Minnesota Timberwolves,3.8,Oklahoma City Thunder,1.27,1.051,BetRight
Washington Wizards v Brooklyn Nets,2025-02-25T00:00:00Z,Head To Head,Washington Wizards,2.34,Brooklyn Nets,1.6,1.052,BetRight
Philadelphia 76ers v Chicago Bulls,2025-02-25T00:00:00Z,Head To Head,Philadelphia 76ers,1.77,Chicago Bulls,2.05,1.053,BetRight
Indiana Pacers v Denver Nuggets,2025-02-25T00:00:00Z,Head To Head,Indiana Pacers,2.34,Denver Nuggets,1.6,1.052,BetRight
Atlanta Hawks v Miami Heat,2025-02-25T00:30:00Z,Head To Head,Atlanta Hawks,1.94,Miami Heat,1.86,1.053,BetRight
Utah Jazz v Portland Trail Blazers,2025-02-25T02:00:00Z,Head To Head,Utah Jazz,1.9,Portland Trail Blazers,1.9,1.053,BetRight
Los Angeles Lakers v Dallas Mavericks,2025-02-26T03:00:00Z,Head To Head,Los Angeles Lakers,1.39,Dallas Mavericks,3,1.053,BetRight
