match,start_time,market_name,home_team,home_win,away_team,away_win,margin,agency
Orlando Magic v Toronto Raptors,2025-03-05T00:00:00Z,Head To Head,Orlando Magic,1.34,Toronto Raptors,3.25,1.054,BetRight
New York Knicks v Golden State Warriors,2025-03-05T00:30:00Z,Head To Head,New York Knicks,1.54,Golden State Warriors,2.48,1.053,BetRight
Atlanta Hawks v Milwaukee Bucks,2025-03-05T00:30:00Z,Head To Head,Atlanta Hawks,2.6,Milwaukee Bucks,1.5,1.051,BetRight
Chicago Bulls v Cleveland Cavaliers,2025-03-05T01:00:00Z,Head To Head,Chicago Bulls,5.5,Cleveland Cavaliers,1.15,1.051,BetRight
Minnesota Timberwolves v Philadelphia 76ers,2025-03-05T01:00:00Z,Head To Head,Minnesota Timberwolves,1.15,Philadelphia 76ers,5.5,1.051,BetRight
San Antonio Spurs v Brooklyn Nets,2025-03-05T01:30:00Z,Head To Head,San Antonio Spurs,1.54,Brooklyn Nets,2.48,1.053,BetRight
Phoenix Suns v Los Angeles Clippers,2025-03-05T03:00:00Z,Head To Head,Phoenix Suns,2.06,Los Angeles Clippers,1.76,1.054,BetRight
Los Angeles Lakers v New Orleans Pelicans,2025-03-05T03:30:00Z,Head To Head,Los Angeles Lakers,1.31,New Orleans Pelicans,3.45,1.053,BetRight
