match,start_time,market_name,home_team,home_win,away_team,away_win,margin,agency
Golden State Warriors v Milwaukee Bucks,2024-03-07T03:00:00Z,Head To Head,Golden State Warriors,1.68,Milwaukee Bucks,2.18,1.054,BetRight
Portland Trail Blazers v Oklahoma City Thunder,2024-03-07T03:00:00Z,Head To Head,Portland Trail Blazers,6.25,Oklahoma City Thunder,1.12,1.053,BetRight
Los Angeles Lakers v Sacramento Kings,2024-03-07T03:30:00Z,Head To Head,Los Angeles Lakers,1.7,Sacramento Kings,2.15,1.053,BetRight
Detroit Pistons v Brooklyn Nets,2024-03-08T00:00:00Z,Head To Head,Detroit Pistons,2.15,Brooklyn Nets,1.7,1.053,BetRight
Dallas Mavericks v Miami Heat,2024-03-08T00:30:00Z,Head To Head,Dallas Mavericks,1.54,Miami Heat,2.48,1.053,BetRight
Phoenix Suns v Toronto Raptors,2024-03-08T02:00:00Z,Head To Head,Phoenix Suns,1.2,Toronto Raptors,4.6,1.051,BetRight
Denver Nuggets v Boston Celtics,2024-03-08T03:00:00Z,Head To Head,Denver Nuggets,1.9,Boston Celtics,1.9,1.053,BetRight
Golden State Warriors v Chicago Bulls,2024-03-08T03:00:00Z,Head To Head,Golden State Warriors,1.38,Chicago Bulls,3.05,1.053,BetRight
