match,start_time,market_name,home_team,home_win,away_team,away_win,margin,agency
Atlanta Hawks v New York Knicks,2025-04-05T19:00:00Z,Head To Head,Atlanta Hawks,2.38,New York Knicks,1.58,1.053,BetRight
Detroit Pistons v Memphis Grizzlies,2025-04-05T23:00:00Z,Head To Head,Detroit Pistons,2.05,Memphis Grizzlies,1.77,1.053,BetRight
Philadelphia 76ers v Minnesota Timberwolves,2025-04-05T23:00:00Z,Head To Head,Philadelphia 76ers,8,Minnesota Timberwolves,1.08,1.051,BetRight
Miami Heat v Milwaukee Bucks,2025-04-06T00:00:00Z,Head To Head,Miami Heat,1.82,Milwaukee Bucks,2,1.049,BetRight
Los Angeles Clippers v Dallas Mavericks,2025-04-06T02:30:00Z,Head To Head,Los Angeles Clippers,1.3,Dallas Mavericks,3.55,1.051,BetRight
