match,start_time,market_name,home_team,home_win,away_team,away_win,margin,agency
Dallas Mavericks v Los Angeles Clippers,2024-12-20T01:30:00Z,Head To Head,Dallas Mavericks,1.92,Los Angeles Clippers,1.85,1.061,BetRight
Phoenix Suns v Indiana Pacers,2024-12-20T02:00:00Z,Head To Head,Phoenix Suns,1.41,Indiana Pacers,2.92,1.052,BetRight
Minnesota Timberwolves v New York Knicks,2024-12-20T02:30:00Z,Head To Head,Minnesota Timberwolves,1.68,New York Knicks,2.18,1.054,BetRight
Portland Trail Blazers v Denver Nuggets,2024-12-20T03:00:00Z,Head To Head,Portland Trail Blazers,3.6,Denver Nuggets,1.29,1.053,BetRight
Sacramento Kings v Los Angeles Lakers,2024-12-20T03:00:00Z,Head To Head,Sacramento Kings,1.54,Los Angeles Lakers,2.48,1.053,BetRight
Philadelphia 76ers v Charlotte Hornets,2024-12-21T00:00:00Z,Head To Head,Philadelphia 76ers,1.24,Charlotte Hornets,4.1,1.05,BetRight
Cleveland Cavaliers v Milwaukee Bucks,2024-12-21T00:30:00Z,Head To Head,Cleveland Cavaliers,1.3,Milwaukee Bucks,3.55,1.051,BetRight
Miami Heat v Oklahoma City Thunder,2024-12-21T01:00:00Z,Head To Head,Miami Heat,2.02,Oklahoma City Thunder,1.8,1.051,BetRight
