match,start_time,market_name,home_team,home_win,away_team,away_win,margin,agency
Milwaukee Bucks v Miami Heat,2025-01-24T01:30:00Z,Head To Head,Milwaukee Bucks,1.43,Miami Heat,2.95,1.038,BetRight
Denver Nuggets v Sacramento Kings,2025-01-24T02:00:00Z,Head To Head,Denver Nuggets,1.33,Sacramento Kings,3.35,1.05,BetRight
Los Angeles Lakers v Boston Celtics,2025-01-24T03:00:00Z,Head To Head,Los Angeles Lakers,2.85,Boston Celtics,1.43,1.05,BetRight
Los Angeles Clippers v Washington Wizards,2025-01-24T03:30:00Z,Head To Head,Los Angeles Clippers,1.1,Washington Wizards,7,1.052,BetRight
Philadelphia 76ers v Cleveland Cavaliers,2025-01-25T00:00:00Z,Head To Head,Philadelphia 76ers,4.1,Cleveland Cavaliers,1.24,1.05,BetRight
Charlotte Hornets v Portland Trail Blazers,2025-01-25T00:00:00Z,Head To Head,Charlotte Hornets,1.54,Portland Trail Blazers,2.48,1.053,BetRight
Memphis Grizzlies v New Orleans Pelicans,2025-01-25T01:00:00Z,Head To Head,Memphis Grizzlies,1.18,New Orleans Pelicans,4.9,1.052,BetRight
