match,start_time,market_name,home_team,home_win,away_team,away_win,margin,agency
Utah Jazz v Atlanta Hawks,2025-01-08T02:00:00Z,Head To Head,Utah Jazz,2.7,Atlanta Hawks,1.5,1.037,BetRight
Denver Nuggets v Boston Celtics,2025-01-08T03:00:00Z,Head To Head,Denver Nuggets,3.8,Boston Celtics,1.27,1.051,BetRight
Golden State Warriors v Miami Heat,2025-01-08T03:00:00Z,Head To Head,Golden State Warriors,1.24,Miami Heat,4.1,1.05,BetRight
Indiana Pacers v Chicago Bulls,2025-01-09T00:00:00Z,Head To Head,Indiana Pacers,1.5,Chicago Bulls,2.6,1.051,BetRight
Cleveland Cavaliers v Oklahoma City Thunder,2025-01-09T00:00:00Z,Head To Head,Cleveland Cavaliers,1.77,Oklahoma City Thunder,2.05,1.053,BetRight
Brooklyn Nets v Detroit Pistons,2025-01-09T00:30:00Z,Head To Head,Brooklyn Nets,3,Detroit Pistons,1.39,1.053,BetRight
New York Knicks v Toronto Raptors,2025-01-09T00:30:00Z,Head To Head,New York Knicks,1.15,Toronto Raptors,5.5,1.051,BetRight
Milwaukee Bucks v San Antonio Spurs,2025-01-09T02:30:00Z,Head To Head,Milwaukee Bucks,1.44,San Antonio Spurs,2.8,1.052,BetRight
