match,start_time,market_name,home_team,home_win,away_team,away_win,margin,agency
Memphis Grizzlies v New Orleans Pelicans,2025-01-25T01:00:00Z,Head To Head,Memphis Grizzlies,1.24,New Orleans Pelicans,4.1,1.05,BetRight
San Antonio Spurs v Indiana Pacers,2025-01-25T17:00:00Z,Head To Head,San Antonio Spurs,2.05,Indiana Pacers,1.77,1.053,BetRight
Minnesota Timberwolves v Denver Nuggets,2025-01-25T20:00:00Z,Head To Head,Minnesota Timberwolves,2.15,Denver Nuggets,1.7,1.053,BetRight
Dallas Mavericks v Boston Celtics,2025-01-25T22:30:00Z,Head To Head,Dallas Mavericks,3.2,Boston Celtics,1.35,1.053,BetRight
Orlando Magic v Detroit Pistons,2025-01-26T00:00:00Z,Head To Head,Orlando Magic,1.63,Detroit Pistons,2.28,1.052,BetRight
Atlanta Hawks v Toronto Raptors,2025-01-26T00:30:00Z,Head To Head,Atlanta Hawks,1.6,Toronto Raptors,2.34,1.052,BetRight
