match,start_time,market_name,home_team,home_win,away_team,away_win,margin,agency
Detroit Pistons v New Orleans Pelicans,2025-03-23T19:00:00Z,Head To Head,Detroit Pistons,1.15,New Orleans Pelicans,5.5,1.051,BetRight
Utah Jazz v Cleveland Cavaliers,2025-03-23T19:30:00Z,Head To Head,Utah Jazz,8,Cleveland Cavaliers,1.08,1.051,BetRight
Portland Trail Blazers v Boston Celtics,2025-03-23T22:00:00Z,Head To Head,Portland Trail Blazers,3.25,Boston Celtics,1.34,1.054,BetRight
Miami Heat v Charlotte Hornets,2025-03-23T22:00:00Z,Head To Head,Miami Heat,1.53,Charlotte Hornets,2.5,1.054,BetRight
Atlanta Hawks v Philadelphia 76ers,2025-03-23T22:00:00Z,Head To Head,Atlanta Hawks,1.22,Philadelphia 76ers,4.3,1.052,BetRight
Toronto Raptors v San Antonio Spurs,2025-03-23T22:00:00Z,Head To Head,Toronto Raptors,1.83,San Antonio Spurs,1.98,1.051,BetRight
Houston Rockets v Denver Nuggets,2025-03-23T23:00:00Z,Head To Head,Houston Rockets,1.37,Denver Nuggets,3.1,1.053,BetRight
Los Angeles Clippers v Oklahoma City Thunder,2025-03-24T01:00:00Z,Head To Head,Los Angeles Clippers,2.24,Oklahoma City Thunder,1.65,1.052,BetRight
