match,start_time,market_name,home_team,home_win,away_team,away_win,margin,agency
Toronto Raptors v Atlanta Hawks,2024-12-29T23:00:00Z,Head To Head,Toronto Raptors,1.91,Atlanta Hawks,1.89,1.053,BetRight
Boston Celtics v Indiana Pacers,2024-12-29T23:00:00Z,Head To Head,Boston Celtics,1.2,Indiana Pacers,4.6,1.051,BetRight
Oklahoma City Thunder v Memphis Grizzlies,2024-12-30T00:00:00Z,Head To Head,Oklahoma City Thunder,1.35,Memphis Grizzlies,3.2,1.053,BetRight
Houston Rockets v Miami Heat,2024-12-30T00:00:00Z,Head To Head,Houston Rockets,1.28,Miami Heat,3.7,1.052,BetRight
Minnesota Timberwolves v San Antonio Spurs,2024-12-30T01:00:00Z,Head To Head,Minnesota Timberwolves,1.44,San Antonio Spurs,2.8,1.052,BetRight
