match,start_time,market_name,home_team,home_win,away_team,away_win,margin,agency
Charlotte Hornets v Minnesota Timberwolves,2025-03-06T00:00:00Z,Head To Head,Charlotte Hornets,3.6,Minnesota Timberwolves,1.29,1.053,BetRight
Washington Wizards v Utah Jazz,2025-03-06T00:00:00Z,Head To Head,Washington Wizards,1.52,Utah Jazz,2.55,1.05,BetRight
Milwaukee Bucks v Dallas Mavericks,2025-03-06T01:00:00Z,Head To Head,Milwaukee Bucks,1.19,Dallas Mavericks,4.75,1.051,BetRight
Denver Nuggets v Sacramento Kings,2025-03-06T02:00:00Z,Head To Head,Denver Nuggets,1.43,Sacramento Kings,2.85,1.05,BetRight
Memphis Grizzlies v Oklahoma City Thunder,2025-03-06T02:30:00Z,Head To Head,Memphis Grizzlies,3.4,Oklahoma City Thunder,1.32,1.052,BetRight
Los Angeles Clippers v Detroit Pistons,2025-03-06T03:30:00Z,Head To Head,Los Angeles Clippers,2.42,Detroit Pistons,1.56,1.054,BetRight
Brooklyn Nets v Golden State Warriors,2025-03-07T00:30:00Z,Head To Head,Brooklyn Nets,4.9,Golden State Warriors,1.18,1.052,BetRight
