match,start_time,market_name,home_team,home_win,away_team,away_win,margin,agency
Phoenix Suns v Portland Trail Blazers,2024-12-16T01:00:00Z,Head To Head,Phoenix Suns,1.16,Portland Trail Blazers,6,1.029,BetRight
Golden State Warriors v Dallas Mavericks,2024-12-16T01:30:00Z,Head To Head,Golden State Warriors,2.02,Dallas Mavericks,1.8,1.051,BetRight
Los Angeles Lakers v Memphis Grizzlies,2024-12-16T02:30:00Z,Head To Head,Los Angeles Lakers,2.24,Memphis Grizzlies,1.65,1.052,BetRight
Detroit Pistons v Miami Heat,2024-12-17T00:00:00Z,Head To Head,Detroit Pistons,2.34,Miami Heat,1.6,1.052,BetRight
Charlotte Hornets v Philadelphia 76ers,2024-12-17T00:00:00Z,Head To Head,Charlotte Hornets,2.05,Philadelphia 76ers,1.77,1.053,BetRight
