match,start_time,market_name,home_team,home_win,away_team,away_win,margin,agency
Toronto Raptors v Indiana Pacers,2024-12-04T00:30:00Z,Head To Head,Toronto Raptors,2.3,Indiana Pacers,1.66,1.037,BetRight
New York Knicks v Orlando Magic,2024-12-04T00:30:00Z,Head To Head,New York Knicks,1.51,Orlando Magic,2.7,1.033,BetRight
Oklahoma City Thunder v Utah Jazz,2024-12-04T01:00:00Z,Head To Head,Oklahoma City Thunder,1.09,Utah Jazz,7.5,1.051,BetRight
Dallas Mavericks v Memphis Grizzlies,2024-12-04T01:30:00Z,Head To Head,Dallas Mavericks,1.52,Memphis Grizzlies,2.55,1.05,BetRight
Phoenix Suns v San Antonio Spurs,2024-12-04T02:00:00Z,Head To Head,Phoenix Suns,1.35,San Antonio Spurs,3.2,1.053,BetRight
Denver Nuggets v Golden State Warriors,2024-12-04T03:00:00Z,Head To Head,Denver Nuggets,1.51,Golden State Warriors,2.58,1.05,BetRight
Sacramento Kings v Houston Rockets,2024-12-04T03:00:00Z,Head To Head,Sacramento Kings,1.82,Houston Rockets,2,1.049,BetRight
Los Angeles Clippers v Portland Trail Blazers,2024-12-04T03:30:00Z,Head To Head,Los Angeles Clippers,1.27,Portland Trail Blazers,3.8,1.051,BetRight
