match,start_time,market_name,home_team,home_win,away_team,away_win,margin,agency
Orlando Magic v Golden State Warriors,2025-02-28T00:00:00Z,Head To Head,Orlando Magic,2.85,Golden State Warriors,1.43,1.05,BetRight
Milwaukee Bucks v Denver Nuggets,2025-02-28T01:00:00Z,Head To Head,Milwaukee Bucks,2.15,Denver Nuggets,1.7,1.053,BetRight
Dallas Mavericks v Charlotte Hornets,2025-02-28T01:30:00Z,Head To Head,Dallas Mavericks,1.23,Charlotte Hornets,4.25,1.048,BetRight
Phoenix Suns v New Orleans Pelicans,2025-02-28T02:00:00Z,Head To Head,Phoenix Suns,1.34,New Orleans Pelicans,3.25,1.054,BetRight
Los Angeles Lakers v Minnesota Timberwolves,2025-02-28T03:30:00Z,Head To Head,Los Angeles Lakers,1.46,Minnesota Timberwolves,2.72,1.053,BetRight
