match,start_time,market_name,home_team,home_win,away_team,away_win,margin,agency
Indiana Pacers v Chicago Bulls,2025-01-09T00:00:00Z,Head To Head,Indiana Pacers,1.45,Chicago Bulls,2.75,1.053,BetRight
Cleveland Cavaliers v Oklahoma City Thunder,2025-01-09T00:00:00Z,Head To Head,Cleveland Cavaliers,1.7,Oklahoma City Thunder,2.15,1.053,BetRight
Philadelphia 76ers v Washington Wizards,2025-01-09T00:00:00Z,Head To Head,Philadelphia 76ers,1.17,Washington Wizards,5,1.055,BetRight
Brooklyn Nets v Detroit Pistons,2025-01-09T00:30:00Z,Head To Head,Brooklyn Nets,3.85,Detroit Pistons,1.26,1.053,BetRight
New York Knicks v Toronto Raptors,2025-01-09T00:30:00Z,Head To Head,New York Knicks,1.15,Toronto Raptors,5.5,1.051,BetRight
New Orleans Pelicans v Portland Trail Blazers,2025-01-09T01:00:00Z,Head To Head,New Orleans Pelicans,1.82,Portland Trail Blazers,2,1.049,BetRight
Denver Nuggets v Los Angeles Clippers,2025-01-09T02:00:00Z,Head To Head,Denver Nuggets,1.98,Los Angeles Clippers,1.83,1.051,BetRight
Milwaukee Bucks v San Antonio Spurs,2025-01-09T02:30:00Z,Head To Head,Milwaukee Bucks,1.5,San Antonio Spurs,2.6,1.051,BetRight
