match,start_time,market_name,home_team,home_win,away_team,away_win,margin,agency
Utah Jazz v New Orleans Pelicans,2025-03-03T01:00:00Z,Head To Head,Utah Jazz,3.2,New Orleans Pelicans,1.38,1.037,BetRight
Los Angeles Lakers v Los Angeles Clippers,2025-03-03T02:30:00Z,Head To Head,Los Angeles Lakers,2.05,Los Angeles Clippers,1.77,1.053,BetRight
Phoenix Suns v Minnesota Timberwolves,2025-03-03T02:30:00Z,Head To Head,Phoenix Suns,1.85,Minnesota Timberwolves,1.95,1.053,BetRight
Charlotte Hornets v Golden State Warriors,2025-03-04T00:00:00Z,Head To Head,Charlotte Hornets,5.25,Golden State Warriors,1.16,1.053,BetRight
Philadelphia 76ers v Portland Trail Blazers,2025-03-04T00:00:00Z,Head To Head,Philadelphia 76ers,1.6,Portland Trail Blazers,2.34,1.052,BetRight
Miami Heat v Washington Wizards,2025-03-04T00:30:00Z,Head To Head,Miami Heat,1.14,Washington Wizards,5.75,1.051,BetRight
Memphis Grizzlies v Atlanta Hawks,2025-03-04T01:00:00Z,Head To Head,Memphis Grizzlies,1.41,Atlanta Hawks,2.92,1.052,BetRight
