match,start_time,market_name,home_team,home_win,away_team,away_win,margin,agency
Orlando Magic v Los Angeles Lakers,2025-03-24T23:00:00Z,Head To Head,Orlando Magic,2.4,Los Angeles Lakers,1.57,1.054,BetRight
Indiana Pacers v Minnesota Timberwolves,2025-03-24T23:00:00Z,Head To Head,Indiana Pacers,1.85,Minnesota Timberwolves,1.95,1.053,BetRight
Washington Wizards v Toronto Raptors,2025-03-24T23:00:00Z,Head To Head,Washington Wizards,1.82,Toronto Raptors,2,1.049,BetRight
Brooklyn Nets v Dallas Mavericks,2025-03-24T23:30:00Z,Head To Head,Brooklyn Nets,2.1,Dallas Mavericks,1.74,1.051,BetRight
New Orleans Pelicans v Philadelphia 76ers,2025-03-25T00:00:00Z,Head To Head,New Orleans Pelicans,1.57,Philadelphia 76ers,2.4,1.054,BetRight
Denver Nuggets v Chicago Bulls,2025-03-25T01:00:00Z,Head To Head,Denver Nuggets,1.68,Chicago Bulls,2.18,1.054,BetRight
Sacramento Kings v Boston Celtics,2025-03-25T02:00:00Z,Head To Head,Sacramento Kings,2.45,Boston Celtics,1.54,1.058,BetRight
Phoenix Suns v Milwaukee Bucks,2025-03-25T02:00:00Z,Head To Head,Phoenix Suns,1.68,Milwaukee Bucks,2.18,1.054,BetRight
