match,start_time,market_name,home_team,home_win,away_team,away_win,margin,agency
Oklahoma City Thunder v Chicago Bulls,2025-04-01T00:00:00Z,Head To Head,Oklahoma City Thunder,1.09,Chicago Bulls,7.5,1.051,BetRight
Dallas Mavericks v Brooklyn Nets,2025-04-01T00:30:00Z,Head To Head,Dallas Mavericks,1.24,Brooklyn Nets,4.1,1.05,BetRight
Los Angeles Lakers v Houston Rockets,2025-04-01T02:00:00Z,Head To Head,Los Angeles Lakers,1.6,Houston Rockets,2.34,1.052,BetRight
Milwaukee Bucks v Phoenix Suns,2025-04-01T23:30:00Z,Head To Head,Milwaukee Bucks,1.35,Phoenix Suns,3.2,1.053,BetRight
Atlanta Hawks v Portland Trail Blazers,2025-04-01T23:30:00Z,Head To Head,Atlanta Hawks,1.37,Portland Trail Blazers,3.1,1.053,BetRight
Memphis Grizzlies v Golden State Warriors,2025-04-02T00:00:00Z,Head To Head,Memphis Grizzlies,2.12,Golden State Warriors,1.72,1.053,BetRight
