match,start_time,market_name,home_team,home_win,away_team,away_win,margin,agency
Dallas Mavericks v Washington Wizards,2025-01-28T01:30:00Z,Head To Head,Dallas Mavericks,1.14,Washington Wizards,6.25,1.037,BetRight
Utah Jazz v Milwaukee Bucks,2025-01-28T02:00:00Z,Head To Head,Utah Jazz,3.95,Milwaukee Bucks,1.26,1.047,BetRight
Phoenix Suns v Los Angeles Clippers,2025-01-28T02:30:00Z,Head To Head,Phoenix Suns,2,Los Angeles Clippers,1.82,1.049,BetRight
Atlanta Hawks v Houston Rockets,2025-01-29T00:30:00Z,Head To Head,Atlanta Hawks,2.65,Houston Rockets,1.48,1.053,BetRight
Philadelphia 76ers v Los Angeles Lakers,2025-01-29T00:30:00Z,Head To Head,Philadelphia 76ers,2.4,Los Angeles Lakers,1.57,1.054,BetRight
Portland Trail Blazers v Milwaukee Bucks,2025-01-29T03:00:00Z,Head To Head,Portland Trail Blazers,2.88,Milwaukee Bucks,1.42,1.051,BetRight
Golden State Warriors v Utah Jazz,2025-01-29T03:00:00Z,Head To Head,Golden State Warriors,1.2,Utah Jazz,4.6,1.051,BetRight
