match,start_time,market_name,home_team,home_win,away_team,away_win,margin,agency
Charlotte Hornets v Washington Wizards,2025-03-01T23:00:00Z,Head To Head,Charlotte Hornets,1.63,Washington Wizards,2.28,1.052,BetRight
Detroit Pistons v Brooklyn Nets,2025-03-02T00:00:00Z,Head To Head,Detroit Pistons,1.16,Brooklyn Nets,5.25,1.053,BetRight
Houston Rockets v Sacramento Kings,2025-03-02T01:00:00Z,Head To Head,Houston Rockets,1.54,Sacramento Kings,2.48,1.053,BetRight
Memphis Grizzlies v San Antonio Spurs,2025-03-02T01:00:00Z,Head To Head,Memphis Grizzlies,1.34,San Antonio Spurs,3.25,1.054,BetRight
Philadelphia 76ers v Golden State Warriors,2025-03-02T01:30:00Z,Head To Head,Philadelphia 76ers,3.7,Golden State Warriors,1.27,1.058,BetRight
Dallas Mavericks v Milwaukee Bucks,2025-03-02T01:30:00Z,Head To Head,Dallas Mavericks,2.26,Milwaukee Bucks,1.64,1.052,BetRight
