match,start_time,market_name,home_team,home_win,away_team,away_win,margin,agency
Toronto Raptors v Chicago Bulls,2025-02-01T00:30:00Z,Head To Head,Toronto Raptors,1.62,Chicago Bulls,2.38,1.037,BetRight
Philadelphia 76ers v Denver Nuggets,2025-02-01T00:30:00Z,Head To Head,Philadelphia 76ers,3.95,Denver Nuggets,1.26,1.047,BetRight
New Orleans Pelicans v Boston Celtics,2025-02-01T01:00:00Z,Head To Head,New Orleans Pelicans,5.5,Boston Celtics,1.15,1.051,BetRight
San Antonio Spurs v Milwaukee Bucks,2025-02-01T01:00:00Z,Head To Head,San Antonio Spurs,2.05,Milwaukee Bucks,1.77,1.053,BetRight
Golden State Warriors v Phoenix Suns,2025-02-01T03:00:00Z,Head To Head,Golden State Warriors,1.96,Phoenix Suns,1.84,1.054,BetRight
Indiana Pacers v Atlanta Hawks,2025-02-01T22:00:00Z,Head To Head,Indiana Pacers,1.41,Atlanta Hawks,2.92,1.052,BetRight
Charlotte Hornets v Denver Nuggets,2025-02-02T00:00:00Z,Head To Head,Charlotte Hornets,7.5,Denver Nuggets,1.09,1.051,BetRight
