match,start_time,market_name,home_team,home_win,away_team,away_win,margin,agency
Detroit Pistons v Brooklyn Nets,2024-03-08T00:00:00Z,Head To Head,Detroit Pistons,2.05,Brooklyn Nets,1.77,1.053,BetRight
Dallas Mavericks v Miami Heat,2024-03-08T00:30:00Z,Head To Head,Dallas Mavericks,1.51,Miami Heat,2.58,1.05,BetRight
Phoenix Suns v Toronto Raptors,2024-03-08T02:00:00Z,Head To Head,Phoenix Suns,1.2,Toronto Raptors,4.6,1.051,BetRight
Denver Nuggets v Boston Celtics,2024-03-08T03:00:00Z,Head To Head,Denver Nuggets,1.89,Boston Celtics,1.91,1.053,BetRight
Golden State Warriors v Chicago Bulls,2024-03-08T03:00:00Z,Head To Head,Golden State Warriors,1.31,Chicago Bulls,3.45,1.053,BetRight
