match,start_time,market_name,home_team,home_win,away_team,away_win,margin,agency
Orlando Magic v Sacramento Kings,2025-03-29T21:00:00Z,Head To Head,Orlando Magic,1.93,Sacramento Kings,1.87,1.053,BetRight
Washington Wizards v Brooklyn Nets,2025-03-29T23:00:00Z,Head To Head,Washington Wizards,1.89,Brooklyn Nets,1.91,1.053,BetRight
Philadelphia 76ers v Miami Heat,2025-03-29T23:30:00Z,Head To Head,Philadelphia 76ers,3.25,Miami Heat,1.34,1.054,BetRight
San Antonio Spurs v Boston Celtics,2025-03-30T00:00:00Z,Head To Head,San Antonio Spurs,5.75,Boston Celtics,1.14,1.051,BetRight
Chicago Bulls v Dallas Mavericks,2025-03-30T00:00:00Z,Head To Head,Chicago Bulls,1.74,Dallas Mavericks,2.1,1.051,BetRight
Oklahoma City Thunder v Indiana Pacers,2025-03-30T00:00:00Z,Head To Head,Oklahoma City Thunder,1.2,Indiana Pacers,4.6,1.051,BetRight
Memphis Grizzlies v Los Angeles Lakers,2025-03-30T00:00:00Z,Head To Head,Memphis Grizzlies,1.74,Los Angeles Lakers,2.1,1.051,BetRight
