match,start_time,market_name,home_team,home_win,away_team,away_win,margin,agency
Miami Heat v New York Knicks,2025-03-02T23:00:00Z,Head To Head,Miami Heat,2.92,New York Knicks,1.44,1.037,BetRight
Orlando Magic v Toronto Raptors,2025-03-02T23:00:00Z,Head To Head,Orlando Magic,1.39,Toronto Raptors,3.15,1.037,BetRight
San Antonio Spurs v Oklahoma City Thunder,2025-03-03T00:00:00Z,Head To Head,San Antonio Spurs,6,Oklahoma City Thunder,1.13,1.052,BetRight
Utah Jazz v New Orleans Pelicans,2025-03-03T01:00:00Z,Head To Head,Utah Jazz,3.15,New Orleans Pelicans,1.36,1.053,BetRight
Los Angeles Lakers v Los Angeles Clippers,2025-03-03T02:30:00Z,Head To Head,Los Angeles Lakers,2.4,Los Angeles Clippers,1.58,1.05,BetRight
Phoenix Suns v Minnesota Timberwolves,2025-03-03T02:30:00Z,Head To Head,Phoenix Suns,1.85,Minnesota Timberwolves,1.95,1.053,BetRight
