match,start_time,market_name,home_team,home_win,away_team,away_win,margin,agency
Golden State Warriors v Houston Rockets,2024-12-06T03:00:00Z,Head To Head,Golden State Warriors,2.42,Houston Rockets,1.56,1.054,BetRight
Philadelphia 76ers v Orlando Magic,2024-12-07T00:00:00Z,Head To Head,Philadelphia 76ers,2.2,Orlando Magic,1.67,1.053,BetRight
Atlanta Hawks v Los Angeles Lakers,2024-12-07T00:30:00Z,Head To Head,Atlanta Hawks,1.73,Los Angeles Lakers,2.11,1.052,BetRight
Boston Celtics v Milwaukee Bucks,2024-12-07T00:30:00Z,Head To Head,Boston Celtics,1.38,Milwaukee Bucks,3.05,1.053,BetRight
Chicago Bulls v Indiana Pacers,2024-12-07T01:00:00Z,Head To Head,Chicago Bulls,2.18,Indiana Pacers,1.68,1.054,BetRight
San Antonio Spurs v Sacramento Kings,2024-12-07T01:00:00Z,Head To Head,San Antonio Spurs,2.24,Sacramento Kings,1.65,1.052,BetRight
Golden State Warriors v Minnesota Timberwolves,2024-12-07T03:00:00Z,Head To Head,Golden State Warriors,1.7,Minnesota Timberwolves,2.15,1.053,BetRight
Portland Trail Blazers v Utah Jazz,2024-12-07T03:00:00Z,Head To Head,Portland Trail Blazers,1.67,Utah Jazz,2.2,1.053,BetRight
