match,start_time,market_name,home_team,home_win,away_team,away_win,margin,agency
Toronto Raptors v Dallas Mavericks,2024-02-29T00:30:00Z,Head To Head,Toronto Raptors,2.12,Dallas Mavericks,1.72,1.053,BetRight
Chicago Bulls v Cleveland Cavaliers,2024-02-29T01:00:00Z,Head To Head,Chicago Bulls,2.58,Cleveland Cavaliers,1.51,1.05,BetRight
Minnesota Timberwolves v Memphis Grizzlies,2024-02-29T01:00:00Z,Head To Head,Minnesota Timberwolves,1.13,Memphis Grizzlies,6,1.052,BetRight
Denver Nuggets v Sacramento Kings,2024-02-29T02:00:00Z,Head To Head,Denver Nuggets,1.33,Sacramento Kings,3.35,1.05,BetRight
Los Angeles Clippers v Los Angeles Lakers,2024-02-29T03:00:00Z,Head To Head,Los Angeles Clippers,1.65,Los Angeles Lakers,2.24,1.052,BetRight
