match,start_time,market_name,home_team,home_win,away_team,away_win,margin,agency
Los Angeles Clippers v Minnesota Timberwolves,2024-12-05T03:30:00Z,Head To Head,Los Angeles Clippers,2.65,Minnesota Timberwolves,1.52,1.035,BetRight
Washington Wizards v Dallas Mavericks,2024-12-06T00:00:00Z,Head To Head,Washington Wizards,5.75,Dallas Mavericks,1.14,1.051,BetRight
Cleveland Cavaliers v Denver Nuggets,2024-12-06T00:00:00Z,Head To Head,Cleveland Cavaliers,1.6,Denver Nuggets,2.34,1.052,BetRight
New York Knicks v Charlotte Hornets,2024-12-06T00:30:00Z,Head To Head,New York Knicks,1.07,Charlotte Hornets,8.5,1.052,BetRight
Toronto Raptors v Oklahoma City Thunder,2024-12-06T00:30:00Z,Head To Head,Toronto Raptors,4.1,Oklahoma City Thunder,1.24,1.05,BetRight
San Antonio Spurs v Chicago Bulls,2024-12-06T01:00:00Z,Head To Head,San Antonio Spurs,1.77,Chicago Bulls,2.05,1.053,BetRight
New Orleans Pelicans v Phoenix Suns,2024-12-06T01:00:00Z,Head To Head,New Orleans Pelicans,1.95,Phoenix Suns,1.85,1.053,BetRight
Memphis Grizzlies v Sacramento Kings,2024-12-06T01:00:00Z,Head To Head,Memphis Grizzlies,1.54,Sacramento Kings,2.48,1.053,BetRight
Golden State Warriors v Houston Rockets,2024-12-06T03:00:00Z,Head To Head,Golden State Warriors,2.15,Houston Rockets,1.7,1.053,BetRight
