match,start_time,market_name,home_team,home_win,away_team,away_win,margin,agency
Indiana Pacers v Denver Nuggets,2024-01-24T00:00:00Z,Head To Head,Indiana Pacers,2.24,Denver Nuggets,1.65,1.052,BetRight
Brooklyn Nets v New York Knicks,2024-01-24T00:30:00Z,Head To Head,Brooklyn Nets,2.5,New York Knicks,1.53,1.054,BetRight
Oklahoma City Thunder v Portland Trail Blazers,2024-01-24T01:00:00Z,Head To Head,Oklahoma City Thunder,1.1,Portland Trail Blazers,7,1.052,BetRight
New Orleans Pelicans v Utah Jazz,2024-01-24T01:00:00Z,Head To Head,New Orleans Pelicans,1.41,Utah Jazz,2.92,1.052,BetRight
Los Angeles Clippers v Los Angeles Lakers,2024-01-24T03:00:00Z,Head To Head,Los Angeles Clippers,1.29,Los Angeles Lakers,3.6,1.053,BetRight
