match,start_time,market_name,home_team,home_win,away_team,away_win,margin,agency
Orlando Magic v Los Angeles Clippers,2025-03-31T23:00:00Z,Head To Head,Orlando Magic,2.24,Los Angeles Clippers,1.65,1.052,BetRight
Washington Wizards v Miami Heat,2025-03-31T23:00:00Z,Head To Head,Washington Wizards,3.85,Miami Heat,1.26,1.053,BetRight
Indiana Pacers v Sacramento Kings,2025-03-31T23:00:00Z,Head To Head,Indiana Pacers,1.45,Sacramento Kings,2.75,1.053,BetRight
Charlotte Hornets v Utah Jazz,2025-03-31T23:00:00Z,Head To Head,Charlotte Hornets,1.91,Utah Jazz,1.89,1.053,BetRight
Memphis Grizzlies v Boston Celtics,2025-03-31T23:30:00Z,Head To Head,Memphis Grizzlies,2.5,Boston Celtics,1.53,1.054,BetRight
Oklahoma City Thunder v Chicago Bulls,2025-04-01T00:00:00Z,Head To Head,Oklahoma City Thunder,1.09,Chicago Bulls,7.5,1.051,BetRight
Dallas Mavericks v Brooklyn Nets,2025-04-01T00:30:00Z,Head To Head,Dallas Mavericks,1.21,Brooklyn Nets,4.5,1.049,BetRight
Los Angeles Lakers v Houston Rockets,2025-04-01T02:00:00Z,Head To Head,Los Angeles Lakers,1.54,Houston Rockets,2.48,1.053,BetRight
