match,start_time,market_name,home_team,home_win,away_team,away_win,margin,agency
Phoenix Suns v Chicago Bulls,2025-03-20T02:00:00Z,Head To Head,Phoenix Suns,1.47,Chicago Bulls,2.65,1.058,BetRight
Sacramento Kings v Cleveland Cavaliers,2025-03-20T02:00:00Z,Head To Head,Sacramento Kings,2.95,Cleveland Cavaliers,1.4,1.053,BetRight
Los Angeles Lakers v Denver Nuggets,2025-03-20T02:00:00Z,Head To Head,Los Angeles Lakers,1.48,Denver Nuggets,2.65,1.053,BetRight
Portland Trail Blazers v Memphis Grizzlies,2025-03-20T02:00:00Z,Head To Head,Portland Trail Blazers,2.48,Memphis Grizzlies,1.54,1.053,BetRight
Indiana Pacers v Brooklyn Nets,2025-03-20T23:00:00Z,Head To Head,Indiana Pacers,1.26,Brooklyn Nets,3.85,1.053,BetRight
Charlotte Hornets v New York Knicks,2025-03-20T23:00:00Z,Head To Head,Charlotte Hornets,3.35,New York Knicks,1.33,1.05,BetRight
Sacramento Kings v Chicago Bulls,2025-03-21T02:00:00Z,Head To Head,Sacramento Kings,1.39,Chicago Bulls,3,1.053,BetRight
Golden State Warriors v Toronto Raptors,2025-03-21T02:00:00Z,Head To Head,Golden State Warriors,1.1,Toronto Raptors,7,1.052,BetRight
Los Angeles Lakers v Milwaukee Bucks,2025-03-21T02:30:00Z,Head To Head,Los Angeles Lakers,2.24,Milwaukee Bucks,1.65,1.052,BetRight
