match,start_time,market_name,home_team,home_win,away_team,away_win,margin,agency
Washington Wizards v Minnesota Timberwolves,2025-01-14T00:00:00Z,Head To Head,Washington Wizards,7,Minnesota Timberwolves,1.1,1.052,BetRight
New York Knicks v Detroit Pistons,2025-01-14T00:30:00Z,Head To Head,New York Knicks,1.34,Detroit Pistons,3.25,1.054,BetRight
Toronto Raptors v Golden State Warriors,2025-01-14T00:30:00Z,Head To Head,Toronto Raptors,2.72,Golden State Warriors,1.46,1.053,BetRight
Houston Rockets v Memphis Grizzlies,2025-01-14T01:00:00Z,Head To Head,Houston Rockets,1.62,Memphis Grizzlies,2.3,1.052,BetRight
Los Angeles Clippers v Miami Heat,2025-01-14T03:30:00Z,Head To Head,Los Angeles Clippers,1.36,Miami Heat,3.15,1.053,BetRight
Los Angeles Lakers v San Antonio Spurs,2025-01-14T03:30:00Z,Head To Head,Los Angeles Lakers,1.6,San Antonio Spurs,2.34,1.052,BetRight
Philadelphia 76ers v Oklahoma City Thunder,2025-01-15T00:00:00Z,Head To Head,Philadelphia 76ers,6.75,Oklahoma City Thunder,1.11,1.049,BetRight
Milwaukee Bucks v Sacramento Kings,2025-01-15T01:00:00Z,Head To Head,Milwaukee Bucks,1.74,Sacramento Kings,2.1,1.051,BetRight
