match,start_time,market_name,home_team,home_win,away_team,away_win,margin,agency
Golden State Warriors v Sacramento Kings,2025-03-14T02:00:00Z,Head To Head,Golden State Warriors,1.35,Sacramento Kings,3.2,1.053,BetRight
Miami Heat v Boston Celtics,2025-03-14T23:00:00Z,Head To Head,Miami Heat,3.2,Boston Celtics,1.35,1.053,BetRight
Philadelphia 76ers v Indiana Pacers,2025-03-14T23:00:00Z,Head To Head,Philadelphia 76ers,4.75,Indiana Pacers,1.19,1.051,BetRight
Atlanta Hawks v Los Angeles Clippers,2025-03-14T23:30:00Z,Head To Head,Atlanta Hawks,2.2,Los Angeles Clippers,1.67,1.053,BetRight
Houston Rockets v Dallas Mavericks,2025-03-15T00:00:00Z,Head To Head,Houston Rockets,1.17,Dallas Mavericks,5,1.055,BetRight
Minnesota Timberwolves v Orlando Magic,2025-03-15T00:00:00Z,Head To Head,Minnesota Timberwolves,1.22,Orlando Magic,4.3,1.052,BetRight
Denver Nuggets v Los Angeles Lakers,2025-03-15T01:30:00Z,Head To Head,Denver Nuggets,1.12,Los Angeles Lakers,6.25,1.053,BetRight
