match,start_time,market_name,home_team,home_win,away_team,away_win,margin,agency
Cleveland Cavaliers v Atlanta Hawks,2024-11-28T00:00:00Z,Head To Head,Cleveland Cavaliers,1.15,Atlanta Hawks,5.5,1.051,BetRight
Orlando Magic v Chicago Bulls,2024-11-28T00:00:00Z,Head To Head,Orlando Magic,1.2,Chicago Bulls,4.6,1.051,BetRight
Washington Wizards v Los Angeles Clippers,2024-11-28T00:00:00Z,Head To Head,Washington Wizards,4.5,Los Angeles Clippers,1.21,1.049,BetRight
Charlotte Hornets v Miami Heat,2024-11-28T00:00:00Z,Head To Head,Charlotte Hornets,2.24,Miami Heat,1.65,1.052,BetRight
Dallas Mavericks v New York Knicks,2024-11-28T00:30:00Z,Head To Head,Dallas Mavericks,2.5,New York Knicks,1.53,1.054,BetRight
