match,start_time,market_name,home_team,home_win,away_team,away_win,margin,agency
Golden State Warriors v Dallas Mavericks,2024-12-16T01:30:00Z,Head To Head,Golden State Warriors,1.91,Dallas Mavericks,1.94,1.039,BetRight
Los Angeles Lakers v Memphis Grizzlies,2024-12-16T02:30:00Z,Head To Head,Los Angeles Lakers,2.14,Memphis Grizzlies,1.71,1.052,BetRight
Detroit Pistons v Miami Heat,2024-12-17T00:00:00Z,Head To Head,Detroit Pistons,2.34,Miami Heat,1.6,1.052,BetRight
Charlotte Hornets v Philadelphia 76ers,2024-12-17T00:00:00Z,Head To Head,Charlotte Hornets,2.05,Philadelphia 76ers,1.77,1.053,BetRight
Toronto Raptors v Chicago Bulls,2024-12-17T00:30:00Z,Head To Head,Toronto Raptors,1.84,Chicago Bulls,1.96,1.054,BetRight
Los Angeles Clippers v Utah Jazz,2024-12-17T03:30:00Z,Head To Head,Los Angeles Clippers,1.23,Utah Jazz,4.25,1.048,BetRight
