match,start_time,market_name,home_team,home_win,away_team,away_win,margin,agency
Indiana Pacers v Houston Rockets,2025-03-05T00:00:00Z,Head To Head,Indiana Pacers,1.6,Houston Rockets,2.34,1.052,BetRight
Orlando Magic v Toronto Raptors,2025-03-05T00:00:00Z,Head To Head,Orlando Magic,1.34,Toronto Raptors,3.25,1.054,BetRight
New York Knicks v Golden State Warriors,2025-03-05T00:30:00Z,Head To Head,New York Knicks,1.47,Golden State Warriors,2.7,1.051,BetRight
Atlanta Hawks v Milwaukee Bucks,2025-03-05T00:30:00Z,Head To Head,Atlanta Hawks,2.8,Milwaukee Bucks,1.44,1.052,BetRight
Chicago Bulls v Cleveland Cavaliers,2025-03-05T01:00:00Z,Head To Head,Chicago Bulls,5.75,Cleveland Cavaliers,1.14,1.051,BetRight
Minnesota Timberwolves v Philadelphia 76ers,2025-03-05T01:00:00Z,Head To Head,Minnesota Timberwolves,1.1,Philadelphia 76ers,7,1.052,BetRight
San Antonio Spurs v Brooklyn Nets,2025-03-05T01:30:00Z,Head To Head,San Antonio Spurs,1.62,Brooklyn Nets,2.3,1.052,BetRight
Phoenix Suns v Los Angeles Clippers,2025-03-05T03:00:00Z,Head To Head,Phoenix Suns,2.2,Los Angeles Clippers,1.67,1.053,BetRight
Los Angeles Lakers v New Orleans Pelicans,2025-03-05T03:30:00Z,Head To Head,Los Angeles Lakers,1.24,New Orleans Pelicans,4.1,1.05,BetRight
