match,start_time,market_name,home_team,home_win,away_team,away_win,margin,agency
Minnesota Timberwolves v San Antonio Spurs,2024-12-30T02:00:00Z,Head To Head,Minnesota Timberwolves,1.44,San Antonio Spurs,2.8,1.052,BetRight
Charlotte Hornets v Chicago Bulls,2024-12-31T00:00:00Z,Head To Head,Charlotte Hornets,2.92,Chicago Bulls,1.41,1.052,BetRight
Washington Wizards v New York Knicks,2024-12-31T00:00:00Z,Head To Head,Washington Wizards,4.6,New York Knicks,1.2,1.051,BetRight
New Orleans Pelicans v Los Angeles Clippers,2024-12-31T01:00:00Z,Head To Head,New Orleans Pelicans,2.72,Los Angeles Clippers,1.46,1.053,BetRight
Utah Jazz v Denver Nuggets,2024-12-31T02:00:00Z,Head To Head,Utah Jazz,3.6,Denver Nuggets,1.29,1.053,BetRight
Golden State Warriors v Cleveland Cavaliers,2024-12-31T03:00:00Z,Head To Head,Golden State Warriors,2.34,Cleveland Cavaliers,1.6,1.052,BetRight
Portland Trail Blazers v Philadelphia 76ers,2024-12-31T03:00:00Z,Head To Head,Portland Trail Blazers,2.85,Philadelphia 76ers,1.43,1.05,BetRight
