match,start_time,market_name,home_team,home_win,away_team,away_win,margin,agency
Portland Trail Blazers v Dallas Mavericks,2024-12-29T03:00:00Z,Head To Head,Portland Trail Blazers,2.26,Dallas Mavericks,1.68,1.038,BetRight
Los Angeles Lakers v Sacramento Kings,2024-12-29T03:30:00Z,Head To Head,Los Angeles Lakers,2.2,Sacramento Kings,1.69,1.046,BetRight
Orlando Magic v Brooklyn Nets,2024-12-29T20:30:00Z,Head To Head,Orlando Magic,1.48,Brooklyn Nets,2.65,1.053,BetRight
Toronto Raptors v Atlanta Hawks,2024-12-29T23:00:00Z,Head To Head,Toronto Raptors,2.05,Atlanta Hawks,1.77,1.053,BetRight
Oklahoma City Thunder v Memphis Grizzlies,2024-12-30T00:00:00Z,Head To Head,Oklahoma City Thunder,1.3,Memphis Grizzlies,3.55,1.051,BetRight
Houston Rockets v Miami Heat,2024-12-30T00:00:00Z,Head To Head,Houston Rockets,1.36,Miami Heat,3.15,1.053,BetRight
Minnesota Timberwolves v San Antonio Spurs,2024-12-30T01:00:00Z,Head To Head,Minnesota Timberwolves,1.36,San Antonio Spurs,3.15,1.053,BetRight
