match,start_time,market_name,home_team,home_win,away_team,away_win,margin,agency
Chicago Bulls v Milwaukee Bucks,2024-12-29T01:00:00Z,Head To Head,Chicago Bulls,2.11,Milwaukee Bucks,1.77,1.039,BetRight
Golden State Warriors v Phoenix Suns,2024-12-29T01:30:00Z,Head To Head,Golden State Warriors,1.41,Phoenix Suns,2.92,1.052,BetRight
Denver Nuggets v Detroit Pistons,2024-12-29T02:00:00Z,Head To Head,Denver Nuggets,1.42,Detroit Pistons,2.88,1.051,BetRight
Utah Jazz v Philadelphia 76ers,2024-12-29T02:30:00Z,Head To Head,Utah Jazz,2.88,Philadelphia 76ers,1.42,1.051,BetRight
Portland Trail Blazers v Dallas Mavericks,2024-12-29T03:00:00Z,Head To Head,Portland Trail Blazers,2.42,Dallas Mavericks,1.56,1.054,BetRight
Los Angeles Lakers v Sacramento Kings,2024-12-29T03:30:00Z,Head To Head,Los Angeles Lakers,1.95,Sacramento Kings,1.85,1.053,BetRight
Orlando Magic v Brooklyn Nets,2024-12-29T20:30:00Z,Head To Head,Orlando Magic,1.54,Brooklyn Nets,2.48,1.053,BetRight
Toronto Raptors v Atlanta Hawks,2024-12-29T23:00:00Z,Head To Head,Toronto Raptors,1.95,Atlanta Hawks,1.85,1.053,BetRight
