match,start_time,market_name,home_team,home_win,away_team,away_win,margin,agency
Orlando Magic v Denver Nuggets,2025-01-19T23:00:00Z,Head To Head,Orlando Magic,3.25,Denver Nuggets,1.33,1.06,BetRight
Oklahoma City Thunder v Brooklyn Nets,2025-01-20T00:00:00Z,Head To Head,Oklahoma City Thunder,1.07,Brooklyn Nets,8.5,1.052,BetRight
Milwaukee Bucks v Philadelphia 76ers,2025-01-20T00:00:00Z,Head To Head,Milwaukee Bucks,1.13,Philadelphia 76ers,6,1.052,BetRight
Portland Trail Blazers v Chicago Bulls,2025-01-20T02:00:00Z,Head To Head,Portland Trail Blazers,3,Chicago Bulls,1.37,1.063,BetRight
Los Angeles Clippers v Los Angeles Lakers,2025-01-20T02:00:00Z,Head To Head,Los Angeles Clippers,1.55,Los Angeles Lakers,2.42,1.058,BetRight
Sacramento Kings v Washington Wizards,2025-01-20T02:00:00Z,Head To Head,Sacramento Kings,1.06,Washington Wizards,9.5,1.049,BetRight
