match,start_time,market_name,home_team,home_win,away_team,away_win,margin,agency
Detroit Pistons v Minnesota Timberwolves,2024-01-18T00:00:00.0000000Z,Head To Head,Detroit Pistons,6,Minnesota Timberwolves,1.13,1.052,BlueBet
Atlanta Hawks v Orlando Magic,2024-01-18T00:30:00.0000000Z,Head To Head,Atlanta Hawks,1.56,Orlando Magic,2.45,1.049,BlueBet
Boston Celtics v San Antonio Spurs,2024-01-18T00:30:00.0000000Z,Head To Head,Boston Celtics,1.07,San Antonio Spurs,8.75,1.049,BlueBet
New York Knicks v Houston Rockets,2024-01-18T00:30:00.0000000Z,Head To Head,New York Knicks,1.39,Houston Rockets,3,1.053,BlueBet
Toronto Raptors v Miami Heat,2024-01-18T00:30:00.0000000Z,Head To Head,Toronto Raptors,2.25,Miami Heat,1.64,1.054,BlueBet
New Orleans Pelicans v Charlotte Hornets,2024-01-18T01:00:00.0000000Z,Head To Head,New Orleans Pelicans,1.13,Charlotte Hornets,6,1.052,BlueBet
Los Angeles Lakers v Dallas Mavericks,2024-01-18T01:30:00.0000000Z,Head To Head,Los Angeles Lakers,1.58,Dallas Mavericks,2.4,1.05,BlueBet
Portland Trail Blazers v Brooklyn Nets,2024-01-18T03:00:00.0000000Z,Head To Head,Portland Trail Blazers,3,Brooklyn Nets,1.39,1.053,BlueBet
