match,start_time,market_name,home_team,home_win,away_team,away_win,margin,agency
Philadelphia 76ers v Washington Wizards,2025-03-26T23:00:00.0000000Z,Head To Head,Philadelphia 76ers,1.66,Washington Wizards,2.25,1.047,Betr
Brooklyn Nets v Toronto Raptors,2025-03-26T23:30:00.0000000Z,Head To Head,Brooklyn Nets,1.8,Toronto Raptors,2,1.056,Betr
Indiana Pacers v Los Angeles Lakers,2025-03-26T23:30:00.0000000Z,Head To Head,Indiana Pacers,2.05,Los Angeles Lakers,1.79,1.046,Betr
New York Knicks v Los Angeles Clippers,2025-03-26T23:30:00.0000000Z,Head To Head,New York Knicks,2.1,Los Angeles Clippers,1.73,1.054,Betr
Denver Nuggets v Milwaukee Bucks,2025-03-27T01:00:00.0000000Z,Head To Head,Denver Nuggets,1.5,Milwaukee Bucks,2.6,1.051,Betr
Phoenix Suns v Boston Celtics,2025-03-27T02:00:00.0000000Z,Head To Head,Phoenix Suns,2.35,Boston Celtics,1.61,1.047,Betr
