match,start_time,market_name,home_team,home_win,away_team,away_win,margin,agency
Atlanta Hawks v Cleveland Cavaliers,2024-03-07T00:40:00.0000000Z,Head To Head,Atlanta Hawks,1.54,Cleveland Cavaliers,2.38,1.07,BlueBet
Utah Jazz v Chicago Bulls,2024-03-07T02:00:00.0000000Z,Head To Head,Utah Jazz,2.9,Chicago Bulls,1.38,1.069,BlueBet
Portland Trail Blazers v Oklahoma City Thunder,2024-03-07T03:00:00.0000000Z,Head To Head,Portland Trail Blazers,6.75,Oklahoma City Thunder,1.11,1.049,BlueBet
Golden State Warriors v Milwaukee Bucks,2024-03-07T03:00:00.0000000Z,Head To Head,Golden State Warriors,1.66,Milwaukee Bucks,2.25,1.047,BlueBet
Los Angeles Lakers v Sacramento Kings,2024-03-07T03:30:00.0000000Z,Head To Head,Los Angeles Lakers,1.69,Sacramento Kings,2.2,1.046,BlueBet
Detroit Pistons v Brooklyn Nets,2024-03-08T00:00:00.0000000Z,Head To Head,Detroit Pistons,2.2,Brooklyn Nets,1.69,1.046,BlueBet
Indiana Pacers v Minnesota Timberwolves,2024-03-08T00:00:00.0000000Z,Head To Head,Indiana Pacers,1.85,Minnesota Timberwolves,1.96,1.051,BlueBet
Dallas Mavericks v Miami Heat,2024-03-08T00:30:00.0000000Z,Head To Head,Dallas Mavericks,1.51,Miami Heat,2.55,1.054,BlueBet
Phoenix Suns v Toronto Raptors,2024-03-08T02:00:00.0000000Z,Head To Head,Phoenix Suns,1.19,Toronto Raptors,4.75,1.051,BlueBet
