match,start_time,market_name,home_team,home_win,away_team,away_win,margin,agency
Boston Celtics v Denver Nuggets,2025-03-02T18:00:00.0000000Z,Head To Head,Boston Celtics,1.69,Denver Nuggets,2.2,1.046,Betr
Cleveland Cavaliers v Portland Trail Blazers,2025-03-02T20:30:00.0000000Z,Head To Head,Cleveland Cavaliers,1.16,Portland Trail Blazers,5.25,1.053,Betr
Indiana Pacers v Chicago Bulls,2025-03-02T22:00:00.0000000Z,Head To Head,Indiana Pacers,1.21,Chicago Bulls,4.45,1.051,Betr
Orlando Magic v Toronto Raptors,2025-03-02T23:00:00.0000000Z,Head To Head,Orlando Magic,1.36,Toronto Raptors,3.15,1.053,Betr
Miami Heat v New York Knicks,2025-03-02T23:00:00.0000000Z,Head To Head,Miami Heat,2.8,New York Knicks,1.44,1.052,Betr
San Antonio Spurs v Oklahoma City Thunder,2025-03-03T00:00:00.0000000Z,Head To Head,San Antonio Spurs,7,Oklahoma City Thunder,1.1,1.052,Betr
Utah Jazz v New Orleans Pelicans,2025-03-03T01:00:00.0000000Z,Head To Head,Utah Jazz,3,New Orleans Pelicans,1.39,1.053,Betr
Phoenix Suns v Minnesota Timberwolves,2025-03-03T02:30:00.0000000Z,Head To Head,Phoenix Suns,1.83,Minnesota Timberwolves,1.98,1.051,Betr
Los Angeles Lakers v Los Angeles Clippers,2025-03-03T02:30:00.0000000Z,Head To Head,Los Angeles Lakers,1.79,Los Angeles Clippers,2.05,1.046,Betr
