match,start_time,market_name,home_team,home_win,away_team,away_win,margin,agency
Orlando Magic v Minnesota Timberwolves,2024-01-10T00:00:00.0000000Z,Head To Head,Orlando Magic,2.7,Minnesota Timberwolves,1.47,1.051,BlueBet
Detroit Pistons v Sacramento Kings,2024-01-10T00:00:00.0000000Z,Head To Head,Detroit Pistons,5,Sacramento Kings,1.17,1.055,BlueBet
New York Knicks v Portland Trail Blazers,2024-01-10T00:30:00.0000000Z,Head To Head,New York Knicks,1.13,Portland Trail Blazers,6,1.052,BlueBet
Dallas Mavericks v Memphis Grizzlies,2024-01-10T01:30:00.0000000Z,Head To Head,Dallas Mavericks,1.26,Memphis Grizzlies,3.9,1.05,BlueBet
Los Angeles Lakers v Toronto Raptors,2024-01-10T03:30:00.0000000Z,Head To Head,Los Angeles Lakers,1.53,Toronto Raptors,2.5,1.054,BlueBet
