match,start_time,market_name,home_team,home_win,away_team,away_win,margin,agency
Orlando Magic v Sacramento Kings,2025-03-29T21:00:00.0000000Z,Head To Head,Orlando Magic,1.95,Sacramento Kings,1.86,1.05,Betr
Washington Wizards v Brooklyn Nets,2025-03-29T23:00:00.0000000Z,Head To Head,Washington Wizards,1.86,Brooklyn Nets,1.95,1.05,Betr
Philadelphia 76ers v Miami Heat,2025-03-29T23:30:00.0000000Z,Head To Head,Philadelphia 76ers,3.35,Miami Heat,1.33,1.05,Betr
Memphis Grizzlies v Los Angeles Lakers,2025-03-30T00:00:00.0000000Z,Head To Head,Memphis Grizzlies,1.72,Los Angeles Lakers,2.15,1.047,Betr
Chicago Bulls v Dallas Mavericks,2025-03-30T00:00:00.0000000Z,Head To Head,Chicago Bulls,1.72,Dallas Mavericks,2.15,1.047,Betr
San Antonio Spurs v Boston Celtics,2025-03-30T00:00:00.0000000Z,Head To Head,San Antonio Spurs,6,Boston Celtics,1.13,1.052,Betr
Oklahoma City Thunder v Indiana Pacers,2025-03-30T00:00:00.0000000Z,Head To Head,Oklahoma City Thunder,1.2,Indiana Pacers,4.6,1.051,Betr
