match,start_time,market_name,home_team,home_win,away_team,away_win,margin,agency
Phoenix Suns v Milwaukee Bucks,2025-03-25T02:00:00.0000000Z,Head To Head,Phoenix Suns,1.61,Milwaukee Bucks,2.35,1.047,Betr
Sacramento Kings v Boston Celtics,2025-03-25T02:00:00.0000000Z,Head To Head,Sacramento Kings,2.7,Boston Celtics,1.45,1.06,Betr
Charlotte Hornets v Orlando Magic,2025-03-25T23:00:00.0000000Z,Head To Head,Charlotte Hornets,2.65,Orlando Magic,1.48,1.053,Betr
Detroit Pistons v San Antonio Spurs,2025-03-25T23:00:00.0000000Z,Head To Head,Detroit Pistons,1.28,San Antonio Spurs,3.7,1.052,Betr
New York Knicks v Dallas Mavericks,2025-03-25T23:30:00.0000000Z,Head To Head,New York Knicks,1.31,Dallas Mavericks,3.5,1.049,Betr
Miami Heat v Golden State Warriors,2025-03-25T23:30:00.0000000Z,Head To Head,Miami Heat,2.55,Golden State Warriors,1.51,1.054,Betr
Houston Rockets v Atlanta Hawks,2025-03-26T00:00:00.0000000Z,Head To Head,Houston Rockets,1.3,Atlanta Hawks,3.55,1.051,Betr
Utah Jazz v Memphis Grizzlies,2025-03-26T01:00:00.0000000Z,Head To Head,Utah Jazz,4.35,Memphis Grizzlies,1.22,1.05,Betr
