match,start_time,market_name,home_team,home_win,away_team,away_win,margin,agency
Detroit Pistons v Brooklyn Nets,2025-03-02T00:00:00.0000000Z,Head To Head,Detroit Pistons,1.16,Brooklyn Nets,5.25,1.053,Betr
Houston Rockets v Sacramento Kings,2025-03-02T01:00:00.0000000Z,Head To Head,Houston Rockets,1.53,Sacramento Kings,2.5,1.054,Betr
Memphis Grizzlies v San Antonio Spurs,2025-03-02T01:00:00.0000000Z,Head To Head,Memphis Grizzlies,1.33,San Antonio Spurs,3.35,1.05,Betr
Dallas Mavericks v Milwaukee Bucks,2025-03-02T01:30:00.0000000Z,Head To Head,Dallas Mavericks,2.3,Milwaukee Bucks,1.63,1.048,Betr
Philadelphia 76ers v Golden State Warriors,2025-03-02T01:30:00.0000000Z,Head To Head,Philadelphia 76ers,3.65,Golden State Warriors,1.29,1.049,Betr
Cleveland Cavaliers v Portland Trail Blazers,2025-03-02T20:30:00.0000000Z,Head To Head,Cleveland Cavaliers,1.08,Portland Trail Blazers,8,1.051,Betr
Miami Heat v New York Knicks,2025-03-02T23:00:00.0000000Z,Head To Head,Miami Heat,2.8,New York Knicks,1.44,1.052,Betr
