match,start_time,market_name,home_team,home_win,away_team,away_win,margin,agency
Charlotte Hornets v Chicago Bulls,2024-01-09T00:00:00.0000000Z,Head To Head,Charlotte Hornets,3.1,Chicago Bulls,1.37,1.053,BlueBet
Washington Wizards v Oklahoma City Thunder,2024-01-09T00:00:00.0000000Z,Head To Head,Washington Wizards,5.25,Oklahoma City Thunder,1.16,1.053,BlueBet
Indiana Pacers v Boston Celtics,2024-01-09T00:00:00.0000000Z,Head To Head,Indiana Pacers,2.25,Boston Celtics,1.64,1.054,BlueBet
Miami Heat v Houston Rockets,2024-01-09T00:30:00.0000000Z,Head To Head,Miami Heat,1.56,Houston Rockets,2.45,1.049,BlueBet
Milwaukee Bucks v Utah Jazz,2024-01-09T01:00:00.0000000Z,Head To Head,Milwaukee Bucks,1.28,Utah Jazz,3.7,1.052,BlueBet
Los Angeles Clippers v Phoenix Suns,2024-01-09T03:30:00.0000000Z,Head To Head,Los Angeles Clippers,1.5,Phoenix Suns,2.65,1.044,BlueBet
