match,start_time,market_name,home_team,home_win,away_team,away_win,margin,agency
Orlando Magic v Sacramento Kings,2025-03-29T21:00:00.0000000Z,Head To Head,Orlando Magic,1.9,Sacramento Kings,1.9,1.053,Betr
Washington Wizards v Brooklyn Nets,2025-03-29T23:00:00.0000000Z,Head To Head,Washington Wizards,1.75,Brooklyn Nets,2.1,1.048,Betr
Philadelphia 76ers v Miami Heat,2025-03-29T23:30:00.0000000Z,Head To Head,Philadelphia 76ers,3.55,Miami Heat,1.3,1.051,Betr
Memphis Grizzlies v Los Angeles Lakers,2025-03-30T00:00:00.0000000Z,Head To Head,Memphis Grizzlies,1.71,Los Angeles Lakers,2.15,1.05,Betr
Chicago Bulls v Dallas Mavericks,2025-03-30T00:00:00.0000000Z,Head To Head,Chicago Bulls,1.68,Dallas Mavericks,2.2,1.05,Betr
San Antonio Spurs v Boston Celtics,2025-03-30T00:00:00.0000000Z,Head To Head,San Antonio Spurs,6.75,Boston Celtics,1.11,1.049,Betr
Oklahoma City Thunder v Indiana Pacers,2025-03-30T00:00:00.0000000Z,Head To Head,Oklahoma City Thunder,1.21,Indiana Pacers,4.45,1.051,Betr
