match,start_time,market_name,home_team,home_win,away_team,away_win,margin,agency
Sacramento Kings v Oklahoma City Thunder,2025-03-26T02:00:00.0000000Z,Head To Head,Sacramento Kings,4.2,Oklahoma City Thunder,1.23,1.051,Betr
Portland Trail Blazers v Cleveland Cavaliers,2025-03-26T02:00:00.0000000Z,Head To Head,Portland Trail Blazers,3,Cleveland Cavaliers,1.39,1.053,Betr
Philadelphia 76ers v Washington Wizards,2025-03-26T23:00:00.0000000Z,Head To Head,Philadelphia 76ers,1.7,Washington Wizards,2.15,1.053,Betr
Brooklyn Nets v Toronto Raptors,2025-03-26T23:30:00.0000000Z,Head To Head,Brooklyn Nets,1.8,Toronto Raptors,2,1.056,Betr
Indiana Pacers v Los Angeles Lakers,2025-03-26T23:30:00.0000000Z,Head To Head,Indiana Pacers,1.85,Los Angeles Lakers,1.96,1.051,Betr
New York Knicks v Los Angeles Clippers,2025-03-26T23:30:00.0000000Z,Head To Head,New York Knicks,2.1,Los Angeles Clippers,1.75,1.048,Betr
Denver Nuggets v Milwaukee Bucks,2025-03-27T01:00:00.0000000Z,Head To Head,Denver Nuggets,1.6,Milwaukee Bucks,2.35,1.051,Betr
