match,start_time,market_name,home_team,home_win,away_team,away_win,margin,agency
Chicago Bulls v Toronto Raptors,2025-03-01T01:11:00.0000000Z,Head To Head,Chicago Bulls,1.85,Toronto Raptors,1.96,1.051,Betr
Memphis Grizzlies v New York Knicks,2025-03-01T01:11:00.0000000Z,Head To Head,Memphis Grizzlies,1.73,New York Knicks,2.05,1.066,Betr
Miami Heat v Indiana Pacers,2025-03-01T01:11:00.0000000Z,Head To Head,Miami Heat,2.25,Indiana Pacers,1.65,1.051,Betr
Phoenix Suns v New Orleans Pelicans,2025-03-01T02:00:00.0000000Z,Head To Head,Phoenix Suns,1.23,New Orleans Pelicans,4.2,1.051,Betr
Utah Jazz v Minnesota Timberwolves,2025-03-01T02:30:00.0000000Z,Head To Head,Utah Jazz,2.5,Minnesota Timberwolves,1.54,1.049,Betr
Los Angeles Lakers v Los Angeles Clippers,2025-03-01T03:00:00.0000000Z,Head To Head,Los Angeles Lakers,2.4,Los Angeles Clippers,1.57,1.054,Betr
Charlotte Hornets v Washington Wizards,2025-03-01T23:00:00.0000000Z,Head To Head,Charlotte Hornets,1.54,Washington Wizards,2.5,1.049,Betr
Detroit Pistons v Brooklyn Nets,2025-03-02T00:00:00.0000000Z,Head To Head,Detroit Pistons,1.22,Brooklyn Nets,4.35,1.05,Betr
