match,start_time,market_name,home_team,home_win,away_team,away_win,margin,agency
Detroit Pistons v Brooklyn Nets,2024-03-08T00:00:00.0000000Z,Head To Head,Detroit Pistons,2.1,Brooklyn Nets,1.75,1.048,BlueBet
Indiana Pacers v Minnesota Timberwolves,2024-03-08T00:00:00.0000000Z,Head To Head,Indiana Pacers,1.83,Minnesota Timberwolves,1.98,1.051,BlueBet
Dallas Mavericks v Miami Heat,2024-03-08T00:30:00.0000000Z,Head To Head,Dallas Mavericks,1.5,Miami Heat,2.6,1.051,BlueBet
Phoenix Suns v Toronto Raptors,2024-03-08T02:00:00.0000000Z,Head To Head,Phoenix Suns,1.18,Toronto Raptors,5,1.047,BlueBet
Denver Nuggets v Boston Celtics,2024-03-08T03:00:00.0000000Z,Head To Head,Denver Nuggets,1.89,Boston Celtics,1.91,1.053,BlueBet
Sacramento Kings v San Antonio Spurs,2024-03-08T03:00:00.0000000Z,Head To Head,Sacramento Kings,1.15,San Antonio Spurs,5.5,1.051,BlueBet
Golden State Warriors v Chicago Bulls,2024-03-08T03:00:00.0000000Z,Head To Head,Golden State Warriors,1.27,Chicago Bulls,3.6,1.065,BlueBet
