match,start_time,market_name,home_team,home_win,away_team,away_win,margin,agency
Golden State Warriors v Denver Nuggets,2025-04-05T02:00:00.0000000Z,Head To Head,Golden State Warriors,1.95,Denver Nuggets,1.86,1.05,Betr
Los Angeles Clippers v Dallas Mavericks,2025-04-05T02:30:00.0000000Z,Head To Head,Los Angeles Clippers,1.21,Dallas Mavericks,4.45,1.051,Betr
Los Angeles Lakers v New Orleans Pelicans,2025-04-05T02:30:00.0000000Z,Head To Head,Los Angeles Lakers,1.08,New Orleans Pelicans,8,1.051,Betr
Atlanta Hawks v New York Knicks,2025-04-05T19:00:00.0000000Z,Head To Head,Atlanta Hawks,2.4,New York Knicks,1.58,1.05,Betr
Philadelphia 76ers v Minnesota Timberwolves,2025-04-05T23:00:00.0000000Z,Head To Head,Philadelphia 76ers,8,Minnesota Timberwolves,1.08,1.051,Betr
Detroit Pistons v Memphis Grizzlies,2025-04-05T23:00:00.0000000Z,Head To Head,Detroit Pistons,1.9,Memphis Grizzlies,1.9,1.053,Betr
