match,start_time,market_name,home_team,home_win,away_team,away_win,margin,agency
Milwaukee Bucks v Los Angeles Lakers,2025-03-13T23:30:00.0000000Z,Head To Head,Milwaukee Bucks,1.42,Los Angeles Lakers,2.9,1.049,Betr
New Orleans Pelicans v Orlando Magic,2025-03-14T00:00:00.0000000Z,Head To Head,New Orleans Pelicans,2.1,Orlando Magic,1.73,1.054,Betr
Chicago Bulls v Brooklyn Nets,2025-03-14T00:00:00.0000000Z,Head To Head,Chicago Bulls,1.79,Brooklyn Nets,2.05,1.046,Betr
Golden State Warriors v Sacramento Kings,2025-03-14T02:00:00.0000000Z,Head To Head,Golden State Warriors,1.33,Sacramento Kings,3.35,1.05,Betr
Miami Heat v Boston Celtics,2025-03-14T23:00:00.0000000Z,Head To Head,Miami Heat,3.35,Boston Celtics,1.33,1.05,Betr
Philadelphia 76ers v Indiana Pacers,2025-03-14T23:00:00.0000000Z,Head To Head,Philadelphia 76ers,4.45,Indiana Pacers,1.21,1.051,Betr
