match,start_time,market_name,home_team,home_win,away_team,away_win,margin,agency
Charlotte Hornets v Washington Wizards,2025-03-01T23:00:00.0000000Z,Head To Head,Charlotte Hornets,1.59,Washington Wizards,2.35,1.054,Betr
Detroit Pistons v Brooklyn Nets,2025-03-02T00:00:00.0000000Z,Head To Head,Detroit Pistons,1.16,Brooklyn Nets,5.25,1.053,Betr
Memphis Grizzlies v San Antonio Spurs,2025-03-02T01:00:00.0000000Z,Head To Head,Memphis Grizzlies,1.32,San Antonio Spurs,3.4,1.052,Betr
Houston Rockets v Sacramento Kings,2025-03-02T01:00:00.0000000Z,Head To Head,Houston Rockets,1.5,Sacramento Kings,2.6,1.051,Betr
Dallas Mavericks v Milwaukee Bucks,2025-03-02T01:30:00.0000000Z,Head To Head,Dallas Mavericks,2.3,Milwaukee Bucks,1.62,1.052,Betr
Philadelphia 76ers v Golden State Warriors,2025-03-02T01:30:00.0000000Z,Head To Head,Philadelphia 76ers,3.65,Golden State Warriors,1.29,1.049,Betr
