match,start_time,market_name,home_team,home_win,away_team,away_win,margin,agency
Boston Celtics v Portland Trail Blazers,2025-03-06T00:00:00.0000000Z,Head To Head,Boston Celtics,1.25,Portland Trail Blazers,3.9,1.056,Betr
Charlotte Hornets v Minnesota Timberwolves,2025-03-06T00:00:00.0000000Z,Head To Head,Charlotte Hornets,3.7,Minnesota Timberwolves,1.28,1.052,Betr
Cleveland Cavaliers v Miami Heat,2025-03-06T00:00:00.0000000Z,Head To Head,Cleveland Cavaliers,1.11,Miami Heat,6.75,1.049,Betr
Washington Wizards v Utah Jazz,2025-03-06T00:00:00.0000000Z,Head To Head,Washington Wizards,1.5,Utah Jazz,2.6,1.051,Betr
Milwaukee Bucks v Dallas Mavericks,2025-03-06T01:00:00.0000000Z,Head To Head,Milwaukee Bucks,1.18,Dallas Mavericks,4.95,1.049,Betr
Denver Nuggets v Sacramento Kings,2025-03-06T02:00:00.0000000Z,Head To Head,Denver Nuggets,1.39,Sacramento Kings,3,1.053,Betr
Memphis Grizzlies v Oklahoma City Thunder,2025-03-06T02:30:00.0000000Z,Head To Head,Memphis Grizzlies,3.5,Oklahoma City Thunder,1.31,1.049,Betr
Los Angeles Clippers v Detroit Pistons,2025-03-06T03:30:00.0000000Z,Head To Head,Los Angeles Clippers,2.45,Detroit Pistons,1.56,1.049,Betr
