match,start_time,market_name,home_team,home_win,away_team,away_win,margin,agency
Washington Wizards v Miami Heat,2025-03-31T23:00:00.0000000Z,Head To Head,Washington Wizards,4.35,Miami Heat,1.22,1.05,Betr
Orlando Magic v Los Angeles Clippers,2025-03-31T23:00:00.0000000Z,Head To Head,Orlando Magic,2.25,Los Angeles Clippers,1.66,1.047,Betr
Indiana Pacers v Sacramento Kings,2025-03-31T23:00:00.0000000Z,Head To Head,Indiana Pacers,1.57,Sacramento Kings,2.4,1.054,Betr
Charlotte Hornets v Utah Jazz,2025-03-31T23:00:00.0000000Z,Head To Head,Charlotte Hornets,1.58,Utah Jazz,2.4,1.05,Betr
Memphis Grizzlies v Boston Celtics,2025-03-31T23:30:00.0000000Z,Head To Head,Memphis Grizzlies,2.6,Boston Celtics,1.5,1.051,Betr
Oklahoma City Thunder v Chicago Bulls,2025-04-01T00:00:00.0000000Z,Head To Head,Oklahoma City Thunder,1.09,Chicago Bulls,7.5,1.051,Betr
Dallas Mavericks v Brooklyn Nets,2025-04-01T00:30:00.0000000Z,Head To Head,Dallas Mavericks,1.23,Brooklyn Nets,4.2,1.051,Betr
Los Angeles Lakers v Houston Rockets,2025-04-01T02:00:00.0000000Z,Head To Head,Los Angeles Lakers,1.57,Houston Rockets,2.4,1.054,Betr
