match,start_time,market_name,home_team,home_win,away_team,away_win,margin,agency
Charlotte Hornets v Brooklyn Nets,2025-03-08T23:00:00.0000000Z,Head To Head,Charlotte Hornets,2.65,Brooklyn Nets,1.48,1.053,Betr
Houston Rockets v New Orleans Pelicans,2025-03-09T00:00:00.0000000Z,Head To Head,Houston Rockets,1.3,New Orleans Pelicans,3.55,1.051,Betr
Atlanta Hawks v Indiana Pacers,2025-03-09T00:30:00.0000000Z,Head To Head,Atlanta Hawks,2.3,Indiana Pacers,1.62,1.052,Betr
Toronto Raptors v Washington Wizards,2025-03-09T00:30:00.0000000Z,Head To Head,Toronto Raptors,1.58,Washington Wizards,2.4,1.05,Betr
Milwaukee Bucks v Orlando Magic,2025-03-09T01:00:00.0000000Z,Head To Head,Milwaukee Bucks,1.51,Orlando Magic,2.55,1.054,Betr
Miami Heat v Chicago Bulls,2025-03-09T01:00:00.0000000Z,Head To Head,Miami Heat,1.5,Chicago Bulls,2.6,1.051,Betr
Boston Celtics v Los Angeles Lakers,2025-03-09T01:30:00.0000000Z,Head To Head,Boston Celtics,1.35,Los Angeles Lakers,3.25,1.048,Betr
Golden State Warriors v Detroit Pistons,2025-03-09T01:30:00.0000000Z,Head To Head,Golden State Warriors,1.45,Detroit Pistons,2.75,1.053,Betr
