match,start_time,market_name,home_team,home_win,away_team,away_win,margin,agency
Los Angeles Lakers v Houston Rockets,2025-04-01T02:00:00.0000000Z,Head To Head,Los Angeles Lakers,1.57,Houston Rockets,2.4,1.054,Betr
Atlanta Hawks v Portland Trail Blazers,2025-04-01T23:30:00.0000000Z,Head To Head,Atlanta Hawks,1.36,Portland Trail Blazers,3.15,1.053,Betr
Milwaukee Bucks v Phoenix Suns,2025-04-01T23:30:00.0000000Z,Head To Head,Milwaukee Bucks,1.35,Phoenix Suns,3.25,1.048,Betr
New York Knicks v Philadelphia 76ers,2025-04-01T23:30:00.0000000Z,Head To Head,New York Knicks,1.1,Philadelphia 76ers,7,1.052,Betr
Memphis Grizzlies v Golden State Warriors,2025-04-02T00:00:00.0000000Z,Head To Head,Memphis Grizzlies,2.15,Golden State Warriors,1.71,1.05,Betr
