match,market_name,home_team,home_win,away_team,away_win,margin,agency
Boston Celtics v Dallas Mavericks,Head To Head,Boston Celtics,1.2,Dallas Mavericks,4.75,1.044,Dabble
Minnesota Timberwolves v Houston Rockets,Head To Head,Minnesota Timberwolves,1.88,Houston Rockets,1.95,1.045,Dabble
Denver Nuggets v Orlando Magic,Head To Head,Denver Nuggets,1.24,Orlando Magic,4.25,1.042,Dabble
Portland Trail Blazers v Sacramento Kings,Head To Head,Portland Trail Blazers,2.08,Sacramento Kings,1.77,1.046,Dabble
Los Angeles Lakers v Golden State Warriors,Head To Head,Los Angeles Lakers,1.37,Golden State Warriors,3.2,1.042,Dabble
Los Angeles Clippers v Indiana Pacers,Head To Head,Los Angeles Clippers,1.65,Indiana Pacers,2.3,1.041,Dabble
