match,market_name,home_team,home_win,away_team,away_win,margin,agency
Los Angeles Clippers v Oklahoma City Thunder,Head To Head,Los Angeles Clippers,2.3,Oklahoma City Thunder,1.65,1.041,Dabble
Portland Trail Blazers v Sacramento Kings,Head To Head,Portland Trail Blazers,3.3,Sacramento Kings,1.35,1.044,Dabble
Charlotte Hornets v Atlanta Hawks,Head To Head,Charlotte Hornets,2.35,Atlanta Hawks,1.62,1.043,Dabble
Milwaukee Bucks v Washington Wizards,Head To Head,Milwaukee Bucks,1.08,Washington Wizards,8.5,1.044,Dabble
Phoenix Suns v Golden State Warriors,Head To Head,Phoenix Suns,1.7,Golden State Warriors,2.2,1.043,Dabble
Utah Jazz v Dallas Mavericks,Head To Head,Utah Jazz,2.95,Dallas Mavericks,1.42,1.043,Dabble
