match,market_name,home_team,home_win,away_team,away_win,margin,agency
Atlanta Hawks v Portland Trail Blazers,Head To Head,Atlanta Hawks,1.48,Portland Trail Blazers,2.7,1.046,Dabble
Milwaukee Bucks v Phoenix Suns,Head To Head,Milwaukee Bucks,1.45,Phoenix Suns,2.8,1.047,Dabble
New York Knicks v Philadelphia 76ers,Head To Head,New York Knicks,1.11,Philadelphia 76ers,7,1.044,Dabble
Memphis Grizzlies v Golden State Warriors,Head To Head,Memphis Grizzlies,2.65,Golden State Warriors,1.5,1.044,Dabble
Chicago Bulls v Toronto Raptors,Head To Head,Chicago Bulls,1.5,Toronto Raptors,2.65,1.044,Dabble
San Antonio Spurs v Orlando Magic,Head To Head,San Antonio Spurs,2.45,Orlando Magic,1.57,1.045,Dabble
Denver Nuggets v Minnesota Timberwolves,Head To Head,Denver Nuggets,1.67,Minnesota Timberwolves,2.25,1.043,Dabble
