match,market_name,home_team,home_win,away_team,away_win,margin,agency
Portland Trail Blazers v Utah Jazz,Head To Head,Portland Trail Blazers,1.64,Utah Jazz,2.3,1.045,Dabble
Sacramento Kings v Detroit Pistons,Head To Head,Sacramento Kings,1.52,Detroit Pistons,2.6,1.043,Dabble
Orlando Magic v New York Knicks,Head To Head,Orlando Magic,3.1,New York Knicks,1.38,1.047,Dabble
Brooklyn Nets v San Antonio Spurs,Head To Head,Brooklyn Nets,3,San Antonio Spurs,1.4,1.048,Dabble
Houston Rockets v Minnesota Timberwolves,Head To Head,Houston Rockets,2.02,Minnesota Timberwolves,1.82,1.045,Dabble
Denver Nuggets v Cleveland Cavaliers,Head To Head,Denver Nuggets,2.02,Cleveland Cavaliers,1.82,1.045,Dabble
Los Angeles Clippers v Golden State Warriors,Head To Head,Los Angeles Clippers,1.82,Golden State Warriors,2.02,1.045,Dabble
