match,market_name,home_team,home_win,away_team,away_win,margin,agency
Los Angeles Clippers v Chicago Bulls,Head To Head,Los Angeles Clippers,1.42,Chicago Bulls,2.95,1.043,Dabble
Brooklyn Nets v New York Knicks,Head To Head,Brooklyn Nets,4.75,New York Knicks,1.2,1.044,Dabble
Miami Heat v Portland Trail Blazers,Head To Head,Miami Heat,1.17,Portland Trail Blazers,5.25,1.045,Dabble
Toronto Raptors v Orlando Magic,Head To Head,Toronto Raptors,2.35,Orlando Magic,1.62,1.043,Dabble
Denver Nuggets v Philadelphia 76ers,Head To Head,Denver Nuggets,1.11,Philadelphia 76ers,7,1.044,Dabble
Los Angeles Lakers v Washington Wizards,Head To Head,Los Angeles Lakers,1.12,Washington Wizards,6.5,1.047,Dabble
