match,market_name,home_team,home_win,away_team,away_win,margin,agency
Oklahoma City Thunder v Minnesota Timberwolves,Head To Head,Oklahoma City Thunder,1.37,Minnesota Timberwolves,3.2,1.042,Dabble
Phoenix Suns v Memphis Grizzlies,Head To Head,Phoenix Suns,1.48,Memphis Grizzlies,2.7,1.046,Dabble
Detroit Pistons v Orlando Magic,Head To Head,Detroit Pistons,1.82,Orlando Magic,2.02,1.045,Dabble
Miami Heat v New Orleans Pelicans,Head To Head,Miami Heat,1.26,New Orleans Pelicans,4,1.044,Dabble
New York Knicks v Utah Jazz,Head To Head,New York Knicks,1.11,Utah Jazz,7,1.044,Dabble
Denver Nuggets v Atlanta Hawks,Head To Head,Denver Nuggets,1.53,Atlanta Hawks,2.55,1.046,Dabble
