match,market_name,home_team,home_win,away_team,away_win,margin,agency
Golden State Warriors v Denver Nuggets,Head To Head,Golden State Warriors,1.98,Denver Nuggets,1.85,1.046,Dabble
Los Angeles Lakers v New Orleans Pelicans,Head To Head,Los Angeles Lakers,1.09,New Orleans Pelicans,8,1.042,Dabble
Los Angeles Clippers v Dallas Mavericks,Head To Head,Los Angeles Clippers,1.22,Dallas Mavericks,4.5,1.042,Dabble
Atlanta Hawks v New York Knicks,Head To Head,Atlanta Hawks,2.45,New York Knicks,1.58,1.041,Dabble
Philadelphia 76ers v Minnesota Timberwolves,Head To Head,Philadelphia 76ers,9,Minnesota Timberwolves,1.08,1.037,Dabble
