match,market_name,home_team,home_win,away_team,away_win,margin,agency
Philadelphia 76ers v Washington Wizards,Head To Head,Philadelphia 76ers,1.7,Washington Wizards,2.2,1.043,Dabble
Brooklyn Nets v Toronto Raptors,Head To Head,Brooklyn Nets,1.82,Toronto Raptors,2.02,1.045,Dabble
New York Knicks v Los Angeles Clippers,Head To Head,New York Knicks,2.08,Los Angeles Clippers,1.77,1.046,Dabble
Indiana Pacers v Los Angeles Lakers,Head To Head,Indiana Pacers,1.88,Los Angeles Lakers,1.95,1.045,Dabble
Denver Nuggets v Milwaukee Bucks,Head To Head,Denver Nuggets,1.58,Milwaukee Bucks,2.45,1.041,Dabble
Phoenix Suns v Boston Celtics,Head To Head,Phoenix Suns,2.35,Boston Celtics,1.62,1.043,Dabble
