match,market_name,home_team,home_win,away_team,away_win,margin,agency
Orlando Magic v Philadelphia 76ers,Head To Head,Orlando Magic,2.05,Philadelphia 76ers,1.8,1.043,Dabble
Cleveland Cavaliers v Indiana Pacers,Head To Head,Cleveland Cavaliers,1.24,Indiana Pacers,4.25,1.042,Dabble
Washington Wizards v Oklahoma City Thunder,Head To Head,Washington Wizards,9.5,Oklahoma City Thunder,1.07,1.04,Dabble
Boston Celtics v New Orleans Pelicans,Head To Head,Boston Celtics,1.08,New Orleans Pelicans,8.5,1.044,Dabble
Utah Jazz v Brooklyn Nets,Head To Head,Utah Jazz,1.6,Brooklyn Nets,2.4,1.042,Dabble
Phoenix Suns v Charlotte Hornets,Head To Head,Phoenix Suns,1.33,Charlotte Hornets,3.4,1.046,Dabble
