match,market_name,home_team,home_win,away_team,away_win,margin,agency
Indiana Pacers v Utah Jazz,Head To Head,Indiana Pacers,1.08,Utah Jazz,9,1.037,Dabble
Toronto Raptors v Detroit Pistons,Head To Head,Toronto Raptors,5.75,Detroit Pistons,1.15,1.043,Dabble
Boston Celtics v Phoenix Suns,Head To Head,Boston Celtics,1.11,Phoenix Suns,7,1.044,Dabble
San Antonio Spurs v Cleveland Cavaliers,Head To Head,San Antonio Spurs,6.5,Cleveland Cavaliers,1.13,1.039,Dabble
Chicago Bulls v Portland Trail Blazers,Head To Head,Chicago Bulls,1.42,Portland Trail Blazers,2.95,1.043,Dabble
Houston Rockets v Oklahoma City Thunder,Head To Head,Houston Rockets,3.3,Oklahoma City Thunder,1.35,1.044,Dabble
Los Angeles Clippers v Dallas Mavericks,Head To Head,Los Angeles Clippers,1.22,Dallas Mavericks,4.4,1.047,Dabble
