match,market_name,home_team,home_win,away_team,away_win,margin,agency
Los Angeles Lakers v Houston Rockets,Head To Head,Los Angeles Lakers,1.6,Houston Rockets,2.4,1.042,Dabble
Atlanta Hawks v Portland Trail Blazers,Head To Head,Atlanta Hawks,1.37,Portland Trail Blazers,3.2,1.042,Dabble
Milwaukee Bucks v Phoenix Suns,Head To Head,Milwaukee Bucks,1.35,Phoenix Suns,3.3,1.044,Dabble
New York Knicks v Philadelphia 76ers,Head To Head,New York Knicks,1.1,Philadelphia 76ers,7.5,1.042,Dabble
Memphis Grizzlies v Golden State Warriors,Head To Head,Memphis Grizzlies,2.15,Golden State Warriors,1.72,1.047,Dabble
