match,market_name,home_team,home_win,away_team,away_win,margin,agency
Washington Wizards v Brooklyn Nets,Head To Head,Washington Wizards,1.77,Brooklyn Nets,2.08,1.046,Dabble
Philadelphia 76ers v Miami Heat,Head To Head,Philadelphia 76ers,3.6,Miami Heat,1.3,1.047,Dabble
San Antonio Spurs v Boston Celtics,Head To Head,San Antonio Spurs,6,Boston Celtics,1.14,1.044,Dabble
Memphis Grizzlies v Los Angeles Lakers,Head To Head,Memphis Grizzlies,1.77,Los Angeles Lakers,2.08,1.046,Dabble
Chicago Bulls v Dallas Mavericks,Head To Head,Chicago Bulls,1.68,Dallas Mavericks,2.2,1.05,Dabble
Oklahoma City Thunder v Indiana Pacers,Head To Head,Oklahoma City Thunder,1.22,Indiana Pacers,4.4,1.047,Dabble
Cleveland Cavaliers v Los Angeles Clippers,Head To Head,Cleveland Cavaliers,1.4,Los Angeles Clippers,3,1.048,Dabble
New York Knicks v Portland Trail Blazers,Head To Head,New York Knicks,1.26,Portland Trail Blazers,4,1.044,Dabble
