match,market_name,home_team,home_win,away_team,away_win,margin,agency
Los Angeles Lakers v Los Angeles Clippers,Head To Head,Los Angeles Lakers,2.02,Los Angeles Clippers,1.82,1.045,Dabble
Phoenix Suns v Minnesota Timberwolves,Head To Head,Phoenix Suns,2.02,Minnesota Timberwolves,1.82,1.045,Dabble
Philadelphia 76ers v Portland Trail Blazers,Head To Head,Philadelphia 76ers,1.62,Portland Trail Blazers,2.35,1.043,Dabble
Charlotte Hornets v Golden State Warriors,Head To Head,Charlotte Hornets,5.5,Golden State Warriors,1.17,1.037,Dabble
Miami Heat v Washington Wizards,Head To Head,Miami Heat,1.2,Washington Wizards,4.75,1.044,Dabble
Oklahoma City Thunder v Houston Rockets,Head To Head,Oklahoma City Thunder,1.15,Houston Rockets,5.75,1.043,Dabble
Memphis Grizzlies v Atlanta Hawks,Head To Head,Memphis Grizzlies,1.37,Atlanta Hawks,3.2,1.042,Dabble
Dallas Mavericks v Sacramento Kings,Head To Head,Dallas Mavericks,1.82,Sacramento Kings,2,1.049,Dabble
