match,market_name,home_team,home_win,away_team,away_win,margin,agency
Washington Wizards v Sacramento Kings,Head To Head,Washington Wizards,6,Sacramento Kings,1.14,1.044,Dabble
Indiana Pacers v Charlotte Hornets,Head To Head,Indiana Pacers,1.1,Charlotte Hornets,7.5,1.042,Dabble
Cleveland Cavaliers v New York Knicks,Head To Head,Cleveland Cavaliers,1.2,New York Knicks,4.75,1.044,Dabble
Boston Celtics v Miami Heat,Head To Head,Boston Celtics,1.18,Miami Heat,5,1.047,Dabble
Houston Rockets v Utah Jazz,Head To Head,Houston Rockets,1.06,Utah Jazz,11,1.034,Dabble
Dallas Mavericks v Atlanta Hawks,Head To Head,Dallas Mavericks,1.55,Atlanta Hawks,2.5,1.045,Dabble
Denver Nuggets v San Antonio Spurs,Head To Head,Denver Nuggets,1.28,San Antonio Spurs,3.75,1.048,Dabble
Oklahoma City Thunder v Detroit Pistons,Head To Head,Oklahoma City Thunder,1.11,Detroit Pistons,7,1.044,Dabble
Los Angeles Clippers v New Orleans Pelicans,Head To Head,Los Angeles Clippers,1.06,New Orleans Pelicans,11,1.034,Dabble
