match,market_name,home_team,home_win,away_team,away_win,margin,agency
Oklahoma City Thunder v Houston Rockets,Head To Head,Oklahoma City Thunder,1.12,Houston Rockets,6.5,1.047,Dabble
Memphis Grizzlies v Atlanta Hawks,Head To Head,Memphis Grizzlies,1.35,Atlanta Hawks,3.3,1.044,Dabble
Dallas Mavericks v Sacramento Kings,Head To Head,Dallas Mavericks,2.08,Sacramento Kings,1.77,1.046,Dabble
Utah Jazz v Detroit Pistons,Head To Head,Utah Jazz,5,Detroit Pistons,1.18,1.047,Dabble
Orlando Magic v Toronto Raptors,Head To Head,Orlando Magic,1.35,Toronto Raptors,3.3,1.044,Dabble
New York Knicks v Golden State Warriors,Head To Head,New York Knicks,1.6,Golden State Warriors,2.4,1.042,Dabble
Atlanta Hawks v Milwaukee Bucks,Head To Head,Atlanta Hawks,2.7,Milwaukee Bucks,1.48,1.046,Dabble
