match,market_name,home_team,home_win,away_team,away_win,margin,agency
Washington Wizards v New York Knicks,Head To Head,Washington Wizards,4.75,New York Knicks,1.2,1.044,Dabble
Charlotte Hornets v Chicago Bulls,Head To Head,Charlotte Hornets,2.85,Chicago Bulls,1.44,1.045,Dabble
New Orleans Pelicans v Los Angeles Clippers,Head To Head,New Orleans Pelicans,3,Los Angeles Clippers,1.4,1.048,Dabble
Utah Jazz v Denver Nuggets,Head To Head,Utah Jazz,3.4,Denver Nuggets,1.33,1.046,Dabble
Portland Trail Blazers v Philadelphia 76ers,Head To Head,Portland Trail Blazers,2.95,Philadelphia 76ers,1.42,1.043,Dabble
Golden State Warriors v Cleveland Cavaliers,Head To Head,Golden State Warriors,2.65,Cleveland Cavaliers,1.5,1.044,Dabble
Sacramento Kings v Dallas Mavericks,Head To Head,Sacramento Kings,1.55,Dallas Mavericks,2.5,1.045,Dabble
