match,market_name,home_team,home_win,away_team,away_win,margin,agency
Phoenix Suns v New Orleans Pelicans,Head To Head,Phoenix Suns,1.26,New Orleans Pelicans,4,1.044,Dabble
Utah Jazz v Minnesota Timberwolves,Head To Head,Utah Jazz,2.5,Minnesota Timberwolves,1.55,1.045,Dabble
Los Angeles Lakers v Los Angeles Clippers,Head To Head,Los Angeles Lakers,2.2,Los Angeles Clippers,1.7,1.043,Dabble
Charlotte Hornets v Washington Wizards,Head To Head,Charlotte Hornets,1.55,Washington Wizards,2.5,1.045,Dabble
Detroit Pistons v Brooklyn Nets,Head To Head,Detroit Pistons,1.22,Brooklyn Nets,4.4,1.047,Dabble
Houston Rockets v Sacramento Kings,Head To Head,Houston Rockets,1.6,Sacramento Kings,2.4,1.042,Dabble
Memphis Grizzlies v San Antonio Spurs,Head To Head,Memphis Grizzlies,1.18,San Antonio Spurs,5,1.047,Dabble
Dallas Mavericks v Milwaukee Bucks,Head To Head,Dallas Mavericks,2.2,Milwaukee Bucks,1.7,1.043,Dabble
Philadelphia 76ers v Golden State Warriors,Head To Head,Philadelphia 76ers,3,Golden State Warriors,1.4,1.048,Dabble
