match,market_name,home_team,home_win,away_team,away_win,margin,agency
Orlando Magic v Chicago Bulls,Head To Head,Orlando Magic,1.35,Chicago Bulls,3.3,1.044,Dabble
Brooklyn Nets v Golden State Warriors,Head To Head,Brooklyn Nets,5,Golden State Warriors,1.18,1.047,Dabble
Atlanta Hawks v Indiana Pacers,Head To Head,Atlanta Hawks,2.4,Indiana Pacers,1.6,1.042,Dabble
Boston Celtics v Philadelphia 76ers,Head To Head,Boston Celtics,1.12,Philadelphia 76ers,6.5,1.047,Dabble
New Orleans Pelicans v Houston Rockets,Head To Head,New Orleans Pelicans,2.45,Houston Rockets,1.57,1.045,Dabble
Los Angeles Lakers v New York Knicks,Head To Head,Los Angeles Lakers,1.67,New York Knicks,2.25,1.043,Dabble
