match,market_name,home_team,home_win,away_team,away_win,margin,agency
Atlanta Hawks v Portland Trail Blazers,Head To Head,Atlanta Hawks,1.45,Portland Trail Blazers,2.8,1.047,Dabble
Milwaukee Bucks v Phoenix Suns,Head To Head,Milwaukee Bucks,1.38,Phoenix Suns,3.1,1.047,Dabble
New York Knicks v Philadelphia 76ers,Head To Head,New York Knicks,1.11,Philadelphia 76ers,7,1.044,Dabble
Memphis Grizzlies v Golden State Warriors,Head To Head,Memphis Grizzlies,2.4,Golden State Warriors,1.6,1.042,Dabble
Chicago Bulls v Toronto Raptors,Head To Head,Chicago Bulls,1.6,Toronto Raptors,2.4,1.042,Dabble
San Antonio Spurs v Orlando Magic,Head To Head,San Antonio Spurs,2.65,Orlando Magic,1.5,1.044,Dabble
Denver Nuggets v Minnesota Timberwolves,Head To Head,Denver Nuggets,1.62,Minnesota Timberwolves,2.35,1.043,Dabble
Washington Wizards v Sacramento Kings,Head To Head,Washington Wizards,5.75,Sacramento Kings,1.15,1.043,Dabble
