match,market_name,home_team,home_win,away_team,away_win,margin,agency
Milwaukee Bucks v Memphis Grizzlies,Head To Head,Milwaukee Bucks,1.62,Memphis Grizzlies,2.35,1.043,Dabble
Detroit Pistons v Atlanta Hawks,Head To Head,Detroit Pistons,1.62,Atlanta Hawks,2.35,1.043,Dabble
Charlotte Hornets v Washington Wizards,Head To Head,Charlotte Hornets,1.53,Washington Wizards,2.55,1.046,Dabble
New York Knicks v Houston Rockets,Head To Head,New York Knicks,1.48,Houston Rockets,2.7,1.046,Dabble
Golden State Warriors v Orlando Magic,Head To Head,Golden State Warriors,1.77,Orlando Magic,2.08,1.046,Dabble
