match,market_name,home_team,home_win,away_team,away_win,margin,agency
Houston Rockets v Dallas Mavericks,Head To Head,Houston Rockets,1.52,Dallas Mavericks,2.6,1.043,Dabble
Denver Nuggets v Atlanta Hawks,Head To Head,Denver Nuggets,1.33,Atlanta Hawks,3.4,1.046,Dabble
Sacramento Kings v Philadelphia 76ers,Head To Head,Sacramento Kings,1.4,Philadelphia 76ers,3,1.048,Dabble
Minnesota Timberwolves v Boston Celtics,Head To Head,Minnesota Timberwolves,2.4,Boston Celtics,1.6,1.042,Dabble
Miami Heat v Indiana Pacers,Head To Head,Miami Heat,1.8,Indiana Pacers,2.05,1.043,Dabble
Oklahoma City Thunder v Los Angeles Clippers,Head To Head,Oklahoma City Thunder,1.26,Los Angeles Clippers,4,1.044,Dabble
Milwaukee Bucks v Brooklyn Nets,Head To Head,Milwaukee Bucks,1.12,Brooklyn Nets,6.5,1.047,Dabble
Golden State Warriors v Philadelphia 76ers,Head To Head,Golden State Warriors,1.8,Philadelphia 76ers,2.05,1.043,Dabble
Los Angeles Clippers v Portland Trail Blazers,Head To Head,Los Angeles Clippers,1.26,Portland Trail Blazers,4,1.044,Dabble
