match,market_name,home_team,home_win,away_team,away_win,margin,agency
Golden State Warriors v Atlanta Hawks,Head To Head,Golden State Warriors,1.3,Atlanta Hawks,3.6,1.047,Dabble
Phoenix Suns v New York Knicks,Head To Head,Phoenix Suns,2.6,New York Knicks,1.52,1.043,Dabble
Los Angeles Clippers v Orlando Magic,Head To Head,Los Angeles Clippers,2.3,Orlando Magic,1.64,1.045,Dabble
Los Angeles Clippers v Orlando Magic,Head To Head,Los Angeles Clippers,2.3,Orlando Magic,2.6,0.819,Dabble
Charlotte Hornets v Detroit Pistons,Head To Head,Charlotte Hornets,1.88,Detroit Pistons,1.95,1.045,Dabble
Toronto Raptors v Minnesota Timberwolves,Head To Head,Toronto Raptors,3.3,Minnesota Timberwolves,1.35,1.044,Dabble
San Antonio Spurs v Utah Jazz,Head To Head,San Antonio Spurs,1.67,Utah Jazz,2.25,1.043,Dabble
Los Angeles Clippers v Orlando Magic,Head To Head,Los Angeles Clippers,1.52,Orlando Magic,1.64,1.268,Dabble
Los Angeles Clippers v Orlando Magic,Head To Head,Los Angeles Clippers,1.52,Orlando Magic,2.6,1.043,Dabble
