match,market_name,home_team,home_win,away_team,away_win,margin,agency
Philadelphia 76ers v Orlando Magic,Head To Head,Philadelphia 76ers,2.2,Orlando Magic,1.68,1.05,Dabble
Boston Celtics v Milwaukee Bucks,Head To Head,Boston Celtics,1.3,Milwaukee Bucks,3.6,1.047,Dabble
San Antonio Spurs v Sacramento Kings,Head To Head,San Antonio Spurs,2.85,Sacramento Kings,1.44,1.045,Dabble
Chicago Bulls v Indiana Pacers,Head To Head,Chicago Bulls,2.3,Indiana Pacers,1.65,1.041,Dabble
Portland Trail Blazers v Utah Jazz,Head To Head,Portland Trail Blazers,1.72,Utah Jazz,2.15,1.047,Dabble
Golden State Warriors v Minnesota Timberwolves,Head To Head,Golden State Warriors,1.98,Minnesota Timberwolves,1.85,1.046,Dabble
Charlotte Hornets v Cleveland Cavaliers,Head To Head,Charlotte Hornets,5.5,Cleveland Cavaliers,1.17,1.037,Dabble
