match,market_name,home_team,home_win,away_team,away_win,margin,agency
Utah Jazz v Memphis Grizzlies,Head To Head,Utah Jazz,5,Memphis Grizzlies,1.18,1.047,Dabble
Portland Trail Blazers v Cleveland Cavaliers,Head To Head,Portland Trail Blazers,3,Cleveland Cavaliers,1.4,1.048,Dabble
Sacramento Kings v Oklahoma City Thunder,Head To Head,Sacramento Kings,4,Oklahoma City Thunder,1.25,1.05,Dabble
Philadelphia 76ers v Washington Wizards,Head To Head,Philadelphia 76ers,1.62,Washington Wizards,2.35,1.043,Dabble
Brooklyn Nets v Toronto Raptors,Head To Head,Brooklyn Nets,1.82,Toronto Raptors,2.02,1.045,Dabble
New York Knicks v Los Angeles Clippers,Head To Head,New York Knicks,1.98,Los Angeles Clippers,1.85,1.046,Dabble
Indiana Pacers v Los Angeles Lakers,Head To Head,Indiana Pacers,1.82,Los Angeles Lakers,2.02,1.045,Dabble
