match,market_name,home_team,home_win,away_team,away_win,margin,agency
Milwaukee Bucks v Oklahoma City Thunder,Head To Head,Milwaukee Bucks,2.8,Oklahoma City Thunder,1.46,1.042,Dabble
New York Knicks v Miami Heat,Head To Head,New York Knicks,1.3,Miami Heat,3.6,1.047,Dabble
Minnesota Timberwolves v Indiana Pacers,Head To Head,Minnesota Timberwolves,1.32,Indiana Pacers,3.5,1.043,Dabble
Houston Rockets v Philadelphia 76ers,Head To Head,Houston Rockets,1.12,Philadelphia 76ers,6.5,1.047,Dabble
Golden State Warriors v Denver Nuggets,Head To Head,Golden State Warriors,1.67,Denver Nuggets,2.25,1.043,Dabble
