match,market_name,home_team,home_win,away_team,away_win,margin,agency
Orlando Magic v New York Knicks,Head To Head,Orlando Magic,3.25,New York Knicks,1.35,1.048,Dabble
Brooklyn Nets v San Antonio Spurs,Head To Head,Brooklyn Nets,3.4,San Antonio Spurs,1.33,1.046,Dabble
Boston Celtics v Indiana Pacers,Head To Head,Boston Celtics,1.15,Indiana Pacers,5.75,1.043,Dabble
Houston Rockets v Minnesota Timberwolves,Head To Head,Houston Rockets,1.88,Minnesota Timberwolves,1.95,1.045,Dabble
New Orleans Pelicans v Memphis Grizzlies,Head To Head,New Orleans Pelicans,3.6,Memphis Grizzlies,1.3,1.047,Dabble
Denver Nuggets v Cleveland Cavaliers,Head To Head,Denver Nuggets,2.2,Cleveland Cavaliers,1.68,1.05,Dabble
Phoenix Suns v Dallas Mavericks,Head To Head,Phoenix Suns,1.88,Dallas Mavericks,1.95,1.045,Dabble
Los Angeles Clippers v Golden State Warriors,Head To Head,Los Angeles Clippers,1.48,Golden State Warriors,2.7,1.046,Dabble
