match,market_name,home_team,home_win,away_team,away_win,margin,agency
Los Angeles Clippers v Indiana Pacers,Head To Head,Los Angeles Clippers,1.46,Indiana Pacers,2.8,1.042,Dabble
Washington Wizards v Cleveland Cavaliers,Head To Head,Washington Wizards,10,Cleveland Cavaliers,1.07,1.035,Dabble
Charlotte Hornets v San Antonio Spurs,Head To Head,Charlotte Hornets,5.5,San Antonio Spurs,1.15,1.051,Dabble
Detroit Pistons v Philadelphia 76ers,Head To Head,Detroit Pistons,2.05,Philadelphia 76ers,1.8,1.043,Dabble
Atlanta Hawks v Milwaukee Bucks,Head To Head,Atlanta Hawks,2.75,Milwaukee Bucks,1.46,1.049,Dabble
Brooklyn Nets v Miami Heat,Head To Head,Brooklyn Nets,3.25,Miami Heat,1.35,1.048,Dabble
Oklahoma City Thunder v Toronto Raptors,Head To Head,Oklahoma City Thunder,1.06,Toronto Raptors,11,1.034,Dabble
Phoenix Suns v Utah Jazz,Head To Head,Phoenix Suns,1.33,Utah Jazz,3.4,1.046,Dabble
