match,market_name,home_team,home_win,away_team,away_win,margin,agency
Dallas Mavericks v Oklahoma City Thunder,Head To Head,Dallas Mavericks,2.25,Oklahoma City Thunder,1.67,1.043,Dabble
San Antonio Spurs v Memphis Grizzlies,Head To Head,San Antonio Spurs,2.02,Memphis Grizzlies,1.82,1.045,Dabble
Los Angeles Lakers v Brooklyn Nets,Head To Head,Los Angeles Lakers,1.18,Brooklyn Nets,5,1.047,Dabble
Detroit Pistons v Phoenix Suns,Head To Head,Detroit Pistons,2.02,Phoenix Suns,1.82,1.045,Dabble
Indiana Pacers v Philadelphia 76ers,Head To Head,Indiana Pacers,1.32,Philadelphia 76ers,3.5,1.043,Dabble
