match,market_name,home_team,home_win,away_team,away_win,margin,agency
Cleveland Cavaliers v Atlanta Hawks,Head To Head,Cleveland Cavaliers,1.2,Atlanta Hawks,4.75,1.044,Dabble
Washington Wizards v Los Angeles Lakers,Head To Head,Washington Wizards,3.75,Los Angeles Lakers,1.28,1.048,Dabble
Utah Jazz v Minnesota Timberwolves,Head To Head,Utah Jazz,2.95,Minnesota Timberwolves,1.42,1.043,Dabble
Memphis Grizzlies v Houston Rockets,Head To Head,Memphis Grizzlies,1.48,Houston Rockets,2.7,1.046,Dabble
Portland Trail Blazers v Orlando Magic,Head To Head,Portland Trail Blazers,2.75,Orlando Magic,1.46,1.049,Dabble
