match,market_name,home_team,home_win,away_team,away_win,margin,agency
Phoenix Suns v Charlotte Hornets,Head To Head,Phoenix Suns,1.35,Charlotte Hornets,3.25,1.048,Dabble
Washington Wizards v Minnesota Timberwolves,Head To Head,Washington Wizards,7,Minnesota Timberwolves,1.11,1.044,Dabble
New York Knicks v Detroit Pistons,Head To Head,New York Knicks,1.35,Detroit Pistons,3.3,1.044,Dabble
Toronto Raptors v Golden State Warriors,Head To Head,Toronto Raptors,2.55,Golden State Warriors,1.53,1.046,Dabble
Houston Rockets v Memphis Grizzlies,Head To Head,Houston Rockets,1.7,Memphis Grizzlies,2.2,1.043,Dabble
Los Angeles Lakers v San Antonio Spurs,Head To Head,Los Angeles Lakers,1.62,San Antonio Spurs,2.35,1.043,Dabble
Los Angeles Clippers v Miami Heat,Head To Head,Los Angeles Clippers,1.5,Miami Heat,2.65,1.044,Dabble
