match,market_name,home_team,home_win,away_team,away_win,margin,agency
Boston Celtics v Dallas Mavericks,Head To Head,Boston Celtics,1.13,Dallas Mavericks,6.5,1.039,Dabble
Minnesota Timberwolves v Houston Rockets,Head To Head,Minnesota Timberwolves,1.85,Houston Rockets,1.98,1.046,Dabble
Denver Nuggets v Orlando Magic,Head To Head,Denver Nuggets,1.38,Orlando Magic,3.1,1.047,Dabble
Portland Trail Blazers v Sacramento Kings,Head To Head,Portland Trail Blazers,2,Sacramento Kings,1.82,1.049,Dabble
Los Angeles Lakers v Golden State Warriors,Head To Head,Los Angeles Lakers,1.38,Golden State Warriors,3.1,1.047,Dabble
Los Angeles Clippers v Indiana Pacers,Head To Head,Los Angeles Clippers,1.5,Indiana Pacers,2.65,1.044,Dabble
Brooklyn Nets v Miami Heat,Head To Head,Brooklyn Nets,3.3,Miami Heat,1.35,1.044,Dabble
