match,market_name,home_team,home_win,away_team,away_win,margin,agency
Minnesota Timberwolves v Oklahoma City Thunder,Head To Head,Minnesota Timberwolves,4,Oklahoma City Thunder,1.26,1.044,Dabble
Washington Wizards v Brooklyn Nets,Head To Head,Washington Wizards,2.25,Brooklyn Nets,1.67,1.043,Dabble
Philadelphia 76ers v Chicago Bulls,Head To Head,Philadelphia 76ers,1.72,Chicago Bulls,2.15,1.047,Dabble
Indiana Pacers v Denver Nuggets,Head To Head,Indiana Pacers,2.4,Denver Nuggets,1.6,1.042,Dabble
Detroit Pistons v Los Angeles Clippers,Head To Head,Detroit Pistons,1.85,Los Angeles Clippers,1.98,1.046,Dabble
Atlanta Hawks v Miami Heat,Head To Head,Atlanta Hawks,1.95,Miami Heat,1.88,1.045,Dabble
Utah Jazz v Portland Trail Blazers,Head To Head,Utah Jazz,2.02,Portland Trail Blazers,1.82,1.045,Dabble
Sacramento Kings v Charlotte Hornets,Head To Head,Sacramento Kings,1.22,Charlotte Hornets,4.4,1.047,Dabble
