match,market_name,home_team,home_win,away_team,away_win,margin,agency
Minnesota Timberwolves v San Antonio Spurs,Head To Head,Minnesota Timberwolves,1.42,San Antonio Spurs,2.95,1.043,Dabble
Washington Wizards v New York Knicks,Head To Head,Washington Wizards,4.75,New York Knicks,1.2,1.044,Dabble
New Orleans Pelicans v Los Angeles Clippers,Head To Head,New Orleans Pelicans,2.8,Los Angeles Clippers,1.45,1.047,Dabble
Utah Jazz v Denver Nuggets,Head To Head,Utah Jazz,3.75,Denver Nuggets,1.28,1.048,Dabble
Portland Trail Blazers v Philadelphia 76ers,Head To Head,Portland Trail Blazers,2.85,Philadelphia 76ers,1.44,1.045,Dabble
Golden State Warriors v Cleveland Cavaliers,Head To Head,Golden State Warriors,2.35,Cleveland Cavaliers,1.62,1.043,Dabble
Sacramento Kings v Dallas Mavericks,Head To Head,Sacramento Kings,1.62,Dallas Mavericks,2.35,1.043,Dabble
