match,market_name,home_team,home_win,away_team,away_win,margin,agency
Milwaukee Bucks v Toronto Raptors,Head To Head,Milwaukee Bucks,1.17,Toronto Raptors,5.25,1.045,Dabble
Chicago Bulls v Charlotte Hornets,Head To Head,Chicago Bulls,1.53,Charlotte Hornets,2.55,1.046,Dabble
New Orleans Pelicans v Utah Jazz,Head To Head,New Orleans Pelicans,1.15,Utah Jazz,5.75,1.043,Dabble
Miami Heat v Denver Nuggets,Head To Head,Miami Heat,2.3,Denver Nuggets,1.64,1.045,Dabble
Dallas Mavericks v Oklahoma City Thunder,Head To Head,Dallas Mavericks,2.8,Oklahoma City Thunder,1.45,1.047,Dabble
San Antonio Spurs v Memphis Grizzlies,Head To Head,San Antonio Spurs,2.1,Memphis Grizzlies,1.75,1.048,Dabble
Los Angeles Lakers v Brooklyn Nets,Head To Head,Los Angeles Lakers,1.18,Brooklyn Nets,5,1.047,Dabble
Detroit Pistons v Phoenix Suns,Head To Head,Detroit Pistons,2.05,Phoenix Suns,1.8,1.043,Dabble
Indiana Pacers v Philadelphia 76ers,Head To Head,Indiana Pacers,1.35,Philadelphia 76ers,3.3,1.044,Dabble
