match,market_name,home_team,home_win,away_team,away_win,margin,agency
Los Angeles Lakers v Utah Jazz,Head To Head,Los Angeles Lakers,1.14,Utah Jazz,6,1.044,Dabble
Philadelphia 76ers v Toronto Raptors,Head To Head,Philadelphia 76ers,1.33,Toronto Raptors,3.4,1.046,Dabble
Indiana Pacers v New York Knicks,Head To Head,Indiana Pacers,1.95,New York Knicks,1.88,1.045,Dabble
Chicago Bulls v Detroit Pistons,Head To Head,Chicago Bulls,2.45,Detroit Pistons,1.58,1.041,Dabble
Phoenix Suns v Memphis Grizzlies,Head To Head,Phoenix Suns,2.4,Memphis Grizzlies,1.6,1.042,Dabble
