match,market_name,home_team,home_win,away_team,away_win,margin,agency
Washington Wizards v San Antonio Spurs,Head To Head,Washington Wizards,5.5,San Antonio Spurs,1.17,1.037,Dabble
Orlando Magic v Atlanta Hawks,Head To Head,Orlando Magic,1.48,Atlanta Hawks,2.7,1.046,Dabble
Milwaukee Bucks v Golden State Warriors,Head To Head,Milwaukee Bucks,2.85,Golden State Warriors,1.44,1.045,Dabble
Oklahoma City Thunder v New Orleans Pelicans,Head To Head,Oklahoma City Thunder,1.11,New Orleans Pelicans,7,1.044,Dabble
Denver Nuggets v Portland Trail Blazers,Head To Head,Denver Nuggets,1.26,Portland Trail Blazers,4,1.044,Dabble
Los Angeles Lakers v Utah Jazz,Head To Head,Los Angeles Lakers,1.11,Utah Jazz,7,1.044,Dabble
