match,market_name,home_team,home_win,away_team,away_win,margin,agency
Cleveland Cavaliers v Los Angeles Clippers,Head To Head,Cleveland Cavaliers,1.33,Los Angeles Clippers,3.4,1.046,Dabble
New York Knicks v Portland Trail Blazers,Head To Head,New York Knicks,1.3,Portland Trail Blazers,3.6,1.047,Dabble
New Orleans Pelicans v Charlotte Hornets,Head To Head,New Orleans Pelicans,1.68,Charlotte Hornets,2.2,1.05,Dabble
Minnesota Timberwolves v Detroit Pistons,Head To Head,Minnesota Timberwolves,1.35,Detroit Pistons,3.3,1.044,Dabble
San Antonio Spurs v Golden State Warriors,Head To Head,San Antonio Spurs,5.75,Golden State Warriors,1.15,1.043,Dabble
Milwaukee Bucks v Atlanta Hawks,Head To Head,Milwaukee Bucks,1.58,Atlanta Hawks,2.45,1.041,Dabble
Philadelphia 76ers v Toronto Raptors,Head To Head,Philadelphia 76ers,2.55,Toronto Raptors,1.53,1.046,Dabble
Phoenix Suns v Houston Rockets,Head To Head,Phoenix Suns,2.08,Houston Rockets,1.77,1.046,Dabble
