match,market_name,home_team,home_win,away_team,away_win,margin,agency
Washington Wizards v Miami Heat,Head To Head,Washington Wizards,4,Miami Heat,1.26,1.044,Dabble
Indiana Pacers v Sacramento Kings,Head To Head,Indiana Pacers,1.45,Sacramento Kings,2.8,1.047,Dabble
Orlando Magic v Los Angeles Clippers,Head To Head,Orlando Magic,2.2,Los Angeles Clippers,1.7,1.043,Dabble
Charlotte Hornets v Utah Jazz,Head To Head,Charlotte Hornets,1.82,Utah Jazz,2.02,1.045,Dabble
Oklahoma City Thunder v Chicago Bulls,Head To Head,Oklahoma City Thunder,1.1,Chicago Bulls,7.5,1.042,Dabble
Dallas Mavericks v Brooklyn Nets,Head To Head,Dallas Mavericks,1.26,Brooklyn Nets,4,1.044,Dabble
