match,market_name,home_team,home_win,away_team,away_win,margin,agency
Los Angeles Clippers v New York Knicks,Head To Head,Los Angeles Clippers,1.4,New York Knicks,3,1.048,Dabble
Charlotte Hornets v Brooklyn Nets,Head To Head,Charlotte Hornets,2.4,Brooklyn Nets,1.6,1.042,Dabble
Houston Rockets v New Orleans Pelicans,Head To Head,Houston Rockets,1.32,New Orleans Pelicans,3.5,1.043,Dabble
Atlanta Hawks v Indiana Pacers,Head To Head,Atlanta Hawks,2.05,Indiana Pacers,1.8,1.043,Dabble
Toronto Raptors v Washington Wizards,Head To Head,Toronto Raptors,1.5,Washington Wizards,2.65,1.044,Dabble
Miami Heat v Chicago Bulls,Head To Head,Miami Heat,1.55,Chicago Bulls,2.5,1.045,Dabble
Milwaukee Bucks v Orlando Magic,Head To Head,Milwaukee Bucks,1.35,Orlando Magic,3.3,1.044,Dabble
Boston Celtics v Los Angeles Lakers,Head To Head,Boston Celtics,1.38,Los Angeles Lakers,3.1,1.047,Dabble
Golden State Warriors v Detroit Pistons,Head To Head,Golden State Warriors,1.42,Detroit Pistons,2.95,1.043,Dabble
