match,market_name,home_team,home_win,away_team,away_win,margin,agency
Oklahoma City Thunder v Brooklyn Nets,Head To Head,Oklahoma City Thunder,1.07,Brooklyn Nets,10,1.035,Dabble
Los Angeles Clippers v Los Angeles Lakers,Head To Head,Los Angeles Clippers,1.55,Los Angeles Lakers,2.5,1.045,Dabble
Sacramento Kings v Washington Wizards,Head To Head,Sacramento Kings,1.07,Washington Wizards,10,1.035,Dabble
Charlotte Hornets v Dallas Mavericks,Head To Head,Charlotte Hornets,2.75,Dallas Mavericks,1.46,1.049,Dabble
Houston Rockets v Detroit Pistons,Head To Head,Houston Rockets,1.32,Detroit Pistons,3.5,1.043,Dabble
