match,market_name,home_team,home_win,away_team,away_win,margin,agency
Indiana Pacers v Brooklyn Nets,Head To Head,Indiana Pacers,1.26,Brooklyn Nets,4,1.044,Dabble
Atlanta Hawks v Golden State Warriors,Head To Head,Atlanta Hawks,2.15,Golden State Warriors,1.72,1.047,Dabble
New York Knicks v Washington Wizards,Head To Head,New York Knicks,1.09,Washington Wizards,8,1.042,Dabble
Sacramento Kings v Milwaukee Bucks,Head To Head,Sacramento Kings,1.95,Milwaukee Bucks,1.88,1.045,Dabble
Los Angeles Lakers v Chicago Bulls,Head To Head,Los Angeles Lakers,1.22,Chicago Bulls,4.5,1.042,Dabble
