match,market_name,home_team,home_win,away_team,away_win,margin,agency
Philadelphia 76ers v Boston Celtics,Head To Head,Philadelphia 76ers,3.3,Boston Celtics,1.35,1.044,Dabble
Indiana Pacers v Memphis Grizzlies,Head To Head,Indiana Pacers,2.02,Memphis Grizzlies,1.82,1.045,Dabble
Brooklyn Nets v Cleveland Cavaliers,Head To Head,Brooklyn Nets,6.5,Cleveland Cavaliers,1.12,1.047,Dabble
Atlanta Hawks v Orlando Magic,Head To Head,Atlanta Hawks,1.95,Orlando Magic,1.88,1.045,Dabble
New York Knicks v Chicago Bulls,Head To Head,New York Knicks,1.17,Chicago Bulls,5.5,1.037,Dabble
Milwaukee Bucks v Los Angeles Clippers,Head To Head,Milwaukee Bucks,2.25,Los Angeles Clippers,1.67,1.043,Dabble
Denver Nuggets v Charlotte Hornets,Head To Head,Denver Nuggets,1.07,Charlotte Hornets,10,1.035,Dabble
San Antonio Spurs v Phoenix Suns,Head To Head,San Antonio Spurs,2.2,Phoenix Suns,1.7,1.043,Dabble
Portland Trail Blazers v Los Angeles Lakers,Head To Head,Portland Trail Blazers,2.02,Los Angeles Lakers,1.82,1.045,Dabble
