match,market_name,home_team,home_win,away_team,away_win,margin,agency
Orlando Magic v Toronto Raptors,Head To Head,Orlando Magic,1.4,Toronto Raptors,3,1.048,Dabble
Indiana Pacers v Houston Rockets,Head To Head,Indiana Pacers,1.58,Houston Rockets,2.45,1.041,Dabble
New York Knicks v Golden State Warriors,Head To Head,New York Knicks,1.8,Golden State Warriors,2.05,1.043,Dabble
Atlanta Hawks v Milwaukee Bucks,Head To Head,Atlanta Hawks,2.7,Milwaukee Bucks,1.48,1.046,Dabble
Chicago Bulls v Cleveland Cavaliers,Head To Head,Chicago Bulls,6.5,Cleveland Cavaliers,1.12,1.047,Dabble
Minnesota Timberwolves v Philadelphia 76ers,Head To Head,Minnesota Timberwolves,1.11,Philadelphia 76ers,7,1.044,Dabble
San Antonio Spurs v Brooklyn Nets,Head To Head,San Antonio Spurs,1.62,Brooklyn Nets,2.35,1.043,Dabble
Phoenix Suns v Los Angeles Clippers,Head To Head,Phoenix Suns,2.2,Los Angeles Clippers,1.68,1.05,Dabble
Los Angeles Lakers v New Orleans Pelicans,Head To Head,Los Angeles Lakers,1.26,New Orleans Pelicans,4,1.044,Dabble
