match,market_name,home_team,home_win,away_team,away_win,margin,agency
Minnesota Timberwolves v San Antonio Spurs,Head To Head,Minnesota Timberwolves,1.42,San Antonio Spurs,2.95,1.043,Dabble
New Orleans Pelicans v Los Angeles Clippers,Head To Head,New Orleans Pelicans,2.8,Los Angeles Clippers,1.45,1.047,Dabble
Utah Jazz v Denver Nuggets,Head To Head,Utah Jazz,4,Denver Nuggets,1.26,1.044,Dabble
Portland Trail Blazers v Philadelphia 76ers,Head To Head,Portland Trail Blazers,3,Philadelphia 76ers,1.4,1.048,Dabble
Golden State Warriors v Cleveland Cavaliers,Head To Head,Golden State Warriors,2.35,Cleveland Cavaliers,1.62,1.043,Dabble
