match,market_name,home_team,home_win,away_team,away_win,margin,agency
Memphis Grizzlies v Indiana Pacers,Head To Head,Memphis Grizzlies,1.32,Indiana Pacers,3.5,1.043,Dabble
Brooklyn Nets v Orlando Magic,Head To Head,Brooklyn Nets,3.6,Orlando Magic,1.3,1.047,Dabble
New York Knicks v New Orleans Pelicans,Head To Head,New York Knicks,1.15,New Orleans Pelicans,5.75,1.043,Dabble
Cleveland Cavaliers v Boston Celtics,Head To Head,Cleveland Cavaliers,2,Boston Celtics,1.82,1.049,Dabble
Toronto Raptors v Miami Heat,Head To Head,Toronto Raptors,2.6,Miami Heat,1.52,1.043,Dabble
Houston Rockets v Oklahoma City Thunder,Head To Head,Houston Rockets,1.95,Oklahoma City Thunder,1.88,1.045,Dabble
Utah Jazz v Los Angeles Clippers,Head To Head,Utah Jazz,3.4,Los Angeles Clippers,1.33,1.046,Dabble
Sacramento Kings v San Antonio Spurs,Head To Head,Sacramento Kings,1.46,San Antonio Spurs,2.8,1.042,Dabble
Los Angeles Clippers v Denver Nuggets,Head To Head,Los Angeles Clippers,2.15,Denver Nuggets,1.72,1.047,Dabble
