match,market_name,home_team,home_win,away_team,away_win,margin,agency
Cleveland Cavaliers v Boston Celtics,Head To Head,Cleveland Cavaliers,1.85,Boston Celtics,1.98,1.046,Dabble
Toronto Raptors v Miami Heat,Head To Head,Toronto Raptors,2.6,Miami Heat,1.52,1.043,Dabble
Houston Rockets v Oklahoma City Thunder,Head To Head,Houston Rockets,2.02,Oklahoma City Thunder,1.82,1.045,Dabble
Utah Jazz v Los Angeles Clippers,Head To Head,Utah Jazz,3.3,Los Angeles Clippers,1.35,1.044,Dabble
Sacramento Kings v San Antonio Spurs,Head To Head,Sacramento Kings,1.42,San Antonio Spurs,2.95,1.043,Dabble
Portland Trail Blazers v Dallas Mavericks,Head To Head,Portland Trail Blazers,3.1,Dallas Mavericks,1.38,1.047,Dabble
Los Angeles Clippers v Denver Nuggets,Head To Head,Los Angeles Clippers,2.25,Denver Nuggets,1.66,1.047,Dabble
