match,market_name,home_team,home_win,away_team,away_win,margin,agency
Brooklyn Nets v Boston Celtics,Head To Head,Brooklyn Nets,5,Boston Celtics,1.18,1.047,Dabble
Detroit Pistons v Oklahoma City Thunder,Head To Head,Detroit Pistons,2.5,Oklahoma City Thunder,1.55,1.045,Dabble
Houston Rockets v Chicago Bulls,Head To Head,Houston Rockets,1.28,Chicago Bulls,3.75,1.048,Dabble
Memphis Grizzlies v Miami Heat,Head To Head,Memphis Grizzlies,1.37,Miami Heat,3.2,1.042,Dabble
Milwaukee Bucks v Indiana Pacers,Head To Head,Milwaukee Bucks,1.6,Indiana Pacers,2.4,1.042,Dabble
Golden State Warriors v New York Knicks,Head To Head,Golden State Warriors,1.37,New York Knicks,3.2,1.042,Dabble
San Antonio Spurs v New Orleans Pelicans,Head To Head,San Antonio Spurs,2.1,New Orleans Pelicans,1.75,1.048,Dabble
Denver Nuggets v Washington Wizards,Head To Head,Denver Nuggets,1.14,Washington Wizards,6,1.044,Dabble
Portland Trail Blazers v Toronto Raptors,Head To Head,Portland Trail Blazers,1.52,Toronto Raptors,2.6,1.043,Dabble
