match,market_name,home_team,home_win,away_team,away_win,margin,agency
Memphis Grizzlies v Portland Trail Blazers,Head To Head,Memphis Grizzlies,1.2,Portland Trail Blazers,4.75,1.044,Dabble
Denver Nuggets v New York Knicks,Head To Head,Denver Nuggets,1.6,New York Knicks,2.4,1.042,Dabble
Golden State Warriors v Brooklyn Nets,Head To Head,Golden State Warriors,1.11,Brooklyn Nets,7,1.044,Dabble
Sacramento Kings v Oklahoma City Thunder,Head To Head,Sacramento Kings,2.35,Oklahoma City Thunder,1.62,1.043,Dabble
Miami Heat v Milwaukee Bucks,Head To Head,Miami Heat,1.78,Milwaukee Bucks,2.08,1.043,Dabble
Minnesota Timberwolves v Houston Rockets,Head To Head,Minnesota Timberwolves,1.62,Houston Rockets,2.35,1.043,Dabble
