match,market_name,home_team,home_win,away_team,away_win,margin,agency
Milwaukee Bucks v Philadelphia 76ers,Head To Head,Milwaukee Bucks,1.13,Philadelphia 76ers,6.5,1.039,Dabble
Oklahoma City Thunder v Brooklyn Nets,Head To Head,Oklahoma City Thunder,1.07,Brooklyn Nets,10,1.035,Dabble
Los Angeles Clippers v Los Angeles Lakers,Head To Head,Los Angeles Clippers,1.55,Los Angeles Lakers,2.5,1.045,Dabble
Sacramento Kings v Washington Wizards,Head To Head,Sacramento Kings,1.07,Washington Wizards,10,1.035,Dabble
Portland Trail Blazers v Chicago Bulls,Head To Head,Portland Trail Blazers,3,Chicago Bulls,1.4,1.048,Dabble
Charlotte Hornets v Dallas Mavericks,Head To Head,Charlotte Hornets,2.8,Dallas Mavericks,1.46,1.042,Dabble
Houston Rockets v Detroit Pistons,Head To Head,Houston Rockets,1.33,Detroit Pistons,3.4,1.046,Dabble
Cleveland Cavaliers v Phoenix Suns,Head To Head,Cleveland Cavaliers,1.35,Phoenix Suns,3.3,1.044,Dabble
