match,market_name,home_team,home_win,away_team,away_win,margin,agency
Chicago Bulls v Golden State Warriors,Head To Head,Chicago Bulls,3,Golden State Warriors,1.4,1.048,Dabble
Minnesota Timberwolves v Portland Trail Blazers,Head To Head,Minnesota Timberwolves,1.62,Portland Trail Blazers,2.35,1.043,Dabble
Memphis Grizzlies v Oklahoma City Thunder,Head To Head,Memphis Grizzlies,1.98,Oklahoma City Thunder,1.85,1.046,Dabble
New York Knicks v Boston Celtics,Head To Head,New York Knicks,2.5,Boston Celtics,1.55,1.045,Dabble
Sacramento Kings v New Orleans Pelicans,Head To Head,Sacramento Kings,1.33,New Orleans Pelicans,3.4,1.046,Dabble
Los Angeles Clippers v Utah Jazz,Head To Head,Los Angeles Clippers,1.07,Utah Jazz,10,1.035,Dabble
Detroit Pistons v Charlotte Hornets,Head To Head,Detroit Pistons,1.22,Charlotte Hornets,4.4,1.047,Dabble
Houston Rockets v Toronto Raptors,Head To Head,Houston Rockets,1.22,Toronto Raptors,4.4,1.047,Dabble
Milwaukee Bucks v Philadelphia 76ers,Head To Head,Milwaukee Bucks,1.72,Philadelphia 76ers,2.15,1.047,Dabble
