match,market_name,home_team,home_win,away_team,away_win,margin,agency
Indiana Pacers v Minnesota Timberwolves,Head To Head,Indiana Pacers,1.85,Minnesota Timberwolves,1.98,1.046,Dabble
Orlando Magic v Los Angeles Lakers,Head To Head,Orlando Magic,2.5,Los Angeles Lakers,1.55,1.045,Dabble
Washington Wizards v Toronto Raptors,Head To Head,Washington Wizards,1.78,Toronto Raptors,2.08,1.043,Dabble
Brooklyn Nets v Dallas Mavericks,Head To Head,Brooklyn Nets,2.2,Dallas Mavericks,1.68,1.05,Dabble
New Orleans Pelicans v Philadelphia 76ers,Head To Head,New Orleans Pelicans,1.58,Philadelphia 76ers,2.45,1.041,Dabble
Denver Nuggets v Chicago Bulls,Head To Head,Denver Nuggets,1.67,Chicago Bulls,2.25,1.043,Dabble
Sacramento Kings v Boston Celtics,Head To Head,Sacramento Kings,2.55,Boston Celtics,1.53,1.046,Dabble
Phoenix Suns v Milwaukee Bucks,Head To Head,Phoenix Suns,1.7,Milwaukee Bucks,2.2,1.043,Dabble
