match,market_name,home_team,home_win,away_team,away_win,margin,agency
Atlanta Hawks v Phoenix Suns,Head To Head,Atlanta Hawks,2.1,Phoenix Suns,1.75,1.048,Dabble
Milwaukee Bucks v Sacramento Kings,Head To Head,Milwaukee Bucks,1.75,Sacramento Kings,2.1,1.048,Dabble
Chicago Bulls v New Orleans Pelicans,Head To Head,Chicago Bulls,1.78,New Orleans Pelicans,2.08,1.043,Dabble
Dallas Mavericks v Denver Nuggets,Head To Head,Dallas Mavericks,2.3,Denver Nuggets,1.65,1.041,Dabble
Portland Trail Blazers v Brooklyn Nets,Head To Head,Portland Trail Blazers,1.5,Brooklyn Nets,2.65,1.044,Dabble
Toronto Raptors v Boston Celtics,Head To Head,Toronto Raptors,5.75,Boston Celtics,1.15,1.043,Dabble
San Antonio Spurs v Memphis Grizzlies,Head To Head,San Antonio Spurs,2.35,Memphis Grizzlies,1.62,1.043,Dabble
Denver Nuggets v Houston Rockets,Head To Head,Denver Nuggets,2.1,Houston Rockets,1.75,1.048,Dabble
Minnesota Timberwolves v Golden State Warriors,Head To Head,Minnesota Timberwolves,1.46,Golden State Warriors,2.8,1.042,Dabble
