match,market_name,home_team,home_win,away_team,away_win,margin,agency
Phoenix Suns v Atlanta Hawks,Head To Head,Phoenix Suns,1.24,Atlanta Hawks,4.25,1.042,Dabble
Toronto Raptors v Oklahoma City Thunder,Head To Head,Toronto Raptors,8.5,Oklahoma City Thunder,1.08,1.044,Dabble
Detroit Pistons v Boston Celtics,Head To Head,Detroit Pistons,7.5,Boston Celtics,1.1,1.042,Dabble
San Antonio Spurs v Memphis Grizzlies,Head To Head,San Antonio Spurs,1.44,Memphis Grizzlies,2.85,1.045,Dabble
Golden State Warriors v Indiana Pacers,Head To Head,Golden State Warriors,1.53,Indiana Pacers,2.55,1.046,Dabble
