match,market_name,home_team,home_win,away_team,away_win,margin,agency
Indiana Pacers v Los Angeles Clippers,Head To Head,Indiana Pacers,1.57,Los Angeles Clippers,2.45,1.045,Dabble
Atlanta Hawks v Detroit Pistons,Head To Head,Atlanta Hawks,2.2,Detroit Pistons,1.68,1.05,Dabble
Milwaukee Bucks v Miami Heat,Head To Head,Milwaukee Bucks,1.5,Miami Heat,2.65,1.044,Dabble
Toronto Raptors v Phoenix Suns,Head To Head,Toronto Raptors,2.2,Phoenix Suns,1.7,1.043,Dabble
Orlando Magic v Washington Wizards,Head To Head,Orlando Magic,1.12,Washington Wizards,6.5,1.047,Dabble
Cleveland Cavaliers v Memphis Grizzlies,Head To Head,Cleveland Cavaliers,1.44,Memphis Grizzlies,2.85,1.045,Dabble
New Orleans Pelicans v San Antonio Spurs,Head To Head,New Orleans Pelicans,1.77,San Antonio Spurs,2.08,1.046,Dabble
Minnesota Timberwolves v Oklahoma City Thunder,Head To Head,Minnesota Timberwolves,4,Oklahoma City Thunder,1.26,1.044,Dabble
