match,market_name,home_team,home_win,away_team,away_win,margin,agency
Memphis Grizzlies v Brooklyn Nets,Head To Head,Memphis Grizzlies,1.22,Brooklyn Nets,4.5,1.042,Dabble
Chicago Bulls v Charlotte Hornets,Head To Head,Chicago Bulls,1.48,Charlotte Hornets,2.7,1.046,Dabble
Minnesota Timberwolves v Los Angeles Clippers,Head To Head,Minnesota Timberwolves,1.28,Los Angeles Clippers,3.85,1.041,Dabble
Denver Nuggets v Los Angeles Clippers,Head To Head,Denver Nuggets,1.44,Los Angeles Clippers,2.85,1.045,Dabble
Utah Jazz v Phoenix Suns,Head To Head,Utah Jazz,3.3,Phoenix Suns,1.35,1.044,Dabble
Portland Trail Blazers v San Antonio Spurs,Head To Head,Portland Trail Blazers,2.3,San Antonio Spurs,1.65,1.041,Dabble
