match,market_name,home_team,home_win,away_team,away_win,margin,agency
Charlotte Hornets v Orlando Magic,Head To Head,Charlotte Hornets,2.8,Orlando Magic,1.45,1.047,Dabble
Miami Heat v Golden State Warriors,Head To Head,Miami Heat,2.8,Golden State Warriors,1.46,1.042,Dabble
New York Knicks v Dallas Mavericks,Head To Head,New York Knicks,1.22,Dallas Mavericks,4.4,1.047,Dabble
Houston Rockets v Atlanta Hawks,Head To Head,Houston Rockets,1.32,Atlanta Hawks,3.5,1.043,Dabble
Utah Jazz v Memphis Grizzlies,Head To Head,Utah Jazz,4.5,Memphis Grizzlies,1.22,1.042,Dabble
Portland Trail Blazers v Cleveland Cavaliers,Head To Head,Portland Trail Blazers,3.1,Cleveland Cavaliers,1.38,1.047,Dabble
Sacramento Kings v Oklahoma City Thunder,Head To Head,Sacramento Kings,4.4,Oklahoma City Thunder,1.22,1.047,Dabble
