match,market_name,home_team,home_win,away_team,away_win,margin,agency
Portland Trail Blazers v Los Angeles Clippers,Head To Head,Portland Trail Blazers,3.25,Los Angeles Clippers,1.35,1.048,Dabble
Sacramento Kings v Houston Rockets,Head To Head,Sacramento Kings,1.55,Houston Rockets,2.5,1.045,Dabble
Boston Celtics v Orlando Magic,Head To Head,Boston Celtics,1.15,Orlando Magic,5.75,1.043,Dabble
New York Knicks v Minnesota Timberwolves,Head To Head,New York Knicks,1.6,Minnesota Timberwolves,2.4,1.042,Dabble
Milwaukee Bucks v Toronto Raptors,Head To Head,Milwaukee Bucks,1.17,Toronto Raptors,5.5,1.037,Dabble
Los Angeles Lakers v Brooklyn Nets,Head To Head,Los Angeles Lakers,1.15,Brooklyn Nets,5.75,1.043,Dabble
