match,market_name,home_team,home_win,away_team,away_win,margin,agency
Miami Heat v San Antonio Spurs,Head To Head,Miami Heat,1.67,San Antonio Spurs,2.25,1.043,Dabble
Orlando Magic v Denver Nuggets,Head To Head,Orlando Magic,3.3,Denver Nuggets,1.35,1.044,Dabble
Milwaukee Bucks v Philadelphia 76ers,Head To Head,Milwaukee Bucks,1.17,Philadelphia 76ers,5.5,1.037,Dabble
Oklahoma City Thunder v Brooklyn Nets,Head To Head,Oklahoma City Thunder,1.06,Brooklyn Nets,11,1.034,Dabble
Los Angeles Clippers v Los Angeles Lakers,Head To Head,Los Angeles Clippers,1.57,Los Angeles Lakers,2.45,1.045,Dabble
Sacramento Kings v Washington Wizards,Head To Head,Sacramento Kings,1.07,Washington Wizards,10,1.035,Dabble
Portland Trail Blazers v Chicago Bulls,Head To Head,Portland Trail Blazers,3,Chicago Bulls,1.4,1.048,Dabble
