match,market_name,home_team,home_win,away_team,away_win,margin,agency
Milwaukee Bucks v Los Angeles Lakers,Head To Head,Milwaukee Bucks,1.4,Los Angeles Lakers,3,1.048,Dabble
Chicago Bulls v Brooklyn Nets,Head To Head,Chicago Bulls,1.8,Brooklyn Nets,2.05,1.043,Dabble
New Orleans Pelicans v Orlando Magic,Head To Head,New Orleans Pelicans,2.1,Orlando Magic,1.75,1.048,Dabble
Golden State Warriors v Sacramento Kings,Head To Head,Golden State Warriors,1.33,Sacramento Kings,3.4,1.046,Dabble
Miami Heat v Boston Celtics,Head To Head,Miami Heat,3.3,Boston Celtics,1.35,1.044,Dabble
Philadelphia 76ers v Indiana Pacers,Head To Head,Philadelphia 76ers,4.4,Indiana Pacers,1.22,1.047,Dabble
Atlanta Hawks v Los Angeles Clippers,Head To Head,Atlanta Hawks,2.25,Los Angeles Clippers,1.67,1.043,Dabble
Houston Rockets v Dallas Mavericks,Head To Head,Houston Rockets,1.17,Dallas Mavericks,5.5,1.037,Dabble
San Antonio Spurs v Charlotte Hornets,Head To Head,San Antonio Spurs,1.4,Charlotte Hornets,3,1.048,Dabble
