match,market_name,home_team,home_win,away_team,away_win,margin,agency
Denver Nuggets v Minnesota Timberwolves,Head To Head,Denver Nuggets,1.8,Minnesota Timberwolves,2.05,1.043,Dabble
Washington Wizards v Sacramento Kings,Head To Head,Washington Wizards,5.75,Sacramento Kings,1.15,1.043,Dabble
Indiana Pacers v Charlotte Hornets,Head To Head,Indiana Pacers,1.09,Charlotte Hornets,8,1.042,Dabble
Cleveland Cavaliers v New York Knicks,Head To Head,Cleveland Cavaliers,1.18,New York Knicks,5,1.047,Dabble
Boston Celtics v Miami Heat,Head To Head,Boston Celtics,1.17,Miami Heat,5.5,1.037,Dabble
Houston Rockets v Utah Jazz,Head To Head,Houston Rockets,1.06,Utah Jazz,11,1.034,Dabble
Dallas Mavericks v Atlanta Hawks,Head To Head,Dallas Mavericks,1.72,Atlanta Hawks,2.15,1.047,Dabble
Los Angeles Clippers v New Orleans Pelicans,Head To Head,Los Angeles Clippers,1.06,New Orleans Pelicans,11,1.034,Dabble
