match,market_name,home_team,home_win,away_team,away_win,margin,agency
Golden State Warriors v Philadelphia 76ers,Head To Head,Golden State Warriors,1.62,Philadelphia 76ers,2.35,1.043,Dabble
Los Angeles Clippers v Portland Trail Blazers,Head To Head,Los Angeles Clippers,1.37,Portland Trail Blazers,3.2,1.042,Dabble
Detroit Pistons v Charlotte Hornets,Head To Head,Detroit Pistons,1.45,Charlotte Hornets,2.8,1.047,Dabble
Toronto Raptors v Orlando Magic,Head To Head,Toronto Raptors,1.98,Orlando Magic,1.85,1.046,Dabble
New Orleans Pelicans v Washington Wizards,Head To Head,New Orleans Pelicans,1.44,Washington Wizards,2.85,1.045,Dabble
Dallas Mavericks v Cleveland Cavaliers,Head To Head,Dallas Mavericks,3,Cleveland Cavaliers,1.4,1.048,Dabble
Sacramento Kings v Memphis Grizzlies,Head To Head,Sacramento Kings,1.55,Memphis Grizzlies,2.5,1.045,Dabble
