match,market_name,home_team,home_win,away_team,away_win,margin,agency
Boston Celtics v Milwaukee Bucks,Head To Head,Boston Celtics,1.3,Milwaukee Bucks,3.6,1.047,Dabble
Atlanta Hawks v Los Angeles Clippers,Head To Head,Atlanta Hawks,1.62,Los Angeles Clippers,2.35,1.043,Dabble
San Antonio Spurs v Sacramento Kings,Head To Head,San Antonio Spurs,3.1,Sacramento Kings,1.38,1.047,Dabble
Chicago Bulls v Indiana Pacers,Head To Head,Chicago Bulls,2.35,Indiana Pacers,1.62,1.043,Dabble
Portland Trail Blazers v Utah Jazz,Head To Head,Portland Trail Blazers,1.72,Utah Jazz,2.15,1.047,Dabble
Golden State Warriors v Minnesota Timberwolves,Head To Head,Golden State Warriors,2.02,Minnesota Timberwolves,1.82,1.045,Dabble
Charlotte Hornets v Cleveland Cavaliers,Head To Head,Charlotte Hornets,5.5,Cleveland Cavaliers,1.17,1.037,Dabble
New Orleans Pelicans v Oklahoma City Thunder,Head To Head,New Orleans Pelicans,3.4,Oklahoma City Thunder,1.33,1.046,Dabble
New York Knicks v Detroit Pistons,Head To Head,New York Knicks,1.14,Detroit Pistons,6,1.044,Dabble
