match,market_name,home_team,home_win,away_team,away_win,margin,agency
Los Angeles Clippers v Sacramento Kings,Head To Head,Los Angeles Clippers,2.4,Sacramento Kings,1.6,1.042,Dabble
Utah Jazz v New York Knicks,Head To Head,Utah Jazz,4,New York Knicks,1.26,1.044,Dabble
Orlando Magic v Detroit Pistons,Head To Head,Orlando Magic,1.22,Detroit Pistons,4.4,1.047,Dabble
Milwaukee Bucks v Charlotte Hornets,Head To Head,Milwaukee Bucks,1.3,Charlotte Hornets,3.6,1.047,Dabble
Chicago Bulls v Memphis Grizzlies,Head To Head,Chicago Bulls,2.7,Memphis Grizzlies,1.48,1.046,Dabble
