match,market_name,home_team,home_win,away_team,away_win,margin,agency
Golden State Warriors v Memphis Grizzlies,Head To Head,Golden State Warriors,1.33,Memphis Grizzlies,3.4,1.046,Dabble
Sacramento Kings v Minnesota Timberwolves,Head To Head,Sacramento Kings,2.02,Minnesota Timberwolves,1.82,1.045,Dabble
Charlotte Hornets v Milwaukee Bucks,Head To Head,Charlotte Hornets,2.45,Milwaukee Bucks,1.58,1.041,Dabble
Boston Celtics v Toronto Raptors,Head To Head,Boston Celtics,1.06,Toronto Raptors,11,1.034,Dabble
New Orleans Pelicans v Los Angeles Clippers,Head To Head,New Orleans Pelicans,3.2,Los Angeles Clippers,1.37,1.042,Dabble
Dallas Mavericks v San Antonio Spurs,Head To Head,Dallas Mavericks,1.2,San Antonio Spurs,4.75,1.044,Dabble
Sacramento Kings v Utah Jazz,Head To Head,Sacramento Kings,1.26,Utah Jazz,4,1.044,Dabble
