match,market_name,home_team,home_win,away_team,away_win,margin,agency
Cleveland Cavaliers v Toronto Raptors,Head To Head,Cleveland Cavaliers,1.08,Toronto Raptors,8.5,1.044,Dabble
Detroit Pistons v Golden State Warriors,Head To Head,Detroit Pistons,1.72,Golden State Warriors,2.15,1.047,Dabble
Orlando Magic v Minnesota Timberwolves,Head To Head,Orlando Magic,2.35,Minnesota Timberwolves,1.62,1.043,Dabble
Memphis Grizzlies v Houston Rockets,Head To Head,Memphis Grizzlies,2.25,Houston Rockets,1.67,1.043,Dabble
Dallas Mavericks v Portland Trail Blazers,Head To Head,Dallas Mavericks,1.35,Portland Trail Blazers,3.3,1.044,Dabble
Phoenix Suns v Atlanta Hawks,Head To Head,Phoenix Suns,1.62,Atlanta Hawks,2.35,1.043,Dabble
Utah Jazz v Miami Heat,Head To Head,Utah Jazz,2.8,Miami Heat,1.46,1.042,Dabble
Los Angeles Clippers v Charlotte Hornets,Head To Head,Los Angeles Clippers,1.26,Charlotte Hornets,4,1.044,Dabble
