match,market_name,home_team,home_win,away_team,away_win,margin,agency
Indiana Pacers v Chicago Bulls,Head To Head,Indiana Pacers,1.48,Chicago Bulls,2.7,1.046,Dabble
Cleveland Cavaliers v Oklahoma City Thunder,Head To Head,Cleveland Cavaliers,1.75,Oklahoma City Thunder,2.1,1.048,Dabble
Brooklyn Nets v Detroit Pistons,Head To Head,Brooklyn Nets,3.2,Detroit Pistons,1.37,1.042,Dabble
New York Knicks v Toronto Raptors,Head To Head,New York Knicks,1.15,Toronto Raptors,5.75,1.043,Dabble
Milwaukee Bucks v San Antonio Spurs,Head To Head,Milwaukee Bucks,1.45,San Antonio Spurs,2.8,1.047,Dabble
