match,market_name,home_team,home_win,away_team,away_win,margin,agency
Detroit Pistons v Cleveland Cavaliers,Head To Head,Detroit Pistons,3.1,Cleveland Cavaliers,1.38,1.047,Dabble
Brooklyn Nets v Los Angeles Clippers,Head To Head,Brooklyn Nets,6.5,Los Angeles Clippers,1.13,1.039,Dabble
Toronto Raptors v Charlotte Hornets,Head To Head,Toronto Raptors,1.45,Charlotte Hornets,2.8,1.047,Dabble
New Orleans Pelicans v Golden State Warriors,Head To Head,New Orleans Pelicans,8.5,Golden State Warriors,1.08,1.044,Dabble
Milwaukee Bucks v New York Knicks,Head To Head,Milwaukee Bucks,1.92,New York Knicks,1.9,1.047,Dabble
Minnesota Timberwolves v Phoenix Suns,Head To Head,Minnesota Timberwolves,1.33,Phoenix Suns,3.4,1.046,Dabble
Denver Nuggets v Utah Jazz,Head To Head,Denver Nuggets,1.06,Utah Jazz,11,1.034,Dabble
