match,market_name,home_team,home_win,away_team,away_win,margin,agency
Orlando Magic v Toronto Raptors,Head To Head,Orlando Magic,1.33,Toronto Raptors,3.4,1.046,Dabble
Indiana Pacers v Houston Rockets,Head To Head,Indiana Pacers,1.62,Houston Rockets,2.35,1.043,Dabble
New York Knicks v Golden State Warriors,Head To Head,New York Knicks,1.46,Golden State Warriors,2.75,1.049,Dabble
Atlanta Hawks v Milwaukee Bucks,Head To Head,Atlanta Hawks,2.9,Milwaukee Bucks,1.42,1.049,Dabble
Chicago Bulls v Cleveland Cavaliers,Head To Head,Chicago Bulls,6,Cleveland Cavaliers,1.14,1.044,Dabble
Minnesota Timberwolves v Philadelphia 76ers,Head To Head,Minnesota Timberwolves,1.1,Philadelphia 76ers,7.5,1.042,Dabble
San Antonio Spurs v Brooklyn Nets,Head To Head,San Antonio Spurs,1.6,Brooklyn Nets,2.4,1.042,Dabble
Phoenix Suns v Los Angeles Clippers,Head To Head,Phoenix Suns,2.2,Los Angeles Clippers,1.68,1.05,Dabble
Los Angeles Lakers v New Orleans Pelicans,Head To Head,Los Angeles Lakers,1.28,New Orleans Pelicans,3.75,1.048,Dabble
