match,market_name,home_team,home_win,away_team,away_win,margin,agency
Los Angeles Lakers v Brooklyn Nets,Head To Head,Los Angeles Lakers,1.17,Brooklyn Nets,5.5,1.037,Dabble
Detroit Pistons v Phoenix Suns,Head To Head,Detroit Pistons,2.02,Phoenix Suns,1.82,1.045,Dabble
Indiana Pacers v Philadelphia 76ers,Head To Head,Indiana Pacers,1.3,Philadelphia 76ers,3.6,1.047,Dabble
Boston Celtics v Atlanta Hawks,Head To Head,Boston Celtics,1.17,Atlanta Hawks,5.25,1.045,Dabble
Golden State Warriors v Washington Wizards,Head To Head,Golden State Warriors,1.11,Washington Wizards,7,1.044,Dabble
Minnesota Timberwolves v Cleveland Cavaliers,Head To Head,Minnesota Timberwolves,2.7,Cleveland Cavaliers,1.48,1.046,Dabble
