match,market_name,home_team,home_win,away_team,away_win,margin,agency
Sacramento Kings v Utah Jazz,Head To Head,Sacramento Kings,1.37,Utah Jazz,3.2,1.042,Dabble
Minnesota Timberwolves v Phoenix Suns,Head To Head,Minnesota Timberwolves,1.35,Phoenix Suns,3.25,1.048,Dabble
Indiana Pacers v Miami Heat,Head To Head,Indiana Pacers,1.7,Miami Heat,2.2,1.043,Dabble
Portland Trail Blazers v Atlanta Hawks,Head To Head,Portland Trail Blazers,2.65,Atlanta Hawks,1.5,1.044,Dabble
Washington Wizards v Detroit Pistons,Head To Head,Washington Wizards,2.7,Detroit Pistons,1.48,1.046,Dabble
Memphis Grizzlies v Denver Nuggets,Head To Head,Memphis Grizzlies,1.88,Denver Nuggets,1.95,1.045,Dabble
Cleveland Cavaliers v Charlotte Hornets,Head To Head,Cleveland Cavaliers,1.18,Charlotte Hornets,5,1.047,Dabble
New York Knicks v Brooklyn Nets,Head To Head,New York Knicks,1.22,Brooklyn Nets,4.4,1.047,Dabble
Chicago Bulls v Houston Rockets,Head To Head,Chicago Bulls,2.6,Houston Rockets,1.52,1.043,Dabble
