match,market_name,home_team,home_win,away_team,away_win,margin,agency
Chicago Bulls v Detroit Pistons,Head To Head,Chicago Bulls,2.9,Detroit Pistons,1.42,1.049,Dabble
Minnesota Timberwolves v Milwaukee Bucks,Head To Head,Minnesota Timberwolves,1.26,Milwaukee Bucks,4,1.044,Dabble
New Orleans Pelicans v Sacramento Kings,Head To Head,New Orleans Pelicans,2.8,Sacramento Kings,1.45,1.047,Dabble
Oklahoma City Thunder v Miami Heat,Head To Head,Oklahoma City Thunder,1.11,Miami Heat,7,1.044,Dabble
Houston Rockets v Phoenix Suns,Head To Head,Houston Rockets,1.26,Phoenix Suns,4,1.044,Dabble
Utah Jazz v Los Angeles Lakers,Head To Head,Utah Jazz,4,Los Angeles Lakers,1.26,1.044,Dabble
Denver Nuggets v Portland Trail Blazers,Head To Head,Denver Nuggets,1.2,Portland Trail Blazers,4.75,1.044,Dabble
Dallas Mavericks v Golden State Warriors,Head To Head,Dallas Mavericks,3.6,Golden State Warriors,1.3,1.047,Dabble
Los Angeles Clippers v Memphis Grizzlies,Head To Head,Los Angeles Clippers,1.46,Memphis Grizzlies,2.75,1.049,Dabble
