match,market_name,home_team,home_win,away_team,away_win,margin,agency
Miami Heat v Los Angeles Clippers,Head To Head,Miami Heat,1.64,Los Angeles Clippers,2.3,1.045,Dabble
Boston Celtics v Detroit Pistons,Head To Head,Boston Celtics,1.11,Detroit Pistons,7,1.044,Dabble
Brooklyn Nets v Indiana Pacers,Head To Head,Brooklyn Nets,2.2,Indiana Pacers,1.7,1.043,Dabble
Philadelphia 76ers v Orlando Magic,Head To Head,Philadelphia 76ers,2.6,Orlando Magic,1.52,1.043,Dabble
Milwaukee Bucks v Atlanta Hawks,Head To Head,Milwaukee Bucks,1.58,Atlanta Hawks,2.45,1.041,Dabble
Los Angeles Clippers v Minnesota Timberwolves,Head To Head,Los Angeles Clippers,2.3,Minnesota Timberwolves,1.64,1.045,Dabble
