match,market_name,home_team,home_win,away_team,away_win,margin,agency
Indiana Pacers v Brooklyn Nets,Head To Head,Indiana Pacers,1.3,Brooklyn Nets,3.6,1.047,Dabble
Charlotte Hornets v New York Knicks,Head To Head,Charlotte Hornets,3.5,New York Knicks,1.32,1.043,Dabble
Sacramento Kings v Chicago Bulls,Head To Head,Sacramento Kings,1.4,Chicago Bulls,3,1.048,Dabble
Golden State Warriors v Toronto Raptors,Head To Head,Golden State Warriors,1.09,Toronto Raptors,8,1.042,Dabble
Los Angeles Lakers v Milwaukee Bucks,Head To Head,Los Angeles Lakers,3.2,Milwaukee Bucks,1.37,1.042,Dabble
