match,market_name,home_team,home_win,away_team,away_win,margin,agency
Indiana Pacers v Brooklyn Nets,Head To Head,Indiana Pacers,1.14,Brooklyn Nets,6,1.044,Dabble
Atlanta Hawks v Golden State Warriors,Head To Head,Atlanta Hawks,2.15,Golden State Warriors,1.72,1.047,Dabble
New York Knicks v Washington Wizards,Head To Head,New York Knicks,1.08,Washington Wizards,8.5,1.044,Dabble
Sacramento Kings v Milwaukee Bucks,Head To Head,Sacramento Kings,1.75,Milwaukee Bucks,2.1,1.048,Dabble
Los Angeles Lakers v Chicago Bulls,Head To Head,Los Angeles Lakers,1.22,Chicago Bulls,4.4,1.047,Dabble
Detroit Pistons v New Orleans Pelicans,Head To Head,Detroit Pistons,1.24,New Orleans Pelicans,4.25,1.042,Dabble
