match,market_name,home_team,home_win,away_team,away_win,margin,agency
Los Angeles Lakers v Minnesota Timberwolves,Head To Head,Los Angeles Lakers,1.4,Minnesota Timberwolves,3,1.048,Dabble
Detroit Pistons v Denver Nuggets,Head To Head,Detroit Pistons,1.95,Denver Nuggets,1.88,1.045,Dabble
Boston Celtics v Cleveland Cavaliers,Head To Head,Boston Celtics,1.7,Cleveland Cavaliers,2.2,1.043,Dabble
Atlanta Hawks v Oklahoma City Thunder,Head To Head,Atlanta Hawks,5.75,Oklahoma City Thunder,1.15,1.043,Dabble
Brooklyn Nets v Portland Trail Blazers,Head To Head,Brooklyn Nets,1.88,Portland Trail Blazers,1.95,1.045,Dabble
Miami Heat v Indiana Pacers,Head To Head,Miami Heat,2.4,Indiana Pacers,1.6,1.042,Dabble
Memphis Grizzlies v New York Knicks,Head To Head,Memphis Grizzlies,1.68,New York Knicks,2.2,1.05,Dabble
Chicago Bulls v Toronto Raptors,Head To Head,Chicago Bulls,1.82,Toronto Raptors,2.02,1.045,Dabble
Los Angeles Lakers v Los Angeles Clippers,Head To Head,Los Angeles Lakers,1.82,Los Angeles Clippers,2,1.049,Dabble
