match,market_name,home_team,home_win,away_team,away_win,margin,agency
Toronto Raptors v New Orleans Pelicans,Head To Head,Toronto Raptors,2,New Orleans Pelicans,1.82,1.049,Dabble
Brooklyn Nets v Sacramento Kings,Head To Head,Brooklyn Nets,5.75,Sacramento Kings,1.15,1.043,Dabble
Boston Celtics v Houston Rockets,Head To Head,Boston Celtics,1.45,Houston Rockets,2.8,1.047,Dabble
Miami Heat v Orlando Magic,Head To Head,Miami Heat,1.92,Orlando Magic,1.9,1.047,Dabble
Chicago Bulls v Denver Nuggets,Head To Head,Chicago Bulls,4,Denver Nuggets,1.26,1.044,Dabble
Minnesota Timberwolves v Atlanta Hawks,Head To Head,Minnesota Timberwolves,1.2,Atlanta Hawks,4.75,1.044,Dabble
Dallas Mavericks v Washington Wizards,Head To Head,Dallas Mavericks,1.12,Washington Wizards,6.5,1.047,Dabble
Utah Jazz v Milwaukee Bucks,Head To Head,Utah Jazz,4,Milwaukee Bucks,1.25,1.05,Dabble
Phoenix Suns v Los Angeles Clippers,Head To Head,Phoenix Suns,2.02,Los Angeles Clippers,1.82,1.045,Dabble
