match,market_name,home_team,home_win,away_team,away_win,margin,agency
Miami Heat v Milwaukee Bucks,Head To Head,Miami Heat,1.44,Milwaukee Bucks,2.85,1.045,Dabble
Minnesota Timberwolves v Houston Rockets,Head To Head,Minnesota Timberwolves,1.67,Houston Rockets,2.25,1.043,Dabble
Utah Jazz v San Antonio Spurs,Head To Head,Utah Jazz,2.1,San Antonio Spurs,1.75,1.048,Dabble
Phoenix Suns v Los Angeles Clippers,Head To Head,Phoenix Suns,1.75,Los Angeles Clippers,2.1,1.048,Dabble
Dallas Mavericks v New York Knicks,Head To Head,Dallas Mavericks,2.5,New York Knicks,1.55,1.045,Dabble
Utah Jazz v Denver Nuggets,Head To Head,Utah Jazz,3.85,Denver Nuggets,1.28,1.041,Dabble
