match,market_name,home_team,home_win,away_team,away_win,margin,agency
Washington Wizards v Miami Heat,Head To Head,Washington Wizards,4,Miami Heat,1.26,1.044,Dabble
Indiana Pacers v Sacramento Kings,Head To Head,Indiana Pacers,1.6,Sacramento Kings,2.4,1.042,Dabble
Orlando Magic v Los Angeles Clippers,Head To Head,Orlando Magic,2.2,Los Angeles Clippers,1.7,1.043,Dabble
Charlotte Hornets v Utah Jazz,Head To Head,Charlotte Hornets,1.62,Utah Jazz,2.35,1.043,Dabble
Memphis Grizzlies v Boston Celtics,Head To Head,Memphis Grizzlies,2.55,Boston Celtics,1.53,1.046,Dabble
Oklahoma City Thunder v Chicago Bulls,Head To Head,Oklahoma City Thunder,1.11,Chicago Bulls,7,1.044,Dabble
Dallas Mavericks v Brooklyn Nets,Head To Head,Dallas Mavericks,1.26,Brooklyn Nets,4,1.044,Dabble
Los Angeles Lakers v Houston Rockets,Head To Head,Los Angeles Lakers,1.6,Houston Rockets,2.4,1.042,Dabble
