match,market_name,home_team,home_win,away_team,away_win,margin,agency
Dallas Mavericks v Philadelphia 76ers,Head To Head,Dallas Mavericks,1.38,Philadelphia 76ers,3.1,1.047,Dabble
Cleveland Cavaliers v Orlando Magic,Head To Head,Cleveland Cavaliers,1.2,Orlando Magic,4.75,1.044,Dabble
Los Angeles Lakers v Phoenix Suns,Head To Head,Los Angeles Lakers,1.62,Phoenix Suns,2.35,1.043,Dabble
Portland Trail Blazers v Toronto Raptors,Head To Head,Portland Trail Blazers,1.4,Toronto Raptors,3,1.048,Dabble
Brooklyn Nets v Atlanta Hawks,Head To Head,Brooklyn Nets,2.75,Atlanta Hawks,1.46,1.049,Dabble
Minnesota Timberwolves v Utah Jazz,Head To Head,Minnesota Timberwolves,1.12,Utah Jazz,6.5,1.047,Dabble
Los Angeles Clippers v Charlotte Hornets,Head To Head,Los Angeles Clippers,1.15,Charlotte Hornets,5.75,1.043,Dabble
Milwaukee Bucks v Oklahoma City Thunder,Head To Head,Milwaukee Bucks,2.45,Oklahoma City Thunder,1.58,1.041,Dabble
