match,market_name,home_team,home_win,away_team,away_win,margin,agency
Indiana Pacers v Cleveland Cavaliers,Head To Head,Indiana Pacers,1.4,Cleveland Cavaliers,3,1.048,Dabble
Boston Celtics v Detroit Pistons,Head To Head,Boston Celtics,1.08,Detroit Pistons,9,1.037,Dabble
Philadelphia 76ers v Miami Heat,Head To Head,Philadelphia 76ers,1.8,Miami Heat,2.05,1.043,Dabble
Chicago Bulls v Portland Trail Blazers,Head To Head,Chicago Bulls,1.3,Portland Trail Blazers,3.6,1.047,Dabble
Utah Jazz v Minnesota Timberwolves,Head To Head,Utah Jazz,2.8,Minnesota Timberwolves,1.46,1.042,Dabble
Sacramento Kings v Memphis Grizzlies,Head To Head,Sacramento Kings,1.18,Memphis Grizzlies,5,1.047,Dabble
Golden State Warriors v New York Knicks,Head To Head,Golden State Warriors,1.4,New York Knicks,3,1.048,Dabble
Los Angeles Clippers v Atlanta Hawks,Head To Head,Los Angeles Clippers,1.22,Atlanta Hawks,4.4,1.047,Dabble
