match,market_name,home_team,home_win,away_team,away_win,margin,agency
Los Angeles Clippers v Detroit Pistons,Head To Head,Los Angeles Clippers,2.4,Detroit Pistons,1.6,1.042,Dabble
Orlando Magic v Chicago Bulls,Head To Head,Orlando Magic,1.35,Chicago Bulls,3.25,1.048,Dabble
Brooklyn Nets v Golden State Warriors,Head To Head,Brooklyn Nets,4.4,Golden State Warriors,1.22,1.047,Dabble
Atlanta Hawks v Indiana Pacers,Head To Head,Atlanta Hawks,2.15,Indiana Pacers,1.72,1.047,Dabble
Boston Celtics v Philadelphia 76ers,Head To Head,Boston Celtics,1.15,Philadelphia 76ers,5.75,1.043,Dabble
New Orleans Pelicans v Houston Rockets,Head To Head,New Orleans Pelicans,2.55,Houston Rockets,1.53,1.046,Dabble
Los Angeles Lakers v New York Knicks,Head To Head,Los Angeles Lakers,1.67,New York Knicks,2.25,1.043,Dabble
