match,market_name,home_team,home_win,away_team,away_win,margin,agency
Sacramento Kings v Memphis Grizzlies,Head To Head,Sacramento Kings,1.65,Memphis Grizzlies,2.3,1.041,Dabble
Los Angeles Clippers v Atlanta Hawks,Head To Head,Los Angeles Clippers,1.7,Atlanta Hawks,2.2,1.043,Dabble
Brooklyn Nets v Philadelphia 76ers,Head To Head,Brooklyn Nets,3.1,Philadelphia 76ers,1.38,1.047,Dabble
Detroit Pistons v Minnesota Timberwolves,Head To Head,Detroit Pistons,2.85,Minnesota Timberwolves,1.44,1.045,Dabble
Indiana Pacers v Phoenix Suns,Head To Head,Indiana Pacers,1.78,Phoenix Suns,2.08,1.043,Dabble
Miami Heat v Utah Jazz,Head To Head,Miami Heat,1.3,Utah Jazz,3.6,1.047,Dabble
