match,market_name,home_team,home_win,away_team,away_win,margin,agency
Detroit Pistons v Boston Celtics,Head To Head,Detroit Pistons,2.4,Boston Celtics,1.6,1.042,Dabble
Washington Wizards v Portland Trail Blazers,Head To Head,Washington Wizards,2.8,Portland Trail Blazers,1.45,1.047,Dabble
New York Knicks v Philadelphia 76ers,Head To Head,New York Knicks,1.22,Philadelphia 76ers,4.4,1.047,Dabble
Indiana Pacers v Toronto Raptors,Head To Head,Indiana Pacers,1.24,Toronto Raptors,4.25,1.042,Dabble
Miami Heat v Atlanta Hawks,Head To Head,Miami Heat,1.82,Atlanta Hawks,2.02,1.045,Dabble
Brooklyn Nets v Oklahoma City Thunder,Head To Head,Brooklyn Nets,9.5,Oklahoma City Thunder,1.07,1.04,Dabble
Chicago Bulls v Los Angeles Clippers,Head To Head,Chicago Bulls,3.4,Los Angeles Clippers,1.33,1.046,Dabble
Utah Jazz v Sacramento Kings,Head To Head,Utah Jazz,3.75,Sacramento Kings,1.28,1.048,Dabble
Houston Rockets v San Antonio Spurs,Head To Head,Houston Rockets,1.28,San Antonio Spurs,3.75,1.048,Dabble
