match,market_name,home_team,home_win,away_team,away_win,margin,agency
New York Knicks v Minnesota Timberwolves,Head To Head,New York Knicks,1.68,Minnesota Timberwolves,2.2,1.05,Dabble
Milwaukee Bucks v Toronto Raptors,Head To Head,Milwaukee Bucks,1.18,Toronto Raptors,5,1.047,Dabble
New Orleans Pelicans v Utah Jazz,Head To Head,New Orleans Pelicans,1.17,Utah Jazz,5.5,1.037,Dabble
Miami Heat v Denver Nuggets,Head To Head,Miami Heat,2.25,Denver Nuggets,1.67,1.043,Dabble
San Antonio Spurs v Memphis Grizzlies,Head To Head,San Antonio Spurs,2.1,Memphis Grizzlies,1.75,1.048,Dabble
