match,market_name,home_team,home_win,away_team,away_win,margin,agency
Philadelphia 76ers v Golden State Warriors,Head To Head,Philadelphia 76ers,3.2,Golden State Warriors,1.37,1.042,Dabble
Boston Celtics v Denver Nuggets,Head To Head,Boston Celtics,1.72,Denver Nuggets,2.15,1.047,Dabble
Indiana Pacers v Chicago Bulls,Head To Head,Indiana Pacers,1.22,Chicago Bulls,4.4,1.047,Dabble
Orlando Magic v Toronto Raptors,Head To Head,Orlando Magic,1.37,Toronto Raptors,3.2,1.042,Dabble
Miami Heat v New York Knicks,Head To Head,Miami Heat,2.85,New York Knicks,1.44,1.045,Dabble
San Antonio Spurs v Oklahoma City Thunder,Head To Head,San Antonio Spurs,6.5,Oklahoma City Thunder,1.12,1.047,Dabble
