match,market_name,home_team,home_win,away_team,away_win,margin,agency
Portland Trail Blazers v Sacramento Kings,Head To Head,Portland Trail Blazers,1.98,Sacramento Kings,1.85,1.046,Dabble
Los Angeles Lakers v Golden State Warriors,Head To Head,Los Angeles Lakers,1.38,Golden State Warriors,3.1,1.047,Dabble
Los Angeles Clippers v Indiana Pacers,Head To Head,Los Angeles Clippers,1.5,Indiana Pacers,2.65,1.044,Dabble
Washington Wizards v Cleveland Cavaliers,Head To Head,Washington Wizards,10,Cleveland Cavaliers,1.07,1.035,Dabble
Charlotte Hornets v San Antonio Spurs,Head To Head,Charlotte Hornets,5.5,San Antonio Spurs,1.15,1.051,Dabble
Detroit Pistons v Philadelphia 76ers,Head To Head,Detroit Pistons,2.1,Philadelphia 76ers,1.75,1.048,Dabble
Atlanta Hawks v Milwaukee Bucks,Head To Head,Atlanta Hawks,2.75,Milwaukee Bucks,1.46,1.049,Dabble
Brooklyn Nets v Miami Heat,Head To Head,Brooklyn Nets,3.3,Miami Heat,1.35,1.044,Dabble
Oklahoma City Thunder v Toronto Raptors,Head To Head,Oklahoma City Thunder,1.04,Toronto Raptors,13,1.038,Dabble
