match,market_name,home_team,home_win,away_team,away_win,margin,agency
Detroit Pistons v Washington Wizards,Head To Head,Detroit Pistons,1.12,Washington Wizards,6.5,1.047,Dabble
Milwaukee Bucks v Los Angeles Lakers,Head To Head,Milwaukee Bucks,1.38,Los Angeles Lakers,3.1,1.047,Dabble
Chicago Bulls v Brooklyn Nets,Head To Head,Chicago Bulls,1.77,Brooklyn Nets,2.08,1.046,Dabble
New Orleans Pelicans v Orlando Magic,Head To Head,New Orleans Pelicans,2.1,Orlando Magic,1.75,1.048,Dabble
Golden State Warriors v Sacramento Kings,Head To Head,Golden State Warriors,1.4,Sacramento Kings,3,1.048,Dabble
