match,market_name,home_team,home_win,away_team,away_win,margin,agency
Washington Wizards v Houston Rockets,Head To Head,Washington Wizards,7,Houston Rockets,1.11,1.044,Dabble
Charlotte Hornets v Phoenix Suns,Head To Head,Charlotte Hornets,2.65,Phoenix Suns,1.5,1.044,Dabble
Dallas Mavericks v Los Angeles Clippers,Head To Head,Dallas Mavericks,3,Los Angeles Clippers,1.4,1.048,Dabble
New Orleans Pelicans v Minnesota Timberwolves,Head To Head,New Orleans Pelicans,2.55,Minnesota Timberwolves,1.53,1.046,Dabble
Utah Jazz v Atlanta Hawks,Head To Head,Utah Jazz,3,Atlanta Hawks,1.4,1.048,Dabble
Golden State Warriors v Miami Heat,Head To Head,Golden State Warriors,1.24,Miami Heat,4.25,1.042,Dabble
Denver Nuggets v Boston Celtics,Head To Head,Denver Nuggets,2.9,Boston Celtics,1.42,1.049,Dabble
Indiana Pacers v Chicago Bulls,Head To Head,Indiana Pacers,1.5,Chicago Bulls,2.65,1.044,Dabble
