match,market_name,home_team,home_win,away_team,away_win,margin,agency
Philadelphia 76ers v Phoenix Suns,Head To Head,Philadelphia 76ers,1.62,Phoenix Suns,2.35,1.043,Dabble
Detroit Pistons v Portland Trail Blazers,Head To Head,Detroit Pistons,1.4,Portland Trail Blazers,3,1.048,Dabble
Toronto Raptors v Milwaukee Bucks,Head To Head,Toronto Raptors,3.4,Milwaukee Bucks,1.33,1.046,Dabble
New York Knicks v Orlando Magic,Head To Head,New York Knicks,1.18,Orlando Magic,5,1.047,Dabble
Brooklyn Nets v Indiana Pacers,Head To Head,Brooklyn Nets,3.75,Indiana Pacers,1.28,1.048,Dabble
Chicago Bulls v San Antonio Spurs,Head To Head,Chicago Bulls,2.1,San Antonio Spurs,1.75,1.048,Dabble
Memphis Grizzlies v Dallas Mavericks,Head To Head,Memphis Grizzlies,1.55,Dallas Mavericks,2.5,1.045,Dabble
Minnesota Timberwolves v Los Angeles Clippers,Head To Head,Minnesota Timberwolves,1.68,Los Angeles Clippers,2.2,1.05,Dabble
Sacramento Kings v Miami Heat,Head To Head,Sacramento Kings,1.7,Miami Heat,2.2,1.043,Dabble
