match,home_team,away_team,home_win,away_win,margin,agency
Denver Nuggets v Los Angeles Clippers,Denver Nuggets,Los Angeles Clippers,2,1.8199999999999998,1.05,Neds
Philadelphia 76ers v Washington Wizards,Philadelphia 76ers,Washington Wizards,1.17,5.2,1.05,Neds
New York Knicks v Toronto Raptors,New York Knicks,Toronto Raptors,1.1400000000000001,5.8,1.05,Neds
New Orleans Pelicans v Portland Trail Blazers,New Orleans Pelicans,Portland Trail Blazers,1.8,2.02,1.05,Neds
Cleveland Cavaliers v Oklahoma City Thunder,Cleveland Cavaliers,Oklahoma City Thunder,1.67,2.25,1.04,Neds
Milwaukee Bucks v San Antonio Spurs,Milwaukee Bucks,San Antonio Spurs,1.62,2.35,1.04,Neds
