match,home_team,away_team,home_win,away_win,margin,agency
Dallas Mavericks v New Orleans Pelicans,Dallas Mavericks,New Orleans Pelicans,1.45,2.8,1.05,Neds
Houston Rockets v Minnesota Timberwolves,Houston Rockets,Minnesota Timberwolves,1.6,2.35,1.05,Neds
Toronto Raptors v Miami Heat,Toronto Raptors,Miami Heat,2.25,1.65,1.05,Neds
Washington Wizards v Milwaukee Bucks,Washington Wizards,Milwaukee Bucks,2.65,1.48,1.05,Neds
Los Angeles Lakers v Dallas Mavericks,Los Angeles Lakers,Dallas Mavericks,1.38,3.05,1.05,Neds
Utah Jazz v Oklahoma City Thunder,Utah Jazz,Oklahoma City Thunder,8.5,1.07,1.05,Neds
Cleveland Cavaliers v New York Knicks,Cleveland Cavaliers,New York Knicks,1.32,3.4,1.05,Neds
