match,home_team,away_team,home_win,away_win,margin,agency
Los Angeles Clippers v New York Knicks,Los Angeles Clippers,New York Knicks,1.62,2.35,1.04,Neds
Oklahoma City Thunder v Portland Trail Blazers,Oklahoma City Thunder,Portland Trail Blazers,1.75,2.1,1.05,Neds
Sacramento Kings v San Antonio Spurs,Sacramento Kings,San Antonio Spurs,1.48,2.7,1.05,Neds
Denver Nuggets v Phoenix Suns,Denver Nuggets,Phoenix Suns,1.35,3.3,1.04,Neds
Miami Heat v Minnesota Timberwolves,Miami Heat,Minnesota Timberwolves,2.4,1.5699999999999998,1.05,Neds
Dallas Mavericks v Memphis Grizzlies,Dallas Mavericks,Memphis Grizzlies,4.75,1.19,1.05,Neds
Charlotte Hornets v Cleveland Cavaliers,Charlotte Hornets,Cleveland Cavaliers,9.25,1.06,1.05,Neds
Toronto Raptors v Utah Jazz,Toronto Raptors,Utah Jazz,1.53,2.55,1.05,Neds
