match,home_team,away_team,home_win,away_win,margin,agency
Dallas Mavericks v Portland Trail Blazers,Dallas Mavericks,Portland Trail Blazers,1.3599999999999999,3.2,1.05,Neds
Los Angeles Lakers v Charlotte Hornets,Los Angeles Lakers,Charlotte Hornets,1.24,4.1,1.05,Neds
Memphis Grizzlies v Houston Rockets,Memphis Grizzlies,Houston Rockets,2.25,1.6400000000000001,1.05,Neds
Detroit Pistons v Golden State Warriors,Detroit Pistons,Golden State Warriors,1.67,2.25,1.04,Neds
Cleveland Cavaliers v Toronto Raptors,Cleveland Cavaliers,Toronto Raptors,1.07,8.25,1.06,Neds
Orlando Magic v Minnesota Timberwolves,Orlando Magic,Minnesota Timberwolves,2.4,1.58,1.05,Neds
Phoenix Suns v Atlanta Hawks,Phoenix Suns,Atlanta Hawks,1.6,2.35,1.05,Neds
Utah Jazz v Miami Heat,Utah Jazz,Miami Heat,2.8,1.44,1.05,Neds
