match,home_team,away_team,home_win,away_win,margin,agency
Los Angeles Lakers v Sacramento Kings,Los Angeles Lakers,Sacramento Kings,1.96,1.85,1.05,Neds
Washington Wizards v New York Knicks,Washington Wizards,New York Knicks,6.25,1.12,1.05,Neds
Denver Nuggets v Detroit Pistons,Denver Nuggets,Detroit Pistons,1.42,2.9,1.05,Neds
Utah Jazz v Philadelphia 76ers,Utah Jazz,Philadelphia 76ers,2.95,1.4,1.05,Neds
Portland Trail Blazers v Dallas Mavericks,Portland Trail Blazers,Dallas Mavericks,2.5,1.53,1.05,Neds
