match,home_team,away_team,home_win,away_win,margin,agency
Portland Trail Blazers v Philadelphia 76ers,Portland Trail Blazers,Philadelphia 76ers,3.2,1.3599999999999999,1.05,Neds
Oklahoma City Thunder v Minnesota Timberwolves,Oklahoma City Thunder,Minnesota Timberwolves,1.35,3.25,1.05,Neds
Los Angeles Lakers v Cleveland Cavaliers,Los Angeles Lakers,Cleveland Cavaliers,2.3,1.6400000000000001,1.04,Neds
Phoenix Suns v Memphis Grizzlies,Phoenix Suns,Memphis Grizzlies,1.32,3.5,1.04,Neds
Indiana Pacers v Milwaukee Bucks,Indiana Pacers,Milwaukee Bucks,1.8199999999999998,2,1.05,Neds
Boston Celtics v Toronto Raptors,Boston Celtics,Toronto Raptors,1.03,12,1.05,Neds
San Antonio Spurs v Los Angeles Clippers,San Antonio Spurs,Los Angeles Clippers,1.65,2.25,1.05,Neds
