match,home_team,away_team,home_win,away_win,margin,agency
Denver Nuggets v Los Angeles Clippers,Denver Nuggets,Los Angeles Clippers,1.87,1.95,1.05,Neds
Brooklyn Nets v Detroit Pistons,Brooklyn Nets,Detroit Pistons,3.05,1.38,1.05,Neds
New Orleans Pelicans v Minnesota Timberwolves,New Orleans Pelicans,Minnesota Timberwolves,2.5,1.55,1.05,Neds
Indiana Pacers v Chicago Bulls,Indiana Pacers,Chicago Bulls,1.48,2.65,1.05,Neds
New York Knicks v Toronto Raptors,New York Knicks,Toronto Raptors,1.13,6,1.05,Neds
Cleveland Cavaliers v Oklahoma City Thunder,Cleveland Cavaliers,Oklahoma City Thunder,1.75,2.1,1.05,Neds
Golden State Warriors v Miami Heat,Golden State Warriors,Miami Heat,1.22,4.4,1.05,Neds
Utah Jazz v Atlanta Hawks,Utah Jazz,Atlanta Hawks,2.75,1.45,1.05,Neds
Milwaukee Bucks v San Antonio Spurs,Milwaukee Bucks,San Antonio Spurs,1.45,2.8,1.05,Neds
