match,home_team,away_team,home_win,away_win,margin,agency
Atlanta Hawks v Toronto Raptors,Atlanta Hawks,Toronto Raptors,1.46,2.75,1.05,Neds
Milwaukee Bucks v Miami Heat,Milwaukee Bucks,Miami Heat,1.38,3.1,1.05,Neds
Denver Nuggets v Sacramento Kings,Denver Nuggets,Sacramento Kings,1.32,3.45,1.05,Neds
Los Angeles Lakers v Boston Celtics,Los Angeles Lakers,Boston Celtics,3,1.4,1.05,Neds
Oklahoma City Thunder v Dallas Mavericks,Oklahoma City Thunder,Dallas Mavericks,1.1400000000000001,5.75,1.05,Neds
Golden State Warriors v Chicago Bulls,Golden State Warriors,Chicago Bulls,1.77,2.05,1.05,Neds
