match,home_team,away_team,home_win,away_win,margin,agency
Boston Celtics v Indiana Pacers,Boston Celtics,Indiana Pacers,1.1400000000000001,5.75,1.05,Neds
Los Angeles Lakers v Sacramento Kings,Los Angeles Lakers,Sacramento Kings,2.1,1.75,1.05,Neds
Utah Jazz v Philadelphia 76ers,Utah Jazz,Philadelphia 76ers,3.2,1.3599999999999999,1.05,Neds
Portland Trail Blazers v Dallas Mavericks,Portland Trail Blazers,Dallas Mavericks,2.5,1.55,1.05,Neds
Houston Rockets v Miami Heat,Houston Rockets,Miami Heat,1.35,3.25,1.05,Neds
Minnesota Timberwolves v San Antonio Spurs,Minnesota Timberwolves,San Antonio Spurs,1.35,3.3,1.04,Neds
Toronto Raptors v Atlanta Hawks,Toronto Raptors,Atlanta Hawks,2,1.8199999999999998,1.05,Neds
Orlando Magic v Brooklyn Nets,Orlando Magic,Brooklyn Nets,1.46,2.75,1.05,Neds
