match,home_team,away_team,home_win,away_win,margin,agency
Boston Celtics v Dallas Mavericks,Boston Celtics,Dallas Mavericks,1.13,6.2,1.05,Neds
Minnesota Timberwolves v Houston Rockets,Minnesota Timberwolves,Houston Rockets,1.85,1.96,1.05,Neds
Denver Nuggets v Orlando Magic,Denver Nuggets,Orlando Magic,1.38,3.05,1.05,Neds
Los Angeles Lakers v Dallas Mavericks,Los Angeles Lakers,Dallas Mavericks,1.48,2.65,1.05,Neds
Los Angeles Lakers v Golden State Warriors,Los Angeles Lakers,Golden State Warriors,1.38,3.05,1.05,Neds
