match,home_team,away_team,home_win,away_win,margin,agency
Sacramento Kings v Atlanta Hawks,Sacramento Kings,Atlanta Hawks,1.26,3.8,1.06,Neds
Orlando Magic v Cleveland Cavaliers,Orlando Magic,Cleveland Cavaliers,1.96,1.85,1.05,Neds
Minnesota Timberwolves v Charlotte Hornets,Minnesota Timberwolves,Charlotte Hornets,1.05,10,1.05,Neds
Toronto Raptors v Memphis Grizzlies,Toronto Raptors,Memphis Grizzlies,1.35,3.2,1.05,Neds
Dallas Mavericks v Boston Celtics,Dallas Mavericks,Boston Celtics,2.2,1.6800000000000002,1.05,Neds
Detroit Pistons v Milwaukee Bucks,Detroit Pistons,Milwaukee Bucks,6.2,1.13,1.05,Neds
Phoenix Suns v Chicago Bulls,Phoenix Suns,Chicago Bulls,1.38,3.05,1.05,Neds
Philadelphia 76ers v San Antonio Spurs,Philadelphia 76ers,San Antonio Spurs,1.09,7.25,1.06,Neds
