match,home_team,away_team,home_win,away_win,margin,agency
Oklahoma City Thunder v Sacramento Kings,Oklahoma City Thunder,Sacramento Kings,1.22,4.4,1.05,Neds
Utah Jazz v Orlando Magic,Utah Jazz,Orlando Magic,2.8,1.44,1.05,Neds
Minnesota Timberwolves v Washington Wizards,Minnesota Timberwolves,Washington Wizards,1.05,10.5,1.05,Neds
Charlotte Hornets v Denver Nuggets,Charlotte Hornets,Denver Nuggets,7.75,1.08,1.05,Neds
Portland Trail Blazers v Phoenix Suns,Portland Trail Blazers,Phoenix Suns,2.3,1.6400000000000001,1.04,Neds
San Antonio Spurs v Miami Heat,San Antonio Spurs,Miami Heat,1.88,1.94,1.05,Neds
Indiana Pacers v Atlanta Hawks,Indiana Pacers,Atlanta Hawks,1.32,3.4,1.05,Neds
New York Knicks v Los Angeles Lakers,New York Knicks,Los Angeles Lakers,1.22,4.4,1.05,Neds
