match,home_team,away_team,home_win,away_win,margin,agency
Orlando Magic v Portland Trail Blazers,Orlando Magic,Portland Trail Blazers,1.3599999999999999,3.15,1.05,Neds
Atlanta Hawks v Toronto Raptors,Atlanta Hawks,Toronto Raptors,1.45,2.75,1.05,Neds
Milwaukee Bucks v Miami Heat,Milwaukee Bucks,Miami Heat,1.3599999999999999,3.15,1.05,Neds
Denver Nuggets v Sacramento Kings,Denver Nuggets,Sacramento Kings,1.32,3.45,1.05,Neds
Los Angeles Clippers v Washington Wizards,Los Angeles Clippers,Washington Wizards,1.08,8,1.05,Neds
Los Angeles Lakers v Boston Celtics,Los Angeles Lakers,Boston Celtics,3,1.4,1.05,Neds
Golden State Warriors v Chicago Bulls,Golden State Warriors,Chicago Bulls,1.77,2.05,1.05,Neds
