match,home_team,away_team,home_win,away_win,margin,agency
Denver Nuggets v Los Angeles Clippers,Denver Nuggets,Los Angeles Clippers,1.87,1.95,1.05,Neds
Philadelphia 76ers v Washington Wizards,Philadelphia 76ers,Washington Wizards,1.17,5,1.05,Neds
Brooklyn Nets v Detroit Pistons,Brooklyn Nets,Detroit Pistons,3.25,1.35,1.05,Neds
Indiana Pacers v Chicago Bulls,Indiana Pacers,Chicago Bulls,1.44,2.8,1.05,Neds
New York Knicks v Toronto Raptors,New York Knicks,Toronto Raptors,1.13,6,1.05,Neds
Cleveland Cavaliers v Oklahoma City Thunder,Cleveland Cavaliers,Oklahoma City Thunder,1.75,2.1,1.05,Neds
