match,home_team,away_team,home_win,away_win,margin,agency
Washington Wizards v Phoenix Suns,Washington Wizards,Phoenix Suns,5,1.18,1.05,Neds
Sacramento Kings v Houston Rockets,Sacramento Kings,Houston Rockets,1.65,2.25,1.05,Neds
Oklahoma City Thunder v Cleveland Cavaliers,Oklahoma City Thunder,Cleveland Cavaliers,1.65,2.25,1.05,Neds
Los Angeles Clippers v Brooklyn Nets,Los Angeles Clippers,Brooklyn Nets,1.08,8.25,1.05,Neds
Portland Trail Blazers v Los Angeles Clippers,Portland Trail Blazers,Los Angeles Clippers,2.85,1.42,1.06,Neds
Detroit Pistons v Indiana Pacers,Detroit Pistons,Indiana Pacers,1.75,2.1,1.05,Neds
