match,home_team,away_team,home_win,away_win,margin,agency
Chicago Bulls v San Antonio Spurs,Chicago Bulls,San Antonio Spurs,2.15,1.72,1.05,Neds
Toronto Raptors v Milwaukee Bucks,Toronto Raptors,Milwaukee Bucks,3.45,1.32,1.05,Neds
New York Knicks v Orlando Magic,New York Knicks,Orlando Magic,1.18,5,1.05,Neds
Brooklyn Nets v Indiana Pacers,Brooklyn Nets,Indiana Pacers,3.75,1.28,1.05,Neds
Memphis Grizzlies v Dallas Mavericks,Memphis Grizzlies,Dallas Mavericks,1.5,2.6,1.05,Neds
Minnesota Timberwolves v Los Angeles Clippers,Minnesota Timberwolves,Los Angeles Clippers,1.65,2.25,1.05,Neds
Philadelphia 76ers v Phoenix Suns,Philadelphia 76ers,Phoenix Suns,1.58,2.4,1.05,Neds
Sacramento Kings v Miami Heat,Sacramento Kings,Miami Heat,1.65,2.25,1.05,Neds
Detroit Pistons v Portland Trail Blazers,Detroit Pistons,Portland Trail Blazers,1.3599999999999999,3.2,1.05,Neds
