match,home_team,away_team,home_win,away_win,margin,agency
Memphis Grizzlies v Boston Celtics,Memphis Grizzlies,Boston Celtics,2.65,1.48,1.05,Neds
Los Angeles Lakers v Houston Rockets,Los Angeles Lakers,Houston Rockets,1.5699999999999998,2.45,1.05,Neds
Washington Wizards v Miami Heat,Washington Wizards,Miami Heat,4,1.25,1.05,Neds
Dallas Mavericks v Brooklyn Nets,Dallas Mavericks,Brooklyn Nets,1.24,4.1,1.05,Neds
Oklahoma City Thunder v Chicago Bulls,Oklahoma City Thunder,Chicago Bulls,1.08,8.25,1.05,Neds
Orlando Magic v Los Angeles Clippers,Orlando Magic,Los Angeles Clippers,2.2,1.6800000000000002,1.05,Neds
Charlotte Hornets v Utah Jazz,Charlotte Hornets,Utah Jazz,1.8199999999999998,2,1.05,Neds
Indiana Pacers v Sacramento Kings,Indiana Pacers,Sacramento Kings,1.44,2.8,1.05,Neds
