match,home_team,away_team,home_win,away_win,margin,agency
Portland Trail Blazers v Cleveland Cavaliers,Portland Trail Blazers,Cleveland Cavaliers,3,1.4,1.05,Neds
Phoenix Suns v Boston Celtics,Phoenix Suns,Boston Celtics,2.25,1.65,1.05,Neds
Indiana Pacers v Los Angeles Lakers,Indiana Pacers,Los Angeles Lakers,1.83,1.98,1.05,Neds
Denver Nuggets v Milwaukee Bucks,Denver Nuggets,Milwaukee Bucks,1.6,2.35,1.05,Neds
Sacramento Kings v Oklahoma City Thunder,Sacramento Kings,Oklahoma City Thunder,4.4,1.22,1.05,Neds
New York Knicks v Los Angeles Clippers,New York Knicks,Los Angeles Clippers,2.1,1.75,1.05,Neds
Brooklyn Nets v Toronto Raptors,Brooklyn Nets,Toronto Raptors,1.8,2.02,1.05,Neds
Philadelphia 76ers v Washington Wizards,Philadelphia 76ers,Washington Wizards,1.72,2.15,1.05,Neds
