match,home_team,away_team,home_win,away_win,margin,agency
Charlotte Hornets v Los Angeles Lakers,Charlotte Hornets,Los Angeles Lakers,2.7,1.48,1.05,Neds
Utah Jazz v Milwaukee Bucks,Utah Jazz,Milwaukee Bucks,4.25,1.22,1.05,Neds
Phoenix Suns v Los Angeles Clippers,Phoenix Suns,Los Angeles Clippers,2.15,1.72,1.05,Neds
Miami Heat v Orlando Magic,Miami Heat,Orlando Magic,2.1,1.75,1.05,Neds
New York Knicks v Memphis Grizzlies,New York Knicks,Memphis Grizzlies,1.62,2.3,1.05,Neds
Brooklyn Nets v Sacramento Kings,Brooklyn Nets,Sacramento Kings,6.2,1.13,1.05,Neds
Boston Celtics v Houston Rockets,Boston Celtics,Houston Rockets,1.38,3.1,1.05,Neds
