match,home_team,away_team,home_win,away_win,margin,agency
Sacramento Kings v Dallas Mavericks,Sacramento Kings,Dallas Mavericks,1.3599999999999999,3.15,1.05,Neds
Portland Trail Blazers v Philadelphia 76ers,Portland Trail Blazers,Philadelphia 76ers,3.15,1.3599999999999999,1.05,Neds
Washington Wizards v New York Knicks,Washington Wizards,New York Knicks,6.5,1.12,1.05,Neds
Charlotte Hornets v Chicago Bulls,Charlotte Hornets,Chicago Bulls,2.5,1.55,1.05,Neds
Utah Jazz v Denver Nuggets,Utah Jazz,Denver Nuggets,3.4,1.32,1.05,Neds
