match,home_team,away_team,home_win,away_win,margin,agency
Dallas Mavericks v New Orleans Pelicans,Dallas Mavericks,New Orleans Pelicans,1.42,2.85,1.06,Neds
Houston Rockets v Minnesota Timberwolves,Houston Rockets,Minnesota Timberwolves,1.6,2.35,1.05,Neds
San Antonio Spurs v Detroit Pistons,San Antonio Spurs,Detroit Pistons,2.5,1.53,1.05,Neds
Los Angeles Lakers v Dallas Mavericks,Los Angeles Lakers,Dallas Mavericks,1.38,3.05,1.05,Neds
Utah Jazz v Oklahoma City Thunder,Utah Jazz,Oklahoma City Thunder,8.5,1.07,1.05,Neds
