match,home_team,away_team,home_win,away_win,margin,agency
Washington Wizards v Cleveland Cavaliers,Washington Wizards,Cleveland Cavaliers,9.5,1.06,1.05,Neds
Brooklyn Nets v Miami Heat,Brooklyn Nets,Miami Heat,3.3,1.33,1.05,Neds
Minnesota Timberwolves v Houston Rockets,Minnesota Timberwolves,Houston Rockets,1.85,1.96,1.05,Neds
Detroit Pistons v Philadelphia 76ers,Detroit Pistons,Philadelphia 76ers,2.05,1.78,1.05,Neds
Denver Nuggets v Orlando Magic,Denver Nuggets,Orlando Magic,1.38,3.1,1.05,Neds
Los Angeles Lakers v Dallas Mavericks,Los Angeles Lakers,Dallas Mavericks,1.48,2.65,1.05,Neds
Los Angeles Clippers v Indiana Pacers,Los Angeles Clippers,Indiana Pacers,1.48,2.7,1.05,Neds
Los Angeles Lakers v Golden State Warriors,Los Angeles Lakers,Golden State Warriors,1.38,3.05,1.05,Neds
