match,home_team,away_team,home_win,away_win,margin,agency
New York Knicks v Golden State Warriors,New York Knicks,Golden State Warriors,1.5699999999999998,2.45,1.05,Neds
Orlando Magic v Toronto Raptors,Orlando Magic,Toronto Raptors,1.35,3.3,1.04,Neds
Utah Jazz v Detroit Pistons,Utah Jazz,Detroit Pistons,5,1.17,1.05,Neds
Chicago Bulls v Cleveland Cavaliers,Chicago Bulls,Cleveland Cavaliers,5.5,1.15,1.05,Neds
Atlanta Hawks v Milwaukee Bucks,Atlanta Hawks,Milwaukee Bucks,2.7,1.48,1.05,Neds
Miami Heat v Washington Wizards,Miami Heat,Washington Wizards,1.26,3.8,1.06,Neds
Oklahoma City Thunder v Houston Rockets,Oklahoma City Thunder,Houston Rockets,1.17,5.2,1.05,Neds
