match,home_team,away_team,home_win,away_win,margin,agency
Denver Nuggets v San Antonio Spurs,Denver Nuggets,San Antonio Spurs,1.33,3.4,1.05,Neds
Los Angeles Lakers v Portland Trail Blazers,Los Angeles Lakers,Portland Trail Blazers,1.3599999999999999,3.2,1.05,Neds
Detroit Pistons v Charlotte Hornets,Detroit Pistons,Charlotte Hornets,1.48,2.65,1.05,Neds
Toronto Raptors v Orlando Magic,Toronto Raptors,Orlando Magic,2,1.8199999999999998,1.05,Neds
New Orleans Pelicans v Washington Wizards,New Orleans Pelicans,Washington Wizards,1.4,3,1.05,Neds
Golden State Warriors v Philadelphia 76ers,Golden State Warriors,Philadelphia 76ers,1.58,2.4,1.05,Neds
Sacramento Kings v Memphis Grizzlies,Sacramento Kings,Memphis Grizzlies,1.55,2.5,1.05,Neds
