match,home_team,away_team,home_win,away_win,margin,agency
Charlotte Hornets v Atlanta Hawks,Charlotte Hornets,Atlanta Hawks,3.05,1.38,1.05,Neds
Boston Celtics v Brooklyn Nets,Boston Celtics,Brooklyn Nets,1.11,6.6,1.05,Neds
Golden State Warriors v Milwaukee Bucks,Golden State Warriors,Milwaukee Bucks,1.65,2.25,1.05,Neds
Los Angeles Lakers v San Antonio Spurs,Los Angeles Lakers,San Antonio Spurs,1.22,4.25,1.05,Neds
Los Angeles Clippers v Cleveland Cavaliers,Los Angeles Clippers,Cleveland Cavaliers,2.25,1.65,1.05,Neds
