match,home_team,away_team,home_win,away_win,margin,agency
Utah Jazz v Memphis Grizzlies,Utah Jazz,Memphis Grizzlies,4.5,1.2,1.06,Neds
Sacramento Kings v Boston Celtics,Sacramento Kings,Boston Celtics,2.7,1.48,1.05,Neds
Houston Rockets v Atlanta Hawks,Houston Rockets,Atlanta Hawks,1.3,3.6,1.05,Neds
Phoenix Suns v Milwaukee Bucks,Phoenix Suns,Milwaukee Bucks,1.65,2.25,1.05,Neds
Charlotte Hornets v Orlando Magic,Charlotte Hornets,Orlando Magic,2.7,1.48,1.05,Neds
New York Knicks v Dallas Mavericks,New York Knicks,Dallas Mavericks,1.32,3.45,1.05,Neds
Sacramento Kings v Oklahoma City Thunder,Sacramento Kings,Oklahoma City Thunder,4,1.25,1.05,Neds
Detroit Pistons v San Antonio Spurs,Detroit Pistons,San Antonio Spurs,1.26,3.8,1.06,Neds
