match,home_team,away_team,home_win,away_win,margin,agency
Milwaukee Bucks v Miami Heat,Milwaukee Bucks,Miami Heat,1.48,2.65,1.05,Neds
Portland Trail Blazers v Charlotte Hornets,Portland Trail Blazers,Charlotte Hornets,1.48,2.7,1.05,Neds
Golden State Warriors v Dallas Mavericks,Golden State Warriors,Dallas Mavericks,1.3,3.6,1.05,Neds
Orlando Magic v Washington Wizards,Orlando Magic,Washington Wizards,1.13,6,1.05,Neds
Cleveland Cavaliers v Memphis Grizzlies,Cleveland Cavaliers,Memphis Grizzlies,1.42,2.9,1.05,Neds
Utah Jazz v Houston Rockets,Utah Jazz,Houston Rockets,3.9,1.26,1.05,Neds
Los Angeles Lakers v Dallas Mavericks,Los Angeles Lakers,Dallas Mavericks,1.38,3.1,1.05,Neds
Boston Celtics v New York Knicks,Boston Celtics,New York Knicks,1.3,3.6,1.05,Neds
Denver Nuggets v Los Angeles Lakers,Denver Nuggets,Los Angeles Lakers,1.38,3.05,1.05,Neds
