match,home_team,away_team,home_win,away_win,margin,agency
Brooklyn Nets v Dallas Mavericks,Brooklyn Nets,Dallas Mavericks,1.95,1.87,1.05,Neds
Denver Nuggets v Chicago Bulls,Denver Nuggets,Chicago Bulls,1.5699999999999998,2.45,1.05,Neds
Sacramento Kings v Boston Celtics,Sacramento Kings,Boston Celtics,2.45,1.5699999999999998,1.05,Neds
Los Angeles Clippers v Oklahoma City Thunder,Los Angeles Clippers,Oklahoma City Thunder,2.1,1.75,1.05,Neds
Washington Wizards v Toronto Raptors,Washington Wizards,Toronto Raptors,2.25,1.67,1.04,Neds
Orlando Magic v Los Angeles Lakers,Orlando Magic,Los Angeles Lakers,2.45,1.5699999999999998,1.05,Neds
Indiana Pacers v Minnesota Timberwolves,Indiana Pacers,Minnesota Timberwolves,1.87,1.95,1.05,Neds
New Orleans Pelicans v Philadelphia 76ers,New Orleans Pelicans,Philadelphia 76ers,1.48,2.7,1.05,Neds
