match,home_team,away_team,home_win,away_win,margin,agency
Milwaukee Bucks v Cleveland Cavaliers,Milwaukee Bucks,Cleveland Cavaliers,1.3599999999999999,3.15,1.05,Neds
Washington Wizards v Minnesota Timberwolves,Washington Wizards,Minnesota Timberwolves,5.6,1.15,1.05,Neds
Golden State Warriors v Atlanta Hawks,Golden State Warriors,Atlanta Hawks,1.38,3.1,1.05,Neds
Houston Rockets v Portland Trail Blazers,Houston Rockets,Portland Trail Blazers,1.18,5,1.05,Neds
Miami Heat v Memphis Grizzlies,Miami Heat,Memphis Grizzlies,1.16,5.2,1.05,Neds
Dallas Mavericks v Phoenix Suns,Dallas Mavericks,Phoenix Suns,2.1,1.75,1.05,Neds
San Antonio Spurs v Oklahoma City Thunder,San Antonio Spurs,Oklahoma City Thunder,3.7,1.28,1.05,Neds
Detroit Pistons v Charlotte Hornets,Detroit Pistons,Charlotte Hornets,1.6400000000000001,2.25,1.05,Neds
