match,home_team,away_team,home_win,away_win,margin,agency
Los Angeles Lakers v New York Knicks,Los Angeles Lakers,New York Knicks,1.7,2.15,1.05,Neds
Los Angeles Clippers v New York Knicks,Los Angeles Clippers,New York Knicks,1.6,2.35,1.05,Neds
New Orleans Pelicans v Houston Rockets,New Orleans Pelicans,Houston Rockets,2.35,1.6,1.05,Neds
Miami Heat v Minnesota Timberwolves,Miami Heat,Minnesota Timberwolves,2.5,1.53,1.05,Neds
Dallas Mavericks v Memphis Grizzlies,Dallas Mavericks,Memphis Grizzlies,4.1,1.24,1.05,Neds
Boston Celtics v Philadelphia 76ers,Boston Celtics,Philadelphia 76ers,1.1,7.25,1.05,Neds
Charlotte Hornets v Cleveland Cavaliers,Charlotte Hornets,Cleveland Cavaliers,8.5,1.07,1.05,Neds
Toronto Raptors v Utah Jazz,Toronto Raptors,Utah Jazz,1.5,2.6,1.05,Neds
