match,home_team,away_team,home_win,away_win,margin,agency
Toronto Raptors v San Antonio Spurs,Toronto Raptors,San Antonio Spurs,1.87,1.95,1.05,Neds
Miami Heat v Charlotte Hornets,Miami Heat,Charlotte Hornets,1.6400000000000001,2.3,1.04,Neds
Portland Trail Blazers v Boston Celtics,Portland Trail Blazers,Boston Celtics,4.25,1.22,1.05,Neds
Detroit Pistons v New Orleans Pelicans,Detroit Pistons,New Orleans Pelicans,1.22,4.4,1.05,Neds
Los Angeles Lakers v Chicago Bulls,Los Angeles Lakers,Chicago Bulls,1.22,4.4,1.05,Neds
Utah Jazz v Cleveland Cavaliers,Utah Jazz,Cleveland Cavaliers,7.75,1.09,1.05,Neds
Atlanta Hawks v Philadelphia 76ers,Atlanta Hawks,Philadelphia 76ers,1.15,5.5,1.05,Neds
