match,home_team,away_team,home_win,away_win,margin,agency
Detroit Pistons v Charlotte Hornets,Detroit Pistons,Charlotte Hornets,1.2,4.5,1.06,Neds
Los Angeles Clippers v Utah Jazz,Los Angeles Clippers,Utah Jazz,1.05,10,1.05,Neds
Chicago Bulls v Golden State Warriors,Chicago Bulls,Golden State Warriors,2.8,1.44,1.05,Neds
Memphis Grizzlies v Oklahoma City Thunder,Memphis Grizzlies,Oklahoma City Thunder,2.05,1.78,1.05,Neds
Los Angeles Lakers v Dallas Mavericks,Los Angeles Lakers,Dallas Mavericks,1.55,2.5,1.05,Neds
Orlando Magic v San Antonio Spurs,Orlando Magic,San Antonio Spurs,1.6800000000000002,2.2,1.05,Neds
Phoenix Suns v Denver Nuggets,Phoenix Suns,Denver Nuggets,2.6,1.5,1.05,Neds
Minnesota Timberwolves v Portland Trail Blazers,Minnesota Timberwolves,Portland Trail Blazers,1.42,2.9,1.05,Neds
Washington Wizards v Atlanta Hawks,Washington Wizards,Atlanta Hawks,3.3,1.35,1.04,Neds
