match,home_team,away_team,home_win,away_win,margin,agency
Memphis Grizzlies v Oklahoma City Thunder,Memphis Grizzlies,Oklahoma City Thunder,3.5,1.3,1.05,Neds
Boston Celtics v Portland Trail Blazers,Boston Celtics,Portland Trail Blazers,1.22,4.25,1.05,Neds
Denver Nuggets v Sacramento Kings,Denver Nuggets,Sacramento Kings,1.42,2.9,1.05,Neds
Charlotte Hornets v Minnesota Timberwolves,Charlotte Hornets,Minnesota Timberwolves,3.7,1.28,1.05,Neds
Milwaukee Bucks v Dallas Mavericks,Milwaukee Bucks,Dallas Mavericks,1.18,5,1.05,Neds
Cleveland Cavaliers v Miami Heat,Cleveland Cavaliers,Miami Heat,1.1400000000000001,5.8,1.05,Neds
