match,home_team,away_team,home_win,away_win,margin,agency
Miami Heat v Chicago Bulls,Miami Heat,Chicago Bulls,1.5699999999999998,2.45,1.05,Neds
Houston Rockets v New Orleans Pelicans,Houston Rockets,New Orleans Pelicans,1.32,3.45,1.05,Neds
Atlanta Hawks v Indiana Pacers,Atlanta Hawks,Indiana Pacers,2.02,1.8,1.05,Neds
Toronto Raptors v Washington Wizards,Toronto Raptors,Washington Wizards,1.48,2.7,1.05,Neds
Golden State Warriors v Detroit Pistons,Golden State Warriors,Detroit Pistons,1.42,2.9,1.05,Neds
Milwaukee Bucks v Orlando Magic,Milwaukee Bucks,Orlando Magic,1.33,3.35,1.05,Neds
Boston Celtics v Los Angeles Lakers,Boston Celtics,Los Angeles Lakers,1.3599999999999999,3.15,1.05,Neds
Charlotte Hornets v Brooklyn Nets,Charlotte Hornets,Brooklyn Nets,2.4,1.58,1.05,Neds
