match,home_team,away_team,home_win,away_win,margin,agency
Detroit Pistons v Washington Wizards,Detroit Pistons,Washington Wizards,1.08,7.75,1.05,Neds
Indiana Pacers v Milwaukee Bucks,Indiana Pacers,Milwaukee Bucks,1.98,1.83,1.05,Neds
Cleveland Cavaliers v Brooklyn Nets,Cleveland Cavaliers,Brooklyn Nets,1.08,7.75,1.05,Neds
San Antonio Spurs v Dallas Mavericks,San Antonio Spurs,Dallas Mavericks,1.44,2.85,1.05,Neds
Boston Celtics v Oklahoma City Thunder,Boston Celtics,Oklahoma City Thunder,1.53,2.5,1.05,Neds
