match,home_team,away_team,home_win,away_win,margin,agency
San Antonio Spurs v New York Knicks,San Antonio Spurs,New York Knicks,3.9,1.26,1.05,Neds
Orlando Magic v Houston Rockets,Orlando Magic,Houston Rockets,2.15,1.72,1.05,Neds
Indiana Pacers v Dallas Mavericks,Indiana Pacers,Dallas Mavericks,1.18,4.8,1.06,Neds
Los Angeles Lakers v Denver Nuggets,Los Angeles Lakers,Denver Nuggets,2.1,1.75,1.05,Neds
Oklahoma City Thunder v Philadelphia 76ers,Oklahoma City Thunder,Philadelphia 76ers,1.1400000000000001,5.75,1.05,Neds
Minnesota Timberwolves v New Orleans Pelicans,Minnesota Timberwolves,New Orleans Pelicans,1.12,6.5,1.05,Neds
