match,home_team,away_team,home_win,away_win,margin,agency
Los Angeles Lakers v New York Knicks,Los Angeles Lakers,New York Knicks,1.6800000000000002,2.2,1.05,Neds
Memphis Grizzlies v Oklahoma City Thunder,Memphis Grizzlies,Oklahoma City Thunder,3.3,1.33,1.05,Neds
Brooklyn Nets v Golden State Warriors,Brooklyn Nets,Golden State Warriors,4.5,1.2,1.06,Neds
New Orleans Pelicans v Houston Rockets,New Orleans Pelicans,Houston Rockets,2.8,1.44,1.05,Neds
Atlanta Hawks v Indiana Pacers,Atlanta Hawks,Indiana Pacers,2.1,1.73,1.05,Neds
Orlando Magic v Chicago Bulls,Orlando Magic,Chicago Bulls,1.35,3.25,1.05,Neds
Boston Celtics v Philadelphia 76ers,Boston Celtics,Philadelphia 76ers,1.12,6.25,1.05,Neds
