match,home_team,away_team,home_win,away_win,margin,agency
Orlando Magic v Sacramento Kings,Orlando Magic,Sacramento Kings,1.9,1.9,1.05,Neds
Washington Wizards v Brooklyn Nets,Washington Wizards,Brooklyn Nets,2.02,1.8,1.05,Neds
Denver Nuggets v Utah Jazz,Denver Nuggets,Utah Jazz,1.03,12.5,1.05,Neds
Philadelphia 76ers v Miami Heat,Philadelphia 76ers,Miami Heat,3.4,1.32,1.05,Neds
Memphis Grizzlies v Los Angeles Lakers,Memphis Grizzlies,Los Angeles Lakers,1.9,1.9,1.05,Neds
Detroit Pistons v Cleveland Cavaliers,Detroit Pistons,Cleveland Cavaliers,3.15,1.3599999999999999,1.05,Neds
Oklahoma City Thunder v Indiana Pacers,Oklahoma City Thunder,Indiana Pacers,1.22,4.25,1.05,Neds
