match,home_team,away_team,home_win,away_win,margin,agency
Toronto Raptors v San Antonio Spurs,Toronto Raptors,San Antonio Spurs,1.78,2.05,1.05,Neds
Miami Heat v Charlotte Hornets,Miami Heat,Charlotte Hornets,1.5,2.6,1.05,Neds
Portland Trail Blazers v Boston Celtics,Portland Trail Blazers,Boston Celtics,3.4,1.32,1.05,Neds
Detroit Pistons v New Orleans Pelicans,Detroit Pistons,New Orleans Pelicans,1.1,7,1.05,Neds
Los Angeles Clippers v Oklahoma City Thunder,Los Angeles Clippers,Oklahoma City Thunder,2.25,1.6400000000000001,1.05,Neds
Houston Rockets v Denver Nuggets,Houston Rockets,Denver Nuggets,1.35,3.25,1.05,Neds
Utah Jazz v Cleveland Cavaliers,Utah Jazz,Cleveland Cavaliers,9.75,1.05,1.05,Neds
Atlanta Hawks v Philadelphia 76ers,Atlanta Hawks,Philadelphia 76ers,1.22,4.5,1.04,Neds
