match,home_team,away_team,home_win,away_win,margin,agency
Denver Nuggets v Charlotte Hornets,Denver Nuggets,Charlotte Hornets,1.04,11,1.05,Neds
Milwaukee Bucks v Los Angeles Clippers,Milwaukee Bucks,Los Angeles Clippers,1.8199999999999998,2,1.05,Neds
Dallas Mavericks v New Orleans Pelicans,Dallas Mavericks,New Orleans Pelicans,1.48,2.7,1.05,Neds
Toronto Raptors v Miami Heat,Toronto Raptors,Miami Heat,2.25,1.67,1.04,Neds
Brooklyn Nets v Cleveland Cavaliers,Brooklyn Nets,Cleveland Cavaliers,6.6,1.11,1.05,Neds
Los Angeles Lakers v Dallas Mavericks,Los Angeles Lakers,Dallas Mavericks,1.38,3.05,1.05,Neds
New York Knicks v Chicago Bulls,New York Knicks,Chicago Bulls,1.16,5.4,1.05,Neds
Portland Trail Blazers v Los Angeles Lakers,Portland Trail Blazers,Los Angeles Lakers,2,1.8199999999999998,1.05,Neds
