match,home_team,away_team,home_win,away_win,margin,agency
Sacramento Kings v Golden State Warriors,Sacramento Kings,Golden State Warriors,2.1,1.75,1.05,Neds
Portland Trail Blazers v Charlotte Hornets,Portland Trail Blazers,Charlotte Hornets,1.48,2.7,1.05,Neds
Utah Jazz v Houston Rockets,Utah Jazz,Houston Rockets,3.6,1.3,1.05,Neds
Los Angeles Lakers v Dallas Mavericks,Los Angeles Lakers,Dallas Mavericks,1.38,3.05,1.05,Neds
Utah Jazz v Oklahoma City Thunder,Utah Jazz,Oklahoma City Thunder,8.75,1.07,1.05,Neds
Philadelphia 76ers v Brooklyn Nets,Philadelphia 76ers,Brooklyn Nets,1.22,4.25,1.05,Neds
Chicago Bulls v Phoenix Suns,Chicago Bulls,Phoenix Suns,2.4,1.5699999999999998,1.05,Neds
Denver Nuggets v Los Angeles Lakers,Denver Nuggets,Los Angeles Lakers,1.4,3,1.05,Neds
