match,home_team,away_team,home_win,away_win,margin,agency
Memphis Grizzlies v Oklahoma City Thunder,Memphis Grizzlies,Oklahoma City Thunder,3.6,1.3,1.05,Neds
Boston Celtics v Portland Trail Blazers,Boston Celtics,Portland Trail Blazers,1.26,3.9,1.05,Neds
Brooklyn Nets v Golden State Warriors,Brooklyn Nets,Golden State Warriors,4.5,1.2,1.06,Neds
Washington Wizards v Utah Jazz,Washington Wizards,Utah Jazz,1.5,2.6,1.05,Neds
Denver Nuggets v Sacramento Kings,Denver Nuggets,Sacramento Kings,1.4,3,1.05,Neds
Charlotte Hornets v Minnesota Timberwolves,Charlotte Hornets,Minnesota Timberwolves,3.75,1.28,1.05,Neds
Milwaukee Bucks v Dallas Mavericks,Milwaukee Bucks,Dallas Mavericks,1.17,5,1.05,Neds
