match,home_team,away_team,home_win,away_win,margin,agency
Golden State Warriors v Toronto Raptors,Golden State Warriors,Toronto Raptors,1.75,2.1,1.05,Neds
Orlando Magic v Atlanta Hawks,Orlando Magic,Atlanta Hawks,2.1,1.75,1.05,Neds
Denver Nuggets v Detroit Pistons,Denver Nuggets,Detroit Pistons,1.05,10.5,1.05,Neds
Sacramento Kings v New Orleans Pelicans,Sacramento Kings,New Orleans Pelicans,1.52,2.55,1.05,Neds
Phoenix Suns v Memphis Grizzlies,Phoenix Suns,Memphis Grizzlies,1.52,2.55,1.05,Neds
Dallas Mavericks v Minnesota Timberwolves,Dallas Mavericks,Minnesota Timberwolves,2.25,1.6400000000000001,1.05,Neds
Los Angeles Lakers v Los Angeles Clippers,Los Angeles Lakers,Los Angeles Clippers,2.85,1.44,1.05,Neds
