match,home_team,away_team,home_win,away_win,margin,agency
Denver Nuggets v Los Angeles Clippers,Denver Nuggets,Los Angeles Clippers,2,1.8199999999999998,1.05,Neds
Philadelphia 76ers v Washington Wizards,Philadelphia 76ers,Washington Wizards,1.16,5.25,1.05,Neds
Indiana Pacers v Chicago Bulls,Indiana Pacers,Chicago Bulls,1.44,2.85,1.05,Neds
New York Knicks v Toronto Raptors,New York Knicks,Toronto Raptors,1.13,6,1.05,Neds
New Orleans Pelicans v Portland Trail Blazers,New Orleans Pelicans,Portland Trail Blazers,1.8,2.02,1.05,Neds
Cleveland Cavaliers v Oklahoma City Thunder,Cleveland Cavaliers,Oklahoma City Thunder,1.7,2.2,1.04,Neds
