match,home_team,away_team,home_win,away_win,margin,agency
Oklahoma City Thunder v Utah Jazz,Oklahoma City Thunder,Utah Jazz,1.05,10,1.05,Neds
Los Angeles Clippers v Boston Celtics,Los Angeles Clippers,Boston Celtics,5,1.17,1.05,Neds
Brooklyn Nets v Phoenix Suns,Brooklyn Nets,Phoenix Suns,6.5,1.11,1.05,Neds
Houston Rockets v Cleveland Cavaliers,Houston Rockets,Cleveland Cavaliers,2.1,1.73,1.05,Neds
Indiana Pacers v San Antonio Spurs,Indiana Pacers,San Antonio Spurs,1.6400000000000001,2.3,1.04,Neds
Dallas Mavericks v Minnesota Timberwolves,Dallas Mavericks,Minnesota Timberwolves,2.55,1.52,1.05,Neds
