match,home_team,away_team,home_win,away_win,margin,agency
Golden State Warriors v Phoenix Suns,Golden State Warriors,Phoenix Suns,1.4,2.95,1.05,Neds
Los Angeles Lakers v Sacramento Kings,Los Angeles Lakers,Sacramento Kings,1.96,1.85,1.05,Neds
Washington Wizards v New York Knicks,Washington Wizards,New York Knicks,7.25,1.1,1.05,Neds
Utah Jazz v Philadelphia 76ers,Utah Jazz,Philadelphia 76ers,2.95,1.4,1.05,Neds
Portland Trail Blazers v Dallas Mavericks,Portland Trail Blazers,Dallas Mavericks,2.45,1.55,1.05,Neds
Chicago Bulls v Milwaukee Bucks,Chicago Bulls,Milwaukee Bucks,2.15,1.72,1.05,Neds
