match,home_team,away_team,home_win,away_win,margin,agency
Miami Heat v Portland Trail Blazers,Miami Heat,Portland Trail Blazers,1.15,5.6,1.05,Neds
Denver Nuggets v Philadelphia 76ers,Denver Nuggets,Philadelphia 76ers,1.11,6.8,1.05,Neds
Los Angeles Clippers v Chicago Bulls,Los Angeles Clippers,Chicago Bulls,1.42,2.95,1.04,Neds
Brooklyn Nets v New York Knicks,Brooklyn Nets,New York Knicks,5,1.17,1.05,Neds
Los Angeles Lakers v Washington Wizards,Los Angeles Lakers,Washington Wizards,1.1,7.25,1.05,Neds
