match,home_team,away_team,home_win,away_win,margin,agency
San Antonio Spurs v Milwaukee Bucks,San Antonio Spurs,Milwaukee Bucks,2.05,1.77,1.05,Neds
Charlotte Hornets v Denver Nuggets,Charlotte Hornets,Denver Nuggets,8,1.08,1.05,Neds
Golden State Warriors v Phoenix Suns,Golden State Warriors,Phoenix Suns,1.95,1.87,1.05,Neds
New Orleans Pelicans v Boston Celtics,New Orleans Pelicans,Boston Celtics,5.5,1.15,1.05,Neds
Philadelphia 76ers v Denver Nuggets,Philadelphia 76ers,Denver Nuggets,4.1,1.24,1.05,Neds
Toronto Raptors v Chicago Bulls,Toronto Raptors,Chicago Bulls,1.58,2.4,1.05,Neds
Detroit Pistons v Dallas Mavericks,Detroit Pistons,Dallas Mavericks,1.96,1.85,1.05,Neds
