match,home_team,away_team,home_win,away_win,margin,agency
New York Knicks v Portland Trail Blazers,New York Knicks,Portland Trail Blazers,1.12,6.25,1.05,Neds
Detroit Pistons v Sacramento Kings,Detroit Pistons,Sacramento Kings,5.25,1.16,1.05,Neds
Dallas Mavericks v Memphis Grizzlies,Dallas Mavericks,Memphis Grizzlies,1.26,3.9,1.05,Neds
Los Angeles Lakers v Toronto Raptors,Los Angeles Lakers,Toronto Raptors,1.53,2.55,1.05,Neds
Orlando Magic v Minnesota Timberwolves,Orlando Magic,Minnesota Timberwolves,2.7,1.46,1.06,Neds
