match,home_team,away_team,home_win,away_win,margin,agency
New York Knicks v Golden State Warriors,New York Knicks,Golden State Warriors,1.77,2.05,1.05,Neds
Orlando Magic v Toronto Raptors,Orlando Magic,Toronto Raptors,1.33,3.35,1.05,Neds
Chicago Bulls v Cleveland Cavaliers,Chicago Bulls,Cleveland Cavaliers,6.4,1.12,1.05,Neds
Boston Celtics v Portland Trail Blazers,Boston Celtics,Portland Trail Blazers,1.19,4.75,1.05,Neds
Los Angeles Lakers v New Orleans Pelicans,Los Angeles Lakers,New Orleans Pelicans,1.24,4.1,1.05,Neds
Phoenix Suns v Los Angeles Clippers,Phoenix Suns,Los Angeles Clippers,2.25,1.65,1.05,Neds
Atlanta Hawks v Milwaukee Bucks,Atlanta Hawks,Milwaukee Bucks,2.85,1.42,1.06,Neds
Minnesota Timberwolves v Philadelphia 76ers,Minnesota Timberwolves,Philadelphia 76ers,1.1,7,1.05,Neds
Cleveland Cavaliers v Miami Heat,Cleveland Cavaliers,Miami Heat,1.19,4.75,1.05,Neds
