match,home_team,away_team,home_win,away_win,margin,agency
Los Angeles Lakers v New York Knicks,Los Angeles Lakers,New York Knicks,1.67,2.2,1.05,Neds
Los Angeles Clippers v New York Knicks,Los Angeles Clippers,New York Knicks,1.6,2.35,1.05,Neds
Oklahoma City Thunder v Portland Trail Blazers,Oklahoma City Thunder,Portland Trail Blazers,1.7,2.2,1.04,Neds
Denver Nuggets v Phoenix Suns,Denver Nuggets,Phoenix Suns,1.33,3.35,1.05,Neds
Miami Heat v Minnesota Timberwolves,Miami Heat,Minnesota Timberwolves,2.45,1.5699999999999998,1.05,Neds
Dallas Mavericks v Memphis Grizzlies,Dallas Mavericks,Memphis Grizzlies,4.5,1.2,1.06,Neds
Charlotte Hornets v Cleveland Cavaliers,Charlotte Hornets,Cleveland Cavaliers,8.75,1.07,1.05,Neds
Toronto Raptors v Utah Jazz,Toronto Raptors,Utah Jazz,1.52,2.6,1.04,Neds
