match,home_team,away_team,home_win,away_win,margin,agency
Milwaukee Bucks v Cleveland Cavaliers,Milwaukee Bucks,Cleveland Cavaliers,3.3,1.33,1.05,Neds
Minnesota Timberwolves v San Antonio Spurs,Minnesota Timberwolves,San Antonio Spurs,1.16,5.25,1.05,Neds
New Orleans Pelicans v Memphis Grizzlies,New Orleans Pelicans,Memphis Grizzlies,4.75,1.19,1.05,Neds
Portland Trail Blazers v Detroit Pistons,Portland Trail Blazers,Detroit Pistons,2.25,1.65,1.05,Neds
Los Angeles Clippers v Sacramento Kings,Los Angeles Clippers,Sacramento Kings,1.42,2.85,1.06,Neds
