match,home_team,away_team,home_win,away_win,margin,agency
Boston Celtics v Dallas Mavericks,Boston Celtics,Dallas Mavericks,1.18,4.8,1.06,Neds
Minnesota Timberwolves v Houston Rockets,Minnesota Timberwolves,Houston Rockets,1.87,1.95,1.05,Neds
Denver Nuggets v Orlando Magic,Denver Nuggets,Orlando Magic,1.22,4.4,1.05,Neds
Los Angeles Lakers v Dallas Mavericks,Los Angeles Lakers,Dallas Mavericks,1.5,2.6,1.05,Neds
Los Angeles Clippers v Indiana Pacers,Los Angeles Clippers,Indiana Pacers,1.58,2.4,1.05,Neds
Los Angeles Lakers v Golden State Warriors,Los Angeles Lakers,Golden State Warriors,1.3599999999999999,3.15,1.05,Neds
Portland Trail Blazers v Sacramento Kings,Portland Trail Blazers,Sacramento Kings,2.1,1.75,1.05,Neds
