match,home_team,away_team,home_win,away_win,margin,agency
Dallas Mavericks v Cleveland Cavaliers,Dallas Mavericks,Cleveland Cavaliers,3.25,1.35,1.05,Neds
Oklahoma City Thunder v New York Knicks,Oklahoma City Thunder,New York Knicks,1.5,2.6,1.05,Neds
Houston Rockets v Boston Celtics,Houston Rockets,Boston Celtics,2.05,1.78,1.05,Neds
Detroit Pistons v Charlotte Hornets,Detroit Pistons,Charlotte Hornets,1.3599999999999999,3.15,1.05,Neds
Toronto Raptors v Orlando Magic,Toronto Raptors,Orlando Magic,2.02,1.8,1.05,Neds
Los Angeles Lakers v Atlanta Hawks,Los Angeles Lakers,Atlanta Hawks,1.67,2.2,1.05,Neds
Sacramento Kings v Memphis Grizzlies,Sacramento Kings,Memphis Grizzlies,1.6800000000000002,2.2,1.05,Neds
