match,home_team,away_team,home_win,away_win,margin,agency
Phoenix Suns v Boston Celtics,Phoenix Suns,Boston Celtics,2.25,1.65,1.05,Neds
Indiana Pacers v Los Angeles Lakers,Indiana Pacers,Los Angeles Lakers,1.87,1.95,1.05,Neds
Denver Nuggets v Milwaukee Bucks,Denver Nuggets,Milwaukee Bucks,1.5699999999999998,2.4,1.05,Neds
New York Knicks v Los Angeles Clippers,New York Knicks,Los Angeles Clippers,2.1,1.73,1.05,Neds
Brooklyn Nets v Toronto Raptors,Brooklyn Nets,Toronto Raptors,1.8199999999999998,2,1.05,Neds
Philadelphia 76ers v Washington Wizards,Philadelphia 76ers,Washington Wizards,1.7,2.2,1.04,Neds
