match,home_team,away_team,home_win,away_win,margin,agency
Sacramento Kings v Cleveland Cavaliers,Sacramento Kings,Cleveland Cavaliers,2.6,1.5,1.05,Neds
Utah Jazz v Washington Wizards,Utah Jazz,Washington Wizards,1.7,2.2,1.04,Neds
Orlando Magic v Houston Rockets,Orlando Magic,Houston Rockets,2.15,1.72,1.05,Neds
Indiana Pacers v Dallas Mavericks,Indiana Pacers,Dallas Mavericks,1.18,5,1.05,Neds
Los Angeles Lakers v Denver Nuggets,Los Angeles Lakers,Denver Nuggets,2.1,1.73,1.05,Neds
Oklahoma City Thunder v Philadelphia 76ers,Oklahoma City Thunder,Philadelphia 76ers,1.1400000000000001,5.75,1.05,Neds
Minnesota Timberwolves v New Orleans Pelicans,Minnesota Timberwolves,New Orleans Pelicans,1.11,6.6,1.05,Neds
Miami Heat v Detroit Pistons,Miami Heat,Detroit Pistons,2.55,1.52,1.05,Neds
