match,home_team,away_team,home_win,away_win,margin,agency
Milwaukee Bucks v Cleveland Cavaliers,Milwaukee Bucks,Cleveland Cavaliers,3.4,1.32,1.05,Neds
Philadelphia 76ers v Utah Jazz,Philadelphia 76ers,Utah Jazz,1.35,3.3,1.04,Neds
Dallas Mavericks v Phoenix Suns,Dallas Mavericks,Phoenix Suns,3.3,1.33,1.05,Neds
Oklahoma City Thunder v Denver Nuggets,Oklahoma City Thunder,Denver Nuggets,1.3599999999999999,3.2,1.05,Neds
Minnesota Timberwolves v San Antonio Spurs,Minnesota Timberwolves,San Antonio Spurs,1.2,4.6,1.05,Neds
New Orleans Pelicans v Memphis Grizzlies,New Orleans Pelicans,Memphis Grizzlies,4,1.25,1.05,Neds
Portland Trail Blazers v Detroit Pistons,Portland Trail Blazers,Detroit Pistons,2.2,1.7,1.04,Neds
Los Angeles Clippers v Sacramento Kings,Los Angeles Clippers,Sacramento Kings,1.5,2.65,1.04,Neds
