match,home_team,away_team,home_win,away_win,margin,agency
Phoenix Suns v Boston Celtics,Phoenix Suns,Boston Celtics,2.35,1.62,1.04,Neds
Indiana Pacers v Los Angeles Lakers,Indiana Pacers,Los Angeles Lakers,1.87,1.94,1.05,Neds
Denver Nuggets v Milwaukee Bucks,Denver Nuggets,Milwaukee Bucks,1.5699999999999998,2.45,1.05,Neds
New York Knicks v Los Angeles Clippers,New York Knicks,Los Angeles Clippers,2.15,1.72,1.05,Neds
Brooklyn Nets v Toronto Raptors,Brooklyn Nets,Toronto Raptors,1.8199999999999998,2,1.05,Neds
Philadelphia 76ers v Washington Wizards,Philadelphia 76ers,Washington Wizards,1.67,2.2,1.05,Neds
