match,home_team,away_team,home_win,away_win,margin,agency
Washington Wizards v Minnesota Timberwolves,Washington Wizards,Minnesota Timberwolves,7,1.1,1.05,Neds
Phoenix Suns v Charlotte Hornets,Phoenix Suns,Charlotte Hornets,1.35,3.3,1.04,Neds
Los Angeles Clippers v Miami Heat,Los Angeles Clippers,Miami Heat,1.46,2.7,1.06,Neds
Houston Rockets v Memphis Grizzlies,Houston Rockets,Memphis Grizzlies,1.6800000000000002,2.2,1.05,Neds
Los Angeles Lakers v San Antonio Spurs,Los Angeles Lakers,San Antonio Spurs,1.65,2.25,1.05,Neds
Utah Jazz v Brooklyn Nets,Utah Jazz,Brooklyn Nets,1.5699999999999998,2.45,1.05,Neds
