match,home_team,away_team,home_win,away_win,margin,agency
Utah Jazz v Portland Trail Blazers,Utah Jazz,Portland Trail Blazers,3.15,1.3599999999999999,1.05,Neds
Indiana Pacers v Denver Nuggets,Indiana Pacers,Denver Nuggets,2.55,1.53,1.05,Neds
Detroit Pistons v Los Angeles Clippers,Detroit Pistons,Los Angeles Clippers,1.75,2.1,1.05,Neds
Oklahoma City Thunder v Minnesota Timberwolves,Oklahoma City Thunder,Minnesota Timberwolves,1.1400000000000001,5.8,1.05,Neds
Philadelphia 76ers v Chicago Bulls,Philadelphia 76ers,Chicago Bulls,1.5,2.6,1.05,Neds
