match,home_team,away_team,home_win,away_win,margin,agency
Houston Rockets v Minnesota Timberwolves,Houston Rockets,Minnesota Timberwolves,1.87,1.95,1.05,Neds
Phoenix Suns v Dallas Mavericks,Phoenix Suns,Dallas Mavericks,1.85,1.98,1.05,Neds
Orlando Magic v New York Knicks,Orlando Magic,New York Knicks,3.2,1.3599999999999999,1.05,Neds
Denver Nuggets v Cleveland Cavaliers,Denver Nuggets,Cleveland Cavaliers,2.25,1.65,1.05,Neds
Los Angeles Clippers v Golden State Warriors,Los Angeles Clippers,Golden State Warriors,1.45,2.8,1.05,Neds
Brooklyn Nets v San Antonio Spurs,Brooklyn Nets,San Antonio Spurs,3.5,1.3,1.05,Neds
Boston Celtics v Indiana Pacers,Boston Celtics,Indiana Pacers,1.13,6.2,1.05,Neds
New Orleans Pelicans v Memphis Grizzlies,New Orleans Pelicans,Memphis Grizzlies,3.6,1.3,1.05,Neds
