match,home_team,away_team,home_win,away_win,margin,agency
Miami Heat v Chicago Bulls,Miami Heat,Chicago Bulls,1.5,2.6,1.05,Neds
Houston Rockets v New Orleans Pelicans,Houston Rockets,New Orleans Pelicans,1.3,3.5,1.05,Neds
Atlanta Hawks v Indiana Pacers,Atlanta Hawks,Indiana Pacers,2.3,1.62,1.05,Neds
Toronto Raptors v Washington Wizards,Toronto Raptors,Washington Wizards,1.58,2.4,1.05,Neds
Milwaukee Bucks v Orlando Magic,Milwaukee Bucks,Orlando Magic,1.52,2.55,1.05,Neds
Boston Celtics v Los Angeles Lakers,Boston Celtics,Los Angeles Lakers,1.35,3.25,1.05,Neds
Charlotte Hornets v Brooklyn Nets,Charlotte Hornets,Brooklyn Nets,2.65,1.48,1.05,Neds
