match,home_team,away_team,home_win,away_win,margin,agency
Washington Wizards v Oklahoma City Thunder,Washington Wizards,Oklahoma City Thunder,5.25,1.16,1.05,Neds
Indiana Pacers v Boston Celtics,Indiana Pacers,Boston Celtics,2.25,1.6400000000000001,1.05,Neds
Miami Heat v Houston Rockets,Miami Heat,Houston Rockets,1.5699999999999998,2.4,1.05,Neds
Los Angeles Clippers v Phoenix Suns,Los Angeles Clippers,Phoenix Suns,1.45,2.8,1.05,Neds
Milwaukee Bucks v Utah Jazz,Milwaukee Bucks,Utah Jazz,1.26,3.9,1.05,Neds
Charlotte Hornets v Chicago Bulls,Charlotte Hornets,Chicago Bulls,2.95,1.4,1.05,Neds
