match,home_team,away_team,home_win,away_win,margin,agency
Memphis Grizzlies v Utah Jazz,Memphis Grizzlies,Utah Jazz,1.16,5.4,1.05,Neds
Houston Rockets v Phoenix Suns,Houston Rockets,Phoenix Suns,1.52,2.55,1.05,Neds
Detroit Pistons v Washington Wizards,Detroit Pistons,Washington Wizards,1.1,7,1.05,Neds
Toronto Raptors v Philadelphia 76ers,Toronto Raptors,Philadelphia 76ers,1.55,2.45,1.05,Neds
Portland Trail Blazers v New York Knicks,Portland Trail Blazers,New York Knicks,2.5,1.55,1.05,Neds
San Antonio Spurs v Dallas Mavericks,San Antonio Spurs,Dallas Mavericks,1.4,2.95,1.05,Neds
Golden State Warriors v Sacramento Kings,Golden State Warriors,Sacramento Kings,1.3599999999999999,3.2,1.05,Neds
Boston Celtics v Oklahoma City Thunder,Boston Celtics,Oklahoma City Thunder,1.72,2.15,1.05,Neds
