match,home_team,away_team,home_win,away_win,margin,agency
Detroit Pistons v Washington Wizards,Detroit Pistons,Washington Wizards,1.09,7.75,1.05,Neds
Denver Nuggets v Minnesota Timberwolves,Denver Nuggets,Minnesota Timberwolves,1.6,2.35,1.05,Neds
Indiana Pacers v Milwaukee Bucks,Indiana Pacers,Milwaukee Bucks,1.96,1.85,1.05,Neds
Cleveland Cavaliers v Brooklyn Nets,Cleveland Cavaliers,Brooklyn Nets,1.09,7.75,1.05,Neds
Portland Trail Blazers v New York Knicks,Portland Trail Blazers,New York Knicks,2.5,1.53,1.05,Neds
San Antonio Spurs v Dallas Mavericks,San Antonio Spurs,Dallas Mavericks,1.48,2.7,1.05,Neds
Boston Celtics v Oklahoma City Thunder,Boston Celtics,Oklahoma City Thunder,1.53,2.5,1.05,Neds
