match,home_team,away_team,home_win,away_win,margin,agency
Los Angeles Lakers v Indiana Pacers,Los Angeles Lakers,Indiana Pacers,1.6400000000000001,2.25,1.05,Neds
Minnesota Timberwolves v Golden State Warriors,Minnesota Timberwolves,Golden State Warriors,1.72,2.15,1.05,Neds
Miami Heat v Cleveland Cavaliers,Miami Heat,Cleveland Cavaliers,1.55,2.45,1.05,Neds
Los Angeles Clippers v Philadelphia 76ers,Los Angeles Clippers,Philadelphia 76ers,1.2,4.5,1.06,Neds
Milwaukee Bucks v Oklahoma City Thunder,Milwaukee Bucks,Oklahoma City Thunder,1.6800000000000002,2.2,1.05,Neds
Detroit Pistons v New Orleans Pelicans,Detroit Pistons,New Orleans Pelicans,6,1.13,1.05,Neds
