match,home_team,away_team,home_win,away_win,margin,agency
New York Knicks v San Antonio Spurs,New York Knicks,San Antonio Spurs,1.25,4,1.05,Neds
Portland Trail Blazers v San Antonio Spurs,Portland Trail Blazers,San Antonio Spurs,2.35,1.62,1.04,Neds
Boston Celtics v Philadelphia 76ers,Boston Celtics,Philadelphia 76ers,1.25,4,1.05,Neds
Minnesota Timberwolves v Los Angeles Lakers,Minnesota Timberwolves,Los Angeles Lakers,1.26,3.8,1.06,Neds
Denver Nuggets v Los Angeles Clippers,Denver Nuggets,Los Angeles Clippers,1.4,3,1.05,Neds
Utah Jazz v Phoenix Suns,Utah Jazz,Phoenix Suns,3.35,1.33,1.05,Neds
