match,home_team,away_team,home_win,away_win,margin,agency
Washington Wizards v Phoenix Suns,Washington Wizards,Phoenix Suns,4.8,1.19,1.05,Neds
Utah Jazz v Charlotte Hornets,Utah Jazz,Charlotte Hornets,2.75,1.45,1.05,Neds
Los Angeles Lakers v Miami Heat,Los Angeles Lakers,Miami Heat,1.48,2.7,1.05,Neds
Minnesota Timberwolves v Golden State Warriors,Minnesota Timberwolves,Golden State Warriors,1.3599999999999999,3.15,1.05,Neds
Oklahoma City Thunder v Cleveland Cavaliers,Oklahoma City Thunder,Cleveland Cavaliers,1.6800000000000002,2.2,1.05,Neds
Los Angeles Clippers v Brooklyn Nets,Los Angeles Clippers,Brooklyn Nets,1.09,7.5,1.05,Neds
Portland Trail Blazers v Los Angeles Clippers,Portland Trail Blazers,Los Angeles Clippers,2.9,1.42,1.05,Neds
