match,home_team,away_team,home_win,away_win,margin,agency
Milwaukee Bucks v Brooklyn Nets,Milwaukee Bucks,Brooklyn Nets,1.11,6.6,1.05,Neds
Miami Heat v Indiana Pacers,Miami Heat,Indiana Pacers,1.77,2.05,1.05,Neds
Los Angeles Lakers v Portland Trail Blazers,Los Angeles Lakers,Portland Trail Blazers,1.33,3.4,1.05,Neds
Oklahoma City Thunder v Los Angeles Clippers,Oklahoma City Thunder,Los Angeles Clippers,1.16,5.25,1.05,Neds
Golden State Warriors v Philadelphia 76ers,Golden State Warriors,Philadelphia 76ers,1.6,2.35,1.05,Neds
