match,home_team,away_team,home_win,away_win,margin,agency
New Orleans Pelicans v Charlotte Hornets,New Orleans Pelicans,Charlotte Hornets,1.7,2.15,1.05,Neds
Minnesota Timberwolves v Detroit Pistons,Minnesota Timberwolves,Detroit Pistons,1.33,3.35,1.05,Neds
Philadelphia 76ers v Toronto Raptors,Philadelphia 76ers,Toronto Raptors,3,1.4,1.05,Neds
San Antonio Spurs v Golden State Warriors,San Antonio Spurs,Golden State Warriors,5.4,1.16,1.05,Neds
Milwaukee Bucks v Atlanta Hawks,Milwaukee Bucks,Atlanta Hawks,1.55,2.45,1.05,Neds
