match,home_team,away_team,home_win,away_win,margin,agency
Denver Nuggets v Los Angeles Clippers,Denver Nuggets,Los Angeles Clippers,2.1,1.75,1.05,Neds
Philadelphia 76ers v Washington Wizards,Philadelphia 76ers,Washington Wizards,1.2,4.6,1.05,Neds
Brooklyn Nets v Detroit Pistons,Brooklyn Nets,Detroit Pistons,4.1,1.24,1.05,Neds
Indiana Pacers v Chicago Bulls,Indiana Pacers,Chicago Bulls,1.48,2.65,1.05,Neds
New York Knicks v Toronto Raptors,New York Knicks,Toronto Raptors,1.13,6,1.05,Neds
New Orleans Pelicans v Portland Trail Blazers,New Orleans Pelicans,Portland Trail Blazers,1.8199999999999998,2,1.05,Neds
Cleveland Cavaliers v Oklahoma City Thunder,Cleveland Cavaliers,Oklahoma City Thunder,1.6800000000000002,2.2,1.05,Neds
