match,home_team,away_team,home_win,away_win,margin,agency
Washington Wizards v Oklahoma City Thunder,Washington Wizards,Oklahoma City Thunder,5.75,1.1400000000000001,1.05,Neds
Indiana Pacers v Boston Celtics,Indiana Pacers,Boston Celtics,2.35,1.6,1.05,Neds
Miami Heat v Houston Rockets,Miami Heat,Houston Rockets,1.53,2.55,1.05,Neds
Los Angeles Clippers v Phoenix Suns,Los Angeles Clippers,Phoenix Suns,1.4,3,1.05,Neds
Milwaukee Bucks v Utah Jazz,Milwaukee Bucks,Utah Jazz,1.22,4.5,1.04,Neds
Charlotte Hornets v Chicago Bulls,Charlotte Hornets,Chicago Bulls,3,1.4,1.05,Neds
