match,home_team,away_team,home_win,away_win,margin,agency
Washington Wizards v Indiana Pacers,Washington Wizards,Indiana Pacers,5.4,1.16,1.05,Neds
Oklahoma City Thunder v Memphis Grizzlies,Oklahoma City Thunder,Memphis Grizzlies,1.2,4.6,1.05,Neds
Orlando Magic v Dallas Mavericks,Orlando Magic,Dallas Mavericks,1.38,3.1,1.05,Neds
Chicago Bulls v Los Angeles Lakers,Chicago Bulls,Los Angeles Lakers,2.4,1.58,1.05,Neds
Sacramento Kings v Portland Trail Blazers,Sacramento Kings,Portland Trail Blazers,1.44,2.8,1.05,Neds
Utah Jazz v Houston Rockets,Utah Jazz,Houston Rockets,6,1.13,1.05,Neds
Miami Heat v Atlanta Hawks,Miami Heat,Atlanta Hawks,1.75,2.1,1.05,Neds
Cleveland Cavaliers v San Antonio Spurs,Cleveland Cavaliers,San Antonio Spurs,1.1,7.25,1.05,Neds
