match,home_team,away_team,home_win,away_win,margin,agency
Dallas Mavericks v Minnesota Timberwolves,Dallas Mavericks,Minnesota Timberwolves,1.55,2.5,1.05,Neds
New York Knicks v San Antonio Spurs,New York Knicks,San Antonio Spurs,1.22,4.4,1.05,Neds
Denver Nuggets v Phoenix Suns,Denver Nuggets,Phoenix Suns,1.55,2.5,1.05,Neds
Golden State Warriors v Indiana Pacers,Golden State Warriors,Indiana Pacers,1.48,2.65,1.05,Neds
Phoenix Suns v Denver Nuggets,Phoenix Suns,Denver Nuggets,2.05,1.78,1.05,Neds
Boston Celtics v Philadelphia 76ers,Boston Celtics,Philadelphia 76ers,1.22,4.4,1.05,Neds
Golden State Warriors v Los Angeles Lakers,Golden State Warriors,Los Angeles Lakers,1.52,2.55,1.05,Neds
Los Angeles Lakers v Detroit Pistons,Los Angeles Lakers,Detroit Pistons,1.42,2.85,1.06,Neds
