match,home_team,away_team,home_win,away_win,margin,agency
Boston Celtics v Sacramento Kings,Boston Celtics,Sacramento Kings,1.16,5.4,1.05,Neds
Indiana Pacers v Golden State Warriors,Indiana Pacers,Golden State Warriors,1.24,4.1,1.05,Neds
Philadelphia 76ers v New Orleans Pelicans,Philadelphia 76ers,New Orleans Pelicans,1.45,2.8,1.05,Neds
Denver Nuggets v Brooklyn Nets,Denver Nuggets,Brooklyn Nets,1.09,7.75,1.05,Neds
Orlando Magic v Milwaukee Bucks,Orlando Magic,Milwaukee Bucks,3.15,1.3599999999999999,1.05,Neds
Chicago Bulls v Washington Wizards,Chicago Bulls,Washington Wizards,1.15,5.5,1.05,Neds
New York Knicks v Oklahoma City Thunder,New York Knicks,Oklahoma City Thunder,2.4,1.5699999999999998,1.05,Neds
