match,home_team,away_team,home_win,away_win,margin,agency
New York Knicks v Portland Trail Blazers,New York Knicks,Portland Trail Blazers,1.26,3.9,1.05,Neds
Phoenix Suns v Houston Rockets,Phoenix Suns,Houston Rockets,2.1,1.75,1.05,Neds
New Orleans Pelicans v Charlotte Hornets,New Orleans Pelicans,Charlotte Hornets,1.65,2.25,1.05,Neds
Minnesota Timberwolves v Detroit Pistons,Minnesota Timberwolves,Detroit Pistons,1.4,3,1.05,Neds
Philadelphia 76ers v Toronto Raptors,Philadelphia 76ers,Toronto Raptors,2.1,1.75,1.05,Neds
San Antonio Spurs v Golden State Warriors,San Antonio Spurs,Golden State Warriors,5.6,1.15,1.05,Neds
Cleveland Cavaliers v Los Angeles Clippers,Cleveland Cavaliers,Los Angeles Clippers,1.33,3.3,1.05,Neds
Milwaukee Bucks v Atlanta Hawks,Milwaukee Bucks,Atlanta Hawks,1.6,2.35,1.05,Neds
