match,home_team,away_team,home_win,away_win,margin,agency
Denver Nuggets v Los Angeles Clippers,Denver Nuggets,Los Angeles Clippers,1.87,1.95,1.05,Neds
Brooklyn Nets v Detroit Pistons,Brooklyn Nets,Detroit Pistons,3.05,1.38,1.05,Neds
Washington Wizards v Houston Rockets,Washington Wizards,Houston Rockets,7.25,1.1,1.05,Neds
New Orleans Pelicans v Minnesota Timberwolves,New Orleans Pelicans,Minnesota Timberwolves,2.55,1.52,1.05,Neds
Cleveland Cavaliers v Oklahoma City Thunder,Cleveland Cavaliers,Oklahoma City Thunder,1.75,2.1,1.05,Neds
Denver Nuggets v Boston Celtics,Denver Nuggets,Boston Celtics,2.9,1.42,1.05,Neds
Golden State Warriors v Miami Heat,Golden State Warriors,Miami Heat,1.22,4.25,1.05,Neds
Utah Jazz v Atlanta Hawks,Utah Jazz,Atlanta Hawks,3,1.4,1.05,Neds
