match,home_team,away_team,home_win,away_win,margin,agency
New York Knicks v Golden State Warriors,New York Knicks,Golden State Warriors,1.52,2.55,1.05,Neds
Orlando Magic v Toronto Raptors,Orlando Magic,Toronto Raptors,1.35,3.3,1.04,Neds
Utah Jazz v Detroit Pistons,Utah Jazz,Detroit Pistons,4.8,1.19,1.05,Neds
Chicago Bulls v Cleveland Cavaliers,Chicago Bulls,Cleveland Cavaliers,5.25,1.16,1.05,Neds
Los Angeles Lakers v New Orleans Pelicans,Los Angeles Lakers,New Orleans Pelicans,1.3,3.5,1.05,Neds
Phoenix Suns v Los Angeles Clippers,Phoenix Suns,Los Angeles Clippers,1.98,1.83,1.05,Neds
Atlanta Hawks v Milwaukee Bucks,Atlanta Hawks,Milwaukee Bucks,2.7,1.48,1.05,Neds
Minnesota Timberwolves v Philadelphia 76ers,Minnesota Timberwolves,Philadelphia 76ers,1.1400000000000001,5.75,1.05,Neds
San Antonio Spurs v Brooklyn Nets,San Antonio Spurs,Brooklyn Nets,1.48,2.7,1.05,Neds
