match,home_team,away_team,home_win,away_win,margin,agency
Toronto Raptors v San Antonio Spurs,Toronto Raptors,San Antonio Spurs,1.88,1.92,1.05,Neds
Miami Heat v Charlotte Hornets,Miami Heat,Charlotte Hornets,1.55,2.5,1.05,Neds
Portland Trail Blazers v Boston Celtics,Portland Trail Blazers,Boston Celtics,3.45,1.32,1.05,Neds
Detroit Pistons v New Orleans Pelicans,Detroit Pistons,New Orleans Pelicans,1.16,5.25,1.05,Neds
Los Angeles Clippers v Oklahoma City Thunder,Los Angeles Clippers,Oklahoma City Thunder,2.4,1.58,1.05,Neds
Houston Rockets v Denver Nuggets,Houston Rockets,Denver Nuggets,1.35,3.3,1.04,Neds
Utah Jazz v Cleveland Cavaliers,Utah Jazz,Cleveland Cavaliers,8.5,1.07,1.05,Neds
Atlanta Hawks v Philadelphia 76ers,Atlanta Hawks,Philadelphia 76ers,1.22,4.5,1.04,Neds
