match,home_team,away_team,home_win,away_win,margin,agency
Boston Celtics v Atlanta Hawks,Boston Celtics,Atlanta Hawks,1.2,4.5,1.06,Neds
Los Angeles Clippers v Los Angeles Lakers,Los Angeles Clippers,Los Angeles Lakers,1.53,2.5,1.05,Neds
Indiana Pacers v Philadelphia 76ers,Indiana Pacers,Philadelphia 76ers,1.25,4,1.05,Neds
Minnesota Timberwolves v Cleveland Cavaliers,Minnesota Timberwolves,Cleveland Cavaliers,2.85,1.44,1.05,Neds
Portland Trail Blazers v Houston Rockets,Portland Trail Blazers,Houston Rockets,5.2,1.17,1.05,Neds
