match,home_team,away_team,home_win,away_win,margin,agency
Utah Jazz v Detroit Pistons,Utah Jazz,Detroit Pistons,5,1.17,1.05,Neds
Philadelphia 76ers v Portland Trail Blazers,Philadelphia 76ers,Portland Trail Blazers,1.8199999999999998,2,1.05,Neds
Charlotte Hornets v Golden State Warriors,Charlotte Hornets,Golden State Warriors,6.25,1.12,1.05,Neds
Miami Heat v Washington Wizards,Miami Heat,Washington Wizards,1.28,3.7,1.05,Neds
Oklahoma City Thunder v Houston Rockets,Oklahoma City Thunder,Houston Rockets,1.17,5,1.05,Neds
