match,home_team,away_team,home_win,away_win,margin,agency
Los Angeles Clippers v Utah Jazz,Los Angeles Clippers,Utah Jazz,1.06,9.25,1.05,Neds
Chicago Bulls v Golden State Warriors,Chicago Bulls,Golden State Warriors,2.8,1.45,1.05,Neds
New York Knicks v Boston Celtics,New York Knicks,Boston Celtics,2.35,1.6,1.05,Neds
Memphis Grizzlies v Oklahoma City Thunder,Memphis Grizzlies,Oklahoma City Thunder,2.05,1.78,1.05,Neds
Los Angeles Lakers v Dallas Mavericks,Los Angeles Lakers,Dallas Mavericks,1.5,2.6,1.05,Neds
Phoenix Suns v Denver Nuggets,Phoenix Suns,Denver Nuggets,2.55,1.52,1.05,Neds
Minnesota Timberwolves v Portland Trail Blazers,Minnesota Timberwolves,Portland Trail Blazers,1.42,2.9,1.05,Neds
Sacramento Kings v New Orleans Pelicans,Sacramento Kings,New Orleans Pelicans,1.33,3.4,1.05,Neds
Washington Wizards v Atlanta Hawks,Washington Wizards,Atlanta Hawks,3.25,1.35,1.05,Neds
