match,start_time,market_name,home_team,home_win,away_team,away_win,margin,agency
Charlotte Hornets v Atlanta Hawks,2024-11-30T23:11:00Z,Head To Head,Charlotte Hornets,81,Atlanta Hawks,1.001,1.011,Pointsbet
Detroit Pistons v Philadelphia 76ers,2024-12-01T00:00:00Z,Head To Head,Detroit Pistons,6.5,Philadelphia 76ers,1.1,1.063,Pointsbet
Milwaukee Bucks v Washington Wizards,2024-12-01T01:00:00Z,Head To Head,Milwaukee Bucks,1.11,Washington Wizards,6,1.068,Pointsbet
Phoenix Suns v Golden State Warriors,2024-12-01T02:10:00Z,Head To Head,Phoenix Suns,1.87,Golden State Warriors,1.95,1.048,Pointsbet
Utah Jazz v Dallas Mavericks,2024-12-01T02:40:00Z,Head To Head,Utah Jazz,2.9,Dallas Mavericks,1.42,1.049,Pointsbet
