match,start_time,market_name,home_team,home_win,away_team,away_win,margin,agency
Los Angeles Lakers v Houston Rockets,2025-04-01T01:50:00Z,Head To Head,Los Angeles Lakers,1.67,Houston Rockets,2.2,1.053,Pointsbet
New York Knicks v Philadelphia 76ers,2025-04-01T23:30:00Z,Head To Head,New York Knicks,1.1,Philadelphia 76ers,7.5,1.042,Pointsbet
Atlanta Hawks v Portland Trail Blazers,2025-04-01T23:30:00Z,Head To Head,Atlanta Hawks,1.44,Portland Trail Blazers,2.85,1.045,Pointsbet
Milwaukee Bucks v Phoenix Suns,2025-04-01T23:30:00Z,Head To Head,Milwaukee Bucks,1.36,Phoenix Suns,3.3,1.038,Pointsbet
Memphis Grizzlies v Golden State Warriors,2025-04-02T00:00:00Z,Head To Head,Memphis Grizzlies,2.35,Golden State Warriors,1.63,1.039,Pointsbet
Chicago Bulls v Toronto Raptors,2025-04-02T00:00:00Z,Head To Head,Chicago Bulls,1.48,Toronto Raptors,2.75,1.039,Pointsbet
San Antonio Spurs v Orlando Magic,2025-04-02T00:00:00Z,Head To Head,San Antonio Spurs,2.5,Orlando Magic,1.56,1.041,Pointsbet
Denver Nuggets v Minnesota Timberwolves,2025-04-02T02:00:00Z,Head To Head,Denver Nuggets,1.71,Minnesota Timberwolves,2.2,1.039,Pointsbet
