match,start_time,market_name,home_team,home_win,away_team,away_win,margin,agency
Miami Heat v Indiana Pacers,2025-01-03T00:30:00Z,Head To Head,Miami Heat,1.77,Indiana Pacers,2.1,1.041,Pointsbet
Minnesota Timberwolves v Boston Celtics,2025-01-03T00:30:00Z,Head To Head,Minnesota Timberwolves,2.75,Boston Celtics,1.48,1.039,Pointsbet
Milwaukee Bucks v Brooklyn Nets,2025-01-03T01:00:00Z,Head To Head,Milwaukee Bucks,1.13,Brooklyn Nets,6.5,1.039,Pointsbet
Oklahoma City Thunder v Los Angeles Clippers,2025-01-03T01:00:00Z,Head To Head,Oklahoma City Thunder,1.18,Los Angeles Clippers,5,1.047,Pointsbet
Golden State Warriors v Philadelphia 76ers,2025-01-03T03:00:00Z,Head To Head,Golden State Warriors,1.67,Philadelphia 76ers,2.3,1.034,Pointsbet
Los Angeles Lakers v Portland Trail Blazers,2025-01-03T03:30:00Z,Head To Head,Los Angeles Lakers,1.31,Portland Trail Blazers,3.5,1.049,Pointsbet
