match,start_time,market_name,home_team,home_win,away_team,away_win,margin,agency
Charlotte Hornets v Milwaukee Bucks,2024-03-01T00:00:00Z,Head To Head,Charlotte Hornets,6,Milwaukee Bucks,1.13,1.052,Pointsbet
Orlando Magic v Utah Jazz,2024-03-01T00:00:00Z,Head To Head,Orlando Magic,1.42,Utah Jazz,2.85,1.055,Pointsbet
Brooklyn Nets v Atlanta Hawks,2024-03-01T00:30:00Z,Head To Head,Brooklyn Nets,1.8,Atlanta Hawks,2.05,1.043,Pointsbet
New York Knicks v Golden State Warriors,2024-03-01T00:30:00Z,Head To Head,New York Knicks,2.45,Golden State Warriors,1.57,1.045,Pointsbet
San Antonio Spurs v Oklahoma City Thunder,2024-03-01T01:30:00Z,Head To Head,San Antonio Spurs,5.25,Oklahoma City Thunder,1.17,1.045,Pointsbet
Phoenix Suns v Houston Rockets,2024-03-01T02:00:00Z,Head To Head,Phoenix Suns,1.27,Houston Rockets,4,1.037,Pointsbet
Denver Nuggets v Miami Heat,2024-03-01T03:00:00Z,Head To Head,Denver Nuggets,1.53,Miami Heat,2.6,1.038,Pointsbet
Los Angeles Lakers v Washington Wizards,2024-03-01T03:30:00Z,Head To Head,Los Angeles Lakers,1.24,Washington Wizards,4.3,1.039,Pointsbet
