match,start_time,market_name,home_team,home_win,away_team,away_win,margin,agency
Miami Heat v San Antonio Spurs,2025-01-19T20:00:00Z,Head To Head,Miami Heat,1.4,San Antonio Spurs,2.75,1.078,Pointsbet
Orlando Magic v Denver Nuggets,2025-01-19T23:10:00Z,Head To Head,Orlando Magic,3.4,Denver Nuggets,1.33,1.046,Pointsbet
Oklahoma City Thunder v Brooklyn Nets,2025-01-20T00:00:00Z,Head To Head,Oklahoma City Thunder,1.07,Brooklyn Nets,9.5,1.04,Pointsbet
Milwaukee Bucks v Philadelphia 76ers,2025-01-20T00:00:00Z,Head To Head,Milwaukee Bucks,1.13,Philadelphia 76ers,6,1.052,Pointsbet
Sacramento Kings v Washington Wizards,2025-01-20T02:00:00Z,Head To Head,Sacramento Kings,1.06,Washington Wizards,11.5,1.03,Pointsbet
Portland Trail Blazers v Chicago Bulls,2025-01-20T02:00:00Z,Head To Head,Portland Trail Blazers,3.3,Chicago Bulls,1.36,1.038,Pointsbet
Los Angeles Clippers v Los Angeles Lakers,2025-01-20T02:00:00Z,Head To Head,Los Angeles Clippers,1.57,Los Angeles Lakers,2.45,1.045,Pointsbet
Houston Rockets v Detroit Pistons,2025-01-20T19:00:00Z,Head To Head,Houston Rockets,1.33,Detroit Pistons,3.4,1.046,Pointsbet
