match,start_time,market_name,home_team,home_win,away_team,away_win,margin,agency
Indiana Pacers v Houston Rockets,2024-02-07T00:00:00Z,Head To Head,Indiana Pacers,1.33,Houston Rockets,3.4,1.046,Pointsbet
Miami Heat v Orlando Magic,2024-02-07T00:30:00Z,Head To Head,Miami Heat,1.59,Orlando Magic,2.4,1.046,Pointsbet
New York Knicks v Memphis Grizzlies,2024-02-07T00:30:00Z,Head To Head,New York Knicks,1.09,Memphis Grizzlies,8,1.042,Pointsbet
Brooklyn Nets v Dallas Mavericks,2024-02-07T00:30:00Z,Head To Head,Brooklyn Nets,2.2,Dallas Mavericks,1.71,1.039,Pointsbet
Chicago Bulls v Minnesota Timberwolves,2024-02-07T01:00:00Z,Head To Head,Chicago Bulls,2.65,Minnesota Timberwolves,1.5,1.044,Pointsbet
Utah Jazz v Oklahoma City Thunder,2024-02-07T02:00:00Z,Head To Head,Utah Jazz,2.3,Oklahoma City Thunder,1.67,1.034,Pointsbet
Phoenix Suns v Milwaukee Bucks,2024-02-07T03:00:00Z,Head To Head,Phoenix Suns,1.63,Milwaukee Bucks,2.35,1.039,Pointsbet
