match,start_time,market_name,home_team,home_win,away_team,away_win,margin,agency
Charlotte Hornets v Dallas Mavericks,2025-01-20T17:00:00Z,Head To Head,Charlotte Hornets,3.2,Dallas Mavericks,1.36,1.048,Pointsbet
Houston Rockets v Detroit Pistons,2025-01-20T19:00:00Z,Head To Head,Houston Rockets,1.29,Detroit Pistons,3.6,1.053,Pointsbet
Memphis Grizzlies v Minnesota Timberwolves,2025-01-20T19:30:00Z,Head To Head,Memphis Grizzlies,1.48,Minnesota Timberwolves,2.75,1.039,Pointsbet
New York Knicks v Atlanta Hawks,2025-01-20T20:00:00Z,Head To Head,New York Knicks,1.4,Atlanta Hawks,3,1.048,Pointsbet
Cleveland Cavaliers v Phoenix Suns,2025-01-20T20:30:00Z,Head To Head,Cleveland Cavaliers,1.33,Phoenix Suns,3.4,1.046,Pointsbet
Golden State Warriors v Boston Celtics,2025-01-20T22:00:00Z,Head To Head,Golden State Warriors,4.5,Boston Celtics,1.22,1.042,Pointsbet
New Orleans Pelicans v Utah Jazz,2025-01-21T01:00:00Z,Head To Head,New Orleans Pelicans,1.16,Utah Jazz,5.5,1.044,Pointsbet
Los Angeles Clippers v Chicago Bulls,2025-01-21T03:30:00Z,Head To Head,Los Angeles Clippers,1.48,Chicago Bulls,2.75,1.039,Pointsbet
