match,start_time,market_name,home_team,home_win,away_team,away_win,margin,agency
Sacramento Kings v Portland Trail Blazers,2025-03-28T02:00:00Z,Head To Head,Sacramento Kings,1.03,Portland Trail Blazers,13,1.048,Pointsbet
Detroit Pistons v Cleveland Cavaliers,2025-03-28T23:00:00Z,Head To Head,Detroit Pistons,3.3,Cleveland Cavaliers,1.36,1.038,Pointsbet
Toronto Raptors v Charlotte Hornets,2025-03-28T23:30:00Z,Head To Head,Toronto Raptors,1.4,Charlotte Hornets,3,1.048,Pointsbet
Brooklyn Nets v Los Angeles Clippers,2025-03-28T23:30:00Z,Head To Head,Brooklyn Nets,5.75,Los Angeles Clippers,1.14,1.051,Pointsbet
Minnesota Timberwolves v Phoenix Suns,2025-03-29T00:00:00Z,Head To Head,Minnesota Timberwolves,1.33,Phoenix Suns,3.4,1.046,Pointsbet
Milwaukee Bucks v New York Knicks,2025-03-29T00:00:00Z,Head To Head,Milwaukee Bucks,1.95,New York Knicks,1.87,1.048,Pointsbet
New Orleans Pelicans v Golden State Warriors,2025-03-29T00:00:00Z,Head To Head,New Orleans Pelicans,6,Golden State Warriors,1.13,1.052,Pointsbet
Denver Nuggets v Utah Jazz,2025-03-29T01:00:00Z,Head To Head,Denver Nuggets,1.06,Utah Jazz,11,1.034,Pointsbet
