match,start_time,market_name,home_team,home_win,away_team,away_win,margin,agency
Utah Jazz v Denver Nuggets,2024-12-31T02:00:00Z,Head To Head,Utah Jazz,3,Denver Nuggets,1.36,1.069,Pointsbet
Portland Trail Blazers v Philadelphia 76ers,2024-12-31T03:00:00Z,Head To Head,Portland Trail Blazers,4.1,Philadelphia 76ers,1.22,1.064,Pointsbet
Golden State Warriors v Cleveland Cavaliers,2024-12-31T03:00:00Z,Head To Head,Golden State Warriors,2.1,Cleveland Cavaliers,1.71,1.061,Pointsbet
Sacramento Kings v Dallas Mavericks,2024-12-31T03:00:00Z,Head To Head,Sacramento Kings,1.77,Dallas Mavericks,2,1.065,Pointsbet
Indiana Pacers v Milwaukee Bucks,2024-12-31T20:00:00Z,Head To Head,Indiana Pacers,1.87,Milwaukee Bucks,1.95,1.048,Pointsbet
Oklahoma City Thunder v Minnesota Timberwolves,2025-01-01T01:00:00Z,Head To Head,Oklahoma City Thunder,1.36,Minnesota Timberwolves,3.3,1.038,Pointsbet
