match,start_time,market_name,home_team,home_win,away_team,away_win,margin,agency
Toronto Raptors v Atlanta Hawks,2024-12-29T23:00:00Z,Head To Head,Toronto Raptors,2.9,Atlanta Hawks,1.4,1.059,Pointsbet
Boston Celtics v Indiana Pacers,2024-12-29T23:00:00Z,Head To Head,Boston Celtics,1.63,Indiana Pacers,2.25,1.058,Pointsbet
Houston Rockets v Miami Heat,2024-12-30T00:00:00Z,Head To Head,Houston Rockets,1.13,Miami Heat,5.5,1.067,Pointsbet
Oklahoma City Thunder v Memphis Grizzlies,2024-12-30T00:00:00Z,Head To Head,Oklahoma City Thunder,1.44,Memphis Grizzlies,2.65,1.072,Pointsbet
Minnesota Timberwolves v San Antonio Spurs,2024-12-30T02:00:00Z,Head To Head,Minnesota Timberwolves,1.42,San Antonio Spurs,2.9,1.049,Pointsbet
New Orleans Pelicans v Los Angeles Clippers,2024-12-31T01:00:00Z,Head To Head,New Orleans Pelicans,2.85,Los Angeles Clippers,1.44,1.045,Pointsbet
Utah Jazz v Denver Nuggets,2024-12-31T02:00:00Z,Head To Head,Utah Jazz,3.5,Denver Nuggets,1.31,1.049,Pointsbet
Portland Trail Blazers v Philadelphia 76ers,2024-12-31T03:00:00Z,Head To Head,Portland Trail Blazers,3.1,Philadelphia 76ers,1.4,1.037,Pointsbet
Golden State Warriors v Cleveland Cavaliers,2024-12-31T03:00:00Z,Head To Head,Golden State Warriors,2.4,Cleveland Cavaliers,1.59,1.046,Pointsbet
