match,start_time,market_name,home_team,home_win,away_team,away_win,margin,agency
New York Knicks v Detroit Pistons,2025-01-14T00:30:00Z,Head To Head,New York Knicks,1.87,Detroit Pistons,1.87,1.07,Pointsbet
Toronto Raptors v Golden State Warriors,2025-01-14T00:30:00Z,Head To Head,Toronto Raptors,5.25,Golden State Warriors,1.14,1.068,Pointsbet
Houston Rockets v Memphis Grizzlies,2025-01-14T01:00:00Z,Head To Head,Houston Rockets,1.8,Memphis Grizzlies,1.95,1.068,Pointsbet
Los Angeles Clippers v Miami Heat,2025-01-14T03:40:00Z,Head To Head,Los Angeles Clippers,1.29,Miami Heat,3.6,1.053,Pointsbet
Los Angeles Lakers v San Antonio Spurs,2025-01-14T03:40:00Z,Head To Head,Los Angeles Lakers,1.57,San Antonio Spurs,2.45,1.045,Pointsbet
Milwaukee Bucks v Sacramento Kings,2025-01-15T01:00:00Z,Head To Head,Milwaukee Bucks,1.71,Sacramento Kings,2.2,1.039,Pointsbet
Chicago Bulls v New Orleans Pelicans,2025-01-15T01:00:00Z,Head To Head,Chicago Bulls,1.71,New Orleans Pelicans,2.2,1.039,Pointsbet
Portland Trail Blazers v Brooklyn Nets,2025-01-15T03:00:00Z,Head To Head,Portland Trail Blazers,1.36,Brooklyn Nets,3.2,1.048,Pointsbet
