match,start_time,market_name,home_team,home_win,away_team,away_win,margin,agency
Philadelphia 76ers v Orlando Magic,2024-12-05T00:30:00Z,Head To Head,Philadelphia 76ers,2.5,Orlando Magic,1.5,1.067,Pointsbet
Miami Heat v Los Angeles Lakers,2024-12-05T00:30:00Z,Head To Head,Miami Heat,1.02,Los Angeles Lakers,18,1.036,Pointsbet
Boston Celtics v Detroit Pistons,2024-12-05T00:30:00Z,Head To Head,Boston Celtics,1.03,Detroit Pistons,15,1.038,Pointsbet
Brooklyn Nets v Indiana Pacers,2024-12-05T00:30:00Z,Head To Head,Brooklyn Nets,1.11,Indiana Pacers,6,1.068,Pointsbet
Milwaukee Bucks v Atlanta Hawks,2024-12-05T01:00:00Z,Head To Head,Milwaukee Bucks,2.75,Atlanta Hawks,1.42,1.068,Pointsbet
Los Angeles Clippers v Minnesota Timberwolves,2024-12-05T03:30:00Z,Head To Head,Los Angeles Clippers,2.4,Minnesota Timberwolves,1.59,1.046,Pointsbet
Cleveland Cavaliers v Denver Nuggets,2024-12-06T00:00:00Z,Head To Head,Cleveland Cavaliers,1.59,Denver Nuggets,2.4,1.046,Pointsbet
New York Knicks v Charlotte Hornets,2024-12-06T00:30:00Z,Head To Head,New York Knicks,1.07,Charlotte Hornets,9,1.046,Pointsbet
Toronto Raptors v Oklahoma City Thunder,2024-12-06T00:30:00Z,Head To Head,Toronto Raptors,4.1,Oklahoma City Thunder,1.25,1.044,Pointsbet
