match,start_time,market_name,home_team,home_win,away_team,away_win,margin,agency
Toronto Raptors v Houston Rockets,2024-12-22T23:00:00Z,Head To Head,Toronto Raptors,4.1,Houston Rockets,1.25,1.044,Pointsbet
Sacramento Kings v Indiana Pacers,2024-12-22T23:10:00Z,Head To Head,Sacramento Kings,1.67,Indiana Pacers,2.3,1.034,Pointsbet
New Orleans Pelicans v Denver Nuggets,2024-12-23T00:00:00Z,Head To Head,New Orleans Pelicans,4.5,Denver Nuggets,1.22,1.042,Pointsbet
Cleveland Cavaliers v Utah Jazz,2024-12-24T00:00:00Z,Head To Head,Cleveland Cavaliers,1.1,Utah Jazz,7.5,1.042,Pointsbet
Charlotte Hornets v Houston Rockets,2024-12-24T00:00:00Z,Head To Head,Charlotte Hornets,3.2,Houston Rockets,1.36,1.048,Pointsbet
Orlando Magic v Boston Celtics,2024-12-24T00:00:00Z,Head To Head,Orlando Magic,3.5,Boston Celtics,1.31,1.049,Pointsbet
Atlanta Hawks v Minnesota Timberwolves,2024-12-24T00:30:00Z,Head To Head,Atlanta Hawks,2.5,Minnesota Timberwolves,1.56,1.041,Pointsbet
