match,start_time,market_name,home_team,home_win,away_team,away_win,margin,agency
Golden State Warriors v Boston Celtics,2025-01-20T22:00:00Z,Head To Head,Golden State Warriors,11.5,Boston Celtics,1.05,1.039,Pointsbet
New Orleans Pelicans v Utah Jazz,2025-01-21T01:00:00Z,Head To Head,New Orleans Pelicans,1.17,Utah Jazz,5.25,1.045,Pointsbet
Los Angeles Clippers v Chicago Bulls,2025-01-21T03:30:00Z,Head To Head,Los Angeles Clippers,1.42,Chicago Bulls,2.9,1.049,Pointsbet
Toronto Raptors v Orlando Magic,2025-01-22T00:30:00Z,Head To Head,Toronto Raptors,2.4,Orlando Magic,1.59,1.046,Pointsbet
Los Angeles Lakers v Washington Wizards,2025-01-22T03:30:00Z,Head To Head,Los Angeles Lakers,1.1,Washington Wizards,7.5,1.042,Pointsbet
