match,start_time,market_name,home_team,home_win,away_team,away_win,margin,agency
New York Knicks v Detroit Pistons,2025-01-14T00:30:00Z,Head To Head,New York Knicks,1.57,Detroit Pistons,2.35,1.062,Pointsbet
Toronto Raptors v Golden State Warriors,2025-01-14T00:30:00Z,Head To Head,Toronto Raptors,3,Golden State Warriors,1.36,1.069,Pointsbet
Houston Rockets v Memphis Grizzlies,2025-01-14T01:00:00Z,Head To Head,Houston Rockets,2.05,Memphis Grizzlies,1.74,1.063,Pointsbet
Los Angeles Clippers v Miami Heat,2025-01-14T03:40:00Z,Head To Head,Los Angeles Clippers,1.29,Miami Heat,3.6,1.053,Pointsbet
Los Angeles Lakers v San Antonio Spurs,2025-01-14T03:40:00Z,Head To Head,Los Angeles Lakers,1.57,San Antonio Spurs,2.45,1.045,Pointsbet
Milwaukee Bucks v Sacramento Kings,2025-01-15T01:00:00Z,Head To Head,Milwaukee Bucks,1.74,Sacramento Kings,2.15,1.04,Pointsbet
Chicago Bulls v New Orleans Pelicans,2025-01-15T01:00:00Z,Head To Head,Chicago Bulls,1.71,New Orleans Pelicans,2.2,1.039,Pointsbet
Portland Trail Blazers v Brooklyn Nets,2025-01-15T03:00:00Z,Head To Head,Portland Trail Blazers,1.4,Brooklyn Nets,3,1.048,Pointsbet
