match,start_time,market_name,home_team,home_win,away_team,away_win,margin,agency
Charlotte Hornets v Philadelphia 76ers,2024-12-17T00:00:00Z,Head To Head,Charlotte Hornets,7.5,Philadelphia 76ers,1.08,1.059,Pointsbet
Detroit Pistons v Miami Heat,2024-12-17T00:00:00Z,Head To Head,Detroit Pistons,1.04,Miami Heat,12,1.045,Pointsbet
Toronto Raptors v Chicago Bulls,2024-12-17T00:30:00Z,Head To Head,Toronto Raptors,2.9,Chicago Bulls,1.4,1.059,Pointsbet
Sacramento Kings v Denver Nuggets,2024-12-17T03:00:00Z,Head To Head,Sacramento Kings,1.87,Denver Nuggets,1.95,1.048,Pointsbet
Los Angeles Clippers v Utah Jazz,2024-12-17T03:30:00Z,Head To Head,Los Angeles Clippers,1.33,Utah Jazz,3.4,1.046,Pointsbet
