match,start_time,market_name,home_team,home_win,away_team,away_win,margin,agency
Golden State Warriors v Minnesota Timberwolves,2024-12-09T01:30:00Z,Head To Head,Golden State Warriors,2.6,Minnesota Timberwolves,1.48,1.06,Pointsbet
Los Angeles Clippers v Houston Rockets,2024-12-09T02:00:00Z,Head To Head,Los Angeles Clippers,2.85,Houston Rockets,1.4,1.065,Pointsbet
Sacramento Kings v Utah Jazz,2024-12-09T02:00:00Z,Head To Head,Sacramento Kings,1.08,Utah Jazz,7.5,1.059,Pointsbet
Los Angeles Lakers v Portland Trail Blazers,2024-12-09T02:30:00Z,Head To Head,Los Angeles Lakers,1.53,Portland Trail Blazers,2.45,1.062,Pointsbet
Toronto Raptors v New York Knicks,2024-12-10T00:30:00Z,Head To Head,Toronto Raptors,2.85,New York Knicks,1.44,1.045,Pointsbet
Milwaukee Bucks v Orlando Magic,2024-12-11T00:00:00Z,Head To Head,Milwaukee Bucks,1.24,Orlando Magic,4.3,1.039,Pointsbet
