match,start_time,market_name,home_team,home_win,away_team,away_win,margin,agency
Utah Jazz v Detroit Pistons,2025-03-04T02:00:00Z,Head To Head,Utah Jazz,29,Detroit Pistons,1.01,1.025,Pointsbet
Orlando Magic v Toronto Raptors,2025-03-05T00:00:00Z,Head To Head,Orlando Magic,1.33,Toronto Raptors,3.4,1.046,Pointsbet
New York Knicks v Golden State Warriors,2025-03-05T00:30:00Z,Head To Head,New York Knicks,1.53,Golden State Warriors,2.6,1.038,Pointsbet
Atlanta Hawks v Milwaukee Bucks,2025-03-05T00:30:00Z,Head To Head,Atlanta Hawks,2.75,Milwaukee Bucks,1.48,1.039,Pointsbet
Chicago Bulls v Cleveland Cavaliers,2025-03-05T01:00:00Z,Head To Head,Chicago Bulls,5.5,Cleveland Cavaliers,1.16,1.044,Pointsbet
Minnesota Timberwolves v Philadelphia 76ers,2025-03-05T01:00:00Z,Head To Head,Minnesota Timberwolves,1.14,Philadelphia 76ers,5.75,1.051,Pointsbet
San Antonio Spurs v Brooklyn Nets,2025-03-05T01:30:00Z,Head To Head,San Antonio Spurs,1.53,Brooklyn Nets,2.6,1.038,Pointsbet
