match,start_time,market_name,home_team,home_win,away_team,away_win,margin,agency
Orlando Magic v Los Angeles Lakers,2025-03-24T23:00:00Z,Head To Head,Orlando Magic,2.4,Los Angeles Lakers,1.59,1.046,Pointsbet
Indiana Pacers v Minnesota Timberwolves,2025-03-24T23:00:00Z,Head To Head,Indiana Pacers,1.74,Minnesota Timberwolves,2.15,1.04,Pointsbet
Washington Wizards v Toronto Raptors,2025-03-24T23:00:00Z,Head To Head,Washington Wizards,1.83,Toronto Raptors,2,1.046,Pointsbet
Brooklyn Nets v Dallas Mavericks,2025-03-24T23:30:00Z,Head To Head,Brooklyn Nets,1.9,Dallas Mavericks,1.9,1.053,Pointsbet
New Orleans Pelicans v Philadelphia 76ers,2025-03-25T00:00:00Z,Head To Head,New Orleans Pelicans,1.4,Philadelphia 76ers,3,1.048,Pointsbet
Denver Nuggets v Chicago Bulls,2025-03-25T01:00:00Z,Head To Head,Denver Nuggets,1.67,Chicago Bulls,2.3,1.034,Pointsbet
Sacramento Kings v Boston Celtics,2025-03-25T02:00:00Z,Head To Head,Sacramento Kings,2.4,Boston Celtics,1.59,1.046,Pointsbet
Phoenix Suns v Milwaukee Bucks,2025-03-25T02:00:00Z,Head To Head,Phoenix Suns,1.69,Milwaukee Bucks,2.25,1.036,Pointsbet
