match,start_time,market_name,home_team,home_win,away_team,away_win,margin,agency
Philadelphia 76ers v Charlotte Hornets,2024-12-21T00:00:00Z,Head To Head,Philadelphia 76ers,1.14,Charlotte Hornets,5.75,1.051,Pointsbet
Cleveland Cavaliers v Milwaukee Bucks,2024-12-21T00:30:00Z,Head To Head,Cleveland Cavaliers,1.24,Milwaukee Bucks,4.3,1.039,Pointsbet
Miami Heat v Oklahoma City Thunder,2024-12-21T01:00:00Z,Head To Head,Miami Heat,2.05,Oklahoma City Thunder,1.8,1.043,Pointsbet
Sacramento Kings v Los Angeles Lakers,2024-12-21T23:00:00Z,Head To Head,Sacramento Kings,1.67,Los Angeles Lakers,2.3,1.034,Pointsbet
Brooklyn Nets v Utah Jazz,2024-12-22T00:30:00Z,Head To Head,Brooklyn Nets,1.8,Utah Jazz,2.05,1.043,Pointsbet
New Orleans Pelicans v New York Knicks,2024-12-22T01:00:00Z,Head To Head,New Orleans Pelicans,4.1,New York Knicks,1.25,1.044,Pointsbet
Minnesota Timberwolves v Golden State Warriors,2024-12-22T01:00:00Z,Head To Head,Minnesota Timberwolves,1.63,Golden State Warriors,2.35,1.039,Pointsbet
Chicago Bulls v Boston Celtics,2024-12-22T01:00:00Z,Head To Head,Chicago Bulls,4.1,Boston Celtics,1.25,1.044,Pointsbet
San Antonio Spurs v Portland Trail Blazers,2024-12-22T01:30:00Z,Head To Head,San Antonio Spurs,1.44,Portland Trail Blazers,2.85,1.045,Pointsbet
