match,start_time,market_name,home_team,home_win,away_team,away_win,margin,agency
Houston Rockets v Toronto Raptors,2025-02-09T19:00:00Z,Head To Head,Houston Rockets,1.08,Toronto Raptors,8,1.051,Pointsbet
Washington Wizards v San Antonio Spurs,2025-02-11T00:00:00Z,Head To Head,Washington Wizards,6.5,San Antonio Spurs,1.13,1.039,Pointsbet
Orlando Magic v Atlanta Hawks,2025-02-11T00:00:00Z,Head To Head,Orlando Magic,1.44,Atlanta Hawks,2.85,1.045,Pointsbet
Cleveland Cavaliers v Minnesota Timberwolves,2025-02-11T00:00:00Z,Head To Head,Cleveland Cavaliers,1.4,Minnesota Timberwolves,3,1.048,Pointsbet
Miami Heat v Boston Celtics,2025-02-11T00:30:00Z,Head To Head,Miami Heat,3.1,Boston Celtics,1.4,1.037,Pointsbet
Brooklyn Nets v Charlotte Hornets,2025-02-11T00:30:00Z,Head To Head,Brooklyn Nets,1.56,Charlotte Hornets,2.5,1.041,Pointsbet
Milwaukee Bucks v Golden State Warriors,2025-02-11T01:00:00Z,Head To Head,Milwaukee Bucks,2.85,Golden State Warriors,1.44,1.045,Pointsbet
Oklahoma City Thunder v New Orleans Pelicans,2025-02-11T01:00:00Z,Head To Head,Oklahoma City Thunder,1.1,New Orleans Pelicans,7.5,1.042,Pointsbet
Los Angeles Lakers v Utah Jazz,2025-02-11T03:30:00Z,Head To Head,Los Angeles Lakers,1.1,Utah Jazz,7.5,1.042,Pointsbet
