match,start_time,market_name,home_team,home_win,away_team,away_win,margin,agency
Detroit Pistons v Washington Wizards,2025-03-13T23:00:00Z,Head To Head,Detroit Pistons,1.17,Washington Wizards,4.75,1.065,Pointsbet
Milwaukee Bucks v Los Angeles Lakers,2025-03-13T23:30:00Z,Head To Head,Milwaukee Bucks,1.44,Los Angeles Lakers,2.65,1.072,Pointsbet
Chicago Bulls v Brooklyn Nets,2025-03-14T00:10:00Z,Head To Head,Chicago Bulls,1.8,Brooklyn Nets,2.05,1.043,Pointsbet
New Orleans Pelicans v Orlando Magic,2025-03-14T00:10:00Z,Head To Head,New Orleans Pelicans,2.05,Orlando Magic,1.8,1.043,Pointsbet
Golden State Warriors v Sacramento Kings,2025-03-14T02:00:00Z,Head To Head,Golden State Warriors,1.36,Sacramento Kings,3.3,1.038,Pointsbet
Denver Nuggets v Los Angeles Lakers,2025-03-15T01:30:00Z,Head To Head,Denver Nuggets,1.13,Los Angeles Lakers,6.5,1.039,Pointsbet
