match,start_time,market_name,home_team,home_win,away_team,away_win,margin,agency
Charlotte Hornets v Detroit Pistons,2024-11-22T00:00:00Z,Head To Head,Charlotte Hornets,2.1,Detroit Pistons,1.71,1.061,Pointsbet
Toronto Raptors v Minnesota Timberwolves,2024-11-22T00:30:00Z,Head To Head,Toronto Raptors,2.6,Minnesota Timberwolves,1.48,1.06,Pointsbet
San Antonio Spurs v Utah Jazz,2024-11-22T01:10:00Z,Head To Head,San Antonio Spurs,1.67,Utah Jazz,2.3,1.034,Pointsbet
Los Angeles Lakers v Orlando Magic,2024-11-22T03:30:00Z,Head To Head,Los Angeles Lakers,1.44,Orlando Magic,2.85,1.045,Pointsbet
Denver Nuggets v Dallas Mavericks,2024-11-23T03:00:00Z,Head To Head,Denver Nuggets,1.5,Dallas Mavericks,2.65,1.044,Pointsbet
