match,start_time,market_name,home_team,home_win,away_team,away_win,margin,agency
Minnesota Timberwolves v Indiana Pacers,2025-03-18T00:00:00Z,Head To Head,Minnesota Timberwolves,1.36,Indiana Pacers,3.1,1.058,Pointsbet
Houston Rockets v Philadelphia 76ers,2025-03-18T00:00:00Z,Head To Head,Houston Rockets,1.95,Philadelphia 76ers,1.8,1.068,Pointsbet
Utah Jazz v Chicago Bulls,2025-03-18T01:00:00Z,Head To Head,Utah Jazz,3.1,Chicago Bulls,1.36,1.058,Pointsbet
Golden State Warriors v Denver Nuggets,2025-03-18T02:10:00Z,Head To Head,Golden State Warriors,1.17,Denver Nuggets,5.25,1.045,Pointsbet
Sacramento Kings v Memphis Grizzlies,2025-03-18T02:10:00Z,Head To Head,Sacramento Kings,1.67,Memphis Grizzlies,2.3,1.034,Pointsbet
Phoenix Suns v Toronto Raptors,2025-03-18T02:10:00Z,Head To Head,Phoenix Suns,1.25,Toronto Raptors,4.1,1.044,Pointsbet
Portland Trail Blazers v Washington Wizards,2025-03-18T02:10:00Z,Head To Head,Portland Trail Blazers,1.42,Washington Wizards,2.9,1.049,Pointsbet
Los Angeles Lakers v San Antonio Spurs,2025-03-18T02:40:00Z,Head To Head,Los Angeles Lakers,1.24,San Antonio Spurs,4.3,1.039,Pointsbet
