match,start_time,market_name,home_team,home_win,away_team,away_win,margin,agency
Los Angeles Clippers v Los Angeles Lakers,2025-02-05T03:00:00Z,Head To Head,Los Angeles Clippers,1.69,Los Angeles Lakers,2.15,1.057,Pointsbet
Portland Trail Blazers v Indiana Pacers,2025-02-05T03:00:00Z,Head To Head,Portland Trail Blazers,2.1,Indiana Pacers,1.71,1.061,Pointsbet
Atlanta Hawks v San Antonio Spurs,2025-02-06T00:00:00Z,Head To Head,Atlanta Hawks,2.45,San Antonio Spurs,1.57,1.045,Pointsbet
Charlotte Hornets v Milwaukee Bucks,2025-02-06T00:00:00Z,Head To Head,Charlotte Hornets,4.1,Milwaukee Bucks,1.25,1.044,Pointsbet
Toronto Raptors v Memphis Grizzlies,2025-02-06T00:30:00Z,Head To Head,Toronto Raptors,3.4,Memphis Grizzlies,1.33,1.046,Pointsbet
Denver Nuggets v New Orleans Pelicans,2025-02-06T02:00:00Z,Head To Head,Denver Nuggets,1.18,New Orleans Pelicans,5,1.047,Pointsbet
Sacramento Kings v Orlando Magic,2025-02-06T03:00:00Z,Head To Head,Sacramento Kings,1.48,Orlando Magic,2.75,1.039,Pointsbet
