match,start_time,market_name,home_team,home_win,away_team,away_win,margin,agency
Phoenix Suns v Portland Trail Blazers,2024-12-16T01:00:00Z,Head To Head,Phoenix Suns,1.36,Portland Trail Blazers,3.1,1.058,Pointsbet
Golden State Warriors v Dallas Mavericks,2024-12-16T01:30:00Z,Head To Head,Golden State Warriors,3,Dallas Mavericks,1.36,1.069,Pointsbet
Los Angeles Lakers v Memphis Grizzlies,2024-12-16T02:40:00Z,Head To Head,Los Angeles Lakers,2.1,Memphis Grizzlies,1.77,1.041,Pointsbet
Charlotte Hornets v Philadelphia 76ers,2024-12-17T00:00:00Z,Head To Head,Charlotte Hornets,2.15,Philadelphia 76ers,1.74,1.04,Pointsbet
Toronto Raptors v Chicago Bulls,2024-12-17T00:30:00Z,Head To Head,Toronto Raptors,1.83,Chicago Bulls,2,1.046,Pointsbet
Brooklyn Nets v Cleveland Cavaliers,2024-12-17T00:30:00Z,Head To Head,Brooklyn Nets,4.75,Cleveland Cavaliers,1.2,1.044,Pointsbet
Sacramento Kings v Denver Nuggets,2024-12-17T03:00:00Z,Head To Head,Sacramento Kings,1.9,Denver Nuggets,1.9,1.053,Pointsbet
Los Angeles Clippers v Utah Jazz,2024-12-17T03:30:00Z,Head To Head,Los Angeles Clippers,1.2,Utah Jazz,4.75,1.044,Pointsbet
