match,start_time,market_name,home_team,home_win,away_team,away_win,margin,agency
Washington Wizards v Orlando Magic,2025-04-03T23:00:00Z,Head To Head,Washington Wizards,7,Orlando Magic,1.11,1.044,Pointsbet
Philadelphia 76ers v Milwaukee Bucks,2025-04-03T23:00:00Z,Head To Head,Philadelphia 76ers,5.75,Milwaukee Bucks,1.14,1.051,Pointsbet
Miami Heat v Memphis Grizzlies,2025-04-03T23:30:00Z,Head To Head,Miami Heat,2.6,Memphis Grizzlies,1.53,1.038,Pointsbet
Brooklyn Nets v Minnesota Timberwolves,2025-04-03T23:30:00Z,Head To Head,Brooklyn Nets,6.5,Minnesota Timberwolves,1.13,1.039,Pointsbet
Toronto Raptors v Portland Trail Blazers,2025-04-03T23:30:00Z,Head To Head,Toronto Raptors,2.3,Portland Trail Blazers,1.63,1.048,Pointsbet
Los Angeles Lakers v Golden State Warriors,2025-04-04T02:00:00Z,Head To Head,Los Angeles Lakers,1.83,Golden State Warriors,2,1.046,Pointsbet
