match,start_time,market_name,home_team,home_win,away_team,away_win,margin,agency
Charlotte Hornets v New York Knicks,2025-03-20T23:00:00Z,Head To Head,Charlotte Hornets,3.4,New York Knicks,1.33,1.046,Pointsbet
Indiana Pacers v Brooklyn Nets,2025-03-20T23:00:00Z,Head To Head,Indiana Pacers,1.27,Brooklyn Nets,4,1.037,Pointsbet
Sacramento Kings v Chicago Bulls,2025-03-21T02:00:00Z,Head To Head,Sacramento Kings,1.36,Chicago Bulls,3.3,1.038,Pointsbet
Golden State Warriors v Toronto Raptors,2025-03-21T02:00:00Z,Head To Head,Golden State Warriors,1.1,Toronto Raptors,7.5,1.042,Pointsbet
Los Angeles Lakers v Milwaukee Bucks,2025-03-21T02:30:00Z,Head To Head,Los Angeles Lakers,2.25,Milwaukee Bucks,1.69,1.036,Pointsbet
