match,start_time,market_name,home_team,home_win,away_team,away_win,margin,agency
Oklahoma City Thunder v Sacramento Kings,2025-02-02T01:00:00Z,Head To Head,Oklahoma City Thunder,1.005,Sacramento Kings,46,1.017,Pointsbet
Minnesota Timberwolves v Washington Wizards,2025-02-02T01:00:00Z,Head To Head,Minnesota Timberwolves,1.8,Washington Wizards,1.95,1.068,Pointsbet
Houston Rockets v Brooklyn Nets,2025-02-02T01:00:00Z,Head To Head,Houston Rockets,2.05,Brooklyn Nets,1.74,1.063,Pointsbet
New York Knicks v Los Angeles Lakers,2025-02-02T01:30:00Z,Head To Head,New York Knicks,1.36,Los Angeles Lakers,3.1,1.058,Pointsbet
San Antonio Spurs v Miami Heat,2025-02-02T01:30:00Z,Head To Head,San Antonio Spurs,2,Miami Heat,1.77,1.065,Pointsbet
Portland Trail Blazers v Phoenix Suns,2025-02-02T03:00:00Z,Head To Head,Portland Trail Blazers,2.4,Phoenix Suns,1.59,1.046,Pointsbet
Philadelphia 76ers v Boston Celtics,2025-02-02T23:00:00Z,Head To Head,Philadelphia 76ers,4.75,Boston Celtics,1.2,1.044,Pointsbet
Milwaukee Bucks v Memphis Grizzlies,2025-02-03T01:30:00Z,Head To Head,Milwaukee Bucks,1.53,Memphis Grizzlies,2.6,1.038,Pointsbet
