match,start_time,market_name,home_team,home_win,away_team,away_win,margin,agency
Oklahoma City Thunder v Dallas Mavericks,2024-11-18T00:10:00Z,Head To Head,Oklahoma City Thunder,26,Dallas Mavericks,1.01,1.029,Pointsbet
Los Angeles Clippers v Utah Jazz,2024-11-18T02:00:00Z,Head To Head,Los Angeles Clippers,1.1,Utah Jazz,6.5,1.063,Pointsbet
New York Knicks v Washington Wizards,2024-11-19T00:30:00Z,Head To Head,New York Knicks,1.1,Washington Wizards,7.5,1.042,Pointsbet
Milwaukee Bucks v Houston Rockets,2024-11-19T01:00:00Z,Head To Head,Milwaukee Bucks,1.67,Houston Rockets,2.3,1.034,Pointsbet
Phoenix Suns v Orlando Magic,2024-11-19T02:00:00Z,Head To Head,Phoenix Suns,1.8,Orlando Magic,2.05,1.043,Pointsbet
Sacramento Kings v Atlanta Hawks,2024-11-19T03:00:00Z,Head To Head,Sacramento Kings,1.5,Atlanta Hawks,2.65,1.044,Pointsbet
Boston Celtics v Cleveland Cavaliers,2024-11-20T00:00:00Z,Head To Head,Boston Celtics,1.57,Cleveland Cavaliers,2.45,1.045,Pointsbet
Memphis Grizzlies v Denver Nuggets,2024-11-20T01:00:00Z,Head To Head,Memphis Grizzlies,1.67,Denver Nuggets,2.3,1.034,Pointsbet
Dallas Mavericks v New Orleans Pelicans,2024-11-20T01:30:00Z,Head To Head,Dallas Mavericks,1.17,New Orleans Pelicans,5.25,1.045,Pointsbet
