match,start_time,market_name,home_team,home_win,away_team,away_win,margin,agency
Philadelphia 76ers v Orlando Magic,2024-12-05T00:40:00Z,Head To Head,Philadelphia 76ers,1,Orlando Magic,1,2,Pointsbet
Milwaukee Bucks v Atlanta Hawks,2024-12-05T01:00:00Z,Head To Head,Milwaukee Bucks,5,Atlanta Hawks,1.16,1.062,Pointsbet
Los Angeles Clippers v Minnesota Timberwolves,2024-12-05T03:30:00Z,Head To Head,Los Angeles Clippers,2.45,Minnesota Timberwolves,1.57,1.045,Pointsbet
Cleveland Cavaliers v Denver Nuggets,2024-12-06T00:00:00Z,Head To Head,Cleveland Cavaliers,1.59,Denver Nuggets,2.4,1.046,Pointsbet
New York Knicks v Charlotte Hornets,2024-12-06T00:30:00Z,Head To Head,New York Knicks,1.07,Charlotte Hornets,9,1.046,Pointsbet
Toronto Raptors v Oklahoma City Thunder,2024-12-06T00:30:00Z,Head To Head,Toronto Raptors,4.5,Oklahoma City Thunder,1.22,1.042,Pointsbet
