match,start_time,market_name,home_team,home_win,away_team,away_win,margin,agency
Charlotte Hornets v Philadelphia 76ers,2024-12-17T00:00:00Z,Head To Head,Charlotte Hornets,3.1,Philadelphia 76ers,1.36,1.058,Pointsbet
Detroit Pistons v Miami Heat,2024-12-17T00:00:00Z,Head To Head,Detroit Pistons,1.71,Miami Heat,2.1,1.061,Pointsbet
Toronto Raptors v Chicago Bulls,2024-12-17T00:30:00Z,Head To Head,Toronto Raptors,1.87,Chicago Bulls,1.87,1.07,Pointsbet
Brooklyn Nets v Cleveland Cavaliers,2024-12-17T00:30:00Z,Head To Head,Brooklyn Nets,3.3,Cleveland Cavaliers,1.31,1.066,Pointsbet
Sacramento Kings v Denver Nuggets,2024-12-17T03:00:00Z,Head To Head,Sacramento Kings,1.83,Denver Nuggets,2,1.046,Pointsbet
Los Angeles Clippers v Utah Jazz,2024-12-17T03:30:00Z,Head To Head,Los Angeles Clippers,1.31,Utah Jazz,3.5,1.049,Pointsbet
