match,start_time,market_name,home_team,home_win,away_team,away_win,margin,agency
Utah Jazz v Chicago Bulls,2025-03-18T01:00:00Z,Head To Head,Utah Jazz,9,Chicago Bulls,1.07,1.046,Pointsbet
Golden State Warriors v Denver Nuggets,2025-03-18T02:00:00Z,Head To Head,Golden State Warriors,1.57,Denver Nuggets,2.35,1.062,Pointsbet
Sacramento Kings v Memphis Grizzlies,2025-03-18T02:00:00Z,Head To Head,Sacramento Kings,1.17,Memphis Grizzlies,4.75,1.065,Pointsbet
Phoenix Suns v Toronto Raptors,2025-03-18T02:00:00Z,Head To Head,Phoenix Suns,1.02,Toronto Raptors,16,1.043,Pointsbet
Portland Trail Blazers v Washington Wizards,2025-03-18T02:00:00Z,Head To Head,Portland Trail Blazers,1.36,Washington Wizards,3.1,1.058,Pointsbet
Los Angeles Lakers v San Antonio Spurs,2025-03-18T02:30:00Z,Head To Head,Los Angeles Lakers,1.22,San Antonio Spurs,4.1,1.064,Pointsbet
Charlotte Hornets v Atlanta Hawks,2025-03-18T23:00:00Z,Head To Head,Charlotte Hornets,3.2,Atlanta Hawks,1.36,1.048,Pointsbet
Boston Celtics v Brooklyn Nets,2025-03-18T23:30:00Z,Head To Head,Boston Celtics,1.11,Brooklyn Nets,7,1.044,Pointsbet
Los Angeles Clippers v Cleveland Cavaliers,2025-03-19T02:30:00Z,Head To Head,Los Angeles Clippers,2.35,Cleveland Cavaliers,1.63,1.039,Pointsbet
