match,start_time,market_name,home_team,home_win,away_team,away_win,margin,agency
Boston Celtics v Orlando Magic,2025-01-18T00:00:00Z,Head To Head,Boston Celtics,1.05,Orlando Magic,10,1.052,Pointsbet
Milwaukee Bucks v Toronto Raptors,2025-01-18T01:10:00Z,Head To Head,Milwaukee Bucks,1.17,Toronto Raptors,5.25,1.045,Pointsbet
Chicago Bulls v Charlotte Hornets,2025-01-18T01:10:00Z,Head To Head,Chicago Bulls,1.57,Charlotte Hornets,2.45,1.045,Pointsbet
New Orleans Pelicans v Utah Jazz,2025-01-18T01:10:00Z,Head To Head,New Orleans Pelicans,1.16,Utah Jazz,5.5,1.044,Pointsbet
Miami Heat v Denver Nuggets,2025-01-18T01:10:00Z,Head To Head,Miami Heat,2.35,Denver Nuggets,1.63,1.039,Pointsbet
Dallas Mavericks v Oklahoma City Thunder,2025-01-18T01:40:00Z,Head To Head,Dallas Mavericks,2.85,Oklahoma City Thunder,1.44,1.045,Pointsbet
San Antonio Spurs v Memphis Grizzlies,2025-01-18T02:40:00Z,Head To Head,San Antonio Spurs,2.15,Memphis Grizzlies,1.74,1.04,Pointsbet
Los Angeles Lakers v Brooklyn Nets,2025-01-18T03:40:00Z,Head To Head,Los Angeles Lakers,1.17,Brooklyn Nets,5.25,1.045,Pointsbet
