match,start_time,market_name,home_team,home_win,away_team,away_win,margin,agency
Detroit Pistons v Charlotte Hornets,2024-03-11T23:00:00Z,Head To Head,Detroit Pistons,1.59,Charlotte Hornets,2.4,1.046,Pointsbet
Cleveland Cavaliers v Phoenix Suns,2024-03-11T23:30:00Z,Head To Head,Cleveland Cavaliers,3,Phoenix Suns,1.4,1.048,Pointsbet
Chicago Bulls v Dallas Mavericks,2024-03-12T00:00:00Z,Head To Head,Chicago Bulls,2.4,Dallas Mavericks,1.59,1.046,Pointsbet
San Antonio Spurs v Golden State Warriors,2024-03-12T00:00:00Z,Head To Head,San Antonio Spurs,2.6,Golden State Warriors,1.53,1.038,Pointsbet
Denver Nuggets v Toronto Raptors,2024-03-12T01:00:00Z,Head To Head,Denver Nuggets,1.09,Toronto Raptors,8,1.042,Pointsbet
Portland Trail Blazers v Boston Celtics,2024-03-12T02:30:00Z,Head To Head,Portland Trail Blazers,4.5,Boston Celtics,1.22,1.042,Pointsbet
