match,start_time,market_name,home_team,home_win,away_team,away_win,margin,agency
New Orleans Pelicans v Los Angeles Clippers,2024-12-31T01:10:00Z,Head To Head,New Orleans Pelicans,5.25,Los Angeles Clippers,1.14,1.068,Pointsbet
Utah Jazz v Denver Nuggets,2024-12-31T02:00:00Z,Head To Head,Utah Jazz,2.5,Denver Nuggets,1.5,1.067,Pointsbet
Golden State Warriors v Cleveland Cavaliers,2024-12-31T03:00:00Z,Head To Head,Golden State Warriors,2.05,Cleveland Cavaliers,1.74,1.063,Pointsbet
Sacramento Kings v Dallas Mavericks,2024-12-31T03:00:00Z,Head To Head,Sacramento Kings,1.31,Dallas Mavericks,3.3,1.066,Pointsbet
Portland Trail Blazers v Philadelphia 76ers,2024-12-31T03:10:00Z,Head To Head,Portland Trail Blazers,3.1,Philadelphia 76ers,1.36,1.058,Pointsbet
Indiana Pacers v Milwaukee Bucks,2024-12-31T20:00:00Z,Head To Head,Indiana Pacers,1.87,Milwaukee Bucks,1.95,1.048,Pointsbet
Oklahoma City Thunder v Minnesota Timberwolves,2025-01-01T01:00:00Z,Head To Head,Oklahoma City Thunder,1.36,Minnesota Timberwolves,3.3,1.038,Pointsbet
