match,start_time,market_name,home_team,home_win,away_team,away_win,margin,agency
Oklahoma City Thunder v Dallas Mavericks,2025-01-24T01:00:00Z,Head To Head,Oklahoma City Thunder,16,Dallas Mavericks,1.02,1.043,Pointsbet
Denver Nuggets v Sacramento Kings,2025-01-24T02:00:00Z,Head To Head,Denver Nuggets,1.03,Sacramento Kings,13,1.048,Pointsbet
Los Angeles Lakers v Boston Celtics,2025-01-24T03:00:00Z,Head To Head,Los Angeles Lakers,2.3,Boston Celtics,1.59,1.064,Pointsbet
Golden State Warriors v Chicago Bulls,2025-01-24T03:00:00Z,Head To Head,Golden State Warriors,1.95,Chicago Bulls,1.8,1.068,Pointsbet
Los Angeles Clippers v Washington Wizards,2025-01-24T03:40:00Z,Head To Head,Los Angeles Clippers,1.08,Washington Wizards,8.5,1.044,Pointsbet
Philadelphia 76ers v Cleveland Cavaliers,2025-01-25T00:00:00Z,Head To Head,Philadelphia 76ers,4.5,Cleveland Cavaliers,1.22,1.042,Pointsbet
Charlotte Hornets v Portland Trail Blazers,2025-01-25T00:00:00Z,Head To Head,Charlotte Hornets,1.56,Portland Trail Blazers,2.5,1.041,Pointsbet
Memphis Grizzlies v New Orleans Pelicans,2025-01-25T01:00:00Z,Head To Head,Memphis Grizzlies,1.16,New Orleans Pelicans,5.5,1.044,Pointsbet
