match,start_time,market_name,home_team,home_win,away_team,away_win,margin,agency
Charlotte Hornets v Orlando Magic,2024-03-06T00:00:00Z,Head To Head,Charlotte Hornets,4,Orlando Magic,1.27,1.037,Pointsbet
Toronto Raptors v New Orleans Pelicans,2024-03-06T00:30:00Z,Head To Head,Toronto Raptors,4.5,New Orleans Pelicans,1.22,1.042,Pointsbet
Miami Heat v Detroit Pistons,2024-03-06T00:30:00Z,Head To Head,Miami Heat,1.16,Detroit Pistons,5.5,1.044,Pointsbet
Brooklyn Nets v Philadelphia 76ers,2024-03-06T00:30:00Z,Head To Head,Brooklyn Nets,2.3,Philadelphia 76ers,1.67,1.034,Pointsbet
New York Knicks v Atlanta Hawks,2024-03-06T00:30:00Z,Head To Head,New York Knicks,1.71,Atlanta Hawks,2.2,1.039,Pointsbet
Cleveland Cavaliers v Boston Celtics,2024-03-06T00:30:00Z,Head To Head,Cleveland Cavaliers,3.6,Boston Celtics,1.29,1.053,Pointsbet
Houston Rockets v San Antonio Spurs,2024-03-06T01:00:00Z,Head To Head,Houston Rockets,1.31,San Antonio Spurs,3.5,1.049,Pointsbet
Dallas Mavericks v Indiana Pacers,2024-03-06T01:30:00Z,Head To Head,Dallas Mavericks,1.56,Indiana Pacers,2.5,1.041,Pointsbet
Denver Nuggets v Phoenix Suns,2024-03-06T03:00:00Z,Head To Head,Denver Nuggets,1.24,Phoenix Suns,4.3,1.039,Pointsbet
