match,start_time,market_name,home_team,home_win,away_team,away_win,margin,agency
Detroit Pistons v Washington Wizards,2025-03-13T23:10:00Z,Head To Head,Detroit Pistons,1.11,Washington Wizards,7,1.044,Pointsbet
Milwaukee Bucks v Los Angeles Lakers,2025-03-13T23:40:00Z,Head To Head,Milwaukee Bucks,1.36,Los Angeles Lakers,3.2,1.048,Pointsbet
Chicago Bulls v Brooklyn Nets,2025-03-14T00:00:00Z,Head To Head,Chicago Bulls,1.8,Brooklyn Nets,2.05,1.043,Pointsbet
New Orleans Pelicans v Orlando Magic,2025-03-14T00:00:00Z,Head To Head,New Orleans Pelicans,2.1,Orlando Magic,1.77,1.041,Pointsbet
Golden State Warriors v Sacramento Kings,2025-03-14T02:00:00Z,Head To Head,Golden State Warriors,1.36,Sacramento Kings,3.3,1.038,Pointsbet
