match,start_time,market_name,home_team,home_win,away_team,away_win,margin,agency
New Orleans Pelicans v Sacramento Kings,2025-02-14T01:00:00Z,Head To Head,New Orleans Pelicans,1.95,Sacramento Kings,1.8,1.068,Pointsbet
Houston Rockets v Golden State Warriors,2025-02-14T01:00:00Z,Head To Head,Houston Rockets,7,Golden State Warriors,1.09,1.06,Pointsbet
Minnesota Timberwolves v Oklahoma City Thunder,2025-02-14T01:30:00Z,Head To Head,Minnesota Timberwolves,2.45,Oklahoma City Thunder,1.53,1.062,Pointsbet
Dallas Mavericks v Miami Heat,2025-02-14T01:30:00Z,Head To Head,Dallas Mavericks,2.5,Miami Heat,1.5,1.067,Pointsbet
Utah Jazz v Los Angeles Clippers,2025-02-14T02:00:00Z,Head To Head,Utah Jazz,1.83,Los Angeles Clippers,1.9,1.073,Pointsbet
