match,start_time,market_name,home_team,home_win,away_team,away_win,margin,agency
Detroit Pistons v San Antonio Spurs,2024-03-26,Head To Head,Detroit Pistons,1.26,San Antonio Spurs,4.05,1.041,Sportsbet
Charlotte Hornets v Orlando Magic,2024-03-26,Head To Head,Charlotte Hornets,2.63,Orlando Magic,1.51,1.042,Sportsbet
Miami Heat v Golden State Warriors,2024-03-26,Head To Head,Miami Heat,2.57,Golden State Warriors,1.53,1.043,Sportsbet
New York Knicks v Dallas Mavericks,2024-03-26,Head To Head,New York Knicks,1.2,Dallas Mavericks,4.85,1.04,Sportsbet
Houston Rockets v Atlanta Hawks,2024-03-26,Head To Head,Houston Rockets,1.32,Atlanta Hawks,3.55,1.039,Sportsbet
Utah Jazz v Memphis Grizzlies,2024-03-26,Head To Head,Utah Jazz,4.85,Memphis Grizzlies,1.2,1.04,Sportsbet
Sacramento Kings v Oklahoma City Thunder,2024-03-26,Head To Head,Sacramento Kings,4.15,Oklahoma City Thunder,1.25,1.041,Sportsbet
Portland Trail Blazers v Cleveland Cavaliers,2024-03-26,Head To Head,Portland Trail Blazers,2.98,Cleveland Cavaliers,1.42,1.04,Sportsbet
