match,start_time,market_name,home_team,home_win,away_team,away_win,margin,agency
Minnesota Timberwolves v Boston Celtics,2024-01-03,Head To Head,Minnesota Timberwolves,2.17,Boston Celtics,1.72,1.042,Sportsbet
Miami Heat v Indiana Pacers,2024-01-03,Head To Head,Miami Heat,1.78,Indiana Pacers,2.09,1.04,Sportsbet
Oklahoma City Thunder v Los Angeles Clippers,2024-01-03,Head To Head,Oklahoma City Thunder,1.14,Los Angeles Clippers,6.1,1.041,Sportsbet
Milwaukee Bucks v Brooklyn Nets,2024-01-03,Head To Head,Milwaukee Bucks,1.11,Brooklyn Nets,7,1.044,Sportsbet
Golden State Warriors v Philadelphia 76ers,2024-01-03,Head To Head,Golden State Warriors,1.62,Philadelphia 76ers,2.36,1.041,Sportsbet
Los Angeles Lakers v Portland Trail Blazers,2024-01-03,Head To Head,Los Angeles Lakers,1.34,Portland Trail Blazers,3.38,1.042,Sportsbet
Detroit Pistons v Charlotte Hornets,2024-01-04,Head To Head,Detroit Pistons,1.43,Charlotte Hornets,2.93,1.041,Sportsbet
