match,start_time,market_name,home_team,home_win,away_team,away_win,margin,agency
Orlando Magic v New York Knicks,2023-12-28,Head To Head,Orlando Magic,3.18,New York Knicks,1.38,1.039,Sportsbet
Brooklyn Nets v San Antonio Spurs,2023-12-28,Head To Head,Brooklyn Nets,3.55,San Antonio Spurs,1.31,1.045,Sportsbet
Boston Celtics v Indiana Pacers,2023-12-28,Head To Head,Boston Celtics,1.14,Indiana Pacers,6.15,1.04,Sportsbet
New Orleans Pelicans v Memphis Grizzlies,2023-12-28,Head To Head,New Orleans Pelicans,3.48,Memphis Grizzlies,1.33,1.039,Sportsbet
Houston Rockets v Minnesota Timberwolves,2023-12-28,Head To Head,Houston Rockets,1.87,Minnesota Timberwolves,1.97,1.042,Sportsbet
Phoenix Suns v Dallas Mavericks,2023-12-28,Head To Head,Phoenix Suns,1.83,Dallas Mavericks,2.02,1.041,Sportsbet
Denver Nuggets v Cleveland Cavaliers,2023-12-28,Head To Head,Denver Nuggets,2.25,Cleveland Cavaliers,1.68,1.04,Sportsbet
Los Angeles Clippers v Golden State Warriors,2023-12-28,Head To Head,Los Angeles Clippers,1.45,Golden State Warriors,2.86,1.039,Sportsbet
