match,start_time,market_name,home_team,home_win,away_team,away_win,margin,agency
Toronto Raptors v New York Knicks,2023-12-10,Head To Head,Toronto Raptors,3.65,New York Knicks,1.3,1.043,Sportsbet
Milwaukee Bucks v Orlando Magic,2023-12-11,Head To Head,Milwaukee Bucks,1.35,Orlando Magic,3.35,1.039,Sportsbet
Oklahoma City Thunder v Dallas Mavericks,2023-12-11,Head To Head,Oklahoma City Thunder,1.55,Dallas Mavericks,2.53,1.04,Sportsbet
New York Knicks v Atlanta Hawks,2023-12-12,Head To Head,New York Knicks,1.34,Atlanta Hawks,3.4,1.04,Sportsbet
Houston Rockets v Golden State Warriors,2023-12-12,Head To Head,Houston Rockets,1.7,Golden State Warriors,2.21,1.041,Sportsbet
