match,start_time,market_name,home_team,home_win,away_team,away_win,margin,agency
Indiana Pacers v Brooklyn Nets,2024-03-23,Head To Head,Indiana Pacers,1.21,Brooklyn Nets,4.7,1.039,Sportsbet
Atlanta Hawks v Golden State Warriors,2024-03-23,Head To Head,Atlanta Hawks,2.15,Golden State Warriors,1.74,1.04,Sportsbet
New York Knicks v Washington Wizards,2024-03-23,Head To Head,New York Knicks,1.07,Washington Wizards,9.5,1.04,Sportsbet
Sacramento Kings v Milwaukee Bucks,2024-03-23,Head To Head,Sacramento Kings,1.74,Milwaukee Bucks,2.15,1.04,Sportsbet
Los Angeles Lakers v Chicago Bulls,2024-03-23,Head To Head,Los Angeles Lakers,1.23,Chicago Bulls,4.4,1.04,Sportsbet
