match,start_time,market_name,home_team,home_win,away_team,away_win,margin,agency
Washington Wizards v Toronto Raptors,2024-03-25,Head To Head,Washington Wizards,1.81,Toronto Raptors,2.04,1.043,Sportsbet
Orlando Magic v Los Angeles Lakers,2024-03-25,Head To Head,Orlando Magic,2.53,Los Angeles Lakers,1.55,1.04,Sportsbet
Indiana Pacers v Minnesota Timberwolves,2024-03-25,Head To Head,Indiana Pacers,1.75,Minnesota Timberwolves,2.12,1.043,Sportsbet
Brooklyn Nets v Dallas Mavericks,2024-03-25,Head To Head,Brooklyn Nets,2.09,Dallas Mavericks,1.78,1.04,Sportsbet
New Orleans Pelicans v Philadelphia 76ers,2024-03-25,Head To Head,New Orleans Pelicans,1.44,Philadelphia 76ers,2.89,1.04,Sportsbet
Denver Nuggets v Chicago Bulls,2024-03-25,Head To Head,Denver Nuggets,1.64,Chicago Bulls,2.32,1.041,Sportsbet
Phoenix Suns v Milwaukee Bucks,2024-03-25,Head To Head,Phoenix Suns,1.68,Milwaukee Bucks,2.24,1.042,Sportsbet
Sacramento Kings v Boston Celtics,2024-03-25,Head To Head,Sacramento Kings,2.35,Boston Celtics,1.63,1.039,Sportsbet
