match,start_time,market_name,home_team,home_win,away_team,away_win,margin,agency
Atlanta Hawks v New York Knicks,2024-04-06,Head To Head,Atlanta Hawks,2.36,New York Knicks,1.62,1.041,Sportsbet
Philadelphia 76ers v Minnesota Timberwolves,2024-04-06,Head To Head,Philadelphia 76ers,10,Minnesota Timberwolves,1.06,1.043,Sportsbet
Detroit Pistons v Memphis Grizzlies,2024-04-06,Head To Head,Detroit Pistons,2.27,Memphis Grizzlies,1.67,1.039,Sportsbet
Miami Heat v Milwaukee Bucks,2024-04-06,Head To Head,Miami Heat,1.85,Milwaukee Bucks,2,1.041,Sportsbet
Los Angeles Clippers v Dallas Mavericks,2024-04-06,Head To Head,Los Angeles Clippers,1.28,Dallas Mavericks,3.85,1.041,Sportsbet
Oklahoma City Thunder v Los Angeles Lakers,2024-04-07,Head To Head,Oklahoma City Thunder,1.26,Los Angeles Lakers,4.05,1.041,Sportsbet
