match,start_time,market_name,home_team,home_win,away_team,away_win,margin,agency
Charlotte Hornets v Utah Jazz,2024-04-01,Head To Head,Charlotte Hornets,1.82,Utah Jazz,2.03,1.042,Sportsbet
Orlando Magic v Los Angeles Clippers,2024-04-01,Head To Head,Orlando Magic,2.21,Los Angeles Clippers,1.7,1.041,Sportsbet
Indiana Pacers v Sacramento Kings,2024-04-01,Head To Head,Indiana Pacers,1.46,Sacramento Kings,2.82,1.04,Sportsbet
Washington Wizards v Miami Heat,2024-04-01,Head To Head,Washington Wizards,3.95,Miami Heat,1.27,1.041,Sportsbet
Memphis Grizzlies v Boston Celtics,2024-04-01,Head To Head,Memphis Grizzlies,2.66,Boston Celtics,1.5,1.043,Sportsbet
Oklahoma City Thunder v Chicago Bulls,2024-04-01,Head To Head,Oklahoma City Thunder,1.08,Chicago Bulls,8.5,1.044,Sportsbet
Dallas Mavericks v Brooklyn Nets,2024-04-01,Head To Head,Dallas Mavericks,1.25,Brooklyn Nets,4.15,1.041,Sportsbet
Los Angeles Lakers v Houston Rockets,2024-04-01,Head To Head,Los Angeles Lakers,1.55,Houston Rockets,2.54,1.039,Sportsbet
