match,start_time,market_name,home_team,home_win,away_team,away_win,margin,agency
Boston Celtics v Atlanta Hawks,2023-11-13,Head To Head,Boston Celtics,1.08,Atlanta Hawks,8,1.051,Sportsbet
Orlando Magic v Charlotte Hornets,2023-11-13,Head To Head,Orlando Magic,1.3,Charlotte Hornets,3.56,1.05,Sportsbet
Detroit Pistons v Miami Heat,2023-11-13,Head To Head,Detroit Pistons,2.02,Miami Heat,1.82,1.045,Sportsbet
Philadelphia 76ers v New York Knicks,2023-11-13,Head To Head,Philadelphia 76ers,2.3,New York Knicks,1.62,1.052,Sportsbet
Milwaukee Bucks v Toronto Raptors,2023-11-13,Head To Head,Milwaukee Bucks,1.26,Toronto Raptors,3.9,1.05,Sportsbet
Utah Jazz v Phoenix Suns,2023-11-13,Head To Head,Utah Jazz,2.78,Phoenix Suns,1.45,1.049,Sportsbet
Golden State Warriors v Dallas Mavericks,2023-11-13,Head To Head,Golden State Warriors,1.68,Dallas Mavericks,2.19,1.052,Sportsbet
Portland Trail Blazers v Minnesota Timberwolves,2023-11-13,Head To Head,Portland Trail Blazers,4.1,Minnesota Timberwolves,1.24,1.05,Sportsbet
