match,start_time,market_name,home_team,home_win,away_team,away_win,margin,agency
Charlotte Hornets v Washington Wizards,2024-03-02,Head To Head,Charlotte Hornets,1.54,Washington Wizards,2.55,1.042,Sportsbet
Detroit Pistons v Brooklyn Nets,2024-03-02,Head To Head,Detroit Pistons,1.16,Brooklyn Nets,5.65,1.039,Sportsbet
Houston Rockets v Sacramento Kings,2024-03-02,Head To Head,Houston Rockets,1.55,Sacramento Kings,2.52,1.042,Sportsbet
Memphis Grizzlies v San Antonio Spurs,2024-03-02,Head To Head,Memphis Grizzlies,1.34,San Antonio Spurs,3.39,1.041,Sportsbet
Dallas Mavericks v Milwaukee Bucks,2024-03-02,Head To Head,Dallas Mavericks,2.24,Milwaukee Bucks,1.68,1.042,Sportsbet
Philadelphia 76ers v Golden State Warriors,2024-03-02,Head To Head,Philadelphia 76ers,3.75,Golden State Warriors,1.29,1.042,Sportsbet
