match,start_time,market_name,home_team,home_win,away_team,away_win,margin,agency
Philadelphia 76ers v Washington Wizards,2024-03-27,Head To Head,Philadelphia 76ers,1.65,Washington Wizards,2.29,1.043,Sportsbet
Indiana Pacers v Los Angeles Lakers,2024-03-27,Head To Head,Indiana Pacers,1.99,Los Angeles Lakers,1.86,1.04,Sportsbet
New York Knicks v Los Angeles Clippers,2024-03-27,Head To Head,New York Knicks,2.63,Los Angeles Clippers,1.51,1.042,Sportsbet
Brooklyn Nets v Toronto Raptors,2024-03-27,Head To Head,Brooklyn Nets,1.71,Toronto Raptors,2.2,1.039,Sportsbet
Denver Nuggets v Milwaukee Bucks,2024-03-27,Head To Head,Denver Nuggets,1.2,Milwaukee Bucks,4.75,1.044,Sportsbet
Phoenix Suns v Boston Celtics,2024-03-27,Head To Head,Phoenix Suns,2.81,Boston Celtics,1.46,1.041,Sportsbet
