match,start_time,market_name,home_team,home_win,away_team,away_win,margin,agency
Washington Wizards v Orlando Magic,2024-04-04,Head To Head,Washington Wizards,10,Orlando Magic,1.06,1.043,Sportsbet
Philadelphia 76ers v Milwaukee Bucks,2024-04-04,Head To Head,Philadelphia 76ers,6.4,Milwaukee Bucks,1.13,1.041,Sportsbet
Miami Heat v Memphis Grizzlies,2024-04-04,Head To Head,Miami Heat,2.81,Memphis Grizzlies,1.46,1.041,Sportsbet
Toronto Raptors v Portland Trail Blazers,2024-04-04,Head To Head,Toronto Raptors,2.69,Portland Trail Blazers,1.5,1.038,Sportsbet
Brooklyn Nets v Minnesota Timberwolves,2024-04-04,Head To Head,Brooklyn Nets,7,Minnesota Timberwolves,1.11,1.044,Sportsbet
Los Angeles Lakers v Golden State Warriors,2024-04-04,Head To Head,Los Angeles Lakers,1.87,Golden State Warriors,1.97,1.042,Sportsbet
