match,start_time,market_name,home_team,home_win,away_team,away_win,margin,agency
Washington Wizards v Utah Jazz,2024-03-06,Head To Head,Washington Wizards,1.49,Utah Jazz,2.7,1.042,Sportsbet
Cleveland Cavaliers v Miami Heat,2024-03-06,Head To Head,Cleveland Cavaliers,1.15,Miami Heat,5.85,1.041,Sportsbet
Charlotte Hornets v Minnesota Timberwolves,2024-03-06,Head To Head,Charlotte Hornets,3.7,Minnesota Timberwolves,1.3,1.04,Sportsbet
Boston Celtics v Portland Trail Blazers,2024-03-06,Head To Head,Boston Celtics,1.24,Portland Trail Blazers,4.3,1.039,Sportsbet
Milwaukee Bucks v Dallas Mavericks,2024-03-06,Head To Head,Milwaukee Bucks,1.17,Dallas Mavericks,5.3,1.043,Sportsbet
Denver Nuggets v Sacramento Kings,2024-03-06,Head To Head,Denver Nuggets,1.43,Sacramento Kings,2.94,1.039,Sportsbet
Memphis Grizzlies v Oklahoma City Thunder,2024-03-06,Head To Head,Memphis Grizzlies,3.44,Oklahoma City Thunder,1.34,1.037,Sportsbet
Los Angeles Clippers v Detroit Pistons,2024-03-06,Head To Head,Los Angeles Clippers,2.67,Detroit Pistons,1.5,1.041,Sportsbet
