match,start_time,market_name,home_team,home_win,away_team,away_win,margin,agency
Indiana Pacers v Chicago Bulls,2024-01-09,Head To Head,Indiana Pacers,1.47,Chicago Bulls,2.77,1.041,Sportsbet
Cleveland Cavaliers v Oklahoma City Thunder,2024-01-09,Head To Head,Cleveland Cavaliers,1.68,Oklahoma City Thunder,2.24,1.042,Sportsbet
Philadelphia 76ers v Washington Wizards,2024-01-09,Head To Head,Philadelphia 76ers,1.19,Washington Wizards,4.95,1.042,Sportsbet
New York Knicks v Toronto Raptors,2024-01-09,Head To Head,New York Knicks,1.14,Toronto Raptors,6.1,1.041,Sportsbet
Brooklyn Nets v Detroit Pistons,2024-01-09,Head To Head,Brooklyn Nets,4.25,Detroit Pistons,1.24,1.042,Sportsbet
New Orleans Pelicans v Portland Trail Blazers,2024-01-09,Head To Head,New Orleans Pelicans,1.82,Portland Trail Blazers,2.03,1.042,Sportsbet
Denver Nuggets v Los Angeles Clippers,2024-01-09,Head To Head,Denver Nuggets,2.13,Los Angeles Clippers,1.76,1.038,Sportsbet
Milwaukee Bucks v San Antonio Spurs,2024-01-09,Head To Head,Milwaukee Bucks,1.58,San Antonio Spurs,2.45,1.041,Sportsbet
