match,start_time,market_name,home_team,home_win,away_team,away_win,margin,agency
Charlotte Hornets v Atlanta Hawks,2023-12-01,Head To Head,Charlotte Hornets,2.97,Atlanta Hawks,1.42,1.041,Sportsbet
Detroit Pistons v Philadelphia 76ers,2023-12-01,Head To Head,Detroit Pistons,1.84,Philadelphia 76ers,2.01,1.041,Sportsbet
Milwaukee Bucks v Washington Wizards,2023-12-01,Head To Head,Milwaukee Bucks,1.09,Washington Wizards,8,1.042,Sportsbet
Phoenix Suns v Golden State Warriors,2023-12-01,Head To Head,Phoenix Suns,1.72,Golden State Warriors,2.18,1.04,Sportsbet
Utah Jazz v Dallas Mavericks,2023-12-01,Head To Head,Utah Jazz,3.27,Dallas Mavericks,1.36,1.041,Sportsbet
Brooklyn Nets v Orlando Magic,2023-12-02,Head To Head,Brooklyn Nets,3.85,Orlando Magic,1.28,1.041,Sportsbet
Cleveland Cavaliers v Boston Celtics,2023-12-02,Head To Head,Cleveland Cavaliers,2.08,Boston Celtics,1.78,1.043,Sportsbet
Toronto Raptors v Miami Heat,2023-12-02,Head To Head,Toronto Raptors,2.77,Miami Heat,1.47,1.041,Sportsbet
