match,start_time,market_name,home_team,home_win,away_team,away_win,margin,agency
Indiana Pacers v New Orleans Pelicans,2023-12-16,Head To Head,Indiana Pacers,1.35,New Orleans Pelicans,3.32,1.042,Sportsbet
Washington Wizards v Boston Celtics,2023-12-16,Head To Head,Washington Wizards,13,Boston Celtics,1.04,1.038,Sportsbet
Orlando Magic v New York Knicks,2023-12-16,Head To Head,Orlando Magic,2.63,New York Knicks,1.51,1.042,Sportsbet
San Antonio Spurs v Minnesota Timberwolves,2023-12-16,Head To Head,San Antonio Spurs,2.6,Minnesota Timberwolves,1.52,1.043,Sportsbet
Phoenix Suns v Portland Trail Blazers,2023-12-16,Head To Head,Phoenix Suns,1.15,Portland Trail Blazers,5.85,1.041,Sportsbet
Golden State Warriors v Dallas Mavericks,2023-12-16,Head To Head,Golden State Warriors,2.26,Dallas Mavericks,1.67,1.041,Sportsbet
Los Angeles Lakers v Memphis Grizzlies,2023-12-16,Head To Head,Los Angeles Lakers,2.5,Memphis Grizzlies,1.56,1.041,Sportsbet
Milwaukee Bucks v Oklahoma City Thunder,2023-12-18,Head To Head,Milwaukee Bucks,2.58,Oklahoma City Thunder,1.53,1.041,Sportsbet
