match,start_time,market_name,home_team,home_win,away_team,away_win,margin,agency
Indiana Pacers v New Orleans Pelicans,NA,Head To Head,Indiana Pacers,1.4,New Orleans Pelicans,2.96,1.052,Sportsbet
Minnesota Timberwolves v Memphis Grizzlies,NA,Head To Head,Minnesota Timberwolves,1.13,Memphis Grizzlies,6.05,1.05,Sportsbet
Toronto Raptors v Dallas Mavericks,NA,Head To Head,Toronto Raptors,2.14,Dallas Mavericks,1.71,1.052,Sportsbet
Chicago Bulls v Cleveland Cavaliers,NA,Head To Head,Chicago Bulls,2.64,Cleveland Cavaliers,1.49,1.05,Sportsbet
Denver Nuggets v Sacramento Kings,NA,Head To Head,Denver Nuggets,1.31,Sacramento Kings,3.48,1.051,Sportsbet
Los Angeles Clippers v Los Angeles Lakers,NA,Head To Head,Los Angeles Clippers,1.65,Los Angeles Lakers,2.25,1.051,Sportsbet
