match,start_time,market_name,home_team,home_win,away_team,away_win,margin,agency
Miami Heat v San Antonio Spurs,2024-01-20,Head To Head,Miami Heat,1.65,San Antonio Spurs,2.29,1.043,Sportsbet
Orlando Magic v Denver Nuggets,2024-01-20,Head To Head,Orlando Magic,3.22,Denver Nuggets,1.37,1.04,Sportsbet
Milwaukee Bucks v Philadelphia 76ers,2024-01-20,Head To Head,Milwaukee Bucks,1.17,Philadelphia 76ers,5.35,1.042,Sportsbet
Oklahoma City Thunder v Brooklyn Nets,2024-01-20,Head To Head,Oklahoma City Thunder,1.04,Brooklyn Nets,11.5,1.048,Sportsbet
Portland Trail Blazers v Chicago Bulls,2024-01-20,Head To Head,Portland Trail Blazers,3.11,Chicago Bulls,1.39,1.041,Sportsbet
Los Angeles Clippers v Los Angeles Lakers,2024-01-20,Head To Head,Los Angeles Clippers,1.57,Los Angeles Lakers,2.48,1.04,Sportsbet
Sacramento Kings v Washington Wizards,2024-01-20,Head To Head,Sacramento Kings,1.06,Washington Wizards,10.5,1.039,Sportsbet
