match,start_time,market_name,home_team,home_win,away_team,away_win,margin,agency
Orlando Magic v Dallas Mavericks,2024-03-28,Head To Head,Orlando Magic,1.38,Dallas Mavericks,3.18,1.039,Sportsbet
Cleveland Cavaliers v San Antonio Spurs,2024-03-28,Head To Head,Cleveland Cavaliers,1.11,San Antonio Spurs,7,1.044,Sportsbet
Washington Wizards v Indiana Pacers,2024-03-28,Head To Head,Washington Wizards,5.2,Indiana Pacers,1.18,1.04,Sportsbet
Miami Heat v Atlanta Hawks,2024-03-28,Head To Head,Miami Heat,1.79,Atlanta Hawks,2.07,1.042,Sportsbet
Chicago Bulls v Los Angeles Lakers,2024-03-28,Head To Head,Chicago Bulls,2.34,Los Angeles Lakers,1.63,1.041,Sportsbet
Oklahoma City Thunder v Memphis Grizzlies,2024-03-28,Head To Head,Oklahoma City Thunder,1.22,Memphis Grizzlies,4.55,1.039,Sportsbet
Utah Jazz v Houston Rockets,2024-03-28,Head To Head,Utah Jazz,6.8,Houston Rockets,1.12,1.04,Sportsbet
Sacramento Kings v Portland Trail Blazers,2024-03-28,Head To Head,Sacramento Kings,1.44,Portland Trail Blazers,2.87,1.043,Sportsbet
