match,start_time,market_name,home_team,home_win,away_team,away_win,margin,agency
Charlotte Hornets v Los Angeles Clippers,2024-02-01,Head To Head,Charlotte Hornets,6.8,Los Angeles Clippers,1.12,1.04,Sportsbet
Detroit Pistons v Dallas Mavericks,2024-02-01,Head To Head,Detroit Pistons,2.01,Dallas Mavericks,1.84,1.041,Sportsbet
Philadelphia 76ers v Denver Nuggets,2024-02-01,Head To Head,Philadelphia 76ers,4.25,Denver Nuggets,1.24,1.042,Sportsbet
Toronto Raptors v Chicago Bulls,2024-02-01,Head To Head,Toronto Raptors,1.57,Chicago Bulls,2.47,1.042,Sportsbet
San Antonio Spurs v Milwaukee Bucks,2024-02-01,Head To Head,San Antonio Spurs,2.13,Milwaukee Bucks,1.75,1.041,Sportsbet
New Orleans Pelicans v Boston Celtics,2024-02-01,Head To Head,New Orleans Pelicans,5.35,Boston Celtics,1.17,1.042,Sportsbet
Golden State Warriors v Phoenix Suns,2024-02-01,Head To Head,Golden State Warriors,1.99,Phoenix Suns,1.86,1.04,Sportsbet
Indiana Pacers v Atlanta Hawks,2024-02-02,Head To Head,Indiana Pacers,1.4,Atlanta Hawks,3.09,1.038,Sportsbet
