match,start_time,market_name,home_team,home_win,away_team,away_win,margin,agency
Detroit Pistons v Cleveland Cavaliers,2024-03-29,Head To Head,Detroit Pistons,3.17,Cleveland Cavaliers,1.38,1.04,Sportsbet
Toronto Raptors v Charlotte Hornets,2024-03-29,Head To Head,Toronto Raptors,1.45,Charlotte Hornets,2.86,1.039,Sportsbet
Brooklyn Nets v Los Angeles Clippers,2024-03-29,Head To Head,Brooklyn Nets,6.8,Los Angeles Clippers,1.12,1.04,Sportsbet
Minnesota Timberwolves v Phoenix Suns,2024-03-29,Head To Head,Minnesota Timberwolves,1.34,Phoenix Suns,3.42,1.039,Sportsbet
Milwaukee Bucks v New York Knicks,2024-03-29,Head To Head,Milwaukee Bucks,1.89,New York Knicks,1.95,1.042,Sportsbet
New Orleans Pelicans v Golden State Warriors,2024-03-29,Head To Head,New Orleans Pelicans,9.5,Golden State Warriors,1.07,1.04,Sportsbet
Denver Nuggets v Utah Jazz,2024-03-29,Head To Head,Denver Nuggets,1.04,Utah Jazz,13,1.038,Sportsbet
Orlando Magic v Sacramento Kings,2024-03-30,Head To Head,Orlando Magic,2.05,Sacramento Kings,1.81,1.04,Sportsbet
Washington Wizards v Brooklyn Nets,2024-03-30,Head To Head,Washington Wizards,1.99,Brooklyn Nets,1.86,1.04,Sportsbet
