match,start_time,market_name,home_team,home_win,away_team,away_win,margin,agency
Orlando Magic v Portland Trail Blazers,2024-01-24,Head To Head,Orlando Magic,1.37,Portland Trail Blazers,3.22,1.04,Sportsbet
Atlanta Hawks v Toronto Raptors,2024-01-24,Head To Head,Atlanta Hawks,1.48,Toronto Raptors,2.73,1.042,Sportsbet
Oklahoma City Thunder v Dallas Mavericks,2024-01-24,Head To Head,Oklahoma City Thunder,1.14,Dallas Mavericks,6.15,1.04,Sportsbet
Milwaukee Bucks v Miami Heat,2024-01-24,Head To Head,Milwaukee Bucks,1.37,Miami Heat,3.21,1.041,Sportsbet
Denver Nuggets v Sacramento Kings,2024-01-24,Head To Head,Denver Nuggets,1.35,Sacramento Kings,3.33,1.041,Sportsbet
Los Angeles Lakers v Boston Celtics,2024-01-24,Head To Head,Los Angeles Lakers,3.08,Boston Celtics,1.4,1.039,Sportsbet
Golden State Warriors v Chicago Bulls,2024-01-24,Head To Head,Golden State Warriors,1.8,Chicago Bulls,2.06,1.041,Sportsbet
Los Angeles Clippers v Washington Wizards,2024-01-24,Head To Head,Los Angeles Clippers,1.09,Washington Wizards,8,1.042,Sportsbet
