match,start_time,market_name,home_team,home_win,away_team,away_win,margin,agency
Detroit Pistons v Charlotte Hornets,2024-01-04,Head To Head,Detroit Pistons,1.4,Charlotte Hornets,3.06,1.041,Sportsbet
Toronto Raptors v Orlando Magic,2024-01-04,Head To Head,Toronto Raptors,2.03,Orlando Magic,1.82,1.042,Sportsbet
Oklahoma City Thunder v New York Knicks,2024-01-04,Head To Head,Oklahoma City Thunder,1.47,New York Knicks,2.77,1.041,Sportsbet
Houston Rockets v Boston Celtics,2024-01-04,Head To Head,Houston Rockets,2.09,Boston Celtics,1.78,1.04,Sportsbet
New Orleans Pelicans v Washington Wizards,2024-01-04,Head To Head,New Orleans Pelicans,1.35,Washington Wizards,3.33,1.041,Sportsbet
Dallas Mavericks v Cleveland Cavaliers,2024-01-04,Head To Head,Dallas Mavericks,3.42,Cleveland Cavaliers,1.34,1.039,Sportsbet
Denver Nuggets v San Antonio Spurs,2024-01-04,Head To Head,Denver Nuggets,1.42,San Antonio Spurs,2.97,1.041,Sportsbet
Sacramento Kings v Memphis Grizzlies,2024-01-04,Head To Head,Sacramento Kings,1.73,Memphis Grizzlies,2.16,1.041,Sportsbet
Los Angeles Lakers v Atlanta Hawks,2024-01-04,Head To Head,Los Angeles Lakers,1.67,Atlanta Hawks,2.26,1.041,Sportsbet
