match,start_time,market_name,home_team,home_win,away_team,away_win,margin,agency
Oklahoma City Thunder v Houston Rockets,2023-12-15,Head To Head,Oklahoma City Thunder,1.46,Houston Rockets,2.81,1.041,Sportsbet
Indiana Pacers v New Orleans Pelicans,2023-12-16,Head To Head,Indiana Pacers,1.41,New Orleans Pelicans,3.03,1.039,Sportsbet
Washington Wizards v Boston Celtics,2023-12-16,Head To Head,Washington Wizards,9.5,Boston Celtics,1.07,1.04,Sportsbet
Orlando Magic v New York Knicks,2023-12-16,Head To Head,Orlando Magic,2.69,New York Knicks,1.5,1.038,Sportsbet
San Antonio Spurs v Minnesota Timberwolves,2023-12-16,Head To Head,San Antonio Spurs,2.64,Minnesota Timberwolves,1.51,1.041,Sportsbet
Phoenix Suns v Portland Trail Blazers,2023-12-16,Head To Head,Phoenix Suns,1.24,Portland Trail Blazers,4.3,1.039,Sportsbet
Golden State Warriors v Dallas Mavericks,2023-12-16,Head To Head,Golden State Warriors,2.33,Dallas Mavericks,1.63,1.043,Sportsbet
Los Angeles Lakers v Memphis Grizzlies,2023-12-16,Head To Head,Los Angeles Lakers,2.15,Memphis Grizzlies,1.74,1.04,Sportsbet
