match,start_time,market_name,home_team,home_win,away_team,away_win,margin,agency
Detroit Pistons v Charlotte Hornets,2024-01-04,Head To Head,Detroit Pistons,1.41,Charlotte Hornets,3.04,1.038,Sportsbet
Toronto Raptors v Orlando Magic,2024-01-04,Head To Head,Toronto Raptors,2.05,Orlando Magic,1.8,1.043,Sportsbet
Oklahoma City Thunder v New York Knicks,2024-01-04,Head To Head,Oklahoma City Thunder,1.54,New York Knicks,2.57,1.038,Sportsbet
Houston Rockets v Boston Celtics,2024-01-04,Head To Head,Houston Rockets,2.13,Boston Celtics,1.75,1.041,Sportsbet
New Orleans Pelicans v Washington Wizards,2024-01-04,Head To Head,New Orleans Pelicans,1.34,Washington Wizards,3.42,1.039,Sportsbet
Dallas Mavericks v Cleveland Cavaliers,2024-01-04,Head To Head,Dallas Mavericks,3.42,Cleveland Cavaliers,1.34,1.039,Sportsbet
Denver Nuggets v San Antonio Spurs,2024-01-04,Head To Head,Denver Nuggets,1.43,San Antonio Spurs,2.94,1.039,Sportsbet
Sacramento Kings v Memphis Grizzlies,2024-01-04,Head To Head,Sacramento Kings,1.74,Memphis Grizzlies,2.15,1.04,Sportsbet
Los Angeles Lakers v Atlanta Hawks,2024-01-04,Head To Head,Los Angeles Lakers,1.66,Atlanta Hawks,2.28,1.041,Sportsbet
