match,start_time,market_name,home_team,home_win,away_team,away_win,margin,agency
Brooklyn Nets v New York Knicks,2024-01-22,Head To Head,Brooklyn Nets,6.15,New York Knicks,1.14,1.04,Sportsbet
Miami Heat v Portland Trail Blazers,2024-01-22,Head To Head,Miami Heat,1.21,Portland Trail Blazers,4.65,1.042,Sportsbet
Toronto Raptors v Orlando Magic,2024-01-22,Head To Head,Toronto Raptors,2.02,Orlando Magic,1.83,1.041,Sportsbet
Denver Nuggets v Philadelphia 76ers,2024-01-22,Head To Head,Denver Nuggets,1.14,Philadelphia 76ers,6.15,1.04,Sportsbet
Los Angeles Lakers v Washington Wizards,2024-01-22,Head To Head,Los Angeles Lakers,1.11,Washington Wizards,7.2,1.04,Sportsbet
