match,start_time,market_name,home_team,home_win,away_team,away_win,margin,agency
Philadelphia 76ers v Dallas Mavericks,2024-02-05,Head To Head,Philadelphia 76ers,1.57,Dallas Mavericks,2.47,1.042,Sportsbet
Cleveland Cavaliers v Boston Celtics,2024-02-05,Head To Head,Cleveland Cavaliers,1.88,Boston Celtics,1.96,1.042,Sportsbet
Brooklyn Nets v Houston Rockets,2024-02-05,Head To Head,Brooklyn Nets,4.8,Houston Rockets,1.2,1.042,Sportsbet
Toronto Raptors v New York Knicks,2024-02-05,Head To Head,Toronto Raptors,2.9,New York Knicks,1.44,1.039,Sportsbet
Chicago Bulls v Miami Heat,2024-02-05,Head To Head,Chicago Bulls,2.35,Miami Heat,1.62,1.043,Sportsbet
Portland Trail Blazers v Indiana Pacers,2024-02-05,Head To Head,Portland Trail Blazers,2.79,Indiana Pacers,1.47,1.039,Sportsbet
Los Angeles Clippers v Los Angeles Lakers,2024-02-05,Head To Head,Los Angeles Clippers,1.27,Los Angeles Lakers,3.95,1.041,Sportsbet
Los Angeles Lakers v Dallas Mavericks,2024-02-26,Head To Head,Los Angeles Lakers,1.52,Dallas Mavericks,2.62,1.04,Sportsbet
