match,start_time,market_name,home_team,home_win,away_team,away_win,margin,agency
Washington Wizards v Houston Rockets,2024-01-08,Head To Head,Washington Wizards,7,Houston Rockets,1.11,1.044,Sportsbet
Charlotte Hornets v Phoenix Suns,2024-01-08,Head To Head,Charlotte Hornets,2.67,Phoenix Suns,1.5,1.041,Sportsbet
Dallas Mavericks v Los Angeles Lakers,2024-01-08,Head To Head,Dallas Mavericks,3.02,Los Angeles Lakers,1.41,1.04,Sportsbet
New Orleans Pelicans v Minnesota Timberwolves,2024-01-08,Head To Head,New Orleans Pelicans,2.61,Minnesota Timberwolves,1.52,1.041,Sportsbet
Utah Jazz v Atlanta Hawks,2024-01-08,Head To Head,Utah Jazz,3.07,Atlanta Hawks,1.4,1.04,Sportsbet
Denver Nuggets v Boston Celtics,2024-01-08,Head To Head,Denver Nuggets,2.82,Boston Celtics,1.46,1.04,Sportsbet
Golden State Warriors v Miami Heat,2024-01-08,Head To Head,Golden State Warriors,1.23,Miami Heat,4.35,1.043,Sportsbet
Cleveland Cavaliers v Oklahoma City Thunder,2024-01-09,Head To Head,Cleveland Cavaliers,1.7,Oklahoma City Thunder,2.21,1.041,Sportsbet
