match,start_time,market_name,home_team,home_win,away_team,away_win,margin,agency
Toronto Raptors v New York Knicks,2023-12-10,Head To Head,Toronto Raptors,3.39,New York Knicks,1.34,1.041,Sportsbet
Milwaukee Bucks v Orlando Magic,2023-12-11,Head To Head,Milwaukee Bucks,1.34,Orlando Magic,3.37,1.043,Sportsbet
Oklahoma City Thunder v Dallas Mavericks,2023-12-11,Head To Head,Oklahoma City Thunder,1.54,Dallas Mavericks,2.56,1.04,Sportsbet
New York Knicks v Atlanta Hawks,2023-12-12,Head To Head,New York Knicks,1.33,Atlanta Hawks,3.45,1.042,Sportsbet
Houston Rockets v Golden State Warriors,2023-12-12,Head To Head,Houston Rockets,1.74,Golden State Warriors,2.15,1.04,Sportsbet
