match,start_time,market_name,home_team,home_win,away_team,away_win,margin,agency
Indiana Pacers v Brooklyn Nets,2024-03-23,Head To Head,Indiana Pacers,1.25,Brooklyn Nets,4.15,1.041,Sportsbet
Atlanta Hawks v Golden State Warriors,2024-03-23,Head To Head,Atlanta Hawks,2.18,Golden State Warriors,1.72,1.04,Sportsbet
New York Knicks v Washington Wizards,2024-03-23,Head To Head,New York Knicks,1.08,Washington Wizards,8.75,1.04,Sportsbet
Sacramento Kings v Milwaukee Bucks,2024-03-23,Head To Head,Sacramento Kings,1.83,Milwaukee Bucks,2.02,1.041,Sportsbet
Los Angeles Lakers v Chicago Bulls,2024-03-23,Head To Head,Los Angeles Lakers,1.21,Chicago Bulls,4.7,1.039,Sportsbet
