match,start_time,market_name,home_team,home_win,away_team,away_win,margin,agency
Charlotte Hornets v Orlando Magic,2023-11-26,Head To Head,Charlotte Hornets,2.81,Orlando Magic,1.46,1.041,Sportsbet
Detroit Pistons v Toronto Raptors,2023-11-26,Head To Head,Detroit Pistons,1.5,Toronto Raptors,2.69,1.038,Sportsbet
Indiana Pacers v New Orleans Pelicans,2023-11-26,Head To Head,Indiana Pacers,1.42,New Orleans Pelicans,2.99,1.039,Sportsbet
Atlanta Hawks v Dallas Mavericks,2023-11-26,Head To Head,Atlanta Hawks,1.63,Dallas Mavericks,2.33,1.043,Sportsbet
Boston Celtics v Los Angeles Clippers,2023-11-26,Head To Head,Boston Celtics,1.2,Los Angeles Clippers,4.85,1.04,Sportsbet
Memphis Grizzlies v Portland Trail Blazers,2023-11-26,Head To Head,Memphis Grizzlies,1.18,Portland Trail Blazers,5.2,1.04,Sportsbet
Denver Nuggets v New York Knicks,2023-11-26,Head To Head,Denver Nuggets,1.59,New York Knicks,2.44,1.039,Sportsbet
Golden State Warriors v Brooklyn Nets,2023-11-26,Head To Head,Golden State Warriors,1.11,Brooklyn Nets,7,1.044,Sportsbet
Sacramento Kings v Oklahoma City Thunder,2023-11-26,Head To Head,Sacramento Kings,2.36,Oklahoma City Thunder,1.62,1.041,Sportsbet
