match,start_time,market_name,home_team,home_win,away_team,away_win,margin,agency
Phoenix Suns v Utah Jazz,2024-01-12,Head To Head,Phoenix Suns,1.16,Utah Jazz,5.65,1.039,Sportsbet
Detroit Pistons v Toronto Raptors,2024-01-12,Head To Head,Detroit Pistons,1.42,Toronto Raptors,2.97,1.041,Sportsbet
Minnesota Timberwolves v Memphis Grizzlies,2024-01-12,Head To Head,Minnesota Timberwolves,1.77,Memphis Grizzlies,2.1,1.041,Sportsbet
Portland Trail Blazers v Miami Heat,2024-01-12,Head To Head,Portland Trail Blazers,2.6,Miami Heat,1.52,1.043,Sportsbet
Dallas Mavericks v Denver Nuggets,2024-01-13,Head To Head,Dallas Mavericks,2.32,Denver Nuggets,1.64,1.041,Sportsbet
New York Knicks v Milwaukee Bucks,2024-01-13,Head To Head,New York Knicks,1.56,Milwaukee Bucks,2.5,1.041,Sportsbet
Chicago Bulls v Sacramento Kings,2024-01-13,Head To Head,Chicago Bulls,2.21,Sacramento Kings,1.7,1.041,Sportsbet
Cleveland Cavaliers v Indiana Pacers,2024-01-13,Head To Head,Cleveland Cavaliers,1.24,Indiana Pacers,4.3,1.039,Sportsbet
Washington Wizards v Oklahoma City Thunder,2024-01-13,Head To Head,Washington Wizards,11.5,Oklahoma City Thunder,1.05,1.039,Sportsbet
