match,start_time,market_name,home_team,home_win,away_team,away_win,margin,agency
Washington Wizards v Utah Jazz,2024-03-06,Head To Head,Washington Wizards,1.49,Utah Jazz,2.7,1.042,Sportsbet
Cleveland Cavaliers v Miami Heat,2024-03-06,Head To Head,Cleveland Cavaliers,1.15,Miami Heat,5.85,1.041,Sportsbet
Charlotte Hornets v Minnesota Timberwolves,2024-03-06,Head To Head,Charlotte Hornets,3.75,Minnesota Timberwolves,1.29,1.042,Sportsbet
Boston Celtics v Portland Trail Blazers,2024-03-06,Head To Head,Boston Celtics,1.23,Portland Trail Blazers,4.4,1.04,Sportsbet
Milwaukee Bucks v Dallas Mavericks,2024-03-06,Head To Head,Milwaukee Bucks,1.18,Dallas Mavericks,5.2,1.04,Sportsbet
Denver Nuggets v Sacramento Kings,2024-03-06,Head To Head,Denver Nuggets,1.42,Sacramento Kings,2.95,1.043,Sportsbet
Memphis Grizzlies v Oklahoma City Thunder,2024-03-06,Head To Head,Memphis Grizzlies,3.47,Oklahoma City Thunder,1.33,1.04,Sportsbet
Los Angeles Clippers v Detroit Pistons,2024-03-06,Head To Head,Los Angeles Clippers,2.64,Detroit Pistons,1.51,1.041,Sportsbet
