match,start_time,market_name,home_team,home_win,away_team,away_win,margin,agency
Washington Wizards v New York Knicks,2023-12-31,Head To Head,Washington Wizards,6.1,New York Knicks,1.14,1.041,Sportsbet
Charlotte Hornets v Chicago Bulls,2023-12-31,Head To Head,Charlotte Hornets,2.81,Chicago Bulls,1.46,1.041,Sportsbet
New Orleans Pelicans v Los Angeles Clippers,2023-12-31,Head To Head,New Orleans Pelicans,2.59,Los Angeles Clippers,1.53,1.04,Sportsbet
Utah Jazz v Denver Nuggets,2023-12-31,Head To Head,Utah Jazz,3.45,Denver Nuggets,1.33,1.042,Sportsbet
Portland Trail Blazers v Philadelphia 76ers,2023-12-31,Head To Head,Portland Trail Blazers,3.18,Philadelphia 76ers,1.38,1.039,Sportsbet
Sacramento Kings v Dallas Mavericks,2023-12-31,Head To Head,Sacramento Kings,1.4,Dallas Mavericks,3.08,1.039,Sportsbet
Golden State Warriors v Cleveland Cavaliers,2023-12-31,Head To Head,Golden State Warriors,2.59,Cleveland Cavaliers,1.52,1.044,Sportsbet
