match,start_time,market_name,home_team,home_win,away_team,away_win,margin,agency
Brooklyn Nets v New York Knicks,2024-01-22,Head To Head,Brooklyn Nets,5.65,New York Knicks,1.16,1.039,Sportsbet
Miami Heat v Portland Trail Blazers,2024-01-22,Head To Head,Miami Heat,1.22,Portland Trail Blazers,4.55,1.039,Sportsbet
Toronto Raptors v Orlando Magic,2024-01-22,Head To Head,Toronto Raptors,2.01,Orlando Magic,1.84,1.041,Sportsbet
Denver Nuggets v Philadelphia 76ers,2024-01-22,Head To Head,Denver Nuggets,1.13,Philadelphia 76ers,6.4,1.041,Sportsbet
Los Angeles Lakers v Washington Wizards,2024-01-22,Head To Head,Los Angeles Lakers,1.1,Washington Wizards,7.5,1.042,Sportsbet
