match,start_time,market_name,home_team,home_win,away_team,away_win,margin,agency
Indiana Pacers v Brooklyn Nets,2024-03-21,Head To Head,Indiana Pacers,1.28,Brooklyn Nets,3.85,1.041,Sportsbet
Charlotte Hornets v New York Knicks,2024-03-21,Head To Head,Charlotte Hornets,3.42,New York Knicks,1.34,1.039,Sportsbet
Sacramento Kings v Chicago Bulls,2024-03-21,Head To Head,Sacramento Kings,1.37,Chicago Bulls,3.22,1.04,Sportsbet
Golden State Warriors v Toronto Raptors,2024-03-21,Head To Head,Golden State Warriors,1.1,Toronto Raptors,7.5,1.042,Sportsbet
Los Angeles Lakers v Milwaukee Bucks,2024-03-21,Head To Head,Los Angeles Lakers,2.27,Milwaukee Bucks,1.67,1.039,Sportsbet
