match,start_time,market_name,home_team,home_win,away_team,away_win,margin,agency
Boston Celtics v Atlanta Hawks,2024-01-19,Head To Head,Boston Celtics,1.24,Atlanta Hawks,4.3,1.039,Sportsbet
Indiana Pacers v Philadelphia 76ers,2024-01-19,Head To Head,Indiana Pacers,1.2,Philadelphia 76ers,4.8,1.042,Sportsbet
Golden State Warriors v Washington Wizards,2024-01-19,Head To Head,Golden State Warriors,1.12,Washington Wizards,6.8,1.04,Sportsbet
Minnesota Timberwolves v Cleveland Cavaliers,2024-01-19,Head To Head,Minnesota Timberwolves,2.89,Cleveland Cavaliers,1.44,1.04,Sportsbet
Portland Trail Blazers v Houston Rockets,2024-01-19,Head To Head,Portland Trail Blazers,5.35,Houston Rockets,1.17,1.042,Sportsbet
