match,start_time,market_name,home_team,home_win,away_team,away_win,margin,agency
Boston Celtics v Indiana Pacers,2024-12-29T23:10:00.000Z,Head To Head,Boston Celtics,1.26,Indiana Pacers,3.8,1.057,TAB
Toronto Raptors v Atlanta Hawks,2024-12-29T23:10:00.000Z,Head To Head,Toronto Raptors,2.9,Atlanta Hawks,1.4,1.059,TAB
Houston Rockets v Miami Heat,2024-12-30T00:10:00.000Z,Head To Head,Houston Rockets,1.28,Miami Heat,3.8,1.044,TAB
Oklahoma City Thunder v Memphis Grizzlies,2024-12-30T00:10:00.000Z,Head To Head,Oklahoma City Thunder,1.34,Memphis Grizzlies,3.4,1.04,TAB
Minnesota Timberwolves v San Antonio Spurs,2024-12-30T01:10:00.000Z,Head To Head,Minnesota Timberwolves,1.44,San Antonio Spurs,2.9,1.039,TAB
New Orleans Pelicans v Los Angeles Clippers,2024-12-31T01:10:00.000Z,Head To Head,New Orleans Pelicans,2.8,Los Angeles Clippers,1.46,1.042,TAB
Portland Trail Blazers v Philadelphia 76ers,2024-12-31T03:10:00.000Z,Head To Head,Portland Trail Blazers,3,Philadelphia 76ers,1.41,1.043,TAB
