match,start_time,market_name,home_team,home_win,away_team,away_win,margin,agency
Charlotte Hornets v Philadelphia 76ers,2024-12-17T00:10:00.000Z,Head To Head,Charlotte Hornets,3,Philadelphia 76ers,1.38,1.058,TAB
Detroit Pistons v Miami Heat,2024-12-17T00:10:00.000Z,Head To Head,Detroit Pistons,1.4,Miami Heat,2.9,1.059,TAB
Brooklyn Nets v Cleveland Cavaliers,2024-12-17T00:40:00.000Z,Head To Head,Brooklyn Nets,26,Cleveland Cavaliers,1.01,1.029,TAB
Toronto Raptors v Chicago Bulls,2024-12-17T00:40:00.000Z,Head To Head,Toronto Raptors,3.6,Chicago Bulls,1.28,1.059,TAB
Sacramento Kings v Denver Nuggets,2024-12-17T03:10:00.000Z,Head To Head,Sacramento Kings,1.85,Denver Nuggets,2,1.041,TAB
Los Angeles Clippers v Utah Jazz,2024-12-17T03:40:00.000Z,Head To Head,Los Angeles Clippers,1.34,Utah Jazz,3.4,1.04,TAB
Oklahoma City Thunder v Milwaukee Bucks,2024-12-18T01:30:00.000Z,Head To Head,Oklahoma City Thunder,1.5,Milwaukee Bucks,2.65,1.044,TAB
