match,start_time,market_name,home_team,home_win,away_team,away_win,margin,agency
Minnesota Timberwolves v San Antonio Spurs,2024-12-30T02:10:00.000Z,Head To Head,Minnesota Timberwolves,1.16,San Antonio Spurs,5,1.062,TAB
Charlotte Hornets v Chicago Bulls,2024-12-31T00:10:00.000Z,Head To Head,Charlotte Hornets,2.9,Chicago Bulls,1.44,1.039,TAB
Washington Wizards v New York Knicks,2024-12-31T00:10:00.000Z,Head To Head,Washington Wizards,5,New York Knicks,1.19,1.04,TAB
New Orleans Pelicans v Los Angeles Clippers,2024-12-31T01:10:00.000Z,Head To Head,New Orleans Pelicans,2.9,Los Angeles Clippers,1.44,1.039,TAB
Utah Jazz v Denver Nuggets,2024-12-31T02:10:00.000Z,Head To Head,Utah Jazz,3.4,Denver Nuggets,1.34,1.04,TAB
Golden State Warriors v Cleveland Cavaliers,2024-12-31T03:10:00.000Z,Head To Head,Golden State Warriors,2.7,Cleveland Cavaliers,1.48,1.046,TAB
Portland Trail Blazers v Philadelphia 76ers,2024-12-31T03:10:00.000Z,Head To Head,Portland Trail Blazers,2.9,Philadelphia 76ers,1.44,1.039,TAB
Sacramento Kings v Dallas Mavericks,2024-12-31T03:10:00.000Z,Head To Head,Sacramento Kings,1.56,Dallas Mavericks,2.5,1.041,TAB
