match,start_time,market_name,home_team,home_win,away_team,away_win,margin,agency
Minnesota Timberwolves v San Antonio Spurs,2024-12-30T02:10:00.000Z,Head To Head,Minnesota Timberwolves,1.7,San Antonio Spurs,2.1,1.064,TAB
Charlotte Hornets v Chicago Bulls,2024-12-31T00:10:00.000Z,Head To Head,Charlotte Hornets,3,Chicago Bulls,1.41,1.043,TAB
Washington Wizards v New York Knicks,2024-12-31T00:10:00.000Z,Head To Head,Washington Wizards,4.8,New York Knicks,1.2,1.042,TAB
New Orleans Pelicans v Los Angeles Clippers,2024-12-31T01:10:00.000Z,Head To Head,New Orleans Pelicans,2.9,Los Angeles Clippers,1.44,1.039,TAB
Utah Jazz v Denver Nuggets,2024-12-31T02:10:00.000Z,Head To Head,Utah Jazz,3.4,Denver Nuggets,1.34,1.04,TAB
Golden State Warriors v Cleveland Cavaliers,2024-12-31T03:10:00.000Z,Head To Head,Golden State Warriors,2.55,Cleveland Cavaliers,1.54,1.042,TAB
Portland Trail Blazers v Philadelphia 76ers,2024-12-31T03:10:00.000Z,Head To Head,Portland Trail Blazers,2.9,Philadelphia 76ers,1.44,1.039,TAB
Sacramento Kings v Dallas Mavericks,2024-12-31T03:10:00.000Z,Head To Head,Sacramento Kings,1.62,Dallas Mavericks,2.35,1.043,TAB
