match,start_time,market_name,home_team,home_win,away_team,away_win,margin,agency
Denver Nuggets v New York Knicks,2024-11-26T02:10:00.000Z,Head To Head,Denver Nuggets,26,New York Knicks,1.01,1.029,TAB
Golden State Warriors v Brooklyn Nets,2024-11-26T03:10:00.000Z,Head To Head,Golden State Warriors,1.12,Brooklyn Nets,6,1.06,TAB
Sacramento Kings v Oklahoma City Thunder,2024-11-26T03:10:00.000Z,Head To Head,Sacramento Kings,2.4,Oklahoma City Thunder,1.55,1.062,TAB
Washington Wizards v Chicago Bulls,2024-11-27T00:10:00.000Z,Head To Head,Washington Wizards,2.45,Chicago Bulls,1.58,1.041,TAB
Miami Heat v Milwaukee Bucks,2024-11-27T00:40:00.000Z,Head To Head,Miami Heat,1.77,Milwaukee Bucks,2.1,1.041,TAB
Minnesota Timberwolves v Houston Rockets,2024-11-27T01:10:00.000Z,Head To Head,Minnesota Timberwolves,1.6,Houston Rockets,2.4,1.042,TAB
Utah Jazz v San Antonio Spurs,2024-11-27T02:10:00.000Z,Head To Head,Utah Jazz,2.15,San Antonio Spurs,1.73,1.043,TAB
Phoenix Suns v Los Angeles Lakers,2024-11-27T03:10:00.000Z,Head To Head,Phoenix Suns,1.58,Los Angeles Lakers,2.45,1.041,TAB
