match,start_time,market_name,home_team,home_win,away_team,away_win,margin,agency
Indiana Pacers v Cleveland Cavaliers,2025-01-15T00:10:00.000Z,Head To Head,Indiana Pacers,3.7,Cleveland Cavaliers,1.3,1.04,TAB
Philadelphia 76ers v Oklahoma City Thunder,2025-01-15T00:10:00.000Z,Head To Head,Philadelphia 76ers,6.5,Oklahoma City Thunder,1.13,1.039,TAB
Atlanta Hawks v Phoenix Suns,2025-01-15T00:40:00.000Z,Head To Head,Atlanta Hawks,2.25,Phoenix Suns,1.67,1.043,TAB
Chicago Bulls v New Orleans Pelicans,2025-01-15T01:10:00.000Z,Head To Head,Chicago Bulls,1.85,New Orleans Pelicans,2,1.041,TAB
Milwaukee Bucks v Sacramento Kings,2025-01-15T01:10:00.000Z,Head To Head,Milwaukee Bucks,1.73,Sacramento Kings,2.15,1.043,TAB
Dallas Mavericks v Denver Nuggets,2025-01-15T02:40:00.000Z,Head To Head,Dallas Mavericks,2.35,Denver Nuggets,1.62,1.043,TAB
Portland Trail Blazers v Brooklyn Nets,2025-01-15T03:10:00.000Z,Head To Head,Portland Trail Blazers,1.48,Brooklyn Nets,2.7,1.046,TAB
