match,start_time,market_name,home_team,home_win,away_team,away_win,margin,agency
New York Knicks v Brooklyn Nets,2024-11-18T00:10:00.000Z,Head To Head,New York Knicks,1.01,Brooklyn Nets,14,1.062,TAB
Oklahoma City Thunder v Dallas Mavericks,2024-11-18T00:10:00.000Z,Head To Head,Oklahoma City Thunder,12,Dallas Mavericks,1.02,1.064,TAB
Los Angeles Clippers v Utah Jazz,2024-11-18T02:10:00.000Z,Head To Head,Los Angeles Clippers,1.1,Utah Jazz,6.5,1.063,TAB
Miami Heat v Philadelphia 76ers,2024-11-19T00:40:00.000Z,Head To Head,Miami Heat,1.6,Philadelphia 76ers,2.4,1.042,TAB
Toronto Raptors v Indiana Pacers,2024-11-19T00:40:00.000Z,Head To Head,Toronto Raptors,2.3,Indiana Pacers,1.65,1.041,TAB
Milwaukee Bucks v Houston Rockets,2024-11-19T01:10:00.000Z,Head To Head,Milwaukee Bucks,1.65,Houston Rockets,2.3,1.041,TAB
Sacramento Kings v Atlanta Hawks,2024-11-19T03:10:00.000Z,Head To Head,Sacramento Kings,1.52,Atlanta Hawks,2.6,1.043,TAB
Los Angeles Clippers v Golden State Warriors,2024-11-19T03:40:00.000Z,Head To Head,Los Angeles Clippers,2.1,Golden State Warriors,1.77,1.041,TAB
