match,start_time,market_name,home_team,home_win,away_team,away_win,margin,agency
Denver Nuggets v Dallas Mavericks,2024-11-23T03:10:00.000Z,Head To Head,Denver Nuggets,1.8,Dallas Mavericks,2,1.056,TAB
Los Angeles Clippers v Sacramento Kings,2024-11-23T03:40:00.000Z,Head To Head,Los Angeles Clippers,2.45,Sacramento Kings,1.58,1.041,TAB
Utah Jazz v New York Knicks,2024-11-23T22:10:00.000Z,Head To Head,Utah Jazz,4,New York Knicks,1.26,1.044,TAB
Orlando Magic v Detroit Pistons,2024-11-24T00:10:00.000Z,Head To Head,Orlando Magic,1.22,Detroit Pistons,4.5,1.042,TAB
Chicago Bulls v Memphis Grizzlies,2024-11-24T01:10:00.000Z,Head To Head,Chicago Bulls,2.65,Memphis Grizzlies,1.5,1.044,TAB
Milwaukee Bucks v Charlotte Hornets,2024-11-24T01:10:00.000Z,Head To Head,Milwaukee Bucks,1.32,Charlotte Hornets,3.5,1.043,TAB
