match,start_time,market_name,home_team,home_win,away_team,away_win,margin,agency
Utah Jazz v Los Angeles Lakers,2024-12-02T01:10:00.000Z,Head To Head,Utah Jazz,3.6,Los Angeles Lakers,1.28,1.059,TAB
Portland Trail Blazers v Dallas Mavericks,2024-12-02T02:10:00.000Z,Head To Head,Portland Trail Blazers,1.85,Dallas Mavericks,1.95,1.053,TAB
Sacramento Kings v San Antonio Spurs,2024-12-02T02:10:00.000Z,Head To Head,Sacramento Kings,1.14,San Antonio Spurs,5.5,1.059,TAB
Los Angeles Clippers v Denver Nuggets,2024-12-02T03:10:00.000Z,Head To Head,Los Angeles Clippers,2.3,Denver Nuggets,1.65,1.041,TAB
Atlanta Hawks v New Orleans Pelicans,2024-12-03T00:40:00.000Z,Head To Head,Atlanta Hawks,1.24,New Orleans Pelicans,4.2,1.045,TAB
Chicago Bulls v Brooklyn Nets,2024-12-03T01:10:00.000Z,Head To Head,Chicago Bulls,1.46,Brooklyn Nets,2.8,1.042,TAB
Minnesota Timberwolves v Los Angeles Lakers,2024-12-03T01:10:00.000Z,Head To Head,Minnesota Timberwolves,1.5,Los Angeles Lakers,2.65,1.044,TAB
