match,start_time,market_name,home_team,home_win,away_team,away_win,margin,agency
Detroit Pistons v Chicago Bulls,2024-11-19T00:10:00.000Z,Head To Head,Detroit Pistons,1.54,Chicago Bulls,2.55,1.042,TAB
Miami Heat v Philadelphia 76ers,2024-11-19T00:40:00.000Z,Head To Head,Miami Heat,1.48,Philadelphia 76ers,2.7,1.046,TAB
New York Knicks v Washington Wizards,2024-11-19T00:40:00.000Z,Head To Head,New York Knicks,1.1,Washington Wizards,7.5,1.042,TAB
Toronto Raptors v Indiana Pacers,2024-11-19T00:40:00.000Z,Head To Head,Toronto Raptors,2.4,Indiana Pacers,1.6,1.042,TAB
Milwaukee Bucks v Houston Rockets,2024-11-19T01:10:00.000Z,Head To Head,Milwaukee Bucks,1.65,Houston Rockets,2.3,1.041,TAB
Phoenix Suns v Orlando Magic,2024-11-19T02:10:00.000Z,Head To Head,Phoenix Suns,2.55,Orlando Magic,1.54,1.042,TAB
Sacramento Kings v Atlanta Hawks,2024-11-19T03:10:00.000Z,Head To Head,Sacramento Kings,1.58,Atlanta Hawks,2.45,1.041,TAB
Los Angeles Clippers v Golden State Warriors,2024-11-19T03:40:00.000Z,Head To Head,Los Angeles Clippers,2.65,Golden State Warriors,1.5,1.044,TAB
