match,start_time,market_name,home_team,home_win,away_team,away_win,margin,agency
Charlotte Hornets v Los Angeles Clippers,2025-02-01T00:10:00.000Z,Head To Head,Charlotte Hornets,6.5,Los Angeles Clippers,1.13,1.039,TAB
Detroit Pistons v Dallas Mavericks,2025-02-01T00:10:00.000Z,Head To Head,Detroit Pistons,2,Dallas Mavericks,1.85,1.041,TAB
Philadelphia 76ers v Denver Nuggets,2025-02-01T00:40:00.000Z,Head To Head,Philadelphia 76ers,4.2,Denver Nuggets,1.24,1.045,TAB
Toronto Raptors v Chicago Bulls,2025-02-01T00:40:00.000Z,Head To Head,Toronto Raptors,1.65,Chicago Bulls,2.3,1.041,TAB
New Orleans Pelicans v Boston Celtics,2025-02-01T01:10:00.000Z,Head To Head,New Orleans Pelicans,5,Boston Celtics,1.19,1.04,TAB
San Antonio Spurs v Milwaukee Bucks,2025-02-01T01:10:00.000Z,Head To Head,San Antonio Spurs,2.1,Milwaukee Bucks,1.77,1.041,TAB
Golden State Warriors v Phoenix Suns,2025-02-01T03:10:00.000Z,Head To Head,Golden State Warriors,2,Phoenix Suns,1.85,1.041,TAB
Indiana Pacers v Atlanta Hawks,2025-02-01T22:10:00.000Z,Head To Head,Indiana Pacers,1.44,Atlanta Hawks,2.9,1.039,TAB
