match,start_time,market_name,home_team,home_win,away_team,away_win,margin,agency
Orlando Magic v Chicago Bulls,2025-03-07T00:10:00.000Z,Head To Head,Orlando Magic,1.34,Chicago Bulls,3.4,1.04,TAB
Boston Celtics v Philadelphia 76ers,2025-03-07T00:30:00.000Z,Head To Head,Boston Celtics,1.12,Philadelphia 76ers,6.8,1.04,TAB
Atlanta Hawks v Indiana Pacers,2025-03-07T00:40:00.000Z,Head To Head,Atlanta Hawks,2.35,Indiana Pacers,1.62,1.043,TAB
Brooklyn Nets v Golden State Warriors,2025-03-07T00:40:00.000Z,Head To Head,Brooklyn Nets,5,Golden State Warriors,1.19,1.04,TAB
New Orleans Pelicans v Houston Rockets,2025-03-07T01:10:00.000Z,Head To Head,New Orleans Pelicans,2.55,Houston Rockets,1.54,1.042,TAB
Los Angeles Lakers v New York Knicks,2025-03-07T03:00:00.000Z,Head To Head,Los Angeles Lakers,1.62,New York Knicks,2.35,1.043,TAB
