match,start_time,market_name,home_team,home_win,away_team,away_win,margin,agency
Los Angeles Clippers v Oklahoma City Thunder,2025-03-24T01:10:00.000Z,Head To Head,Los Angeles Clippers,2.4,Oklahoma City Thunder,1.55,1.062,TAB
Indiana Pacers v Minnesota Timberwolves,2025-03-24T23:10:00.000Z,Head To Head,Indiana Pacers,1.8,Minnesota Timberwolves,2.05,1.043,TAB
Orlando Magic v Los Angeles Lakers,2025-03-24T23:10:00.000Z,Head To Head,Orlando Magic,2.45,Los Angeles Lakers,1.58,1.041,TAB
Washington Wizards v Toronto Raptors,2025-03-24T23:10:00.000Z,Head To Head,Washington Wizards,2.1,Toronto Raptors,1.77,1.041,TAB
Brooklyn Nets v Dallas Mavericks,2025-03-24T23:40:00.000Z,Head To Head,Brooklyn Nets,2,Dallas Mavericks,1.85,1.041,TAB
New Orleans Pelicans v Philadelphia 76ers,2025-03-25T00:10:00.000Z,Head To Head,New Orleans Pelicans,1.44,Philadelphia 76ers,2.9,1.039,TAB
Denver Nuggets v Chicago Bulls,2025-03-25T01:10:00.000Z,Head To Head,Denver Nuggets,1.58,Chicago Bulls,2.45,1.041,TAB
Phoenix Suns v Milwaukee Bucks,2025-03-25T02:10:00.000Z,Head To Head,Phoenix Suns,1.67,Milwaukee Bucks,2.25,1.043,TAB
Sacramento Kings v Boston Celtics,2025-03-25T02:10:00.000Z,Head To Head,Sacramento Kings,2.35,Boston Celtics,1.62,1.043,TAB
