match,start_time,market_name,home_team,home_win,away_team,away_win,margin,agency
Phoenix Suns v Houston Rockets,2025-03-31T01:10:00.000Z,Head To Head,Phoenix Suns,4.4,Houston Rockets,1.2,1.061,TAB
Charlotte Hornets v Utah Jazz,2025-03-31T23:10:00.000Z,Head To Head,Charlotte Hornets,2,Utah Jazz,1.85,1.041,TAB
Indiana Pacers v Sacramento Kings,2025-03-31T23:10:00.000Z,Head To Head,Indiana Pacers,1.46,Sacramento Kings,2.8,1.042,TAB
Orlando Magic v Los Angeles Clippers,2025-03-31T23:10:00.000Z,Head To Head,Orlando Magic,2.25,Los Angeles Clippers,1.67,1.043,TAB
Washington Wizards v Miami Heat,2025-03-31T23:10:00.000Z,Head To Head,Washington Wizards,3.5,Miami Heat,1.32,1.043,TAB
Memphis Grizzlies v Boston Celtics,2025-03-31T23:30:00.000Z,Head To Head,Memphis Grizzlies,2.6,Boston Celtics,1.52,1.043,TAB
Oklahoma City Thunder v Chicago Bulls,2025-04-01T00:10:00.000Z,Head To Head,Oklahoma City Thunder,1.11,Chicago Bulls,7,1.044,TAB
Dallas Mavericks v Brooklyn Nets,2025-04-01T00:40:00.000Z,Head To Head,Dallas Mavericks,1.15,Brooklyn Nets,5.8,1.042,TAB
Los Angeles Lakers v Houston Rockets,2025-04-01T02:00:00.000Z,Head To Head,Los Angeles Lakers,1.54,Houston Rockets,2.55,1.042,TAB
