match,start_time,market_name,home_team,home_win,away_team,away_win,margin,agency
New Orleans Pelicans v Sacramento Kings,2025-02-14T01:10:00.000Z,Head To Head,New Orleans Pelicans,3.3,Sacramento Kings,1.32,1.061,TAB
Minnesota Timberwolves v Oklahoma City Thunder,2025-02-14T01:30:00.000Z,Head To Head,Minnesota Timberwolves,1.36,Oklahoma City Thunder,3.1,1.058,TAB
Dallas Mavericks v Miami Heat,2025-02-14T01:40:00.000Z,Head To Head,Dallas Mavericks,3.1,Miami Heat,1.36,1.058,TAB
Utah Jazz v Los Angeles Clippers,2025-02-14T02:10:00.000Z,Head To Head,Utah Jazz,1.95,Los Angeles Clippers,1.85,1.053,TAB
Los Angeles Lakers v Dallas Mavericks,2025-02-26T03:10:00.000Z,Head To Head,Los Angeles Lakers,1.35,Dallas Mavericks,3.25,1.048,TAB
