match,start_time,market_name,home_team,home_win,away_team,away_win,margin,agency
Charlotte Hornets v Chicago Bulls,2024-12-31T00:10:00.000Z,Head To Head,Charlotte Hornets,2.7,Chicago Bulls,1.48,1.046,TAB
Washington Wizards v New York Knicks,2024-12-31T00:10:00.000Z,Head To Head,Washington Wizards,5.8,New York Knicks,1.15,1.042,TAB
New Orleans Pelicans v Los Angeles Clippers,2024-12-31T01:10:00.000Z,Head To Head,New Orleans Pelicans,2.5,Los Angeles Clippers,1.56,1.041,TAB
Utah Jazz v Denver Nuggets,2024-12-31T02:10:00.000Z,Head To Head,Utah Jazz,3.3,Denver Nuggets,1.35,1.044,TAB
Golden State Warriors v Cleveland Cavaliers,2024-12-31T03:10:00.000Z,Head To Head,Golden State Warriors,2.5,Cleveland Cavaliers,1.56,1.041,TAB
Portland Trail Blazers v Philadelphia 76ers,2024-12-31T03:10:00.000Z,Head To Head,Portland Trail Blazers,3.1,Philadelphia 76ers,1.39,1.042,TAB
Sacramento Kings v Dallas Mavericks,2024-12-31T03:10:00.000Z,Head To Head,Sacramento Kings,1.39,Dallas Mavericks,3.1,1.042,TAB
