match,start_time,market_name,home_team,home_win,away_team,away_win,margin,agency
Charlotte Hornets v Dallas Mavericks,2025-01-20T17:10:00.000Z,Head To Head,Charlotte Hornets,3.1,Dallas Mavericks,1.39,1.042,TAB
Houston Rockets v Detroit Pistons,2025-01-20T19:10:00.000Z,Head To Head,Houston Rockets,1.28,Detroit Pistons,3.8,1.044,TAB
Memphis Grizzlies v Minnesota Timberwolves,2025-01-20T19:40:00.000Z,Head To Head,Memphis Grizzlies,1.5,Minnesota Timberwolves,2.65,1.044,TAB
New York Knicks v Atlanta Hawks,2025-01-20T20:10:00.000Z,Head To Head,New York Knicks,1.41,Atlanta Hawks,3,1.043,TAB
Cleveland Cavaliers v Phoenix Suns,2025-01-20T20:40:00.000Z,Head To Head,Cleveland Cavaliers,1.35,Phoenix Suns,3.3,1.044,TAB
Golden State Warriors v Boston Celtics,2025-01-20T22:10:00.000Z,Head To Head,Golden State Warriors,4.5,Boston Celtics,1.22,1.042,TAB
New Orleans Pelicans v Utah Jazz,2025-01-21T01:10:00.000Z,Head To Head,New Orleans Pelicans,1.16,Utah Jazz,5.5,1.044,TAB
Los Angeles Clippers v Chicago Bulls,2025-01-21T03:40:00.000Z,Head To Head,Los Angeles Clippers,1.46,Chicago Bulls,2.8,1.042,TAB
