match,start_time,market_name,home_team,home_win,away_team,away_win,margin,agency
Charlotte Hornets v New York Knicks,2025-03-20T23:10:00.000Z,Head To Head,Charlotte Hornets,1.75,New York Knicks,2.05,1.059,TAB
Indiana Pacers v Brooklyn Nets,2025-03-20T23:10:00.000Z,Head To Head,Indiana Pacers,2.1,Brooklyn Nets,1.7,1.064,TAB
Golden State Warriors v Toronto Raptors,2025-03-21T02:10:00.000Z,Head To Head,Golden State Warriors,1.1,Toronto Raptors,7.5,1.042,TAB
Sacramento Kings v Chicago Bulls,2025-03-21T02:10:00.000Z,Head To Head,Sacramento Kings,1.41,Chicago Bulls,3,1.043,TAB
Los Angeles Lakers v Milwaukee Bucks,2025-03-21T02:40:00.000Z,Head To Head,Los Angeles Lakers,3.3,Milwaukee Bucks,1.35,1.044,TAB
Washington Wizards v Orlando Magic,2025-03-21T23:10:00.000Z,Head To Head,Washington Wizards,3.4,Orlando Magic,1.34,1.04,TAB
Miami Heat v Houston Rockets,2025-03-22T00:10:00.000Z,Head To Head,Miami Heat,2.65,Houston Rockets,1.5,1.044,TAB
Minnesota Timberwolves v New Orleans Pelicans,2025-03-22T00:10:00.000Z,Head To Head,Minnesota Timberwolves,1.09,New Orleans Pelicans,8,1.042,TAB
Dallas Mavericks v Detroit Pistons,2025-03-22T00:40:00.000Z,Head To Head,Dallas Mavericks,4.5,Detroit Pistons,1.22,1.042,TAB
