match,start_time,market_name,home_team,home_win,away_team,away_win,margin,agency
Cleveland Cavaliers v Los Angeles Clippers,2025-03-30T19:40:00.000Z,Head To Head,Cleveland Cavaliers,1.34,Los Angeles Clippers,3.4,1.04,TAB
New York Knicks v Portland Trail Blazers,2025-03-30T22:10:00.000Z,Head To Head,New York Knicks,1.3,Portland Trail Blazers,3.7,1.04,TAB
Milwaukee Bucks v Atlanta Hawks,2025-03-30T23:10:00.000Z,Head To Head,Milwaukee Bucks,1.58,Atlanta Hawks,2.45,1.041,TAB
Minnesota Timberwolves v Detroit Pistons,2025-03-30T23:10:00.000Z,Head To Head,Minnesota Timberwolves,1.37,Detroit Pistons,3.2,1.042,TAB
New Orleans Pelicans v Charlotte Hornets,2025-03-30T23:10:00.000Z,Head To Head,New Orleans Pelicans,1.67,Charlotte Hornets,2.25,1.043,TAB
San Antonio Spurs v Golden State Warriors,2025-03-30T23:10:00.000Z,Head To Head,San Antonio Spurs,5.8,Golden State Warriors,1.15,1.042,TAB
Philadelphia 76ers v Toronto Raptors,2025-03-30T23:40:00.000Z,Head To Head,Philadelphia 76ers,2.6,Toronto Raptors,1.52,1.043,TAB
Phoenix Suns v Houston Rockets,2025-03-31T01:10:00.000Z,Head To Head,Phoenix Suns,2.1,Houston Rockets,1.77,1.041,TAB
