match,start_time,market_name,home_team,home_win,away_team,away_win,margin,agency
Houston Rockets v Golden State Warriors,2025-02-14T01:10:00.000Z,Head To Head,Houston Rockets,3.8,Golden State Warriors,1.26,1.057,TAB
New Orleans Pelicans v Sacramento Kings,2025-02-14T01:10:00.000Z,Head To Head,New Orleans Pelicans,1.45,Sacramento Kings,2.7,1.06,TAB
Minnesota Timberwolves v Oklahoma City Thunder,2025-02-14T01:30:00.000Z,Head To Head,Minnesota Timberwolves,2.05,Oklahoma City Thunder,1.75,1.059,TAB
Dallas Mavericks v Miami Heat,2025-02-14T01:40:00.000Z,Head To Head,Dallas Mavericks,1.75,Miami Heat,2.05,1.059,TAB
Utah Jazz v Los Angeles Clippers,2025-02-14T02:10:00.000Z,Head To Head,Utah Jazz,2.4,Los Angeles Clippers,1.55,1.062,TAB
Los Angeles Lakers v Dallas Mavericks,2025-02-26T03:10:00.000Z,Head To Head,Los Angeles Lakers,1.35,Dallas Mavericks,3.25,1.048,TAB
