match,start_time,market_name,home_team,home_win,away_team,away_win,margin,agency
Boston Celtics v Atlanta Hawks,2024-11-13T00:10:00.000Z,Head To Head,Boston Celtics,1.09,Atlanta Hawks,8,1.042,TAB
Detroit Pistons v Miami Heat,2024-11-13T00:10:00.000Z,Head To Head,Detroit Pistons,2.05,Miami Heat,1.8,1.043,TAB
Orlando Magic v Charlotte Hornets,2024-11-13T00:10:00.000Z,Head To Head,Orlando Magic,1.35,Charlotte Hornets,3.3,1.044,TAB
Philadelphia 76ers v New York Knicks,2024-11-13T00:40:00.000Z,Head To Head,Philadelphia 76ers,2.05,New York Knicks,1.8,1.043,TAB
Milwaukee Bucks v Toronto Raptors,2024-11-13T01:10:00.000Z,Head To Head,Milwaukee Bucks,1.34,Toronto Raptors,3.4,1.04,TAB
Utah Jazz v Phoenix Suns,2024-11-13T02:10:00.000Z,Head To Head,Utah Jazz,2.4,Phoenix Suns,1.6,1.042,TAB
Golden State Warriors v Dallas Mavericks,2024-11-13T03:10:00.000Z,Head To Head,Golden State Warriors,1.65,Dallas Mavericks,2.3,1.041,TAB
Portland Trail Blazers v Minnesota Timberwolves,2024-11-13T03:10:00.000Z,Head To Head,Portland Trail Blazers,4,Minnesota Timberwolves,1.26,1.044,TAB
