match,start_time,market_name,home_team,home_win,away_team,away_win,margin,agency
Minnesota Timberwolves v Sacramento Kings,2024-11-28T01:10:00.000Z,Head To Head,Minnesota Timberwolves,1.08,Sacramento Kings,7.5,1.059,TAB
San Antonio Spurs v Los Angeles Lakers,2024-11-28T01:40:00.000Z,Head To Head,San Antonio Spurs,10,Los Angeles Lakers,1.04,1.062,TAB
Phoenix Suns v Brooklyn Nets,2024-11-28T02:10:00.000Z,Head To Head,Phoenix Suns,1.27,Brooklyn Nets,3.8,1.051,TAB
Utah Jazz v Denver Nuggets,2024-11-28T02:10:00.000Z,Head To Head,Utah Jazz,7,Denver Nuggets,1.09,1.06,TAB
Golden State Warriors v Oklahoma City Thunder,2024-11-28T03:10:00.000Z,Head To Head,Golden State Warriors,2.8,Oklahoma City Thunder,1.42,1.061,TAB
