match,start_time,market_name,home_team,home_win,away_team,away_win,margin,agency
Indiana Pacers v Milwaukee Bucks,2025-03-11T23:30:00.000Z,Head To Head,Indiana Pacers,2,Milwaukee Bucks,1.85,1.041,TAB
Cleveland Cavaliers v Brooklyn Nets,2025-03-11T23:10:00.000Z,Head To Head,Cleveland Cavaliers,1.08,Brooklyn Nets,8.5,1.044,TAB
Detroit Pistons v Washington Wizards,2025-03-11T23:10:00.000Z,Head To Head,Detroit Pistons,1.1,Washington Wizards,7.5,1.042,TAB
New Orleans Pelicans v Los Angeles Clippers,2025-03-12T00:10:00.000Z,Head To Head,New Orleans Pelicans,3.3,Los Angeles Clippers,1.35,1.044,TAB
Boston Celtics v Oklahoma City Thunder,2025-03-12T23:40:00.000Z,Head To Head,Boston Celtics,1.5,Oklahoma City Thunder,2.65,1.044,TAB
