match,start_time,market_name,home_team,home_win,away_team,away_win,margin,agency
Detroit Pistons v Indiana Pacers,2025-01-17T00:10:00.000Z,Head To Head,Detroit Pistons,1.92,Indiana Pacers,1.92,1.042,TAB
Washington Wizards v Phoenix Suns,2025-01-17T00:10:00.000Z,Head To Head,Washington Wizards,5.5,Phoenix Suns,1.16,1.044,TAB
Oklahoma City Thunder v Cleveland Cavaliers,2025-01-17T00:30:00.000Z,Head To Head,Oklahoma City Thunder,1.73,Cleveland Cavaliers,2.15,1.043,TAB
Sacramento Kings v Houston Rockets,2025-01-17T03:00:00.000Z,Head To Head,Sacramento Kings,1.58,Houston Rockets,2.45,1.041,TAB
Portland Trail Blazers v Los Angeles Clippers,2025-01-17T03:10:00.000Z,Head To Head,Portland Trail Blazers,3.2,Los Angeles Clippers,1.37,1.042,TAB
