match,start_time,market_name,home_team,home_win,away_team,away_win,margin,agency
Indiana Pacers v Washington Wizards,2024-11-24T22:10:00.000Z,Head To Head,Indiana Pacers,1.28,Washington Wizards,3.6,1.059,TAB
Miami Heat v Dallas Mavericks,2024-11-24T23:10:00.000Z,Head To Head,Miami Heat,1.85,Dallas Mavericks,1.95,1.053,TAB
Philadelphia 76ers v Los Angeles Clippers,2024-11-24T23:10:00.000Z,Head To Head,Philadelphia 76ers,4.6,Los Angeles Clippers,1.18,1.065,TAB
Cleveland Cavaliers v Toronto Raptors,2024-11-25T00:40:00.000Z,Head To Head,Cleveland Cavaliers,1.16,Toronto Raptors,5.5,1.044,TAB
Sacramento Kings v Brooklyn Nets,2024-11-25T02:10:00.000Z,Head To Head,Sacramento Kings,1.24,Brooklyn Nets,4.2,1.045,TAB
Atlanta Hawks v Dallas Mavericks,2024-11-26T00:40:00.000Z,Head To Head,Atlanta Hawks,1.77,Dallas Mavericks,2.1,1.041,TAB
Denver Nuggets v New York Knicks,2024-11-26T02:10:00.000Z,Head To Head,Denver Nuggets,1.7,New York Knicks,2.2,1.043,TAB
Golden State Warriors v Brooklyn Nets,2024-11-26T03:10:00.000Z,Head To Head,Golden State Warriors,1.11,Brooklyn Nets,7,1.044,TAB
Sacramento Kings v Oklahoma City Thunder,2024-11-26T03:10:00.000Z,Head To Head,Sacramento Kings,2.45,Oklahoma City Thunder,1.58,1.041,TAB
