match,start_time,market_name,home_team,home_win,away_team,away_win,margin,agency
Charlotte Hornets v Golden State Warriors,2025-03-04T00:10:00.000Z,Head To Head,Charlotte Hornets,6,Golden State Warriors,1.14,1.044,TAB
Philadelphia 76ers v Portland Trail Blazers,2025-03-04T00:10:00.000Z,Head To Head,Philadelphia 76ers,1.7,Portland Trail Blazers,2.2,1.043,TAB
Miami Heat v Washington Wizards,2025-03-04T00:40:00.000Z,Head To Head,Miami Heat,1.3,Washington Wizards,3.7,1.04,TAB
Memphis Grizzlies v Atlanta Hawks,2025-03-04T01:10:00.000Z,Head To Head,Memphis Grizzlies,1.26,Atlanta Hawks,4,1.044,TAB
Oklahoma City Thunder v Houston Rockets,2025-03-04T01:10:00.000Z,Head To Head,Oklahoma City Thunder,1.22,Houston Rockets,4.5,1.042,TAB
Dallas Mavericks v Sacramento Kings,2025-03-04T01:40:00.000Z,Head To Head,Dallas Mavericks,2.1,Sacramento Kings,1.77,1.041,TAB
Utah Jazz v Detroit Pistons,2025-03-04T02:10:00.000Z,Head To Head,Utah Jazz,5,Detroit Pistons,1.19,1.04,TAB
