match,start_time,market_name,home_team,home_win,away_team,away_win,margin,agency
Milwaukee Bucks v Phoenix Suns,2025-04-01T23:30:00.000Z,Head To Head,Milwaukee Bucks,1.44,Phoenix Suns,2.9,1.039,TAB
Atlanta Hawks v Portland Trail Blazers,2025-04-01T23:40:00.000Z,Head To Head,Atlanta Hawks,1.5,Portland Trail Blazers,2.65,1.044,TAB
New York Knicks v Philadelphia 76ers,2025-04-01T23:40:00.000Z,Head To Head,New York Knicks,1.11,Philadelphia 76ers,7,1.044,TAB
Chicago Bulls v Toronto Raptors,2025-04-02T00:10:00.000Z,Head To Head,Chicago Bulls,1.56,Toronto Raptors,2.5,1.041,TAB
Memphis Grizzlies v Golden State Warriors,2025-04-02T00:10:00.000Z,Head To Head,Memphis Grizzlies,2.45,Golden State Warriors,1.58,1.041,TAB
San Antonio Spurs v Orlando Magic,2025-04-02T00:10:00.000Z,Head To Head,San Antonio Spurs,2.45,Orlando Magic,1.58,1.041,TAB
Denver Nuggets v Minnesota Timberwolves,2025-04-02T02:00:00.000Z,Head To Head,Denver Nuggets,1.62,Minnesota Timberwolves,2.35,1.043,TAB
