match,start_time,market_name,home_team,home_win,away_team,away_win,margin,agency
Indiana Pacers v Milwaukee Bucks,2024-12-31T20:10:00.000Z,Head To Head,Indiana Pacers,2.35,Milwaukee Bucks,1.58,1.058,TAB
San Antonio Spurs v Los Angeles Clippers,2025-01-01T00:10:00.000Z,Head To Head,San Antonio Spurs,1.6,Los Angeles Clippers,2.4,1.042,TAB
Oklahoma City Thunder v Minnesota Timberwolves,2025-01-01T01:10:00.000Z,Head To Head,Oklahoma City Thunder,1.37,Minnesota Timberwolves,3.2,1.042,TAB
Los Angeles Lakers v Cleveland Cavaliers,2025-01-01T02:10:00.000Z,Head To Head,Los Angeles Lakers,2.65,Cleveland Cavaliers,1.5,1.044,TAB
Phoenix Suns v Memphis Grizzlies,2025-01-01T02:10:00.000Z,Head To Head,Phoenix Suns,1.52,Memphis Grizzlies,2.6,1.043,TAB
