match,start_time,market_name,home_team,home_win,away_team,away_win,margin,agency
Portland Trail Blazers v Miami Heat,2025-01-22T11:35:00Z,Head To Head,Portland Trail Blazers,4.5,Miami Heat,1.2,1.056,TopSport
Orlando Magic v Toronto Raptors,2025-01-22T11:35:00Z,Head To Head,Orlando Magic,1.82,Toronto Raptors,1.98,1.055,TopSport
Philadelphia 76ers v Denver Nuggets,2025-01-22T14:05:00Z,Head To Head,Philadelphia 76ers,6.25,Denver Nuggets,1.11,1.061,TopSport
Washington Wizards v Los Angeles Lakers,2025-01-22T14:35:00Z,Head To Head,Washington Wizards,6.25,Los Angeles Lakers,1.11,1.061,TopSport
Minnesota Timberwolves v Dallas Mavericks,2025-01-23T11:35:00Z,Head To Head,Minnesota Timberwolves,1.74,Dallas Mavericks,2.02,1.07,TopSport
