match,start_time,market_name,home_team,home_win,away_team,away_win,margin,agency
Atlanta Hawks v Charlotte Hornets,2025-03-19T10:05:00Z,Head To Head,Atlanta Hawks,1.28,Charlotte Hornets,3.7,1.052,TopSport
Brooklyn Nets v Boston Celtics,2025-03-19T10:35:00Z,Head To Head,Brooklyn Nets,6.5,Boston Celtics,1.11,1.055,TopSport
Milwaukee Bucks v Golden State Warriors,2025-03-19T13:05:00Z,Head To Head,Milwaukee Bucks,1.62,Golden State Warriors,2.26,1.06,TopSport
Cleveland Cavaliers v Los Angeles Clippers,2025-03-19T13:35:00Z,Head To Head,Cleveland Cavaliers,1.63,Los Angeles Clippers,2.22,1.064,TopSport
Houston Rockets v Orlando Magic,2025-03-20T10:05:00Z,Head To Head,Houston Rockets,1.7,Orlando Magic,2.08,1.069,TopSport
Detroit Pistons v Miami Heat,2025-03-20T10:35:00Z,Head To Head,Detroit Pistons,1.45,Miami Heat,2.62,1.071,TopSport
New York Knicks v San Antonio Spurs,2025-03-20T11:05:00Z,Head To Head,New York Knicks,1.23,San Antonio Spurs,3.85,1.073,TopSport
Washington Wizards v Utah Jazz,2025-03-20T12:05:00Z,Head To Head,Washington Wizards,2.12,Utah Jazz,1.67,1.071,TopSport
