match,start_time,market_name,home_team,home_win,away_team,away_win,margin,agency
Los Angeles Clippers v Los Angeles Lakers,2025-03-03T13:35:00Z,Head To Head,Los Angeles Clippers,1.73,Los Angeles Lakers,2.11,1.052,TopSport
Minnesota Timberwolves v Phoenix Suns,2025-03-03T13:35:00Z,Head To Head,Minnesota Timberwolves,1.82,Phoenix Suns,2,1.049,TopSport
Golden State Warriors v Charlotte Hornets,2025-03-04T11:05:00Z,Head To Head,Golden State Warriors,1.14,Charlotte Hornets,5.2,1.07,TopSport
Portland Trail Blazers v Philadelphia 76ers,2025-03-04T11:05:00Z,Head To Head,Portland Trail Blazers,2.28,Philadelphia 76ers,1.6,1.064,TopSport
Washington Wizards v Miami Heat,2025-03-04T11:35:00Z,Head To Head,Washington Wizards,4.8,Miami Heat,1.17,1.063,TopSport
Atlanta Hawks v Memphis Grizzlies,2025-03-04T12:05:00Z,Head To Head,Atlanta Hawks,3.1,Memphis Grizzlies,1.35,1.063,TopSport
Houston Rockets v Oklahoma City Thunder,2025-03-04T12:05:00Z,Head To Head,Houston Rockets,5.5,Oklahoma City Thunder,1.13,1.067,TopSport
Sacramento Kings v Dallas Mavericks,2025-03-04T12:35:00Z,Head To Head,Sacramento Kings,1.96,Dallas Mavericks,1.8,1.066,TopSport
Detroit Pistons v Utah Jazz,2025-03-04T13:05:00Z,Head To Head,Detroit Pistons,1.21,Utah Jazz,4.2,1.065,TopSport
