match,start_time,market_name,home_team,home_win,away_team,away_win,margin,agency
Memphis Grizzlies v Dallas Mavericks,2023-10-31T11:10:00Z,Head To Head,Memphis Grizzlies,1.9,Dallas Mavericks,1.91,1.05,TopSport
Oklahoma City Thunder v Detroit Pistons,2023-10-31T11:10:00Z,Head To Head,Oklahoma City Thunder,1.37,Detroit Pistons,3.1,1.053,TopSport
New Orleans Pelicans v Golden State Warriors,2023-10-31T11:10:00Z,Head To Head,New Orleans Pelicans,1.7,Golden State Warriors,2.17,1.049,TopSport
Milwaukee Bucks v Miami Heat,2023-10-31T11:10:00Z,Head To Head,Milwaukee Bucks,1.32,Miami Heat,3.45,1.047,TopSport
Denver Nuggets v Utah Jazz,2023-10-31T12:10:00Z,Head To Head,Denver Nuggets,1.25,Utah Jazz,4,1.05,TopSport
Los Angeles Lakers v Orlando Magic,2023-10-31T13:40:00Z,Head To Head,Los Angeles Lakers,1.6,Orlando Magic,2.32,1.056,TopSport
Phoenix Suns v San Antonio Spurs,2023-11-01T13:10:00Z,Head To Head,Phoenix Suns,1.32,San Antonio Spurs,3.35,1.056,TopSport
