match,start_time,market_name,home_team,home_win,away_team,away_win,margin,agency
Brooklyn Nets v San Antonio Spurs,2025-03-05T12:40:00Z,Head To Head,Brooklyn Nets,2.36,San Antonio Spurs,1.6,1.049,TopSport
Los Angeles Clippers v Phoenix Suns,2025-03-05T14:05:00Z,Head To Head,Los Angeles Clippers,1.64,Phoenix Suns,2.25,1.054,TopSport
Portland Trail Blazers v Boston Celtics,2025-03-06T11:05:00Z,Head To Head,Portland Trail Blazers,4.5,Boston Celtics,1.19,1.063,TopSport
Minnesota Timberwolves v Charlotte Hornets,2025-03-06T11:05:00Z,Head To Head,Minnesota Timberwolves,1.26,Charlotte Hornets,3.7,1.064,TopSport
Miami Heat v Cleveland Cavaliers,2025-03-06T11:05:00Z,Head To Head,Miami Heat,4.7,Cleveland Cavaliers,1.18,1.06,TopSport
Utah Jazz v Washington Wizards,2025-03-06T11:05:00Z,Head To Head,Utah Jazz,2.48,Washington Wizards,1.51,1.065,TopSport
Dallas Mavericks v Milwaukee Bucks,2025-03-06T12:05:00Z,Head To Head,Dallas Mavericks,4.2,Milwaukee Bucks,1.21,1.065,TopSport
Sacramento Kings v Denver Nuggets,2025-03-06T13:05:00Z,Head To Head,Sacramento Kings,3.05,Denver Nuggets,1.35,1.069,TopSport
