match,start_time,market_name,home_team,home_win,away_team,away_win,margin,agency
Atlanta Hawks v Phoenix Suns,2025-01-10T13:05:00Z,Head To Head,Atlanta Hawks,2.97,Phoenix Suns,1.39,1.056,TopSport
Miami Heat v Utah Jazz,2025-01-10T13:05:00Z,Head To Head,Miami Heat,1.44,Utah Jazz,2.82,1.049,TopSport
Milwaukee Bucks v Orlando Magic,2025-01-11T11:05:00Z,Head To Head,Milwaukee Bucks,1.62,Orlando Magic,2.23,1.066,TopSport
New Orleans Pelicans v Philadelphia 76ers,2025-01-11T11:05:00Z,Head To Head,New Orleans Pelicans,2.36,Philadelphia 76ers,1.56,1.065,TopSport
Sacramento Kings v Boston Celtics,2025-01-11T11:35:00Z,Head To Head,Sacramento Kings,4.5,Boston Celtics,1.19,1.063,TopSport
Oklahoma City Thunder v New York Knicks,2025-01-11T11:35:00Z,Head To Head,Oklahoma City Thunder,1.66,New York Knicks,2.17,1.063,TopSport
Washington Wizards v Chicago Bulls,2025-01-11T12:05:00Z,Head To Head,Washington Wizards,5.3,Chicago Bulls,1.14,1.066,TopSport
