match,start_time,market_name,home_team,home_win,away_team,away_win,margin,agency
Golden State Warriors v Sacramento Kings,2025-01-23T14:05:00Z,Head To Head,Golden State Warriors,3.35,Sacramento Kings,1.32,1.056,TopSport
Boston Celtics v Los Angeles Clippers,2025-01-23T14:35:00Z,Head To Head,Boston Celtics,1.1,Los Angeles Clippers,6.75,1.057,TopSport
San Antonio Spurs v Indiana Pacers,2025-01-24T06:05:00Z,Head To Head,San Antonio Spurs,2.15,Indiana Pacers,1.65,1.071,TopSport
Portland Trail Blazers v Orlando Magic,2025-01-24T11:05:00Z,Head To Head,Portland Trail Blazers,4.2,Orlando Magic,1.21,1.065,TopSport
Toronto Raptors v Atlanta Hawks,2025-01-24T11:35:00Z,Head To Head,Toronto Raptors,3.1,Atlanta Hawks,1.35,1.063,TopSport
Miami Heat v Milwaukee Bucks,2025-01-24T11:35:00Z,Head To Head,Miami Heat,2.57,Milwaukee Bucks,1.47,1.069,TopSport
Sacramento Kings v Denver Nuggets,2025-01-24T13:05:00Z,Head To Head,Sacramento Kings,3.15,Denver Nuggets,1.33,1.069,TopSport
