match,start_time,market_name,home_team,home_win,away_team,away_win,margin,agency
Minnesota Timberwolves v Washington Wizards,2025-01-14T11:05:00Z,Head To Head,Minnesota Timberwolves,1.08,Washington Wizards,7.75,1.055,TopSport
Detroit Pistons v New York Knicks,2025-01-14T11:35:00Z,Head To Head,Detroit Pistons,3.3,New York Knicks,1.33,1.055,TopSport
Golden State Warriors v Toronto Raptors,2025-01-14T11:35:00Z,Head To Head,Golden State Warriors,1.4,Toronto Raptors,2.92,1.057,TopSport
Memphis Grizzlies v Houston Rockets,2025-01-14T12:05:00Z,Head To Head,Memphis Grizzlies,2.3,Houston Rockets,1.6,1.06,TopSport
Miami Heat v Los Angeles Clippers,2025-01-14T14:35:00Z,Head To Head,Miami Heat,3.15,Los Angeles Clippers,1.35,1.058,TopSport
San Antonio Spurs v Los Angeles Lakers,2025-01-14T14:35:00Z,Head To Head,San Antonio Spurs,2.36,Los Angeles Lakers,1.57,1.061,TopSport
