match,start_time,market_name,home_team,home_win,away_team,away_win,margin,agency
Indiana Pacers v Detroit Pistons,2025-01-17T11:05:00Z,Head To Head,Indiana Pacers,1.77,Detroit Pistons,2.06,1.05,TopSport
Phoenix Suns v Washington Wizards,2025-01-17T11:05:00Z,Head To Head,Phoenix Suns,1.14,Washington Wizards,5.7,1.053,TopSport
Cleveland Cavaliers v Oklahoma City Thunder,2025-01-17T11:35:00Z,Head To Head,Cleveland Cavaliers,2.1,Oklahoma City Thunder,1.74,1.051,TopSport
Los Angeles Clippers v Portland Trail Blazers,2025-01-17T14:05:00Z,Head To Head,Los Angeles Clippers,1.35,Portland Trail Blazers,3.15,1.058,TopSport
Houston Rockets v Sacramento Kings,2025-01-17T14:05:00Z,Head To Head,Houston Rockets,2.44,Sacramento Kings,1.54,1.059,TopSport
