match,start_time,market_name,home_team,home_win,away_team,away_win,margin,agency
Dallas Mavericks v Philadelphia 76ers,2025-02-05T11:05:00Z,Head To Head,Dallas Mavericks,2.5,Philadelphia 76ers,1.51,1.062,TopSport
Houston Rockets v Brooklyn Nets,2025-02-05T11:35:00Z,Head To Head,Houston Rockets,1.2,Brooklyn Nets,4.4,1.061,TopSport
Boston Celtics v Cleveland Cavaliers,2025-02-05T11:35:00Z,Head To Head,Boston Celtics,1.92,Cleveland Cavaliers,1.85,1.061,TopSport
New York Knicks v Toronto Raptors,2025-02-05T11:35:00Z,Head To Head,New York Knicks,1.43,Toronto Raptors,2.78,1.059,TopSport
Miami Heat v Chicago Bulls,2025-02-05T12:05:00Z,Head To Head,Miami Heat,1.59,Chicago Bulls,2.33,1.058,TopSport
Los Angeles Lakers v Los Angeles Clippers,2025-02-05T14:05:00Z,Head To Head,Los Angeles Lakers,3.65,Los Angeles Clippers,1.27,1.061,TopSport
Indiana Pacers v Portland Trail Blazers,2025-02-05T14:05:00Z,Head To Head,Indiana Pacers,1.45,Portland Trail Blazers,2.72,1.057,TopSport
