match,start_time,market_name,home_team,home_win,away_team,away_win,margin,agency
Milwaukee Bucks v Chicago Bulls,2024-12-29T12:05:00Z,Head To Head,Milwaukee Bucks,1.73,Chicago Bulls,2.13,1.048,TopSport
Phoenix Suns v Golden State Warriors,2024-12-29T12:35:00Z,Head To Head,Phoenix Suns,2.98,Golden State Warriors,1.4,1.05,TopSport
Detroit Pistons v Denver Nuggets,2024-12-29T13:05:00Z,Head To Head,Detroit Pistons,2.9,Denver Nuggets,1.41,1.054,TopSport
Philadelphia 76ers v Utah Jazz,2024-12-29T13:35:00Z,Head To Head,Philadelphia 76ers,1.39,Utah Jazz,2.98,1.055,TopSport
Dallas Mavericks v Portland Trail Blazers,2024-12-29T14:05:00Z,Head To Head,Dallas Mavericks,1.56,Portland Trail Blazers,2.42,1.054,TopSport
Sacramento Kings v Los Angeles Lakers,2024-12-29T14:35:00Z,Head To Head,Sacramento Kings,1.83,Los Angeles Lakers,1.97,1.054,TopSport
