match,start_time,market_name,home_team,home_win,away_team,away_win,margin,agency
Minnesota Timberwolves v New Orleans Pelicans,2025-01-08T12:05:00Z,Head To Head,Minnesota Timberwolves,1.57,New Orleans Pelicans,2.42,1.05,TopSport
Atlanta Hawks v Utah Jazz,2025-01-08T13:05:00Z,Head To Head,Atlanta Hawks,1.45,Utah Jazz,2.74,1.055,TopSport
Boston Celtics v Denver Nuggets,2025-01-08T14:05:00Z,Head To Head,Boston Celtics,1.3,Denver Nuggets,3.5,1.055,TopSport
Miami Heat v Golden State Warriors,2025-01-08T14:05:00Z,Head To Head,Miami Heat,4.2,Golden State Warriors,1.22,1.058,TopSport
Oklahoma City Thunder v Cleveland Cavaliers,2025-01-09T11:05:00Z,Head To Head,Oklahoma City Thunder,2.1,Cleveland Cavaliers,1.7,1.064,TopSport
Chicago Bulls v Indiana Pacers,2025-01-09T11:05:00Z,Head To Head,Chicago Bulls,2.62,Indiana Pacers,1.46,1.067,TopSport
Detroit Pistons v Brooklyn Nets,2025-01-09T11:35:00Z,Head To Head,Detroit Pistons,1.36,Brooklyn Nets,3.05,1.063,TopSport
San Antonio Spurs v Milwaukee Bucks,2025-01-09T13:35:00Z,Head To Head,San Antonio Spurs,2.72,Milwaukee Bucks,1.42,1.072,TopSport
