match,start_time,market_name,home_team,home_win,away_team,away_win,margin,agency
Utah Jazz v Los Angeles Lakers,2025-02-11T14:35:00Z,Head To Head,Utah Jazz,6.5,Los Angeles Lakers,1.12,1.047,TopSport
Toronto Raptors v Philadelphia 76ers,2025-02-12T11:05:00Z,Head To Head,Toronto Raptors,3.3,Philadelphia 76ers,1.31,1.066,TopSport
New York Knicks v Indiana Pacers,2025-02-12T11:35:00Z,Head To Head,New York Knicks,1.85,Indiana Pacers,1.91,1.064,TopSport
Detroit Pistons v Chicago Bulls,2025-02-12T12:05:00Z,Head To Head,Detroit Pistons,1.56,Chicago Bulls,2.36,1.065,TopSport
Memphis Grizzlies v Phoenix Suns,2025-02-12T14:05:00Z,Head To Head,Memphis Grizzlies,1.57,Phoenix Suns,2.34,1.064,TopSport
