match,start_time,market_name,home_team,home_win,away_team,away_win,margin,agency
Boston Celtics v Houston Rockets,2024-01-14T11:10:00Z,Head To Head,Boston Celtics,1.08,Houston Rockets,8,1.051,TopSport
Atlanta Hawks v Washington Wizards,2024-01-14T11:40:00Z,Head To Head,Atlanta Hawks,1.36,Washington Wizards,3.2,1.048,TopSport
Milwaukee Bucks v Golden State Warriors,2024-01-14T12:10:00Z,Head To Head,Milwaukee Bucks,1.09,Golden State Warriors,7.5,1.051,TopSport
Memphis Grizzlies v New York Knicks,2024-01-14T12:10:00Z,Head To Head,Memphis Grizzlies,5.2,New York Knicks,1.17,1.047,TopSport
Oklahoma City Thunder v Orlando Magic,2024-01-14T12:10:00Z,Head To Head,Oklahoma City Thunder,1.16,Orlando Magic,5.5,1.044,TopSport
San Antonio Spurs v Chicago Bulls,2024-01-14T12:40:00Z,Head To Head,San Antonio Spurs,2.95,Chicago Bulls,1.4,1.053,TopSport
Dallas Mavericks v New Orleans Pelicans,2024-01-14T12:40:00Z,Head To Head,Dallas Mavericks,1.58,New Orleans Pelicans,2.41,1.048,TopSport
