match,start_time,market_name,home_team,home_win,away_team,away_win,margin,agency
Orlando Magic v Atlanta Hawks,2024-01-08T10:10:00Z,Head To Head,Orlando Magic,2.18,Atlanta Hawks,1.69,1.05,TopSport
Sacramento Kings v New Orleans Pelicans,2024-01-08T10:10:00Z,Head To Head,Sacramento Kings,1.49,New Orleans Pelicans,2.57,1.06,TopSport
Dallas Mavericks v Minnesota Timberwolves,2024-01-08T11:40:00Z,Head To Head,Dallas Mavericks,2.25,Minnesota Timberwolves,1.62,1.062,TopSport
Denver Nuggets v Detroit Pistons,2024-01-08T12:10:00Z,Head To Head,Denver Nuggets,1.04,Detroit Pistons,11,1.052,TopSport
Phoenix Suns v Memphis Grizzlies,2024-01-08T12:10:00Z,Head To Head,Phoenix Suns,1.5,Memphis Grizzlies,2.51,1.065,TopSport
Golden State Warriors v Toronto Raptors,2024-01-08T12:40:00Z,Head To Head,Golden State Warriors,1.72,Toronto Raptors,2.13,1.051,TopSport
Los Angeles Lakers v Los Angeles Clippers,2024-01-08T13:40:00Z,Head To Head,Los Angeles Lakers,2.92,Los Angeles Clippers,1.38,1.067,TopSport
