match,start_time,market_name,home_team,home_win,away_team,away_win,margin,agency
Brooklyn Nets v Philadelphia 76ers,2024-11-23T11:05:00Z,Head To Head,Brooklyn Nets,2.72,Philadelphia 76ers,1.45,1.057,TopSport
Boston Celtics v Washington Wizards,2024-11-23T11:05:00Z,Head To Head,Boston Celtics,1.06,Washington Wizards,9.5,1.049,TopSport
Golden State Warriors v New Orleans Pelicans,2024-11-23T11:35:00Z,Head To Head,Golden State Warriors,1.2,New Orleans Pelicans,4.5,1.056,TopSport
Atlanta Hawks v Chicago Bulls,2024-11-23T12:05:00Z,Head To Head,Atlanta Hawks,1.81,Chicago Bulls,1.99,1.055,TopSport
Portland Trail Blazers v Houston Rockets,2024-11-23T12:05:00Z,Head To Head,Portland Trail Blazers,6.5,Houston Rockets,1.11,1.055,TopSport
Indiana Pacers v Milwaukee Bucks,2024-11-23T12:05:00Z,Head To Head,Indiana Pacers,2.78,Milwaukee Bucks,1.44,1.054,TopSport
Dallas Mavericks v Denver Nuggets,2024-11-23T14:05:00Z,Head To Head,Dallas Mavericks,2.32,Denver Nuggets,1.59,1.06,TopSport
Sacramento Kings v Los Angeles Clippers,2024-11-23T14:35:00Z,Head To Head,Sacramento Kings,1.61,Los Angeles Clippers,2.28,1.06,TopSport
