match,start_time,market_name,home_team,home_win,away_team,away_win,margin,agency
Sacramento Kings v Orlando Magic,2025-03-30T08:11:00Z,Head To Head,Sacramento Kings,1.99,Orlando Magic,1.83,1.049,TopSport
Brooklyn Nets v Washington Wizards,2025-03-30T10:05:00Z,Head To Head,Brooklyn Nets,2.06,Washington Wizards,1.76,1.054,TopSport
Miami Heat v Philadelphia 76ers,2025-03-30T10:35:00Z,Head To Head,Miami Heat,1.29,Philadelphia 76ers,3.6,1.053,TopSport
Dallas Mavericks v Chicago Bulls,2025-03-30T11:05:00Z,Head To Head,Dallas Mavericks,2.18,Chicago Bulls,1.66,1.061,TopSport
Los Angeles Lakers v Memphis Grizzlies,2025-03-30T11:05:00Z,Head To Head,Los Angeles Lakers,2.06,Memphis Grizzlies,1.74,1.06,TopSport
Indiana Pacers v Oklahoma City Thunder,2025-03-30T11:05:00Z,Head To Head,Indiana Pacers,4.4,Oklahoma City Thunder,1.2,1.061,TopSport
Boston Celtics v San Antonio Spurs,2025-03-30T11:05:00Z,Head To Head,Boston Celtics,1.12,San Antonio Spurs,5.8,1.065,TopSport
