match,start_time,market_name,home_team,home_win,away_team,away_win,margin,agency
Miami Heat v Sacramento Kings,2025-01-07T14:10:00Z,Head To Head,Miami Heat,2.21,Sacramento Kings,1.66,1.055,TopSport
Phoenix Suns v Charlotte Hornets,2025-01-08T11:05:00Z,Head To Head,Phoenix Suns,1.66,Charlotte Hornets,2.16,1.065,TopSport
Houston Rockets v Washington Wizards,2025-01-08T11:05:00Z,Head To Head,Houston Rockets,1.23,Washington Wizards,3.95,1.066,TopSport
Los Angeles Lakers v Dallas Mavericks,2025-01-08T11:35:00Z,Head To Head,Los Angeles Lakers,1.54,Dallas Mavericks,2.4,1.066,TopSport
Minnesota Timberwolves v New Orleans Pelicans,2025-01-08T12:05:00Z,Head To Head,Minnesota Timberwolves,1.45,New Orleans Pelicans,2.66,1.066,TopSport
Boston Celtics v Denver Nuggets,2025-01-08T14:05:00Z,Head To Head,Boston Celtics,1.58,Denver Nuggets,2.28,1.072,TopSport
Miami Heat v Golden State Warriors,2025-01-08T14:05:00Z,Head To Head,Miami Heat,3.3,Golden State Warriors,1.3,1.072,TopSport
