match,start_time,market_name,home_team,home_win,away_team,away_win,margin,agency
Orlando Magic v Charlotte Hornets,2025-03-26T10:10:00Z,Head To Head,Orlando Magic,1.47,Charlotte Hornets,2.7,1.051,TopSport
San Antonio Spurs v Detroit Pistons,2025-03-26T10:10:00Z,Head To Head,San Antonio Spurs,3.8,Detroit Pistons,1.26,1.057,TopSport
Golden State Warriors v Miami Heat,2025-03-26T10:35:00Z,Head To Head,Golden State Warriors,1.54,Miami Heat,2.5,1.049,TopSport
Dallas Mavericks v New York Knicks,2025-03-26T10:35:00Z,Head To Head,Dallas Mavericks,5,New York Knicks,1.18,1.047,TopSport
Atlanta Hawks v Houston Rockets,2025-03-26T11:05:00Z,Head To Head,Atlanta Hawks,3.6,Houston Rockets,1.29,1.053,TopSport
Memphis Grizzlies v Utah Jazz,2025-03-26T12:05:00Z,Head To Head,Memphis Grizzlies,1.2,Utah Jazz,4.6,1.051,TopSport
Cleveland Cavaliers v Portland Trail Blazers,2025-03-26T13:05:00Z,Head To Head,Cleveland Cavaliers,1.38,Portland Trail Blazers,2.98,1.06,TopSport
Oklahoma City Thunder v Sacramento Kings,2025-03-26T13:05:00Z,Head To Head,Oklahoma City Thunder,1.24,Sacramento Kings,3.95,1.06,TopSport
