match,start_time,market_name,home_team,home_win,away_team,away_win,margin,agency
Los Angeles Clippers v Detroit Pistons,2025-02-25T11:05:00Z,Head To Head,Los Angeles Clippers,2.07,Detroit Pistons,1.75,1.055,TopSport
Denver Nuggets v Indiana Pacers,2025-02-25T11:05:00Z,Head To Head,Denver Nuggets,1.52,Indiana Pacers,2.52,1.055,TopSport
Chicago Bulls v Philadelphia 76ers,2025-02-25T11:05:00Z,Head To Head,Chicago Bulls,2.54,Philadelphia 76ers,1.51,1.056,TopSport
Brooklyn Nets v Washington Wizards,2025-02-25T11:05:00Z,Head To Head,Brooklyn Nets,1.64,Washington Wizards,2.24,1.056,TopSport
Miami Heat v Atlanta Hawks,2025-02-25T11:35:00Z,Head To Head,Miami Heat,1.98,Atlanta Hawks,1.82,1.055,TopSport
Minnesota Timberwolves v Oklahoma City Thunder,2025-02-25T12:05:00Z,Head To Head,Minnesota Timberwolves,5.6,Oklahoma City Thunder,1.14,1.056,TopSport
Portland Trail Blazers v Utah Jazz,2025-02-25T13:05:00Z,Head To Head,Portland Trail Blazers,1.35,Utah Jazz,3.15,1.058,TopSport
Charlotte Hornets v Sacramento Kings,2025-02-25T14:05:00Z,Head To Head,Charlotte Hornets,5,Sacramento Kings,1.17,1.055,TopSport
Dallas Mavericks v Los Angeles Lakers,2025-02-26T14:05:00Z,Head To Head,Dallas Mavericks,3.05,Los Angeles Lakers,1.35,1.069,TopSport
