match,start_time,market_name,home_team,home_win,away_team,away_win,margin,agency
Brooklyn Nets v Cleveland Cavaliers,2025-03-12T10:05:00Z,Head To Head,Brooklyn Nets,7.5,Cleveland Cavaliers,1.09,1.051,TopSport
Washington Wizards v Detroit Pistons,2025-03-12T10:05:00Z,Head To Head,Washington Wizards,7,Detroit Pistons,1.11,1.044,TopSport
Milwaukee Bucks v Indiana Pacers,2025-03-12T10:35:00Z,Head To Head,Milwaukee Bucks,1.86,Indiana Pacers,1.95,1.05,TopSport
Los Angeles Clippers v New Orleans Pelicans,2025-03-12T11:05:00Z,Head To Head,Los Angeles Clippers,1.32,New Orleans Pelicans,3.4,1.052,TopSport
Dallas Mavericks v San Antonio Spurs,2025-03-13T11:05:00Z,Head To Head,Dallas Mavericks,2.76,San Antonio Spurs,1.41,1.072,TopSport
