match,start_time,market_name,home_team,home_win,away_team,away_win,margin,agency
New York Knicks v Orlando Magic,2024-12-28T11:05:00Z,Head To Head,New York Knicks,1.37,Orlando Magic,2.99,1.064,TopSport
Indiana Pacers v Boston Celtics,2024-12-28T11:35:00Z,Head To Head,Indiana Pacers,5.7,Boston Celtics,1.14,1.053,TopSport
San Antonio Spurs v Brooklyn Nets,2024-12-28T11:35:00Z,Head To Head,San Antonio Spurs,1.31,Brooklyn Nets,3.5,1.049,TopSport
Minnesota Timberwolves v Houston Rockets,2024-12-28T12:05:00Z,Head To Head,Minnesota Timberwolves,1.86,Houston Rockets,1.93,1.056,TopSport
Memphis Grizzlies v New Orleans Pelicans,2024-12-28T12:05:00Z,Head To Head,Memphis Grizzlies,1.32,New Orleans Pelicans,3.35,1.056,TopSport
Cleveland Cavaliers v Denver Nuggets,2024-12-28T13:05:00Z,Head To Head,Cleveland Cavaliers,1.65,Denver Nuggets,2.22,1.057,TopSport
Dallas Mavericks v Phoenix Suns,2024-12-28T13:05:00Z,Head To Head,Dallas Mavericks,1.93,Phoenix Suns,1.86,1.056,TopSport
Golden State Warriors v Los Angeles Clippers,2024-12-28T14:05:00Z,Head To Head,Golden State Warriors,2.9,Los Angeles Clippers,1.39,1.064,TopSport
Oklahoma City Thunder v Charlotte Hornets,2024-12-29T10:05:00Z,Head To Head,Oklahoma City Thunder,1.11,Charlotte Hornets,6,1.068,TopSport
