match,start_time,market_name,home_team,home_win,away_team,away_win,margin,agency
Utah Jazz v Los Angeles Clippers,2024-11-18T13:05:00Z,Head To Head,Utah Jazz,4.5,Los Angeles Clippers,1.21,1.049,TopSport
Chicago Bulls v Detroit Pistons,2024-11-19T11:05:00Z,Head To Head,Chicago Bulls,2.23,Detroit Pistons,1.62,1.066,TopSport
Philadelphia 76ers v Miami Heat,2024-11-19T11:35:00Z,Head To Head,Philadelphia 76ers,2.23,Miami Heat,1.62,1.066,TopSport
Washington Wizards v New York Knicks,2024-11-19T11:35:00Z,Head To Head,Washington Wizards,6.75,New York Knicks,1.09,1.066,TopSport
Indiana Pacers v Toronto Raptors,2024-11-19T11:35:00Z,Head To Head,Indiana Pacers,1.63,Toronto Raptors,2.21,1.066,TopSport
Houston Rockets v Milwaukee Bucks,2024-11-19T12:05:00Z,Head To Head,Houston Rockets,2.23,Milwaukee Bucks,1.62,1.066,TopSport
Orlando Magic v Phoenix Suns,2024-11-19T13:05:00Z,Head To Head,Orlando Magic,2.08,Phoenix Suns,1.7,1.069,TopSport
Atlanta Hawks v Sacramento Kings,2024-11-19T14:05:00Z,Head To Head,Atlanta Hawks,2.56,Sacramento Kings,1.47,1.071,TopSport
