match,start_time,market_name,home_team,home_win,away_team,away_win,margin,agency
Atlanta Hawks v Chicago Bulls,2024-11-23T12:10:00Z,Head To Head,Atlanta Hawks,1.75,Chicago Bulls,2.09,1.05,TopSport
Portland Trail Blazers v Houston Rockets,2024-11-23T12:10:00Z,Head To Head,Portland Trail Blazers,5.7,Houston Rockets,1.14,1.053,TopSport
Indiana Pacers v Milwaukee Bucks,2024-11-23T12:11:00Z,Head To Head,Indiana Pacers,2.8,Milwaukee Bucks,1.44,1.052,TopSport
Dallas Mavericks v Denver Nuggets,2024-11-23T14:05:00Z,Head To Head,Dallas Mavericks,2.38,Denver Nuggets,1.58,1.053,TopSport
Sacramento Kings v Los Angeles Clippers,2024-11-23T14:35:00Z,Head To Head,Sacramento Kings,1.57,Los Angeles Clippers,2.4,1.054,TopSport
New York Knicks v Utah Jazz,2024-11-24T09:05:00Z,Head To Head,New York Knicks,1.24,Utah Jazz,3.85,1.066,TopSport
