match,start_time,market_name,home_team,home_win,away_team,away_win,margin,agency
Brooklyn Nets v Los Angeles Lakers,2025-01-18T14:35:00Z,Head To Head,Brooklyn Nets,4.6,Los Angeles Lakers,1.2,1.051,TopSport
Phoenix Suns v Detroit Pistons,2025-01-19T08:05:00Z,Head To Head,Phoenix Suns,1.79,Detroit Pistons,1.97,1.066,TopSport
Atlanta Hawks v Boston Celtics,2025-01-19T11:05:00Z,Head To Head,Atlanta Hawks,4.8,Boston Celtics,1.17,1.063,TopSport
Philadelphia 76ers v Indiana Pacers,2025-01-19T11:05:00Z,Head To Head,Philadelphia 76ers,3.6,Indiana Pacers,1.27,1.065,TopSport
Washington Wizards v Golden State Warriors,2025-01-19T12:35:00Z,Head To Head,Washington Wizards,6.5,Golden State Warriors,1.09,1.071,TopSport
Cleveland Cavaliers v Minnesota Timberwolves,2025-01-19T13:05:00Z,Head To Head,Cleveland Cavaliers,1.46,Minnesota Timberwolves,2.62,1.067,TopSport
Houston Rockets v Portland Trail Blazers,2025-01-19T14:05:00Z,Head To Head,Houston Rockets,1.21,Portland Trail Blazers,4.2,1.065,TopSport
