match,start_time,market_name,home_team,home_win,away_team,away_win,margin,agency
Minnesota Timberwolves v Oklahoma City Thunder,2025-01-01T12:05:00Z,Head To Head,Minnesota Timberwolves,3.15,Oklahoma City Thunder,1.37,1.047,TopSport
Cleveland Cavaliers v Los Angeles Lakers,2025-01-01T13:05:00Z,Head To Head,Cleveland Cavaliers,1.47,Los Angeles Lakers,2.66,1.056,TopSport
Memphis Grizzlies v Phoenix Suns,2025-01-01T13:05:00Z,Head To Head,Memphis Grizzlies,2.69,Phoenix Suns,1.44,1.066,TopSport
Orlando Magic v Detroit Pistons,2025-01-02T11:05:00Z,Head To Head,Orlando Magic,1.96,Detroit Pistons,1.8,1.066,TopSport
New Orleans Pelicans v Miami Heat,2025-01-02T11:35:00Z,Head To Head,New Orleans Pelicans,3.9,Miami Heat,1.23,1.069,TopSport
Utah Jazz v New York Knicks,2025-01-02T11:35:00Z,Head To Head,Utah Jazz,6.8,New York Knicks,1.08,1.073,TopSport
Atlanta Hawks v Denver Nuggets,2025-01-02T13:05:00Z,Head To Head,Atlanta Hawks,2.5,Denver Nuggets,1.49,1.071,TopSport
