match,start_time,market_name,home_team,home_win,away_team,away_win,margin,agency
Boston Celtics v Toronto Raptors,2025-02-26T11:05:00Z,Head To Head,Boston Celtics,1.16,Toronto Raptors,5.4,1.047,TopSport
Cleveland Cavaliers v Orlando Magic,2025-02-26T11:35:00Z,Head To Head,Cleveland Cavaliers,1.31,Orlando Magic,3.45,1.053,TopSport
Milwaukee Bucks v Houston Rockets,2025-02-26T12:05:00Z,Head To Head,Milwaukee Bucks,2.18,Houston Rockets,1.68,1.054,TopSport
Phoenix Suns v Memphis Grizzlies,2025-02-26T12:05:00Z,Head To Head,Phoenix Suns,3.3,Memphis Grizzlies,1.33,1.055,TopSport
San Antonio Spurs v New Orleans Pelicans,2025-02-26T12:05:00Z,Head To Head,San Antonio Spurs,2.2,New Orleans Pelicans,1.67,1.053,TopSport
Charlotte Hornets v Golden State Warriors,2025-02-26T14:05:00Z,Head To Head,Charlotte Hornets,9.5,Golden State Warriors,1.06,1.049,TopSport
Dallas Mavericks v Los Angeles Lakers,2025-02-26T14:05:00Z,Head To Head,Dallas Mavericks,4.1,Los Angeles Lakers,1.23,1.057,TopSport
