match,start_time,market_name,home_team,home_win,away_team,away_win,margin,agency
Dallas Mavericks v Milwaukee Bucks,2025-03-06T12:05:00Z,Head To Head,Dallas Mavericks,6,Milwaukee Bucks,1.13,1.052,TopSport
Sacramento Kings v Denver Nuggets,2025-03-06T13:05:00Z,Head To Head,Sacramento Kings,3.7,Denver Nuggets,1.27,1.058,TopSport
Oklahoma City Thunder v Memphis Grizzlies,2025-03-06T13:35:00Z,Head To Head,Oklahoma City Thunder,1.32,Memphis Grizzlies,3.35,1.056,TopSport
Detroit Pistons v Los Angeles Clippers,2025-03-06T14:35:00Z,Head To Head,Detroit Pistons,1.57,Los Angeles Clippers,2.4,1.054,TopSport
Chicago Bulls v Orlando Magic,2025-03-07T11:05:00Z,Head To Head,Chicago Bulls,3.25,Orlando Magic,1.32,1.065,TopSport
Indiana Pacers v Atlanta Hawks,2025-03-07T11:35:00Z,Head To Head,Indiana Pacers,1.7,Atlanta Hawks,2.1,1.064,TopSport
Philadelphia 76ers v Boston Celtics,2025-03-07T11:35:00Z,Head To Head,Philadelphia 76ers,5.7,Boston Celtics,1.12,1.068,TopSport
Golden State Warriors v Brooklyn Nets,2025-03-07T11:35:00Z,Head To Head,Golden State Warriors,1.2,Brooklyn Nets,4.3,1.066,TopSport
