match,start_time,market_name,home_team,home_win,away_team,away_win,margin,agency
Oklahoma City Thunder v Charlotte Hornets,2024-12-29T10:05:00Z,Head To Head,Oklahoma City Thunder,1.11,Charlotte Hornets,6.5,1.055,TopSport
New York Knicks v Washington Wizards,2024-12-29T11:05:00Z,Head To Head,New York Knicks,1.13,Washington Wizards,5.6,1.064,TopSport
Milwaukee Bucks v Chicago Bulls,2024-12-29T12:05:00Z,Head To Head,Milwaukee Bucks,1.58,Chicago Bulls,2.34,1.06,TopSport
Phoenix Suns v Golden State Warriors,2024-12-29T12:35:00Z,Head To Head,Phoenix Suns,3.05,Golden State Warriors,1.37,1.058,TopSport
Philadelphia 76ers v Utah Jazz,2024-12-29T13:35:00Z,Head To Head,Philadelphia 76ers,1.42,Utah Jazz,2.82,1.059,TopSport
Dallas Mavericks v Portland Trail Blazers,2024-12-29T14:05:00Z,Head To Head,Dallas Mavericks,1.5,Portland Trail Blazers,2.54,1.06,TopSport
Sacramento Kings v Los Angeles Lakers,2024-12-29T14:35:00Z,Head To Head,Sacramento Kings,1.84,Los Angeles Lakers,1.94,1.059,TopSport
