match,start_time,market_name,home_team,home_win,away_team,away_win,margin,agency
New York Knicks v Denver Nuggets,2024-11-26T13:05:00Z,Head To Head,New York Knicks,2.23,Denver Nuggets,1.66,1.051,TopSport
Brooklyn Nets v Golden State Warriors,2024-11-26T14:05:00Z,Head To Head,Brooklyn Nets,6.75,Golden State Warriors,1.1,1.057,TopSport
Oklahoma City Thunder v Sacramento Kings,2024-11-26T14:05:00Z,Head To Head,Oklahoma City Thunder,1.6,Sacramento Kings,2.32,1.056,TopSport
Chicago Bulls v Washington Wizards,2024-11-27T11:05:00Z,Head To Head,Chicago Bulls,1.53,Washington Wizards,2.44,1.063,TopSport
Milwaukee Bucks v Miami Heat,2024-11-27T11:35:00Z,Head To Head,Milwaukee Bucks,2.05,Miami Heat,1.73,1.066,TopSport
Houston Rockets v Minnesota Timberwolves,2024-11-27T12:05:00Z,Head To Head,Houston Rockets,2.29,Minnesota Timberwolves,1.59,1.066,TopSport
