match,start_time,market_name,home_team,home_win,away_team,away_win,margin,agency
Brooklyn Nets v Detroit Pistons,2025-03-02T11:05:00Z,Head To Head,Brooklyn Nets,5.3,Detroit Pistons,1.15,1.058,TopSport
Sacramento Kings v Houston Rockets,2025-03-02T12:05:00Z,Head To Head,Sacramento Kings,2.52,Houston Rockets,1.52,1.055,TopSport
San Antonio Spurs v Memphis Grizzlies,2025-03-02T12:05:00Z,Head To Head,San Antonio Spurs,3.25,Memphis Grizzlies,1.34,1.054,TopSport
Milwaukee Bucks v Dallas Mavericks,2025-03-02T12:35:00Z,Head To Head,Milwaukee Bucks,1.64,Dallas Mavericks,2.25,1.054,TopSport
Golden State Warriors v Philadelphia 76ers,2025-03-02T12:35:00Z,Head To Head,Golden State Warriors,1.29,Philadelphia 76ers,3.6,1.053,TopSport
