match,start_time,market_name,home_team,home_win,away_team,away_win,margin,agency
Oklahoma City Thunder v Dallas Mavericks,2025-01-18T12:35:00Z,Head To Head,Oklahoma City Thunder,1.65,Dallas Mavericks,2.25,1.051,TopSport
Memphis Grizzlies v San Antonio Spurs,2025-01-18T13:35:00Z,Head To Head,Memphis Grizzlies,1.85,San Antonio Spurs,1.95,1.053,TopSport
Brooklyn Nets v Los Angeles Lakers,2025-01-18T14:35:00Z,Head To Head,Brooklyn Nets,5.1,Los Angeles Lakers,1.17,1.051,TopSport
Phoenix Suns v Detroit Pistons,2025-01-19T08:05:00Z,Head To Head,Phoenix Suns,1.78,Detroit Pistons,1.99,1.064,TopSport
Philadelphia 76ers v Indiana Pacers,2025-01-19T11:05:00Z,Head To Head,Philadelphia 76ers,3.4,Indiana Pacers,1.3,1.063,TopSport
