match,start_time,market_name,home_team,home_win,away_team,away_win,margin,agency
Sacramento Kings v Phoenix Suns,2025-03-15T13:05:00Z,Head To Head,Sacramento Kings,2.08,Phoenix Suns,1.75,1.052,TopSport
Boston Celtics v Brooklyn Nets,2025-03-16T09:05:00Z,Head To Head,Boston Celtics,1.15,Brooklyn Nets,5,1.07,TopSport
Oklahoma City Thunder v Detroit Pistons,2025-03-16T10:05:00Z,Head To Head,Oklahoma City Thunder,1.39,Detroit Pistons,2.9,1.064,TopSport
Chicago Bulls v Houston Rockets,2025-03-16T11:05:00Z,Head To Head,Chicago Bulls,4.3,Houston Rockets,1.2,1.066,TopSport
Miami Heat v Memphis Grizzlies,2025-03-16T11:05:00Z,Head To Head,Miami Heat,3.3,Memphis Grizzlies,1.31,1.066,TopSport
Indiana Pacers v Milwaukee Bucks,2025-03-16T11:05:00Z,Head To Head,Indiana Pacers,2.44,Milwaukee Bucks,1.53,1.063,TopSport
New York Knicks v Golden State Warriors,2025-03-16T11:35:00Z,Head To Head,New York Knicks,2.94,Golden State Warriors,1.38,1.065,TopSport
New Orleans Pelicans v San Antonio Spurs,2025-03-16T11:35:00Z,Head To Head,New Orleans Pelicans,1.63,San Antonio Spurs,2.21,1.066,TopSport
Washington Wizards v Denver Nuggets,2025-03-16T12:05:00Z,Head To Head,Washington Wizards,8.25,Denver Nuggets,1.07,1.056,TopSport
