match,start_time,market_name,home_team,home_win,away_team,away_win,margin,agency
Chicago Bulls v Utah Jazz,2025-03-18T12:05:00Z,Head To Head,Chicago Bulls,1.52,Utah Jazz,2.54,1.052,TopSport
Denver Nuggets v Golden State Warriors,2025-03-18T13:05:00Z,Head To Head,Denver Nuggets,2.5,Golden State Warriors,1.53,1.054,TopSport
Toronto Raptors v Phoenix Suns,2025-03-18T13:05:00Z,Head To Head,Toronto Raptors,4,Phoenix Suns,1.24,1.056,TopSport
Washington Wizards v Portland Trail Blazers,2025-03-18T13:05:00Z,Head To Head,Washington Wizards,2.94,Portland Trail Blazers,1.4,1.054,TopSport
Memphis Grizzlies v Sacramento Kings,2025-03-18T13:05:00Z,Head To Head,Memphis Grizzlies,2.16,Sacramento Kings,1.69,1.055,TopSport
San Antonio Spurs v Los Angeles Lakers,2025-03-18T13:35:00Z,Head To Head,San Antonio Spurs,4.2,Los Angeles Lakers,1.22,1.058,TopSport
Atlanta Hawks v Charlotte Hornets,2025-03-19T10:05:00Z,Head To Head,Atlanta Hawks,1.35,Charlotte Hornets,3.1,1.063,TopSport
Brooklyn Nets v Boston Celtics,2025-03-19T10:35:00Z,Head To Head,Brooklyn Nets,6.25,Boston Celtics,1.11,1.061,TopSport
