match,start_time,market_name,home_team,home_win,away_team,away_win,margin,agency
Milwaukee Bucks v Dallas Mavericks,2025-03-02T12:35:00Z,Head To Head,Milwaukee Bucks,1.67,Dallas Mavericks,2.22,1.049,TopSport
Golden State Warriors v Philadelphia 76ers,2025-03-02T12:35:00Z,Head To Head,Golden State Warriors,1.36,Philadelphia 76ers,3.2,1.048,TopSport
Denver Nuggets v Boston Celtics,2025-03-03T05:05:00Z,Head To Head,Denver Nuggets,2.1,Boston Celtics,1.7,1.064,TopSport
Chicago Bulls v Indiana Pacers,2025-03-03T09:05:00Z,Head To Head,Chicago Bulls,4.3,Indiana Pacers,1.2,1.066,TopSport
New York Knicks v Miami Heat,2025-03-03T10:05:00Z,Head To Head,New York Knicks,1.42,Miami Heat,2.76,1.067,TopSport
Toronto Raptors v Orlando Magic,2025-03-03T10:05:00Z,Head To Head,Toronto Raptors,3.1,Orlando Magic,1.35,1.063,TopSport
Oklahoma City Thunder v San Antonio Spurs,2025-03-03T11:05:00Z,Head To Head,Oklahoma City Thunder,1.12,San Antonio Spurs,5.7,1.068,TopSport
