match,start_time,market_name,home_team,home_win,away_team,away_win,margin,agency
New York Knicks v Charlotte Hornets,2025-03-21T10:11:00Z,Head To Head,New York Knicks,1.32,Charlotte Hornets,3.4,1.052,TopSport
Brooklyn Nets v Indiana Pacers,2025-03-21T10:05:00Z,Head To Head,Brooklyn Nets,3.45,Indiana Pacers,1.32,1.047,TopSport
Toronto Raptors v Golden State Warriors,2025-03-21T13:05:00Z,Head To Head,Toronto Raptors,7.5,Golden State Warriors,1.07,1.068,TopSport
Chicago Bulls v Sacramento Kings,2025-03-21T13:05:00Z,Head To Head,Chicago Bulls,2.89,Sacramento Kings,1.41,1.055,TopSport
Milwaukee Bucks v Los Angeles Lakers,2025-03-21T13:35:00Z,Head To Head,Milwaukee Bucks,1.36,Los Angeles Lakers,3.1,1.058,TopSport
