match,start_time,market_name,home_team,home_win,away_team,away_win,margin,agency
Atlanta Hawks v Charlotte Hornets,2025-03-19T10:05:00Z,Head To Head,Atlanta Hawks,1.29,Charlotte Hornets,3.6,1.053,TopSport
Brooklyn Nets v Boston Celtics,2025-03-19T10:35:00Z,Head To Head,Brooklyn Nets,6.75,Boston Celtics,1.1,1.057,TopSport
Milwaukee Bucks v Golden State Warriors,2025-03-19T13:05:00Z,Head To Head,Milwaukee Bucks,1.63,Golden State Warriors,2.24,1.06,TopSport
Cleveland Cavaliers v Los Angeles Clippers,2025-03-19T13:35:00Z,Head To Head,Cleveland Cavaliers,1.64,Los Angeles Clippers,2.22,1.06,TopSport
Detroit Pistons v Miami Heat,2025-03-20T10:35:00Z,Head To Head,Detroit Pistons,1.43,Miami Heat,2.7,1.07,TopSport
New York Knicks v San Antonio Spurs,2025-03-20T11:05:00Z,Head To Head,New York Knicks,1.22,San Antonio Spurs,3.95,1.073,TopSport
