match,start_time,market_name,home_team,home_win,away_team,away_win,margin,agency
Washington Wizards v Cleveland Cavaliers,2024-12-14T11:05:00Z,Head To Head,Washington Wizards,11,Cleveland Cavaliers,1.05,1.043,TopSport
Indiana Pacers v Philadelphia 76ers,2024-12-14T11:05:00Z,Head To Head,Indiana Pacers,2.98,Philadelphia 76ers,1.39,1.055,TopSport
Charlotte Hornets v Chicago Bulls,2024-12-14T12:05:00Z,Head To Head,Charlotte Hornets,2.98,Chicago Bulls,1.39,1.055,TopSport
Brooklyn Nets v Memphis Grizzlies,2024-12-14T12:05:00Z,Head To Head,Brooklyn Nets,4.6,Memphis Grizzlies,1.2,1.051,TopSport
Los Angeles Lakers v Minnesota Timberwolves,2024-12-14T12:05:00Z,Head To Head,Los Angeles Lakers,3.95,Minnesota Timberwolves,1.25,1.053,TopSport
Los Angeles Clippers v Denver Nuggets,2024-12-14T13:05:00Z,Head To Head,Los Angeles Clippers,2.82,Denver Nuggets,1.42,1.059,TopSport
Phoenix Suns v Utah Jazz,2024-12-14T13:35:00Z,Head To Head,Phoenix Suns,1.32,Utah Jazz,3.3,1.061,TopSport
San Antonio Spurs v Portland Trail Blazers,2024-12-14T14:05:00Z,Head To Head,San Antonio Spurs,1.61,Portland Trail Blazers,2.27,1.062,TopSport
