match,start_time,market_name,home_team,home_win,away_team,away_win,margin,agency
Washington Wizards v Cleveland Cavaliers,2024-12-14T11:05:00Z,Head To Head,Washington Wizards,11,Cleveland Cavaliers,1.06,1.034,TopSport
Indiana Pacers v Philadelphia 76ers,2024-12-14T11:05:00Z,Head To Head,Indiana Pacers,3.05,Philadelphia 76ers,1.39,1.047,TopSport
Brooklyn Nets v Memphis Grizzlies,2024-12-14T12:05:00Z,Head To Head,Brooklyn Nets,4.7,Memphis Grizzlies,1.19,1.053,TopSport
Los Angeles Lakers v Minnesota Timberwolves,2024-12-14T12:05:00Z,Head To Head,Los Angeles Lakers,3.95,Minnesota Timberwolves,1.25,1.053,TopSport
Phoenix Suns v Utah Jazz,2024-12-14T13:35:00Z,Head To Head,Phoenix Suns,1.33,Utah Jazz,3.25,1.06,TopSport
