match,start_time,market_name,home_team,home_win,away_team,away_win,margin,agency
Detroit Pistons v Orlando Magic,2024-11-24T11:05:00Z,Head To Head,Detroit Pistons,4.2,Orlando Magic,1.23,1.051,TopSport
Memphis Grizzlies v Chicago Bulls,2024-11-24T12:05:00Z,Head To Head,Memphis Grizzlies,1.54,Chicago Bulls,2.46,1.056,TopSport
Portland Trail Blazers v Houston Rockets,2024-11-24T12:05:00Z,Head To Head,Portland Trail Blazers,6.5,Houston Rockets,1.11,1.055,TopSport
Charlotte Hornets v Milwaukee Bucks,2024-11-24T12:05:00Z,Head To Head,Charlotte Hornets,3.35,Milwaukee Bucks,1.32,1.056,TopSport
Golden State Warriors v San Antonio Spurs,2024-11-24T12:35:00Z,Head To Head,Golden State Warriors,1.62,San Antonio Spurs,2.29,1.054,TopSport
Denver Nuggets v Los Angeles Lakers,2024-11-24T14:35:00Z,Head To Head,Denver Nuggets,2.35,Los Angeles Lakers,1.59,1.054,TopSport
Minnesota Timberwolves v Boston Celtics,2024-11-25T07:35:00Z,Head To Head,Minnesota Timberwolves,3.5,Boston Celtics,1.28,1.067,TopSport
Washington Wizards v Indiana Pacers,2024-11-25T09:05:00Z,Head To Head,Washington Wizards,5.7,Indiana Pacers,1.12,1.068,TopSport
