match,start_time,market_name,home_team,home_win,away_team,away_win,margin,agency
New York Knicks v Washington Wizards,2024-12-31T11:10:00Z,Head To Head,New York Knicks,1.12,Washington Wizards,6.25,1.053,TopSport
Chicago Bulls v Charlotte Hornets,2024-12-31T11:11:00Z,Head To Head,Chicago Bulls,1.55,Charlotte Hornets,2.48,1.048,TopSport
Los Angeles Clippers v New Orleans Pelicans,2024-12-31T12:05:00Z,Head To Head,Los Angeles Clippers,1.51,New Orleans Pelicans,2.54,1.056,TopSport
Denver Nuggets v Utah Jazz,2024-12-31T13:05:00Z,Head To Head,Denver Nuggets,1.32,Utah Jazz,3.35,1.056,TopSport
Cleveland Cavaliers v Golden State Warriors,2024-12-31T14:05:00Z,Head To Head,Cleveland Cavaliers,1.51,Golden State Warriors,2.47,1.067,TopSport
Philadelphia 76ers v Portland Trail Blazers,2024-12-31T14:05:00Z,Head To Head,Philadelphia 76ers,1.38,Portland Trail Blazers,3,1.058,TopSport
Dallas Mavericks v Sacramento Kings,2024-12-31T14:05:00Z,Head To Head,Dallas Mavericks,3.1,Sacramento Kings,1.36,1.058,TopSport
