match,start_time,market_name,home_team,home_win,away_team,away_win,margin,agency
Toronto Raptors v Cleveland Cavaliers,2025-01-10T11:05:00Z,Head To Head,Toronto Raptors,7.5,Cleveland Cavaliers,1.09,1.051,TopSport
Golden State Warriors v Detroit Pistons,2025-01-10T11:05:00Z,Head To Head,Golden State Warriors,1.69,Detroit Pistons,2.19,1.048,TopSport
Minnesota Timberwolves v Orlando Magic,2025-01-10T11:05:00Z,Head To Head,Minnesota Timberwolves,1.44,Orlando Magic,2.8,1.052,TopSport
Portland Trail Blazers v Dallas Mavericks,2025-01-10T11:35:00Z,Head To Head,Portland Trail Blazers,3.4,Dallas Mavericks,1.32,1.052,TopSport
Houston Rockets v Memphis Grizzlies,2025-01-10T12:05:00Z,Head To Head,Houston Rockets,2.14,Memphis Grizzlies,1.7,1.056,TopSport
Atlanta Hawks v Phoenix Suns,2025-01-10T13:05:00Z,Head To Head,Atlanta Hawks,2.93,Phoenix Suns,1.39,1.061,TopSport
Miami Heat v Utah Jazz,2025-01-10T13:05:00Z,Head To Head,Miami Heat,1.44,Utah Jazz,2.78,1.054,TopSport
Oklahoma City Thunder v New York Knicks,2025-01-11T11:35:00Z,Head To Head,Oklahoma City Thunder,1.64,New York Knicks,2.17,1.071,TopSport
