match,start_time,market_name,home_team,home_win,away_team,away_win,margin,agency
Minnesota Timberwolves v Charlotte Hornets,2025-03-06T11:05:00Z,Head To Head,Minnesota Timberwolves,1.25,Charlotte Hornets,4,1.05,TopSport
Miami Heat v Cleveland Cavaliers,2025-03-06T11:05:00Z,Head To Head,Miami Heat,6.5,Cleveland Cavaliers,1.11,1.055,TopSport
Utah Jazz v Washington Wizards,2025-03-06T11:10:00Z,Head To Head,Utah Jazz,2.68,Washington Wizards,1.48,1.049,TopSport
Portland Trail Blazers v Boston Celtics,2025-03-06T11:12:00Z,Head To Head,Portland Trail Blazers,4.1,Boston Celtics,1.22,1.064,TopSport
Dallas Mavericks v Milwaukee Bucks,2025-03-06T12:05:00Z,Head To Head,Dallas Mavericks,5.9,Milwaukee Bucks,1.13,1.054,TopSport
Sacramento Kings v Denver Nuggets,2025-03-06T13:05:00Z,Head To Head,Sacramento Kings,3.05,Denver Nuggets,1.38,1.053,TopSport
Oklahoma City Thunder v Memphis Grizzlies,2025-03-06T13:35:00Z,Head To Head,Oklahoma City Thunder,1.32,Memphis Grizzlies,3.35,1.056,TopSport
Detroit Pistons v Los Angeles Clippers,2025-03-06T14:35:00Z,Head To Head,Detroit Pistons,1.55,Los Angeles Clippers,2.4,1.062,TopSport
Golden State Warriors v Brooklyn Nets,2025-03-07T11:35:00Z,Head To Head,Golden State Warriors,1.19,Brooklyn Nets,4.3,1.073,TopSport
