match,start_time,market_name,home_team,home_win,away_team,away_win,margin,agency
Philadelphia 76ers v Milwaukee Bucks,2025-01-20T11:05:00Z,Head To Head,Philadelphia 76ers,6.25,Milwaukee Bucks,1.12,1.053,TopSport
Brooklyn Nets v Oklahoma City Thunder,2025-01-20T11:05:00Z,Head To Head,Brooklyn Nets,11,Oklahoma City Thunder,1.04,1.052,TopSport
Los Angeles Lakers v Los Angeles Clippers,2025-01-20T13:05:00Z,Head To Head,Los Angeles Lakers,2.46,Los Angeles Clippers,1.54,1.056,TopSport
Chicago Bulls v Portland Trail Blazers,2025-01-20T13:05:00Z,Head To Head,Chicago Bulls,1.37,Portland Trail Blazers,2.98,1.065,TopSport
Washington Wizards v Sacramento Kings,2025-01-20T13:05:00Z,Head To Head,Washington Wizards,10,Sacramento Kings,1.06,1.043,TopSport
Dallas Mavericks v Charlotte Hornets,2025-01-21T04:05:00Z,Head To Head,Dallas Mavericks,1.43,Charlotte Hornets,2.72,1.067,TopSport
Detroit Pistons v Houston Rockets,2025-01-21T06:05:00Z,Head To Head,Detroit Pistons,3.35,Houston Rockets,1.3,1.068,TopSport
Phoenix Suns v Cleveland Cavaliers,2025-01-21T07:35:00Z,Head To Head,Phoenix Suns,3.25,Cleveland Cavaliers,1.32,1.065,TopSport
