match,start_time,market_name,home_team,home_win,away_team,away_win,margin,agency
Brooklyn Nets v Los Angeles Clippers,2025-01-16T14:40:00Z,Head To Head,Brooklyn Nets,7.5,Los Angeles Clippers,1.09,1.051,TopSport
Indiana Pacers v Detroit Pistons,2025-01-17T11:05:00Z,Head To Head,Indiana Pacers,2.1,Detroit Pistons,1.7,1.064,TopSport
Phoenix Suns v Washington Wizards,2025-01-17T11:05:00Z,Head To Head,Phoenix Suns,1.17,Washington Wizards,4.8,1.063,TopSport
Cleveland Cavaliers v Oklahoma City Thunder,2025-01-17T11:35:00Z,Head To Head,Cleveland Cavaliers,2.19,Oklahoma City Thunder,1.64,1.066,TopSport
Los Angeles Clippers v Portland Trail Blazers,2025-01-17T14:05:00Z,Head To Head,Los Angeles Clippers,1.38,Portland Trail Blazers,2.94,1.065,TopSport
