match,start_time,market_name,home_team,home_win,away_team,away_win,margin,agency
Los Angeles Clippers v Charlotte Hornets,2025-02-01T11:05:00Z,Head To Head,Los Angeles Clippers,1.11,Charlotte Hornets,6.5,1.055,TopSport
Dallas Mavericks v Detroit Pistons,2025-02-01T11:05:00Z,Head To Head,Dallas Mavericks,1.85,Detroit Pistons,1.96,1.051,TopSport
Chicago Bulls v Toronto Raptors,2025-02-01T11:35:00Z,Head To Head,Chicago Bulls,2.36,Toronto Raptors,1.6,1.049,TopSport
Denver Nuggets v Philadelphia 76ers,2025-02-01T11:38:00Z,Head To Head,Denver Nuggets,1.25,Philadelphia 76ers,4.1,1.044,TopSport
Milwaukee Bucks v San Antonio Spurs,2025-02-01T12:05:00Z,Head To Head,Milwaukee Bucks,1.79,San Antonio Spurs,2.03,1.051,TopSport
Boston Celtics v New Orleans Pelicans,2025-02-01T12:07:00Z,Head To Head,Boston Celtics,1.15,New Orleans Pelicans,5.3,1.058,TopSport
Phoenix Suns v Golden State Warriors,2025-02-01T14:05:00Z,Head To Head,Phoenix Suns,1.82,Golden State Warriors,1.96,1.06,TopSport
Atlanta Hawks v Indiana Pacers,2025-02-02T09:05:00Z,Head To Head,Atlanta Hawks,2.94,Indiana Pacers,1.38,1.065,TopSport
