match,start_time,market_name,home_team,home_win,away_team,away_win,margin,agency
Sacramento Kings v Dallas Mavericks,2025-02-11T12:35:00Z,Head To Head,Sacramento Kings,1.8,Dallas Mavericks,2.02,1.051,TopSport
Portland Trail Blazers v Denver Nuggets,2025-02-11T13:05:00Z,Head To Head,Portland Trail Blazers,3.95,Denver Nuggets,1.25,1.053,TopSport
Utah Jazz v Los Angeles Lakers,2025-02-11T14:35:00Z,Head To Head,Utah Jazz,6,Los Angeles Lakers,1.12,1.06,TopSport
Toronto Raptors v Philadelphia 76ers,2025-02-12T11:05:00Z,Head To Head,Toronto Raptors,3.3,Philadelphia 76ers,1.31,1.066,TopSport
New York Knicks v Indiana Pacers,2025-02-12T11:35:00Z,Head To Head,New York Knicks,1.88,Indiana Pacers,1.88,1.064,TopSport
Detroit Pistons v Chicago Bulls,2025-02-12T12:05:00Z,Head To Head,Detroit Pistons,1.61,Chicago Bulls,2.25,1.066,TopSport
