match,start_time,market_name,home_team,home_win,away_team,away_win,margin,agency
Denver Nuggets v Cleveland Cavaliers,2024-12-06T11:05:00Z,Head To Head,Denver Nuggets,2.4,Cleveland Cavaliers,1.58,1.05,TopSport
Dallas Mavericks v Washington Wizards,2024-12-06T11:05:00Z,Head To Head,Dallas Mavericks,1.1,Washington Wizards,7,1.052,TopSport
Charlotte Hornets v New York Knicks,2024-12-06T11:35:00Z,Head To Head,Charlotte Hornets,8,New York Knicks,1.08,1.051,TopSport
Oklahoma City Thunder v Toronto Raptors,2024-12-06T11:35:00Z,Head To Head,Oklahoma City Thunder,1.22,Toronto Raptors,4.5,1.042,TopSport
Sacramento Kings v Memphis Grizzlies,2024-12-06T12:05:00Z,Head To Head,Sacramento Kings,2.34,Memphis Grizzlies,1.56,1.068,TopSport
Phoenix Suns v New Orleans Pelicans,2024-12-06T12:05:00Z,Head To Head,Phoenix Suns,1.78,New Orleans Pelicans,2.03,1.054,TopSport
Chicago Bulls v San Antonio Spurs,2024-12-06T12:05:00Z,Head To Head,Chicago Bulls,2.03,San Antonio Spurs,1.78,1.054,TopSport
Houston Rockets v Golden State Warriors,2024-12-06T14:05:00Z,Head To Head,Houston Rockets,1.57,Golden State Warriors,2.36,1.061,TopSport
