match,start_time,market_name,home_team,home_win,away_team,away_win,margin,agency
Oklahoma City Thunder v Utah Jazz,2025-02-22T13:35:00Z,Head To Head,Oklahoma City Thunder,1.08,Utah Jazz,7.75,1.055,TopSport
Minnesota Timberwolves v Houston Rockets,2025-02-22T13:38:00Z,Head To Head,Minnesota Timberwolves,2.38,Houston Rockets,1.58,1.053,TopSport
Golden State Warriors v Sacramento Kings,2025-02-22T14:05:00Z,Head To Head,Golden State Warriors,1.74,Sacramento Kings,2.08,1.055,TopSport
Phoenix Suns v Chicago Bulls,2025-02-23T09:05:00Z,Head To Head,Phoenix Suns,1.58,Chicago Bulls,2.32,1.064,TopSport
Brooklyn Nets v Philadelphia 76ers,2025-02-23T11:35:00Z,Head To Head,Brooklyn Nets,4.1,Philadelphia 76ers,1.22,1.064,TopSport
Los Angeles Lakers v Denver Nuggets,2025-02-23T12:35:00Z,Head To Head,Los Angeles Lakers,2.82,Denver Nuggets,1.41,1.064,TopSport
Houston Rockets v Utah Jazz,2025-02-23T13:35:00Z,Head To Head,Houston Rockets,1.27,Utah Jazz,3.55,1.069,TopSport
Charlotte Hornets v Portland Trail Blazers,2025-02-23T14:05:00Z,Head To Head,Charlotte Hornets,2.6,Portland Trail Blazers,1.46,1.07,TopSport
