match,start_time,market_name,home_team,home_win,away_team,away_win,margin,agency
Los Angeles Clippers v Portland Trail Blazers,2025-01-17T14:05:00Z,Head To Head,Los Angeles Clippers,1.37,Portland Trail Blazers,3.15,1.047,TopSport
Houston Rockets v Sacramento Kings,2025-01-17T14:05:00Z,Head To Head,Houston Rockets,2.52,Sacramento Kings,1.53,1.05,TopSport
Orlando Magic v Boston Celtics,2025-01-18T11:05:00Z,Head To Head,Orlando Magic,5.4,Boston Celtics,1.13,1.07,TopSport
Minnesota Timberwolves v New York Knicks,2025-01-18T11:35:00Z,Head To Head,Minnesota Timberwolves,2.36,New York Knicks,1.56,1.065,TopSport
Charlotte Hornets v Chicago Bulls,2025-01-18T12:05:00Z,Head To Head,Charlotte Hornets,2.52,Chicago Bulls,1.5,1.063,TopSport
Toronto Raptors v Milwaukee Bucks,2025-01-18T12:05:00Z,Head To Head,Toronto Raptors,5.3,Milwaukee Bucks,1.14,1.066,TopSport
Brooklyn Nets v Los Angeles Lakers,2025-01-18T14:35:00Z,Head To Head,Brooklyn Nets,5.3,Los Angeles Lakers,1.13,1.074,TopSport
