match,start_time,market_name,home_team,home_win,away_team,away_win,margin,agency
San Antonio Spurs v Orlando Magic,2025-02-09T11:05:00Z,Head To Head,San Antonio Spurs,2.2,Orlando Magic,1.65,1.061,TopSport
Atlanta Hawks v Washington Wizards,2025-02-09T11:05:00Z,Head To Head,Atlanta Hawks,1.35,Washington Wizards,3.2,1.053,TopSport
Golden State Warriors v Chicago Bulls,2025-02-09T12:05:00Z,Head To Head,Golden State Warriors,1.43,Chicago Bulls,2.82,1.054,TopSport
Oklahoma City Thunder v Memphis Grizzlies,2025-02-09T12:05:00Z,Head To Head,Oklahoma City Thunder,1.78,Memphis Grizzlies,2.03,1.054,TopSport
Portland Trail Blazers v Minnesota Timberwolves,2025-02-09T12:05:00Z,Head To Head,Portland Trail Blazers,2.9,Minnesota Timberwolves,1.41,1.054,TopSport
Boston Celtics v New York Knicks,2025-02-09T12:35:00Z,Head To Head,Boston Celtics,1.55,New York Knicks,2.44,1.055,TopSport
Denver Nuggets v Phoenix Suns,2025-02-09T13:05:00Z,Head To Head,Denver Nuggets,1.49,Phoenix Suns,2.58,1.059,TopSport
New Orleans Pelicans v Sacramento Kings,2025-02-09T14:05:00Z,Head To Head,New Orleans Pelicans,3.35,Sacramento Kings,1.31,1.062,TopSport
Utah Jazz v Los Angeles Clippers,2025-02-09T14:35:00Z,Head To Head,Utah Jazz,9.75,Los Angeles Clippers,1.06,1.046,TopSport
