match,start_time,market_name,home_team,home_win,away_team,away_win,margin,agency
Golden State Warriors v Houston Rockets,2025-02-14T12:05:00Z,Head To Head,Golden State Warriors,1.99,Houston Rockets,1.81,1.055,TopSport
Sacramento Kings v New Orleans Pelicans,2025-02-14T12:05:00Z,Head To Head,Sacramento Kings,1.29,New Orleans Pelicans,3.55,1.057,TopSport
Miami Heat v Dallas Mavericks,2025-02-14T12:35:00Z,Head To Head,Miami Heat,1.89,Dallas Mavericks,1.9,1.055,TopSport
Oklahoma City Thunder v Minnesota Timberwolves,2025-02-14T12:35:00Z,Head To Head,Oklahoma City Thunder,1.26,Minnesota Timberwolves,3.85,1.053,TopSport
Los Angeles Clippers v Utah Jazz,2025-02-14T13:05:00Z,Head To Head,Los Angeles Clippers,1.24,Utah Jazz,3.95,1.06,TopSport
