match,start_time,market_name,home_team,home_win,away_team,away_win,margin,agency
Brooklyn Nets v Washington Wizards,2025-03-30T10:05:00Z,Head To Head,Brooklyn Nets,2.08,Washington Wizards,1.76,1.049,TopSport
Miami Heat v Philadelphia 76ers,2025-03-30T10:35:00Z,Head To Head,Miami Heat,1.29,Philadelphia 76ers,3.6,1.053,TopSport
Dallas Mavericks v Chicago Bulls,2025-03-30T11:05:00Z,Head To Head,Dallas Mavericks,2.23,Chicago Bulls,1.65,1.054,TopSport
Los Angeles Lakers v Memphis Grizzlies,2025-03-30T11:05:00Z,Head To Head,Los Angeles Lakers,2.07,Memphis Grizzlies,1.75,1.055,TopSport
Indiana Pacers v Oklahoma City Thunder,2025-03-30T11:05:00Z,Head To Head,Indiana Pacers,4.4,Oklahoma City Thunder,1.21,1.054,TopSport
Boston Celtics v San Antonio Spurs,2025-03-30T11:05:00Z,Head To Head,Boston Celtics,1.13,San Antonio Spurs,5.8,1.057,TopSport
Los Angeles Clippers v Cleveland Cavaliers,2025-03-31T06:35:00Z,Head To Head,Los Angeles Clippers,2.94,Cleveland Cavaliers,1.38,1.065,TopSport
Portland Trail Blazers v New York Knicks,2025-03-31T09:05:00Z,Head To Head,Portland Trail Blazers,3.6,New York Knicks,1.27,1.065,TopSport
