match,start_time,market_name,home_team,home_win,away_team,away_win,margin,agency
Minnesota Timberwolves v Phoenix Suns,2025-01-30T13:05:00Z,Head To Head,Minnesota Timberwolves,2.04,Phoenix Suns,1.79,1.049,TopSport
Oklahoma City Thunder v Golden State Warriors,2025-01-30T14:05:00Z,Head To Head,Oklahoma City Thunder,1.2,Golden State Warriors,4.5,1.056,TopSport
Atlanta Hawks v Cleveland Cavaliers,2025-01-31T11:05:00Z,Head To Head,Atlanta Hawks,4.3,Cleveland Cavaliers,1.2,1.066,TopSport
Los Angeles Lakers v Washington Wizards,2025-01-31T11:05:00Z,Head To Head,Los Angeles Lakers,1.38,Washington Wizards,2.94,1.065,TopSport
Houston Rockets v Memphis Grizzlies,2025-01-31T13:35:00Z,Head To Head,Houston Rockets,2.32,Memphis Grizzlies,1.57,1.068,TopSport
