match,start_time,market_name,home_team,home_win,away_team,away_win,margin,agency
Sacramento Kings v Boston Celtics,2025-01-11T11:35:00Z,Head To Head,Sacramento Kings,5.7,Boston Celtics,1.14,1.053,TopSport
Oklahoma City Thunder v New York Knicks,2025-01-11T11:35:00Z,Head To Head,Oklahoma City Thunder,1.72,New York Knicks,2.13,1.051,TopSport
Washington Wizards v Chicago Bulls,2025-01-11T12:05:00Z,Head To Head,Washington Wizards,5,Chicago Bulls,1.18,1.047,TopSport
Brooklyn Nets v Denver Nuggets,2025-01-11T13:05:00Z,Head To Head,Brooklyn Nets,7.25,Denver Nuggets,1.09,1.055,TopSport
Houston Rockets v Atlanta Hawks,2025-01-12T07:05:00Z,Head To Head,Houston Rockets,1.63,Atlanta Hawks,2.21,1.066,TopSport
Utah Jazz v Phoenix Suns,2025-01-12T09:05:00Z,Head To Head,Utah Jazz,5.1,Phoenix Suns,1.15,1.066,TopSport
Toronto Raptors v Detroit Pistons,2025-01-12T11:05:00Z,Head To Head,Toronto Raptors,2.9,Detroit Pistons,1.39,1.064,TopSport
Memphis Grizzlies v Minnesota Timberwolves,2025-01-12T12:05:00Z,Head To Head,Memphis Grizzlies,2.02,Minnesota Timberwolves,1.74,1.07,TopSport
Miami Heat v Portland Trail Blazers,2025-01-12T14:05:00Z,Head To Head,Miami Heat,1.58,Portland Trail Blazers,2.28,1.072,TopSport
