match,start_time,market_name,home_team,home_win,away_team,away_win,margin,agency
Memphis Grizzlies v Utah Jazz,2025-03-26T12:05:00Z,Head To Head,Memphis Grizzlies,1.18,Utah Jazz,4.9,1.052,TopSport
Cleveland Cavaliers v Portland Trail Blazers,2025-03-26T13:05:00Z,Head To Head,Cleveland Cavaliers,1.38,Portland Trail Blazers,3.05,1.053,TopSport
Oklahoma City Thunder v Sacramento Kings,2025-03-26T13:05:00Z,Head To Head,Oklahoma City Thunder,1.24,Sacramento Kings,4,1.056,TopSport
Toronto Raptors v Brooklyn Nets,2025-03-27T10:35:00Z,Head To Head,Toronto Raptors,1.95,Brooklyn Nets,1.81,1.065,TopSport
Los Angeles Lakers v Indiana Pacers,2025-03-27T10:35:00Z,Head To Head,Los Angeles Lakers,1.97,Indiana Pacers,1.79,1.066,TopSport
