match,start_time,market_name,home_team,home_win,away_team,away_win,margin,agency
Chicago Bulls v Washington Wizards,2024-11-27T11:05:00Z,Head To Head,Chicago Bulls,1.45,Washington Wizards,2.78,1.049,TopSport
Milwaukee Bucks v Miami Heat,2024-11-27T11:35:00Z,Head To Head,Milwaukee Bucks,2.86,Miami Heat,1.4,1.064,TopSport
Houston Rockets v Minnesota Timberwolves,2024-11-27T12:05:00Z,Head To Head,Houston Rockets,2.25,Minnesota Timberwolves,1.64,1.054,TopSport
San Antonio Spurs v Utah Jazz,2024-11-27T13:05:00Z,Head To Head,San Antonio Spurs,1.73,Utah Jazz,2.1,1.054,TopSport
Los Angeles Lakers v Phoenix Suns,2024-11-27T14:05:00Z,Head To Head,Los Angeles Lakers,2.18,Phoenix Suns,1.65,1.065,TopSport
New York Knicks v Dallas Mavericks,2024-11-28T11:35:00Z,Head To Head,New York Knicks,1.51,Dallas Mavericks,2.46,1.069,TopSport
Denver Nuggets v Utah Jazz,2024-11-28T13:05:00Z,Head To Head,Denver Nuggets,1.29,Utah Jazz,3.4,1.069,TopSport
