match,start_time,market_name,home_team,home_win,away_team,away_win,margin,agency
Los Angeles Lakers v Utah Jazz,2024-12-02T12:11:00Z,Head To Head,Los Angeles Lakers,1.46,Utah Jazz,2.74,1.05,TopSport
Dallas Mavericks v Portland Trail Blazers,2024-12-02T13:05:00Z,Head To Head,Dallas Mavericks,1.44,Portland Trail Blazers,2.78,1.054,TopSport
San Antonio Spurs v Sacramento Kings,2024-12-02T13:05:00Z,Head To Head,San Antonio Spurs,2.98,Sacramento Kings,1.39,1.055,TopSport
Denver Nuggets v Los Angeles Clippers,2024-12-02T14:05:00Z,Head To Head,Denver Nuggets,1.62,Los Angeles Clippers,2.28,1.056,TopSport
Brooklyn Nets v Chicago Bulls,2024-12-03T12:05:00Z,Head To Head,Brooklyn Nets,2.6,Chicago Bulls,1.46,1.07,TopSport
