match,start_time,market_name,home_team,home_win,away_team,away_win,margin,agency
Charlotte Hornets v Chicago Bulls,2024-12-14T12:05:00Z,Head To Head,Charlotte Hornets,2.82,Chicago Bulls,1.44,1.049,TopSport
Brooklyn Nets v Memphis Grizzlies,2024-12-14T12:05:00Z,Head To Head,Brooklyn Nets,4.6,Memphis Grizzlies,1.2,1.051,TopSport
Los Angeles Lakers v Minnesota Timberwolves,2024-12-14T12:05:00Z,Head To Head,Los Angeles Lakers,3.95,Minnesota Timberwolves,1.26,1.047,TopSport
Los Angeles Clippers v Denver Nuggets,2024-12-14T13:05:00Z,Head To Head,Los Angeles Clippers,2.82,Denver Nuggets,1.43,1.054,TopSport
Phoenix Suns v Utah Jazz,2024-12-14T13:35:00Z,Head To Head,Phoenix Suns,1.34,Utah Jazz,3.25,1.054,TopSport
San Antonio Spurs v Portland Trail Blazers,2024-12-14T14:05:00Z,Head To Head,San Antonio Spurs,1.63,Portland Trail Blazers,2.27,1.054,TopSport
