match,start_time,market_name,home_team,home_win,away_team,away_win,margin,agency
New York Knicks v Utah Jazz,2024-11-24T09:05:00Z,Head To Head,New York Knicks,1.24,Utah Jazz,4.1,1.05,TopSport
Detroit Pistons v Orlando Magic,2024-11-24T11:05:00Z,Head To Head,Detroit Pistons,4.4,Orlando Magic,1.21,1.054,TopSport
Memphis Grizzlies v Chicago Bulls,2024-11-24T12:05:00Z,Head To Head,Memphis Grizzlies,1.47,Chicago Bulls,2.62,1.062,TopSport
Portland Trail Blazers v Houston Rockets,2024-11-24T12:05:00Z,Head To Head,Portland Trail Blazers,6.5,Houston Rockets,1.11,1.055,TopSport
Charlotte Hornets v Milwaukee Bucks,2024-11-24T12:05:00Z,Head To Head,Charlotte Hornets,3.3,Milwaukee Bucks,1.32,1.061,TopSport
Golden State Warriors v San Antonio Spurs,2024-11-24T12:35:00Z,Head To Head,Golden State Warriors,1.62,San Antonio Spurs,2.26,1.06,TopSport
Denver Nuggets v Los Angeles Lakers,2024-11-24T14:35:00Z,Head To Head,Denver Nuggets,2.44,Los Angeles Lakers,1.54,1.059,TopSport
Minnesota Timberwolves v Boston Celtics,2024-11-25T07:35:00Z,Head To Head,Minnesota Timberwolves,3.5,Boston Celtics,1.29,1.061,TopSport
