match,start_time,market_name,home_team,home_win,away_team,away_win,margin,agency
Memphis Grizzlies v San Antonio Spurs,2025-01-18T13:35:00Z,Head To Head,Memphis Grizzlies,2.08,San Antonio Spurs,1.76,1.049,TopSport
Brooklyn Nets v Los Angeles Lakers,2025-01-18T14:35:00Z,Head To Head,Brooklyn Nets,5.3,Los Angeles Lakers,1.15,1.058,TopSport
Phoenix Suns v Detroit Pistons,2025-01-19T08:05:00Z,Head To Head,Phoenix Suns,1.79,Detroit Pistons,1.97,1.066,TopSport
Atlanta Hawks v Boston Celtics,2025-01-19T11:05:00Z,Head To Head,Atlanta Hawks,5,Boston Celtics,1.15,1.07,TopSport
Philadelphia 76ers v Indiana Pacers,2025-01-19T11:05:00Z,Head To Head,Philadelphia 76ers,3.5,Indiana Pacers,1.29,1.061,TopSport
Washington Wizards v Golden State Warriors,2025-01-19T12:35:00Z,Head To Head,Washington Wizards,7,Golden State Warriors,1.08,1.069,TopSport
Cleveland Cavaliers v Minnesota Timberwolves,2025-01-19T13:05:00Z,Head To Head,Cleveland Cavaliers,1.47,Minnesota Timberwolves,2.6,1.065,TopSport
