match,start_time,market_name,home_team,home_win,away_team,away_win,margin,agency
New York Knicks v Brooklyn Nets,2025-01-22T11:35:00Z,Head To Head,New York Knicks,1.13,Brooklyn Nets,5.9,1.054,TopSport
Portland Trail Blazers v Miami Heat,2025-01-22T11:35:00Z,Head To Head,Portland Trail Blazers,4.3,Miami Heat,1.22,1.052,TopSport
Orlando Magic v Toronto Raptors,2025-01-22T11:35:00Z,Head To Head,Orlando Magic,1.82,Toronto Raptors,1.98,1.055,TopSport
Philadelphia 76ers v Denver Nuggets,2025-01-22T14:05:00Z,Head To Head,Philadelphia 76ers,6,Denver Nuggets,1.12,1.06,TopSport
Washington Wizards v Los Angeles Lakers,2025-01-22T14:35:00Z,Head To Head,Washington Wizards,6.5,Los Angeles Lakers,1.1,1.063,TopSport
Detroit Pistons v Atlanta Hawks,2025-01-23T11:35:00Z,Head To Head,Detroit Pistons,2.13,Atlanta Hawks,1.67,1.068,TopSport
Phoenix Suns v Brooklyn Nets,2025-01-23T11:35:00Z,Head To Head,Phoenix Suns,1.13,Brooklyn Nets,5.3,1.074,TopSport
Minnesota Timberwolves v Dallas Mavericks,2025-01-23T11:35:00Z,Head To Head,Minnesota Timberwolves,1.77,Dallas Mavericks,1.98,1.07,TopSport
