match,start_time,market_name,home_team,home_win,away_team,away_win,margin,agency
Charlotte Hornets v Chicago Bulls,2025-01-18T12:05:00Z,Head To Head,Charlotte Hornets,2.56,Chicago Bulls,1.52,1.049,TopSport
Denver Nuggets v Miami Heat,2025-01-18T12:05:00Z,Head To Head,Denver Nuggets,1.61,Miami Heat,2.34,1.048,TopSport
Toronto Raptors v Milwaukee Bucks,2025-01-18T12:05:00Z,Head To Head,Toronto Raptors,5.4,Milwaukee Bucks,1.15,1.055,TopSport
Utah Jazz v New Orleans Pelicans,2025-01-18T12:05:00Z,Head To Head,Utah Jazz,5.6,New Orleans Pelicans,1.14,1.056,TopSport
Oklahoma City Thunder v Dallas Mavericks,2025-01-18T12:35:00Z,Head To Head,Oklahoma City Thunder,1.44,Dallas Mavericks,2.82,1.049,TopSport
Memphis Grizzlies v San Antonio Spurs,2025-01-18T13:35:00Z,Head To Head,Memphis Grizzlies,1.77,San Antonio Spurs,2.06,1.05,TopSport
Brooklyn Nets v Los Angeles Lakers,2025-01-18T14:35:00Z,Head To Head,Brooklyn Nets,5.1,Los Angeles Lakers,1.17,1.051,TopSport
Phoenix Suns v Detroit Pistons,2025-01-19T08:05:00Z,Head To Head,Phoenix Suns,1.77,Detroit Pistons,2,1.065,TopSport
Philadelphia 76ers v Indiana Pacers,2025-01-19T11:05:00Z,Head To Head,Philadelphia 76ers,3.2,Indiana Pacers,1.33,1.064,TopSport
