match,start_time,market_name,home_team,home_win,away_team,away_win,margin,agency
Memphis Grizzlies v Golden State Warriors,2025-01-05T12:39:00Z,Head To Head,Memphis Grizzlies,2.21,Golden State Warriors,1.69,1.044,TopSport
Atlanta Hawks v Los Angeles Clippers,2025-01-05T14:35:00Z,Head To Head,Atlanta Hawks,2.98,Los Angeles Clippers,1.39,1.055,TopSport
Boston Celtics v Oklahoma City Thunder,2025-01-06T07:35:00Z,Head To Head,Boston Celtics,2.01,Oklahoma City Thunder,1.76,1.066,TopSport
Charlotte Hornets v Cleveland Cavaliers,2025-01-06T10:05:00Z,Head To Head,Charlotte Hornets,7.6,Cleveland Cavaliers,1.07,1.066,TopSport
New Orleans Pelicans v Washington Wizards,2025-01-06T10:05:00Z,Head To Head,New Orleans Pelicans,1.54,Washington Wizards,2.4,1.066,TopSport
Utah Jazz v Orlando Magic,2025-01-06T10:35:00Z,Head To Head,Utah Jazz,2.78,Orlando Magic,1.42,1.064,TopSport
Los Angeles Lakers v Houston Rockets,2025-01-06T11:05:00Z,Head To Head,Los Angeles Lakers,2.54,Houston Rockets,1.49,1.065,TopSport
