match,start_time,market_name,home_team,home_win,away_team,away_win,margin,agency
Cleveland Cavaliers v Portland Trail Blazers,2025-03-26T13:05:00Z,Head To Head,Cleveland Cavaliers,1.39,Portland Trail Blazers,2.98,1.055,TopSport
Oklahoma City Thunder v Sacramento Kings,2025-03-26T13:05:00Z,Head To Head,Oklahoma City Thunder,1.22,Sacramento Kings,4.4,1.047,TopSport
Washington Wizards v Philadelphia 76ers,2025-03-27T10:05:00Z,Head To Head,Washington Wizards,2.12,Philadelphia 76ers,1.69,1.063,TopSport
Toronto Raptors v Brooklyn Nets,2025-03-27T10:35:00Z,Head To Head,Toronto Raptors,1.97,Brooklyn Nets,1.79,1.066,TopSport
Los Angeles Lakers v Indiana Pacers,2025-03-27T10:35:00Z,Head To Head,Los Angeles Lakers,1.96,Indiana Pacers,1.8,1.066,TopSport
Los Angeles Clippers v New York Knicks,2025-03-27T10:35:00Z,Head To Head,Los Angeles Clippers,1.76,New York Knicks,2.01,1.066,TopSport
Milwaukee Bucks v Denver Nuggets,2025-03-27T12:05:00Z,Head To Head,Milwaukee Bucks,2.24,Denver Nuggets,1.62,1.064,TopSport
