match,start_time,market_name,home_team,home_win,away_team,away_win,margin,agency
Milwaukee Bucks v New York Knicks,2023-11-04T10:40:00Z,Head To Head,Milwaukee Bucks,1.47,New York Knicks,2.71,1.049,TopSport
Chicago Bulls v Brooklyn Nets,2023-11-04T11:10:00Z,Head To Head,Chicago Bulls,1.57,Brooklyn Nets,2.43,1.048,TopSport
Oklahoma City Thunder v Golden State Warriors,2023-11-04T11:10:00Z,Head To Head,Oklahoma City Thunder,2.95,Golden State Warriors,1.41,1.048,TopSport
Miami Heat v Washington Wizards,2023-11-04T11:10:00Z,Head To Head,Miami Heat,1.25,Washington Wizards,4,1.05,TopSport
Denver Nuggets v Dallas Mavericks,2023-11-04T13:10:00Z,Head To Head,Denver Nuggets,1.43,Dallas Mavericks,2.87,1.048,TopSport
Portland Trail Blazers v Memphis Grizzlies,2023-11-04T13:10:00Z,Head To Head,Portland Trail Blazers,2.38,Memphis Grizzlies,1.59,1.049,TopSport
Orlando Magic v Los Angeles Lakers,2023-11-05T10:10:00Z,Head To Head,Orlando Magic,2.37,Los Angeles Lakers,1.56,1.063,TopSport
Minnesota Timberwolves v Utah Jazz,2023-11-05T11:10:00Z,Head To Head,Minnesota Timberwolves,1.32,Utah Jazz,3.3,1.061,TopSport
