match,start_time,market_name,home_team,home_win,away_team,away_win,margin,agency
Detroit Pistons v Miami Heat,2025-03-20T10:41:00Z,Head To Head,Detroit Pistons,1.49,Miami Heat,2.61,1.054,TopSport
New Orleans Pelicans v Minnesota Timberwolves,2025-03-20T11:05:00Z,Head To Head,New Orleans Pelicans,6.5,Minnesota Timberwolves,1.11,1.055,TopSport
New York Knicks v San Antonio Spurs,2025-03-20T11:05:00Z,Head To Head,New York Knicks,1.26,San Antonio Spurs,3.9,1.05,TopSport
Washington Wizards v Utah Jazz,2025-03-20T12:05:00Z,Head To Head,Washington Wizards,2.16,Utah Jazz,1.69,1.055,TopSport
Chicago Bulls v Phoenix Suns,2025-03-20T13:05:00Z,Head To Head,Chicago Bulls,2.82,Phoenix Suns,1.43,1.054,TopSport
Memphis Grizzlies v Portland Trail Blazers,2025-03-20T13:05:00Z,Head To Head,Memphis Grizzlies,1.52,Portland Trail Blazers,2.52,1.055,TopSport
Chicago Bulls v Sacramento Kings,2025-03-21T13:05:00Z,Head To Head,Chicago Bulls,2.92,Sacramento Kings,1.37,1.072,TopSport
