match,start_time,market_name,home_team,home_win,away_team,away_win,margin,agency
Golden State Warriors v Orlando Magic,2025-02-28T11:10:00Z,Head To Head,Golden State Warriors,1.47,Orlando Magic,2.63,1.061,TopSport
Denver Nuggets v Milwaukee Bucks,2025-02-28T12:05:00Z,Head To Head,Denver Nuggets,1.6,Milwaukee Bucks,2.32,1.056,TopSport
Charlotte Hornets v Dallas Mavericks,2025-02-28T12:35:00Z,Head To Head,Charlotte Hornets,4.5,Dallas Mavericks,1.2,1.056,TopSport
New Orleans Pelicans v Phoenix Suns,2025-02-28T13:05:00Z,Head To Head,New Orleans Pelicans,3.3,Phoenix Suns,1.32,1.061,TopSport
Minnesota Timberwolves v Los Angeles Lakers,2025-02-28T14:35:00Z,Head To Head,Minnesota Timberwolves,2.79,Los Angeles Lakers,1.42,1.063,TopSport
Oklahoma City Thunder v Atlanta Hawks,2025-03-01T11:35:00Z,Head To Head,Oklahoma City Thunder,1.12,Atlanta Hawks,5.5,1.075,TopSport
Cleveland Cavaliers v Boston Celtics,2025-03-01T11:35:00Z,Head To Head,Cleveland Cavaliers,2.25,Boston Celtics,1.6,1.069,TopSport
