match,start_time,market_name,home_team,home_win,away_team,away_win,margin,agency
Los Angeles Clippers v New Orleans Pelicans,2024-12-31T12:05:00Z,Head To Head,Los Angeles Clippers,1.52,New Orleans Pelicans,2.56,1.049,TopSport
Denver Nuggets v Utah Jazz,2024-12-31T13:05:00Z,Head To Head,Denver Nuggets,1.32,Utah Jazz,3.35,1.056,TopSport
Cleveland Cavaliers v Golden State Warriors,2024-12-31T14:05:00Z,Head To Head,Cleveland Cavaliers,1.55,Golden State Warriors,2.39,1.064,TopSport
Toronto Raptors v Boston Celtics,2025-01-01T07:05:00Z,Head To Head,Toronto Raptors,12,Boston Celtics,1.04,1.045,TopSport
Milwaukee Bucks v Indiana Pacers,2025-01-01T07:05:00Z,Head To Head,Milwaukee Bucks,1.95,Indiana Pacers,1.81,1.065,TopSport
Los Angeles Clippers v San Antonio Spurs,2025-01-01T11:05:00Z,Head To Head,Los Angeles Clippers,2.15,San Antonio Spurs,1.67,1.064,TopSport
Minnesota Timberwolves v Oklahoma City Thunder,2025-01-01T12:05:00Z,Head To Head,Minnesota Timberwolves,3.1,Oklahoma City Thunder,1.34,1.069,TopSport
