match,start_time,market_name,home_team,home_win,away_team,away_win,margin,agency
Washington Wizards v Golden State Warriors,2025-01-19T12:35:00Z,Head To Head,Washington Wizards,6.5,Golden State Warriors,1.11,1.055,TopSport
Cleveland Cavaliers v Minnesota Timberwolves,2025-01-19T13:05:00Z,Head To Head,Cleveland Cavaliers,1.41,Minnesota Timberwolves,2.88,1.056,TopSport
Houston Rockets v Portland Trail Blazers,2025-01-19T14:05:00Z,Head To Head,Houston Rockets,1.18,Portland Trail Blazers,4.9,1.052,TopSport
San Antonio Spurs v Miami Heat,2025-01-20T07:05:00Z,Head To Head,San Antonio Spurs,2.1,Miami Heat,1.7,1.064,TopSport
Denver Nuggets v Orlando Magic,2025-01-20T10:05:00Z,Head To Head,Denver Nuggets,1.5,Orlando Magic,2.52,1.063,TopSport
Brooklyn Nets v Oklahoma City Thunder,2025-01-20T11:05:00Z,Head To Head,Brooklyn Nets,7,Oklahoma City Thunder,1.08,1.069,TopSport
