match,start_time,market_name,home_team,home_win,away_team,away_win,margin,agency
Indiana Pacers v Boston Celtics,2024-12-30T10:05:00Z,Head To Head,Indiana Pacers,4.8,Boston Celtics,1.18,1.056,TopSport
Atlanta Hawks v Toronto Raptors,2024-12-30T10:05:00Z,Head To Head,Atlanta Hawks,1.83,Toronto Raptors,1.97,1.054,TopSport
Miami Heat v Houston Rockets,2024-12-30T11:05:00Z,Head To Head,Miami Heat,3.7,Houston Rockets,1.27,1.058,TopSport
Memphis Grizzlies v Oklahoma City Thunder,2024-12-30T11:05:00Z,Head To Head,Memphis Grizzlies,3.25,Oklahoma City Thunder,1.34,1.054,TopSport
San Antonio Spurs v Minnesota Timberwolves,2024-12-30T12:15:00Z,Head To Head,San Antonio Spurs,2.94,Minnesota Timberwolves,1.39,1.06,TopSport
