match,start_time,market_name,home_team,home_win,away_team,away_win,margin,agency
Phoenix Suns v Charlotte Hornets,2025-01-08T11:05:00Z,Head To Head,Phoenix Suns,1.49,Charlotte Hornets,2.64,1.05,TopSport
Houston Rockets v Washington Wizards,2025-01-08T11:05:00Z,Head To Head,Houston Rockets,1.1,Washington Wizards,7,1.052,TopSport
Los Angeles Lakers v Dallas Mavericks,2025-01-08T11:35:00Z,Head To Head,Los Angeles Lakers,1.4,Dallas Mavericks,2.94,1.054,TopSport
Minnesota Timberwolves v New Orleans Pelicans,2025-01-08T12:05:00Z,Head To Head,Minnesota Timberwolves,1.52,New Orleans Pelicans,2.52,1.055,TopSport
Atlanta Hawks v Utah Jazz,2025-01-08T13:05:00Z,Head To Head,Atlanta Hawks,1.39,Utah Jazz,2.98,1.055,TopSport
Boston Celtics v Denver Nuggets,2025-01-08T14:05:00Z,Head To Head,Boston Celtics,1.41,Denver Nuggets,2.84,1.061,TopSport
Miami Heat v Golden State Warriors,2025-01-08T14:05:00Z,Head To Head,Miami Heat,4.2,Golden State Warriors,1.22,1.058,TopSport
Chicago Bulls v Indiana Pacers,2025-01-09T11:05:00Z,Head To Head,Chicago Bulls,2.64,Indiana Pacers,1.45,1.068,TopSport
