match,start_time,market_name,home_team,home_win,away_team,away_win,margin,agency
Brooklyn Nets v Boston Celtics,2025-03-19T10:35:00Z,Head To Head,Brooklyn Nets,6.5,Boston Celtics,1.11,1.055,TopSport
Milwaukee Bucks v Golden State Warriors,2025-03-19T13:05:00Z,Head To Head,Milwaukee Bucks,1.69,Golden State Warriors,2.16,1.055,TopSport
Cleveland Cavaliers v Los Angeles Clippers,2025-03-19T13:35:00Z,Head To Head,Cleveland Cavaliers,1.63,Los Angeles Clippers,2.22,1.064,TopSport
Dallas Mavericks v Indiana Pacers,2025-03-20T10:05:00Z,Head To Head,Dallas Mavericks,3.4,Indiana Pacers,1.3,1.063,TopSport
Houston Rockets v Orlando Magic,2025-03-20T10:05:00Z,Head To Head,Houston Rockets,1.7,Orlando Magic,2.08,1.069,TopSport
Detroit Pistons v Miami Heat,2025-03-20T10:35:00Z,Head To Head,Detroit Pistons,1.45,Miami Heat,2.62,1.071,TopSport
New York Knicks v San Antonio Spurs,2025-03-20T11:05:00Z,Head To Head,New York Knicks,1.27,San Antonio Spurs,3.55,1.069,TopSport
Washington Wizards v Utah Jazz,2025-03-20T12:05:00Z,Head To Head,Washington Wizards,2.12,Utah Jazz,1.67,1.071,TopSport
Chicago Bulls v Phoenix Suns,2025-03-20T13:05:00Z,Head To Head,Chicago Bulls,3.05,Phoenix Suns,1.35,1.069,TopSport
