match,start_time,market_name,home_team,home_win,away_team,away_win,margin,agency
New Orleans Pelicans v Memphis Grizzlies,2025-01-25T12:10:00Z,Head To Head,New Orleans Pelicans,4.3,Memphis Grizzlies,1.23,1.046,TopSport
Indiana Pacers v San Antonio Spurs,2025-01-26T04:05:00Z,Head To Head,Indiana Pacers,1.73,San Antonio Spurs,2.05,1.066,TopSport
Denver Nuggets v Minnesota Timberwolves,2025-01-26T07:05:00Z,Head To Head,Denver Nuggets,1.67,Minnesota Timberwolves,2.15,1.064,TopSport
Boston Celtics v Dallas Mavericks,2025-01-26T09:35:00Z,Head To Head,Boston Celtics,1.31,Dallas Mavericks,3.3,1.066,TopSport
Miami Heat v Brooklyn Nets,2025-01-26T10:05:00Z,Head To Head,Miami Heat,1.22,Brooklyn Nets,4.1,1.064,TopSport
Detroit Pistons v Orlando Magic,2025-01-26T11:05:00Z,Head To Head,Detroit Pistons,2.21,Orlando Magic,1.63,1.066,TopSport
Toronto Raptors v Atlanta Hawks,2025-01-26T11:35:00Z,Head To Head,Toronto Raptors,2.3,Atlanta Hawks,1.59,1.064,TopSport
