match,start_time,market_name,home_team,home_win,away_team,away_win,margin,agency
Dallas Mavericks v Denver Nuggets,2024-11-23T14:05:00Z,Head To Head,Dallas Mavericks,2.62,Denver Nuggets,1.48,1.057,TopSport
Sacramento Kings v Los Angeles Clippers,2024-11-23T14:35:00Z,Head To Head,Sacramento Kings,1.57,Los Angeles Clippers,2.4,1.054,TopSport
New York Knicks v Utah Jazz,2024-11-24T09:05:00Z,Head To Head,New York Knicks,1.23,Utah Jazz,3.95,1.066,TopSport
Detroit Pistons v Orlando Magic,2024-11-24T11:05:00Z,Head To Head,Detroit Pistons,4.3,Orlando Magic,1.2,1.066,TopSport
Memphis Grizzlies v Chicago Bulls,2024-11-24T12:05:00Z,Head To Head,Memphis Grizzlies,1.46,Chicago Bulls,2.62,1.067,TopSport
