match,start_time,market_name,home_team,home_win,away_team,away_win,margin,agency
New York Knicks v Orlando Magic,2024-12-16T10:05:00Z,Head To Head,New York Knicks,1.54,Orlando Magic,2.5,1.049,TopSport
Boston Celtics v Washington Wizards,2024-12-16T10:05:00Z,Head To Head,Boston Celtics,1.05,Washington Wizards,12,1.036,TopSport
Minnesota Timberwolves v San Antonio Spurs,2024-12-16T11:05:00Z,Head To Head,Minnesota Timberwolves,1.53,San Antonio Spurs,2.48,1.057,TopSport
Portland Trail Blazers v Phoenix Suns,2024-12-16T12:05:00Z,Head To Head,Portland Trail Blazers,5.3,Phoenix Suns,1.15,1.058,TopSport
Dallas Mavericks v Golden State Warriors,2024-12-16T12:35:00Z,Head To Head,Dallas Mavericks,1.66,Golden State Warriors,2.21,1.055,TopSport
Memphis Grizzlies v Los Angeles Lakers,2024-12-16T13:35:00Z,Head To Head,Memphis Grizzlies,1.52,Los Angeles Lakers,2.48,1.061,TopSport
