match,start_time,market_name,home_team,home_win,away_team,away_win,margin,agency
Los Angeles Clippers v San Antonio Spurs,2025-01-01T11:05:00Z,Head To Head,Los Angeles Clippers,2.29,San Antonio Spurs,1.63,1.05,TopSport
Minnesota Timberwolves v Oklahoma City Thunder,2025-01-01T12:05:00Z,Head To Head,Minnesota Timberwolves,3.15,Oklahoma City Thunder,1.36,1.053,TopSport
Cleveland Cavaliers v Los Angeles Lakers,2025-01-01T13:05:00Z,Head To Head,Cleveland Cavaliers,1.48,Los Angeles Lakers,2.64,1.054,TopSport
Memphis Grizzlies v Phoenix Suns,2025-01-01T13:05:00Z,Head To Head,Memphis Grizzlies,2.61,Phoenix Suns,1.47,1.063,TopSport
Orlando Magic v Detroit Pistons,2025-01-02T11:05:00Z,Head To Head,Orlando Magic,1.96,Detroit Pistons,1.79,1.069,TopSport
New Orleans Pelicans v Miami Heat,2025-01-02T11:35:00Z,Head To Head,New Orleans Pelicans,3.9,Miami Heat,1.23,1.069,TopSport
Utah Jazz v New York Knicks,2025-01-02T11:35:00Z,Head To Head,Utah Jazz,6.8,New York Knicks,1.08,1.073,TopSport
Atlanta Hawks v Denver Nuggets,2025-01-02T13:05:00Z,Head To Head,Atlanta Hawks,2.6,Denver Nuggets,1.46,1.07,TopSport
