match,start_time,market_name,home_team,home_win,away_team,away_win,margin,agency
Oklahoma City Thunder v Los Angeles Lakers,2024-11-30T14:10:00Z,Head To Head,Oklahoma City Thunder,1.68,Los Angeles Lakers,2.2,1.05,TopSport
Sacramento Kings v Portland Trail Blazers,2024-11-30T14:10:00Z,Head To Head,Sacramento Kings,1.36,Portland Trail Blazers,3.2,1.048,TopSport
Atlanta Hawks v Charlotte Hornets,2024-12-01T10:05:00Z,Head To Head,Atlanta Hawks,1.58,Charlotte Hornets,2.32,1.064,TopSport
Washington Wizards v Milwaukee Bucks,2024-12-01T12:05:00Z,Head To Head,Washington Wizards,8.5,Milwaukee Bucks,1.06,1.061,TopSport
Golden State Warriors v Phoenix Suns,2024-12-01T13:05:00Z,Head To Head,Golden State Warriors,2.15,Phoenix Suns,1.67,1.064,TopSport
Dallas Mavericks v Utah Jazz,2024-12-01T13:35:00Z,Head To Head,Dallas Mavericks,1.39,Utah Jazz,2.9,1.064,TopSport
