match,start_time,market_name,home_team,home_win,away_team,away_win,margin,agency
Chicago Bulls v Utah Jazz,2025-03-18T12:05:00Z,Head To Head,Chicago Bulls,1.53,Utah Jazz,2.52,1.05,TopSport
Denver Nuggets v Golden State Warriors,2025-03-18T13:05:00Z,Head To Head,Denver Nuggets,3.6,Golden State Warriors,1.29,1.053,TopSport
Toronto Raptors v Phoenix Suns,2025-03-18T13:05:00Z,Head To Head,Toronto Raptors,4,Phoenix Suns,1.24,1.056,TopSport
Washington Wizards v Portland Trail Blazers,2025-03-18T13:05:00Z,Head To Head,Washington Wizards,2.86,Portland Trail Blazers,1.42,1.054,TopSport
Memphis Grizzlies v Sacramento Kings,2025-03-18T13:05:00Z,Head To Head,Memphis Grizzlies,2.13,Sacramento Kings,1.71,1.054,TopSport
San Antonio Spurs v Los Angeles Lakers,2025-03-18T13:35:00Z,Head To Head,San Antonio Spurs,4.3,Los Angeles Lakers,1.22,1.052,TopSport
Atlanta Hawks v Charlotte Hornets,2025-03-19T10:05:00Z,Head To Head,Atlanta Hawks,1.35,Charlotte Hornets,3.1,1.063,TopSport
Brooklyn Nets v Boston Celtics,2025-03-19T10:35:00Z,Head To Head,Brooklyn Nets,6,Boston Celtics,1.11,1.068,TopSport
Cleveland Cavaliers v Los Angeles Clippers,2025-03-19T13:35:00Z,Head To Head,Cleveland Cavaliers,1.55,Los Angeles Clippers,2.36,1.069,TopSport
