match,start_time,market_name,home_team,home_win,away_team,away_win,margin,agency
New Orleans Pelicans v Sacramento Kings,2025-02-09T14:05:00Z,Head To Head,New Orleans Pelicans,3.65,Sacramento Kings,1.29,1.049,TopSport
Utah Jazz v Los Angeles Clippers,2025-02-09T14:40:00Z,Head To Head,Utah Jazz,11,Los Angeles Clippers,1.06,1.034,TopSport
Charlotte Hornets v Detroit Pistons,2025-02-10T05:05:00Z,Head To Head,Charlotte Hornets,4.5,Detroit Pistons,1.19,1.063,TopSport
Toronto Raptors v Houston Rockets,2025-02-10T06:05:00Z,Head To Head,Toronto Raptors,4.4,Houston Rockets,1.19,1.068,TopSport
Philadelphia 76ers v Milwaukee Bucks,2025-02-10T06:05:00Z,Head To Head,Philadelphia 76ers,2.1,Milwaukee Bucks,1.7,1.064,TopSport
