match,start_time,market_name,home_team,home_win,away_team,away_win,margin,agency
Los Angeles Clippers v Chicago Bulls,2025-02-27T12:05:00Z,Head To Head,Los Angeles Clippers,1.24,Chicago Bulls,4.1,1.05,TopSport
Sacramento Kings v Utah Jazz,2025-02-27T13:05:00Z,Head To Head,Sacramento Kings,1.25,Utah Jazz,3.95,1.053,TopSport
San Antonio Spurs v Houston Rockets,2025-02-27T13:35:00Z,Head To Head,San Antonio Spurs,3.65,Houston Rockets,1.28,1.055,TopSport
Golden State Warriors v Orlando Magic,2025-02-28T11:05:00Z,Head To Head,Golden State Warriors,1.41,Orlando Magic,2.76,1.072,TopSport
Denver Nuggets v Milwaukee Bucks,2025-02-28T12:05:00Z,Head To Head,Denver Nuggets,1.63,Milwaukee Bucks,2.19,1.07,TopSport
Charlotte Hornets v Dallas Mavericks,2025-02-28T12:35:00Z,Head To Head,Charlotte Hornets,3.95,Dallas Mavericks,1.22,1.073,TopSport
New Orleans Pelicans v Phoenix Suns,2025-02-28T13:05:00Z,Head To Head,New Orleans Pelicans,3.35,Phoenix Suns,1.3,1.068,TopSport
Minnesota Timberwolves v Los Angeles Lakers,2025-02-28T14:35:00Z,Head To Head,Minnesota Timberwolves,2.42,Los Angeles Lakers,1.52,1.071,TopSport
