match,start_time,market_name,home_team,home_win,away_team,away_win,margin,agency
Utah Jazz v Philadelphia 76ers,2025-03-10T10:40:00Z,Head To Head,Utah Jazz,2.97,Philadelphia 76ers,1.42,1.041,TopSport
Cleveland Cavaliers v Milwaukee Bucks,2025-03-10T11:05:00Z,Head To Head,Cleveland Cavaliers,1.36,Milwaukee Bucks,3.2,1.048,TopSport
San Antonio Spurs v Minnesota Timberwolves,2025-03-10T11:05:00Z,Head To Head,San Antonio Spurs,4.9,Minnesota Timberwolves,1.18,1.052,TopSport
Detroit Pistons v Portland Trail Blazers,2025-03-10T12:05:00Z,Head To Head,Detroit Pistons,1.64,Portland Trail Blazers,2.24,1.056,TopSport
Sacramento Kings v Los Angeles Clippers,2025-03-10T12:35:00Z,Head To Head,Sacramento Kings,2.84,Los Angeles Clippers,1.42,1.056,TopSport
Charlotte Hornets v Miami Heat,2025-03-11T10:35:00Z,Head To Head,Charlotte Hornets,3.95,Miami Heat,1.22,1.073,TopSport
Washington Wizards v Toronto Raptors,2025-03-11T10:35:00Z,Head To Head,Washington Wizards,2.9,Toronto Raptors,1.38,1.069,TopSport
Orlando Magic v Houston Rockets,2025-03-11T11:05:00Z,Head To Head,Orlando Magic,2.38,Houston Rockets,1.54,1.07,TopSport
