match,start_time,market_name,home_team,home_win,away_team,away_win,margin,agency
San Antonio Spurs v Dallas Mavericks,2024-11-17T12:35:00Z,Head To Head,San Antonio Spurs,6.5,Dallas Mavericks,1.11,1.055,TopSport
Utah Jazz v Sacramento Kings,2024-11-17T14:05:00Z,Head To Head,Utah Jazz,3.15,Sacramento Kings,1.36,1.053,TopSport
Phoenix Suns v Minnesota Timberwolves,2024-11-18T07:35:00Z,Head To Head,Phoenix Suns,3.15,Minnesota Timberwolves,1.34,1.064,TopSport
Miami Heat v Indiana Pacers,2024-11-18T09:05:00Z,Head To Head,Miami Heat,2.15,Indiana Pacers,1.67,1.064,TopSport
Charlotte Hornets v Cleveland Cavaliers,2024-11-18T10:05:00Z,Head To Head,Charlotte Hornets,5,Cleveland Cavaliers,1.15,1.07,TopSport
Denver Nuggets v Memphis Grizzlies,2024-11-18T10:05:00Z,Head To Head,Denver Nuggets,1.91,Memphis Grizzlies,1.85,1.064,TopSport
Detroit Pistons v Washington Wizards,2024-11-18T10:05:00Z,Head To Head,Detroit Pistons,1.46,Washington Wizards,2.62,1.067,TopSport
Houston Rockets v Chicago Bulls,2024-11-18T11:05:00Z,Head To Head,Houston Rockets,1.49,Chicago Bulls,2.54,1.065,TopSport
Brooklyn Nets v New York Knicks,2024-11-18T11:05:00Z,Head To Head,Brooklyn Nets,4.45,New York Knicks,1.19,1.065,TopSport
