match,start_time,market_name,home_team,home_win,away_team,away_win,margin,agency
Sacramento Kings v Golden State Warriors,2025-03-14T13:05:00Z,Head To Head,Sacramento Kings,3.45,Golden State Warriors,1.32,1.047,TopSport
Boston Celtics v Miami Heat,2025-03-15T10:05:00Z,Head To Head,Boston Celtics,1.32,Miami Heat,3.25,1.065,TopSport
Indiana Pacers v Philadelphia 76ers,2025-03-15T10:05:00Z,Head To Head,Indiana Pacers,1.17,Philadelphia 76ers,4.9,1.059,TopSport
Los Angeles Clippers v Atlanta Hawks,2025-03-15T10:35:00Z,Head To Head,Los Angeles Clippers,1.63,Atlanta Hawks,2.22,1.064,TopSport
Dallas Mavericks v Houston Rockets,2025-03-15T11:05:00Z,Head To Head,Dallas Mavericks,5.3,Houston Rockets,1.14,1.066,TopSport
Cleveland Cavaliers v Memphis Grizzlies,2025-03-15T11:05:00Z,Head To Head,Cleveland Cavaliers,1.7,Memphis Grizzlies,2.1,1.064,TopSport
Orlando Magic v Minnesota Timberwolves,2025-03-15T11:05:00Z,Head To Head,Orlando Magic,4.4,Minnesota Timberwolves,1.2,1.061,TopSport
Charlotte Hornets v San Antonio Spurs,2025-03-15T11:05:00Z,Head To Head,Charlotte Hornets,2.52,San Antonio Spurs,1.5,1.063,TopSport
Los Angeles Lakers v Denver Nuggets,2025-03-15T12:35:00Z,Head To Head,Los Angeles Lakers,6,Denver Nuggets,1.11,1.068,TopSport
