match,start_time,market_name,home_team,home_win,away_team,away_win,margin,agency
Philadelphia 76ers v Sacramento Kings,2025-01-02T14:05:00Z,Head To Head,Philadelphia 76ers,2.99,Sacramento Kings,1.41,1.044,TopSport
Indiana Pacers v Miami Heat,2025-01-03T11:35:00Z,Head To Head,Indiana Pacers,2.01,Miami Heat,1.76,1.066,TopSport
Boston Celtics v Minnesota Timberwolves,2025-01-03T11:35:00Z,Head To Head,Boston Celtics,1.56,Minnesota Timberwolves,2.36,1.065,TopSport
Brooklyn Nets v Milwaukee Bucks,2025-01-03T12:05:00Z,Head To Head,Brooklyn Nets,6.25,Milwaukee Bucks,1.11,1.061,TopSport
Los Angeles Clippers v Oklahoma City Thunder,2025-01-03T12:05:00Z,Head To Head,Los Angeles Clippers,4.1,Oklahoma City Thunder,1.22,1.064,TopSport
Philadelphia 76ers v Golden State Warriors,2025-01-03T14:05:00Z,Head To Head,Philadelphia 76ers,2.02,Golden State Warriors,1.74,1.07,TopSport
Portland Trail Blazers v Los Angeles Lakers,2025-01-03T14:35:00Z,Head To Head,Portland Trail Blazers,3.9,Los Angeles Lakers,1.23,1.069,TopSport
