match,start_time,market_name,home_team,home_win,away_team,away_win,margin,agency
Houston Rockets v Minnesota Timberwolves,2025-02-07T12:05:00Z,Head To Head,Houston Rockets,1.95,Minnesota Timberwolves,1.86,1.05,TopSport
Orlando Magic v Denver Nuggets,2025-02-07T13:05:00Z,Head To Head,Orlando Magic,3.05,Denver Nuggets,1.38,1.053,TopSport
Golden State Warriors v Los Angeles Lakers,2025-02-07T14:05:00Z,Head To Head,Golden State Warriors,3.05,Los Angeles Lakers,1.38,1.053,TopSport
Sacramento Kings v Portland Trail Blazers,2025-02-07T14:05:00Z,Head To Head,Sacramento Kings,1.83,Portland Trail Blazers,1.97,1.054,TopSport
Indiana Pacers v Los Angeles Clippers,2025-02-07T14:35:00Z,Head To Head,Indiana Pacers,2.64,Los Angeles Clippers,1.48,1.054,TopSport
San Antonio Spurs v Charlotte Hornets,2025-02-08T11:05:00Z,Head To Head,San Antonio Spurs,1.14,Charlotte Hornets,5.3,1.066,TopSport
Miami Heat v Brooklyn Nets,2025-02-08T11:35:00Z,Head To Head,Miami Heat,1.32,Brooklyn Nets,3.25,1.065,TopSport
