match,start_time,market_name,home_team,home_win,away_team,away_win,margin,agency
New York Knicks v Washington Wizards,2024-12-29T11:05:00Z,Head To Head,New York Knicks,1.1,Washington Wizards,7,1.052,TopSport
Milwaukee Bucks v Chicago Bulls,2024-12-29T12:05:00Z,Head To Head,Milwaukee Bucks,1.74,Chicago Bulls,2.1,1.051,TopSport
Phoenix Suns v Golden State Warriors,2024-12-29T12:35:00Z,Head To Head,Phoenix Suns,2.94,Golden State Warriors,1.4,1.054,TopSport
Detroit Pistons v Denver Nuggets,2024-12-29T13:05:00Z,Head To Head,Detroit Pistons,2.88,Denver Nuggets,1.41,1.056,TopSport
Philadelphia 76ers v Utah Jazz,2024-12-29T13:35:00Z,Head To Head,Philadelphia 76ers,1.4,Utah Jazz,2.94,1.054,TopSport
Dallas Mavericks v Portland Trail Blazers,2024-12-29T14:05:00Z,Head To Head,Dallas Mavericks,1.55,Portland Trail Blazers,2.42,1.058,TopSport
Sacramento Kings v Los Angeles Lakers,2024-12-29T14:35:00Z,Head To Head,Sacramento Kings,1.85,Los Angeles Lakers,1.93,1.059,TopSport
