match,start_time,market_name,home_team,home_win,away_team,away_win,margin,agency
Golden State Warriors v Indiana Pacers,2025-01-11T11:05:00Z,Head To Head,Golden State Warriors,4.2,Indiana Pacers,1.22,1.058,TopSport
Milwaukee Bucks v Orlando Magic,2025-01-11T11:05:00Z,Head To Head,Milwaukee Bucks,1.38,Orlando Magic,3.05,1.053,TopSport
New Orleans Pelicans v Philadelphia 76ers,2025-01-11T11:05:00Z,Head To Head,New Orleans Pelicans,2.94,Philadelphia 76ers,1.4,1.054,TopSport
Sacramento Kings v Boston Celtics,2025-01-11T11:35:00Z,Head To Head,Sacramento Kings,5.3,Boston Celtics,1.15,1.058,TopSport
Oklahoma City Thunder v New York Knicks,2025-01-11T11:35:00Z,Head To Head,Oklahoma City Thunder,1.55,New York Knicks,2.44,1.055,TopSport
Washington Wizards v Chicago Bulls,2025-01-11T12:05:00Z,Head To Head,Washington Wizards,5.3,Chicago Bulls,1.15,1.058,TopSport
Brooklyn Nets v Denver Nuggets,2025-01-11T13:05:00Z,Head To Head,Brooklyn Nets,7,Denver Nuggets,1.09,1.06,TopSport
