match,start_time,market_name,home_team,home_win,away_team,away_win,margin,agency
San Antonio Spurs v Cleveland Cavaliers,2025-03-28T10:05:00Z,Head To Head,San Antonio Spurs,7,Cleveland Cavaliers,1.1,1.052,TopSport
Indiana Pacers v Washington Wizards,2025-03-28T10:05:00Z,Head To Head,Indiana Pacers,1.11,Washington Wizards,6.5,1.055,TopSport
Atlanta Hawks v Miami Heat,2025-03-28T10:35:00Z,Head To Head,Atlanta Hawks,2.05,Miami Heat,1.76,1.056,TopSport
Los Angeles Lakers v Chicago Bulls,2025-03-28T11:05:00Z,Head To Head,Los Angeles Lakers,1.54,Chicago Bulls,2.46,1.056,TopSport
Memphis Grizzlies v Oklahoma City Thunder,2025-03-28T11:05:00Z,Head To Head,Memphis Grizzlies,4.7,Oklahoma City Thunder,1.19,1.053,TopSport
Portland Trail Blazers v Sacramento Kings,2025-03-28T13:05:00Z,Head To Head,Portland Trail Blazers,2.8,Sacramento Kings,1.42,1.061,TopSport
