match,start_time,market_name,home_team,home_win,away_team,away_win,margin,agency
Toronto Raptors v Milwaukee Bucks,2024-11-13T12:05:00Z,Head To Head,Toronto Raptors,4.1,Milwaukee Bucks,1.24,1.05,TopSport
Phoenix Suns v Utah Jazz,2024-11-13T13:05:00Z,Head To Head,Phoenix Suns,1.47,Utah Jazz,2.68,1.053,TopSport
Dallas Mavericks v Golden State Warriors,2024-11-13T14:05:00Z,Head To Head,Dallas Mavericks,2.17,Golden State Warriors,1.68,1.056,TopSport
Minnesota Timberwolves v Portland Trail Blazers,2024-11-13T14:05:00Z,Head To Head,Minnesota Timberwolves,1.24,Portland Trail Blazers,3.95,1.06,TopSport
Indiana Pacers v Orlando Magic,2024-11-14T11:05:00Z,Head To Head,Indiana Pacers,1.7,Orlando Magic,2.1,1.064,TopSport
Chicago Bulls v New York Knicks,2024-11-14T11:35:00Z,Head To Head,Chicago Bulls,3.95,New York Knicks,1.23,1.066,TopSport
New Orleans Pelicans v Oklahoma City Thunder,2024-11-14T11:35:00Z,Head To Head,New Orleans Pelicans,7.5,Oklahoma City Thunder,1.07,1.068,TopSport
Los Angeles Clippers v Houston Rockets,2024-11-14T12:05:00Z,Head To Head,Los Angeles Clippers,2.46,Houston Rockets,1.51,1.069,TopSport
