match,start_time,market_name,home_team,home_win,away_team,away_win,margin,agency
Oklahoma City Thunder v Cleveland Cavaliers,2025-01-09T11:05:00Z,Head To Head,Oklahoma City Thunder,2.17,Cleveland Cavaliers,1.68,1.056,TopSport
Chicago Bulls v Indiana Pacers,2025-01-09T11:05:00Z,Head To Head,Chicago Bulls,2.74,Indiana Pacers,1.45,1.055,TopSport
Washington Wizards v Philadelphia 76ers,2025-01-09T11:05:00Z,Head To Head,Washington Wizards,5.1,Philadelphia 76ers,1.17,1.051,TopSport
Detroit Pistons v Brooklyn Nets,2025-01-09T11:35:00Z,Head To Head,Detroit Pistons,1.25,Brooklyn Nets,3.95,1.053,TopSport
Toronto Raptors v New York Knicks,2025-01-09T11:35:00Z,Head To Head,Toronto Raptors,5.8,New York Knicks,1.13,1.057,TopSport
Portland Trail Blazers v New Orleans Pelicans,2025-01-09T12:05:00Z,Head To Head,Portland Trail Blazers,2.03,New Orleans Pelicans,1.78,1.054,TopSport
Los Angeles Clippers v Denver Nuggets,2025-01-09T13:05:00Z,Head To Head,Los Angeles Clippers,1.8,Denver Nuggets,1.98,1.061,TopSport
